Nr,exercise,question,answer,frage_word,german,english,french,explanation_english,explanation_french
237,12,_____ könnte man in einer solchen Situation tun?,Was sonst,was sonst,Was sonst könnte man in einer solchen Situation tun?,What else could one do in such a situation?,Que pourrait-on faire d’autre dans une telle situation ?,Was sonst = What else,Was sonst = Que ... d'autre
238,12,_____ hast du noch von deinem Chef verlangt?,Was sonst,was sonst,Was sonst hast du noch von deinem Chef verlangt?,What else did you ask of your boss?,Qu’as-tu demandé d’autre à ton patron ?,Was sonst = What else,Was sonst = Que ... d'autre
239,12,"_____ würde dich davon abhalten, das Angebot anzunehmen?",Was sonst,was sonst,"Was sonst würde dich davon abhalten, das Angebot anzunehmen?",What else would stop you from accepting the offer?,Qu’est-ce qui pourrait vous empêcher d’accepter l’offre ?,Was sonst = What else,Was sonst = Que ... d'autre
240,12,_____ erwartest du von diesem Projekt?,Was sonst,was sonst,Was sonst erwartest du von diesem Projekt?,What else do you expect from this project?,Qu’attendez-vous d’autre de ce projet ?,Was sonst = What else,Was sonst = Que ... d'autre
241,12,_____ sollte ich dir dazu noch sagen?,Was sonst,was sonst,Was sonst sollte ich dir dazu noch sagen?,What else should I tell you about it?,Que devrais-je vous dire d'autre à ce sujet ?,Was sonst = What else,Was sonst = Que ... d'autre
242,12,"Du hast die E-Mail gestern abgeschickt, _____?",nicht wahr,nicht wahr,"Du hast die E-Mail gestern abgeschickt, nicht wahr?","You sent the email yesterday, didn’t you?","Tu as envoyé l’e-mail hier, n’est-ce pas ?",nicht wahr = isn't it,nicht wahr = n'est-ce pas
243,12,"Das Problem lässt sich mit etwas Geduld lösen, _____?",nicht wahr,nicht wahr,"Das Problem lässt sich mit etwas Geduld lösen, nicht wahr?","The problem can be solved with a bit of patience, can’t it?","Le problème peut être résolu avec un peu de patience, n’est-ce pas ?",nicht wahr = isn't it,nicht wahr = n'est-ce pas
244,12,"In dieser Situation wäre ein Kompromiss sinnvoll, _____?",nicht wahr,nicht wahr,"In dieser Situation wäre ein Kompromiss sinnvoll, nicht wahr?","In this situation, a compromise would be sensible, wouldn’t it?","Dans cette situation, un compromis serait judicieux, n’est-ce pas ?",nicht wahr = isn't it,nicht wahr = n'est-ce pas
245,12,"Er hat deutlich gemacht, dass er mehr Zeit braucht, _____?",nicht wahr,nicht wahr,"Er hat deutlich gemacht, dass er mehr Zeit braucht, nicht wahr?","He made it clear that he needs more time, didn’t he?","Il a clairement indiqué qu’il avait besoin de plus de temps, n’est-ce pas ?",nicht wahr = isn't it,nicht wahr = n'est-ce pas
246,12,"Die Erklärung war verständlich genug, _____?",nicht wahr,nicht wahr,"Die Erklärung war verständlich genug, nicht wahr?","The explanation was clear enough, wasn’t it?","L’explication était assez claire, n’est-ce pas ?",nicht wahr = isn't it,nicht wahr = n'est-ce pas
247,13,,Wie vieler,wie vieler genitive,,How many ● Genitive,Combien ● Génitif,Wie vieler = How many ● Genitive,Wie vieler = Combien ● Génitif
248,13,,Welches,welches masculine genitive,,Which ● Masculine Genitive,Quel ● Génitif Masculin,Welches = Which ● Masculine Genitive,Welches = Quel ● Génitif Masculin
249,13,,Welches,welches neuter genitive,,Which ● Neuter Genitive,"Quel, Quelle ● Génitif Neutre",Welches = Which ● Neuter Genitive,"Welches = Quel, Quelle ● Génitif Neutre"
250,13,,Welcher,welcher feminine genitive,,Which ● Feminine Genitive,Quelle ● Génitif Féminin,Welcher = Which ● Feminine Genitive,Welcher = Quelle ● Génitif Féminin
251,13,,Welcher,welcher plural genitive,,Which ● Plural Genitive,"Quels, Quelles ● Génitif Pluriel",Welcher = Which ● Plural Genitive,"Welcher = Quels, Quelles ● Génitif Pluriel"
252,14,"_____ Opfer bedarf es noch, bevor politische Konsequenzen gezogen werden?",Wie vieler,wie vieler genitive,"Wie vieler Opfer bedarf es noch, bevor politische Konsequenzen gezogen werden?",How many victims are still required before political consequences are drawn?,De combien de victimes faudra-t-il encore avant que des conséquences politiques ne soient tirées ?,Wie vieler = How many ● Genitive,Wie vieler = Combien ● Génitif
253,14,"_____ Jahre intensiver Forschung bedurfte es, um zu diesem Ergebnis zu gelangen?",Wie vieler,wie vieler genitive,"Wie vieler Jahre intensiver Forschung bedurfte es, um zu diesem Ergebnis zu gelangen?",How many years of intensive research were required to reach this result?,De combien d’années de recherche intensive a-t-il fallu pour parvenir à ce résultat ?,Wie vieler = How many ● Genitive,Wie vieler = Combien ● Génitif
254,14,"_____ Fehler hat er sich schuldig gemacht, ohne jemals Verantwortung zu übernehmen?",Wie vieler,wie vieler genitive,"Wie vieler Fehler hat er sich schuldig gemacht, ohne jemals Verantwortung zu übernehmen?",Of how many mistakes has he been guilty without ever taking responsibility?,De combien d’erreurs s’est-il rendu coupable sans jamais assumer de responsabilité ?,Wie vieler = How many ● Genitive,Wie vieler = Combien ● Génitif
255,14,_____ Menschen gedenkt man an diesem Jahrestag offiziell?,Wie vieler,wie vieler genitive,Wie vieler Menschen gedenkt man an diesem Jahrestag offiziell?,How many people are officially commemorated on this anniversary?,De combien de personnes se souvient-on officiellement à l’occasion de cet anniversaire ?,Wie vieler = How many ● Genitive,Wie vieler = Combien ● Génitif
256,14,"_____ Mittel hat sich der Staat bereits bedient, um die Krise zu bewältigen?",Wie vieler,wie vieler genitive,"Wie vieler Mittel hat sich der Staat bereits bedient, um die Krise zu bewältigen?",Of how many means has the state already made use in order to manage the crisis?,De combien de moyens l’État s’est-il déjà servi pour gérer la crise ?,Wie vieler = How many ● Genitive,Wie vieler = Combien ● Génitif
257,14,"_____ Fortschritts bedarf es, um diese Technologie marktreif zu machen?",Welches,welches masculine genitive,"Welches Fortschritts bedarf es, um diese Technologie marktreif zu machen?",What degree of progress is required to make this technology market-ready?,De quel progrès a-t-on besoin pour rendre cette technologie commercialisable ?,Welches = Which ● Masculine Genitive,Welches = Quel ● Génitif Masculin
258,14,_____ Verrats wurde er schließlich für schuldig befunden?,Welches,welches masculine genitive,Welches Verrats wurde er schließlich für schuldig befunden?,Of what act of betrayal was he ultimately found guilty?,De quelle trahison a-t-il finalement été reconnu coupable ?,Welches = Which ● Masculine Genitive,Welches = Quel ● Génitif Masculin
259,14,_____ Moments gedenkt man bei dieser Zeremonie besonders?,Welches,welches masculine genitive,Welches Moments gedenkt man bei dieser Zeremonie besonders?,Which moment is particularly commemorated at this ceremony?,De quel moment se souvient-on particulièrement lors de cette cérémonie ?,Welches = Which ● Masculine Genitive,Welches = Quel ● Génitif Masculin
260,14,_____ Einflusses hat sich der Konzern über Jahre hinweg bedient?,Welches,welches masculine genitive,Welches Einflusses hat sich der Konzern über Jahre hinweg bedient?,What kind of influence did the corporation make use of over the years?,De quelle influence le groupe s’est-il servi pendant des années ?,Welches = Which ● Masculine Genitive,Welches = Quel ● Génitif Masculin
261,14,_____ Umfangs entbehrte der Bericht aus wissenschaftlicher Sicht?,Welches,welches masculine genitive,Welches Umfangs entbehrte der Bericht aus wissenschaftlicher Sicht?,Of what scope did the report lack from a scientific point of view?,De quelle ampleur le rapport manquait-il d’un point de vue scientifique ?,Welches = Which ● Masculine Genitive,Welches = Quel ● Génitif Masculin
262,14,"_____ Ausmaßes bedarf es, damit von einer echten Krise gesprochen werden kann?",Welches,welches neuter genitive,"Welches Ausmaßes bedarf es, damit von einer echten Krise gesprochen werden kann?",What scale is required for one to speak of a real crisis?,De quelle ampleur faut-il parler pour qu’on puisse évoquer une véritable crise ?,Welches = Which ● Neuter Genitive,"Welches = Quel, Quelle ● Génitif Neutre"
263,14,_____ Unrechts gedenkt man in dieser Rede ausdrücklich?,Welches,welches neuter genitive,Welches Unrechts gedenkt man in dieser Rede ausdrücklich?,What injustice is explicitly commemorated in this speech?,De quelle injustice se souvient-on explicitement dans ce discours ?,Welches = Which ● Neuter Genitive,"Welches = Quel, Quelle ● Génitif Neutre"
264,14,_____ Risikos hat sich das Unternehmen bei dieser Entscheidung bewusst ausgesetzt?,Welches,welches neuter genitive,Welches Risikos hat sich das Unternehmen bei dieser Entscheidung bewusst ausgesetzt?,Of what risk did the company deliberately expose itself in this decision?,À quel risque l’entreprise s’est-elle délibérément exposée dans cette décision ?,Welches = Which ● Neuter Genitive,"Welches = Quel, Quelle ● Génitif Neutre"
265,14,_____ Materials hat sich der Künstler für dieses Werk bedient?,Welches,welches neuter genitive,Welches Materials hat sich der Künstler für dieses Werk bedient?,What material did the artist make use of for this work?,De quel matériau l’artiste s’est-il servi pour cette œuvre ?,Welches = Which ● Neuter Genitive,"Welches = Quel, Quelle ● Génitif Neutre"
266,14,_____ Wissens entbehrt die öffentliche Debatte in diesem Zusammenhang?,Welches,welches neuter genitive,Welches Wissens entbehrt die öffentliche Debatte in diesem Zusammenhang?,What kind of knowledge does the public debate lack in this context?,De quel savoir le débat public manque-t-il dans ce contexte ?,Welches = Which ● Neuter Genitive,"Welches = Quel, Quelle ● Génitif Neutre"
267,14,"_____ Geduld bedarf es, um diesen diplomatischen Prozess erfolgreich zu Ende zu führen?",Welcher,welcher feminine genitive,"Welcher Geduld bedarf es, um diesen diplomatischen Prozess erfolgreich zu Ende zu führen?",What degree of patience is required to bring this diplomatic process to a successful conclusion?,De quelle patience a-t-on besoin pour mener ce processus diplomatique à son terme ?,Welcher = Which ● Feminine Genitive,Welcher = Quelle ● Génitif Féminin
268,14,"_____ Freiheit gedenkt man in dieser Rede, ohne sie ausdrücklich zu benennen?",Welcher,welcher feminine genitive,"Welcher Freiheit gedenkt man in dieser Rede, ohne sie ausdrücklich zu benennen?",Which freedom is being commemorated in this speech without being explicitly named?,De quelle liberté se souvient-on dans ce discours sans la nommer explicitement ?,Welcher = Which ● Feminine Genitive,Welcher = Quelle ● Génitif Féminin
269,14,_____ Tat schämte er sich noch Jahre später zutiefst?,Welcher,welcher feminine genitive,Welcher Tat schämte er sich noch Jahre später zutiefst?,Of which deed did he still feel deeply ashamed years later?,De quel acte avait-il encore profondément honte des années plus tard ?,Welcher = Which ● Feminine Genitive,Welcher = Quelle ● Génitif Féminin
270,14,"_____ Herkunft rühmte sie sich, um ihre Autorität zu unterstreichen?",Welcher,welcher feminine genitive,"Welcher Herkunft rühmte sie sich, um ihre Autorität zu unterstreichen?",Of which origin did she boast in order to underscore her authority?,De quelle origine se glorifiait-elle afin de souligner son autorité ?,Welcher = Which ● Feminine Genitive,Welcher = Quelle ● Génitif Féminin
271,14,_____ Kritik hat sich die Kommission bewusst enthalten?,Welcher,welcher feminine genitive,Welcher Kritik hat sich die Kommission bewusst enthalten?,From which criticism did the commission deliberately refrain?,De quelle critique la commission s’est-elle délibérément abstenue ?,Welcher = Which ● Feminine Genitive,Welcher = Quelle ● Génitif Féminin
272,14,"_____ Opfer bedarf es noch, um ein Umdenken herbeizuführen?",Welcher,welcher plural genitive,"Welcher Opfer bedarf es noch, um ein Umdenken herbeizuführen?",Of how many victims is it still necessary to bring about a change in thinking?,De combien de victimes faut-il encore pour provoquer un changement de mentalité ?,Welcher = Which ● Plural Genitive,"Welcher = Quels, Quelles ● Génitif Pluriel"
273,14,_____ Verbrechen wurde er letztlich für schuldig befunden?,Welcher,welcher plural genitive,Welcher Verbrechen wurde er letztlich für schuldig befunden?,Of which crimes was he ultimately found guilty?,De quels crimes a-t-il finalement été reconnu coupable ?,Welcher = Which ● Plural Genitive,"Welcher = Quels, Quelles ● Génitif Pluriel"
274,14,_____ Menschen gedenkt man an diesem nationalen Gedenktag?,Welcher,welcher plural genitive,Welcher Menschen gedenkt man an diesem nationalen Gedenktag?,Which people are commemorated on this national day of remembrance?,De quelles personnes se souvient-on lors de cette journée nationale de commémoration ?,Welcher = Which ● Plural Genitive,"Welcher = Quels, Quelles ● Génitif Pluriel"
275,14,_____ Mittel hat sich die Regierung zur Krisenbewältigung bedient?,Welcher,welcher plural genitive,Welcher Mittel hat sich die Regierung zur Krisenbewältigung bedient?,Of which means did the government make use to manage the crisis?,De quels moyens le gouvernement s’est-il servi pour gérer la crise ?,Welcher = Which ● Plural Genitive,"Welcher = Quels, Quelles ● Génitif Pluriel"
276,14,_____ Werte rühmt sich das Unternehmen in seiner Außendarstellung?,Welcher,welcher plural genitive,Welcher Werte rühmt sich das Unternehmen in seiner Außendarstellung?,Of which values does the company boast in its public image?,De quelles valeurs l’entreprise se prévaut-elle dans sa communication externe ?,Welcher = Which ● Plural Genitive,"Welcher = Quels, Quelles ● Génitif Pluriel"
277,102,Der _____ Präsident der Vereinigten Staaten war Abraham Lincoln eigentlich?,wievielte,,Der wievielte Präsident der Vereinigten Staaten war Abraham Lincoln eigentlich?,"Which number president of the United States was Abraham Lincoln, actually?",Quel numéro était réellement le président des États-Unis Abraham Lincoln ?,#N/A,#N/A
278,102,"Weißt du noch, die _____ Ausgabe der Konferenz das damals war?",wievielte,,"Weißt du noch, die wievielte Ausgabe der Konferenz das damals war?",Do you remember which edition of the conference it was back then?,Vous souvenez-vous de quelle édition de la conférence il s’agissait à l’époque ?,#N/A,#N/A
279,102,"In der _____ Zeile beginnt die Passage, die du zitiert hast?",wievielten,,"In der wievielten Zeile beginnt die Passage, die du zitiert hast?",In which line does the passage you quoted begin?,À quelle ligne commence le passage que vous avez cité ?,#N/A,#N/A
280,102,Nach dem _____ Versuch hat er schließlich aufgegeben?,wievielten,,Nach dem wievielten Versuch hat er schließlich aufgegeben?,After how many attempts did he finally give up?,Après combien de tentatives a-t-il finalement abandonné ?,#N/A,#N/A
281,102,"Das ist jetzt schon das _____ Mal, dass sie denselben Fehler macht?",wievielte,,"Das ist jetzt schon das wievielte Mal, dass sie denselben Fehler macht?",How many times has she made the same mistake now?,Combien de fois a-t-elle fait la même erreur maintenant ?,#N/A,#N/A