Nr,exercise,question,answer,german,english,person,case,gender
671,14,"Die Katze, _____ er adoptiert hat, ist schwarz.",die,"Die Katze, die er adoptiert hat, ist schwarz.",,Feminine,Accusative,
672,14,"Die Straße, _____ wir entlanggehen, ist lang.",die,"Die Straße, die wir entlanggehen, ist lang.",,Feminine,Accusative,
673,14,"Die Tasche, _____ sie gekauft hat, ist teuer.",die,"Die Tasche, die sie gekauft hat, ist teuer.",,Feminine,Accusative,
674,14,"Das Buch, _____ er liest, gehört mir.",das,"Das Buch, das er liest, gehört mir.",,neuter,Accusative,
675,14,"Das Haus, _____ ich besichtigt habe, ist groß.",das,"Das Haus, das ich besichtigt habe, ist groß.",,neuter,Accusative,
676,14,"Das Auto, _____ sie fährt, ist schnell.",das,"Das Auto, das sie fährt, ist schnell.",,neuter,Accusative,
677,14,"Das Bild, _____ du gemalt hast, ist schön.",das,"Das Bild, das du gemalt hast, ist schön.",,neuter,Accusative,
678,14,"Das Spielzeug, _____ sie gekauft haben, ist kaputt.",das,"Das Spielzeug, das sie gekauft haben, ist kaputt.",,neuter,Accusative,
679,14,"Die Kinder, _____ wir gesehen haben, sind laut.",die,"Die Kinder, die wir gesehen haben, sind laut.",,Feminine,Accusative,
680,14,"Die Hunde, _____ sie füttern, sind hungrig.",die,"Die Hunde, die sie füttern, sind hungrig.",,Feminine,Accusative,
681,14,"Die Leute, _____ wir getroffen haben, sind nett.",die,"Die Leute, die wir getroffen haben, sind nett.",,Feminine,Accusative,
682,14,"Die Bücher, _____ ich gelesen habe, sind spannend.",die,"Die Bücher, die ich gelesen habe, sind spannend.",,Feminine,Accusative,
683,14,"Die Frauen, _____ er eingeladen hat, kommen später.",die,"Die Frauen, die er eingeladen hat, kommen später.",,Feminine,Accusative,
684,15,"Der Mann, _____ ich geholfen habe, ist dankbar.",dem,"Der Mann, dem ich geholfen habe, ist dankbar.",,Masculine,Dative,
685,15,"Die Frau, _____ ich das Buch gegeben habe, lacht.",der,"Die Frau, der ich das Buch gegeben habe, lacht.",,Feminine,Dative,
686,15,"Das Kind, _____ ich eine Geschichte erzählt habe, hört zu.",dem,"Das Kind, dem ich eine Geschichte erzählt habe, hört zu.",,neuter,Dative,
687,15,"Die Freunde, _____ wir geschrieben haben, kommen morgen.",denen,"Die Freunde, denen wir geschrieben haben, kommen morgen.",,Feminine,Dative,
688,15,"Die Katze, _____ ich das Futter gekauft habe, ist alt.",der,"Die Katze, der ich das Futter gekauft habe, ist alt.",,Feminine,Dative,
689,15,"Die Kinder, _____ ich Süßigkeiten gegeben habe, sind fröhlich.",denen,"Die Kinder, denen ich Süßigkeiten gegeben habe, sind fröhlich.",,Feminine,Dative,
690,15,"Der Hund, _____ sie Wasser gebracht hat, ist krank.",dem,"Der Hund, dem sie Wasser gebracht hat, ist krank.",,Masculine,Dative,
691,15,"Die Blume, _____ wir Wasser gegeben haben, ist gewachsen.",der,"Die Blume, der wir Wasser gegeben haben, ist gewachsen.",,Feminine,Dative,
692,15,"Die Frau, _____ er alles erklärt hat, ist zufrieden.",der,"Die Frau, der er alles erklärt hat, ist zufrieden.",,Feminine,Dative,
693,15,"Der Lehrer, _____ wir zugehört haben, ist streng.",dem,"Der Lehrer, dem wir zugehört haben, ist streng.",,Masculine,Dative,
694,15,"Das Auto, _____ wir die Reifen gewechselt haben, ist rot.",dem,"Das Auto, dem wir die Reifen gewechselt haben, ist rot.",,neuter,Dative,
695,15,"Die Kinder, _____ sie geholfen hat, danken ihr.",denen,"Die Kinder, denen sie geholfen hat, danken ihr.",,Feminine,Dative,
696,15,"Die Frau, _____ wir die Adresse geschickt haben, kommt heute.",der,"Die Frau, der wir die Adresse geschickt haben, kommt heute.",,Feminine,Dative,
697,15,"Das Kind, _____ Sie ein Spielzeug geschenkt hat, ist glücklich.",dem,"Das Kind, dem Sie ein Spielzeug geschenkt hat, ist glücklich.",,neuter,Dative,
698,15,"Die Männer, _____ sie neue Anzüge gekauft haben, sehen elegant aus.",denen,"Die Männer, denen sie neue Anzüge gekauft haben, sehen elegant aus.",,Feminine,Dative,
699,15,"Der Arzt, _____ ich meine Symptome erklärt habe, war freundlich.",dem,"Der Arzt, dem ich meine Symptome erklärt habe, war freundlich.",,Masculine,Dative,
700,15,"Das Haus, _____ wir eine neue Tür eingesetzt haben, sieht modern aus.",dem,"Das Haus, dem wir eine neue Tür eingesetzt haben, sieht modern aus.",,neuter,Dative,
701,15,"Die Leute, _____ wir geholfen haben, sind dankbar.",denen,"Die Leute, denen wir geholfen haben, sind dankbar.",,Feminine,Dative,
702,15,"Der Mann, _____ ich einen Stift geliehen habe, hat ihn zurückgegeben.",dem,"Der Mann, dem ich einen Stift geliehen habe, hat ihn zurückgegeben.",,Masculine,Dative,
703,16,"Der Mann, _____ Haus verkauft wurde, ist traurig.",dessen,"Der Mann, dessen Haus verkauft wurde, ist traurig.",,Masculine,Genitive,
704,16,"Die Frau, _____ Katze verschwunden ist, sucht sie.",deren,"Die Frau, deren Katze verschwunden ist, sucht sie.",,Feminine,Genitive,
705,16,"Das Auto, _____ Besitzer ich kenne, ist alt.",dessen,"Das Auto, dessen Besitzer ich kenne, ist alt.",,neuter,Genitive,
706,16,"Die Kinder, _____ Spielsachen kaputt sind, weinen.",deren,"Die Kinder, deren Spielsachen kaputt sind, weinen.",,Feminine,Genitive,
707,16,"Der Hund, _____ Besitzer verreist ist, bellt viel.",dessen,"Der Hund, dessen Besitzer verreist ist, bellt viel.",,Masculine,Genitive,
708,16,"Die Blume, _____ Duft so angenehm ist, ist schön.",deren,"Die Blume, deren Duft so angenehm ist, ist schön.",,Feminine,Genitive,
709,16,"Das Haus, _____ Fenster offen sind, gehört mir.",dessen,"Das Haus, dessen Fenster offen sind, gehört mir.",,neuter,Genitive,
710,16,"Die Frau, _____ Meinung gefragt wurde, ist klug.",deren,"Die Frau, deren Meinung gefragt wurde, ist klug.",,Feminine,Genitive,
711,16,"Die Freunde, _____ Namen ich vergessen habe, rufen mich an.",deren,"Die Freunde, deren Namen ich vergessen habe, rufen mich an.",,Feminine,Genitive,
712,16,"Der Lehrer, _____ Erklärung hilfreich war, wurde gelobt.",dessen,"Der Lehrer, dessen Erklärung hilfreich war, wurde gelobt.",,Masculine,Genitive,
713,16,"Das Buch, _____ Autor berühmt ist, wird viel gelesen.",dessen,"Das Buch, dessen Autor berühmt ist, wird viel gelesen.",,neuter,Genitive,
714,16,"Die Männer, _____ Autos auf dem Parkplatz stehen, kommen bald.",deren,"Die Männer, deren Autos auf dem Parkplatz stehen, kommen bald.",,Feminine,Genitive,
715,16,"Die Frau, _____ Tasche gestohlen wurde, hat die Polizei gerufen.",deren,"Die Frau, deren Tasche gestohlen wurde, hat die Polizei gerufen.",,Feminine,Genitive,
716,16,"Der Mann, _____ Arbeit wir bewundern, ist sehr klug.",dessen,"Der Mann, dessen Arbeit wir bewundern, ist sehr klug.",,Masculine,Genitive,
717,16,"Das Kind, _____ Spielzeug ich kaputt gemacht habe, weint jetzt.",dessen,"Das Kind, dessen Spielzeug ich kaputt gemacht habe, weint jetzt.",,neuter,Genitive,
718,16,"Die Familie, _____ Haus renoviert wurde, ist zufrieden.",deren,"Die Familie, deren Haus renoviert wurde, ist zufrieden.",,Feminine,Genitive,
719,16,"Der Arzt, _____ Praxis geschlossen ist, arbeitet jetzt woanders.",dessen,"Der Arzt, dessen Praxis geschlossen ist, arbeitet jetzt woanders.",,Masculine,Genitive,
720,16,"Die Frau, _____ Mann ein berühmter Künstler ist, ist sehr freundlich.",deren,"Die Frau, deren Mann ein berühmter Künstler ist, ist sehr freundlich.",,Feminine,Genitive,
721,16,"Die Kinder, _____ Eltern verreist sind, bleiben bei den Großeltern.",deren,"Die Kinder, deren Eltern verreist sind, bleiben bei den Großeltern.",,Feminine,Genitive,
722,16,"Der Junge, _____ Fahrrad gestohlen wurde, ist traurig.",dessen,"Der Junge, dessen Fahrrad gestohlen wurde, ist traurig.",,Masculine,Genitive,
723,16,"Das Buch, _____ Titel ich mich nicht erinnere, war spannend.",an dessen,"Das Buch, an dessen Titel ich mich nicht erinnere, war spannend.",,neuter,Genitive,
724,17,"Der Mann, _____ hier steht, ist mein Lehrer.",der,"Der Mann, der hier steht, ist mein Lehrer.",,Masculine,Nominative,
725,17,"Der Hund, _____ draußen bellt, gehört Peter.",der,"Der Hund, der draußen bellt, gehört Peter.",,Masculine,Nominative,
726,17,"Der Arzt, _____ in Berlin wohnt, ist bekannt.",der,"Der Arzt, der in Berlin wohnt, ist bekannt.",,Masculine,Nominative,
727,17,"Der Junge, _____ Fußball spielt, ist schnell.",der,"Der Junge, der Fußball spielt, ist schnell.",,Masculine,Nominative,
728,17,"Der Freund, _____ ich kenne, ist nett.",den,"Der Freund, den ich kenne, ist nett.",,Feminine,Nominative,
729,17,"Die Frau, _____ dort sitzt, ist meine Mutter.",die,"Die Frau, die dort sitzt, ist meine Mutter.",,Feminine,Nominative,
730,17,"Die Katze, _____ schläft, ist grau.",die,"Die Katze, die schläft, ist grau.",,Feminine,Nominative,
731,17,"Die Studentin, _____ ein Buch liest, ist klug.",die,"Die Studentin, die ein Buch liest, ist klug.",,Feminine,Nominative,
732,17,"Die Blume, _____ duftet, ist schön.",die,"Die Blume, die duftet, ist schön.",,Feminine,Nominative,
733,17,"Die Lehrerin, _____ singt, ist freundlich.",die,"Die Lehrerin, die singt, ist freundlich.",,neuter,Nominative,
734,17,"Das Kind, _____ lacht, ist glücklich.",das,"Das Kind, das lacht, ist glücklich.",,neuter,Nominative,
735,17,"Das Auto, _____ schnell fährt, ist teuer.",das,"Das Auto, das schnell fährt, ist teuer.",,neuter,Nominative,
736,17,"Das Buch, _____ du liest, ist spannend.",das,"Das Buch, das du liest, ist spannend.",,neuter,Nominative,
737,17,"Das Spielzeug, _____ kaputt ist, ist alt.",das,"Das Spielzeug, das kaputt ist, ist alt.",,neuter,Nominative,
738,17,"Das Haus, _____ renoviert wird, ist alt.",das,"Das Haus, das renoviert wird, ist alt.",,Feminine,Nominative,
739,17,"Die Kinder, _____ laut lachen, sind fröhlich.",die,"Die Kinder, die laut lachen, sind fröhlich.",,Feminine,Nominative,
740,17,"Die Hunde, _____ bellen, sind nervös.",die,"Die Hunde, die bellen, sind nervös.",,Feminine,Nominative,
741,17,"Die Leute, _____ hier wohnen, sind freundlich.",die,"Die Leute, die hier wohnen, sind freundlich.",,Feminine,Nominative,
742,17,"Die Bücher, _____ ich lese, sind interessant.",die,"Die Bücher, die ich lese, sind interessant.",,Feminine,Nominative,
743,17,"Die Frauen, _____ tanzen, sind elegant.",die,"Die Frauen, die tanzen, sind elegant.",,Masculine,Accusative,
744,17,"Der Mann, _____ ich gestern gesehen habe, kennst dich.",den,"Der Mann, den ich gestern gesehen habe, kennst dich.",,Masculine,Accusative,
745,17,"Der Hund, _____ sie gefunden haben, ist verloren.",den,"Der Hund, den sie gefunden haben, ist verloren.",,Masculine,Accusative,
746,17,"Der Film, _____ ich gesehen habe, war spannend.",den,"Der Film, den ich gesehen habe, war spannend.",,Masculine,Accusative,
747,17,"Der Lehrer, _____ du suchst, ist hier.",den,"Der Lehrer, den du suchst, ist hier.",,Masculine,Accusative,
748,17,"Der Brief, _____ ich geschrieben habe, liegt hier.",den,"Der Brief, den ich geschrieben habe, liegt hier.",,Masculine,Accusative,
749,17,"Die Frau, _____ ich getroffen habe, war freundlich.",die,"Die Frau, die ich getroffen habe, war freundlich.",,Feminine,Accusative,
750,17,"Die Blume, _____ ich gepflückt habe, ist schön.",die,"Die Blume, die ich gepflückt habe, ist schön.",,Feminine,Accusative,
751,17,"Die Katze, _____ er adoptiert hat, ist schwarz.",die,"Die Katze, die er adoptiert hat, ist schwarz.",,Feminine,Accusative,
752,17,"Die Straße, _____ wir entlanggehen, ist lang.",die,"Die Straße, die wir entlanggehen, ist lang.",,Feminine,Accusative,
753,17,"Die Tasche, _____ sie gekauft hat, ist teuer.",die,"Die Tasche, die sie gekauft hat, ist teuer.",,Feminine,Accusative,
754,17,"Das Buch, _____ er liest, gehört mir.",das,"Das Buch, das er liest, gehört mir.",,neuter,Accusative,
755,17,"Das Haus, _____ ich besichtigt habe, ist groß.",das,"Das Haus, das ich besichtigt habe, ist groß.",,neuter,Accusative,
756,17,"Das Auto, _____ sie fährt, ist schnell.",das,"Das Auto, das sie fährt, ist schnell.",,neuter,Accusative,
757,17,"Das Bild, _____ du gemalt hast, ist schön.",das,"Das Bild, das du gemalt hast, ist schön.",,neuter,Accusative,
758,17,"Das Spielzeug, _____ sie gekauft haben, ist kaputt.",das,"Das Spielzeug, das sie gekauft haben, ist kaputt.",,neuter,Accusative,
759,17,"Die Kinder, _____ wir gesehen haben, sind laut.",die,"Die Kinder, die wir gesehen haben, sind laut.",,Feminine,Accusative,
760,17,"Die Hunde, _____ sie füttern, sind hungrig.",die,"Die Hunde, die sie füttern, sind hungrig.",,Feminine,Accusative,
761,17,"Die Leute, _____ wir getroffen haben, sind nett.",die,"Die Leute, die wir getroffen haben, sind nett.",,Feminine,Accusative,
762,17,"Die Bücher, _____ ich gelesen habe, sind spannend.",die,"Die Bücher, die ich gelesen habe, sind spannend.",,Feminine,Accusative,
763,17,"Die Frauen, _____ er eingeladen hat, kommen später.",die,"Die Frauen, die er eingeladen hat, kommen später.",,Feminine,Accusative,
764,17,"Der Mann, _____ ich geholfen habe, ist dankbar.",dem,"Der Mann, dem ich geholfen habe, ist dankbar.",,Masculine,Dative,
765,17,"Die Frau, _____ ich das Buch gegeben habe, lacht.",der,"Die Frau, der ich das Buch gegeben habe, lacht.",,Feminine,Dative,
766,17,"Das Kind, _____ ich eine Geschichte erzählt habe, hört zu.",dem,"Das Kind, dem ich eine Geschichte erzählt habe, hört zu.",,neuter,Dative,
767,17,"Die Freunde, _____ wir geschrieben haben, kommen morgen.",denen,"Die Freunde, denen wir geschrieben haben, kommen morgen.",,Feminine,Dative,
768,17,"Die Katze, _____ ich das Futter gekauft habe, ist alt.",der,"Die Katze, der ich das Futter gekauft habe, ist alt.",,Feminine,Dative,
769,17,"Die Kinder, _____ ich Süßigkeiten gegeben habe, sind fröhlich.",denen,"Die Kinder, denen ich Süßigkeiten gegeben habe, sind fröhlich.",,Feminine,Dative,
770,17,"Der Hund, _____ sie Wasser gebracht hat, ist krank.",dem,"Der Hund, dem sie Wasser gebracht hat, ist krank.",,Masculine,Dative,
771,17,"Die Blume, _____ wir Wasser gegeben haben, ist gewachsen.",der,"Die Blume, der wir Wasser gegeben haben, ist gewachsen.",,Feminine,Dative,
772,17,"Die Frau, _____ er alles erklärt hat, ist zufrieden.",der,"Die Frau, der er alles erklärt hat, ist zufrieden.",,Feminine,Dative,
773,17,"Der Lehrer, _____ wir zugehört haben, ist streng.",dem,"Der Lehrer, dem wir zugehört haben, ist streng.",,Masculine,Dative,
774,17,"Das Auto, _____ wir die Reifen gewechselt haben, ist rot.",dem,"Das Auto, dem wir die Reifen gewechselt haben, ist rot.",,neuter,Dative,
775,17,"Die Kinder, _____ sie geholfen hat, danken ihr.",denen,"Die Kinder, denen sie geholfen hat, danken ihr.",,Feminine,Dative,
776,17,"Die Frau, _____ wir die Adresse geschickt haben, kommt heute.",der,"Die Frau, der wir die Adresse geschickt haben, kommt heute.",,Feminine,Dative,
777,17,"Das Kind, _____ Sie ein Spielzeug geschenkt hat, ist glücklich.",dem,"Das Kind, dem Sie ein Spielzeug geschenkt hat, ist glücklich.",,neuter,Dative,
778,17,"Die Männer, _____ sie neue Anzüge gekauft haben, sehen elegant aus.",denen,"Die Männer, denen sie neue Anzüge gekauft haben, sehen elegant aus.",,Feminine,Dative,
779,17,"Der Arzt, _____ ich meine Symptome erklärt habe, war freundlich.",dem,"Der Arzt, dem ich meine Symptome erklärt habe, war freundlich.",,Masculine,Dative,
780,17,"Das Haus, _____ wir eine neue Tür eingesetzt haben, sieht modern aus.",dem,"Das Haus, dem wir eine neue Tür eingesetzt haben, sieht modern aus.",,neuter,Dative,
781,17,"Die Leute, _____ wir geholfen haben, sind dankbar.",denen,"Die Leute, denen wir geholfen haben, sind dankbar.",,Feminine,Dative,
782,17,"Der Mann, _____ ich einen Stift geliehen habe, hat ihn zurückgegeben.",dem,"Der Mann, dem ich einen Stift geliehen habe, hat ihn zurückgegeben.",,Masculine,Dative,
783,17,"Der Mann, _____ Haus verkauft wurde, ist traurig.",dessen,"Der Mann, dessen Haus verkauft wurde, ist traurig.",,Masculine,Genitive,
784,17,"Die Frau, _____ Katze verschwunden ist, sucht sie.",deren,"Die Frau, deren Katze verschwunden ist, sucht sie.",,Feminine,Genitive,
785,17,"Das Auto, _____ Besitzer ich kenne, ist alt.",dessen,"Das Auto, dessen Besitzer ich kenne, ist alt.",,neuter,Genitive,
786,17,"Die Kinder, _____ Spielsachen kaputt sind, weinen.",deren,"Die Kinder, deren Spielsachen kaputt sind, weinen.",,Feminine,Genitive,
787,17,"Der Hund, _____ Besitzer verreist ist, bellt viel.",dessen,"Der Hund, dessen Besitzer verreist ist, bellt viel.",,Masculine,Genitive,
788,17,"Die Blume, _____ Duft so angenehm ist, ist schön.",deren,"Die Blume, deren Duft so angenehm ist, ist schön.",,Feminine,Genitive,
789,17,"Das Haus, _____ Fenster offen sind, gehört mir.",dessen,"Das Haus, dessen Fenster offen sind, gehört mir.",,neuter,Genitive,
790,17,"Die Frau, _____ Meinung gefragt wurde, ist klug.",deren,"Die Frau, deren Meinung gefragt wurde, ist klug.",,Feminine,Genitive,
791,17,"Die Freunde, _____ Namen ich vergessen habe, rufen mich an.",deren,"Die Freunde, deren Namen ich vergessen habe, rufen mich an.",,Feminine,Genitive,
792,17,"Der Lehrer, _____ Erklärung hilfreich war, wurde gelobt.",dessen,"Der Lehrer, dessen Erklärung hilfreich war, wurde gelobt.",,Masculine,Genitive,
793,17,"Das Buch, _____ Autor berühmt ist, wird viel gelesen.",dessen,"Das Buch, dessen Autor berühmt ist, wird viel gelesen.",,neuter,Genitive,
794,17,"Die Männer, _____ Autos auf dem Parkplatz stehen, kommen bald.",deren,"Die Männer, deren Autos auf dem Parkplatz stehen, kommen bald.",,Feminine,Genitive,
795,17,"Die Frau, _____ Tasche gestohlen wurde, hat die Polizei gerufen.",deren,"Die Frau, deren Tasche gestohlen wurde, hat die Polizei gerufen.",,Feminine,Genitive,
796,17,"Der Mann, _____ Arbeit wir bewundern, ist sehr klug.",dessen,"Der Mann, dessen Arbeit wir bewundern, ist sehr klug.",,Masculine,Genitive,
797,17,"Das Kind, _____ Spielzeug ich kaputt gemacht habe, weint jetzt.",dessen,"Das Kind, dessen Spielzeug ich kaputt gemacht habe, weint jetzt.",,neuter,Genitive,
798,17,"Die Familie, _____ Haus renoviert wurde, ist zufrieden.",deren,"Die Familie, deren Haus renoviert wurde, ist zufrieden.",,Feminine,Genitive,
799,17,"Der Arzt, _____ Praxis geschlossen ist, arbeitet jetzt woanders.",dessen,"Der Arzt, dessen Praxis geschlossen ist, arbeitet jetzt woanders.",,Masculine,Genitive,
800,17,"Die Frau, _____ Mann ein berühmter Künstler ist, ist sehr freundlich.",deren,"Die Frau, deren Mann ein berühmter Künstler ist, ist sehr freundlich.",,Feminine,Genitive,
801,17,"Die Kinder, _____ Eltern verreist sind, bleiben bei den Großeltern.",deren,"Die Kinder, deren Eltern verreist sind, bleiben bei den Großeltern.",,Feminine,Genitive,
802,17,"Der Junge, _____ Fahrrad gestohlen wurde, ist traurig.",dessen,"Der Junge, dessen Fahrrad gestohlen wurde, ist traurig.",,Masculine,Genitive,
803,17,"Das Buch, _____ Titel ich mich nicht erinnere, war spannend.",an dessen,"Das Buch, an dessen Titel ich mich nicht erinnere, war spannend.",,neuter,Genitive,
804,18,"Das ist das Fahrrad, _____ schnell fährt.",das,"Das ist das Fahrrad, das schnell fährt.",,neuter,Nominative,
805,18,"Die Reise, _____ wir geplant haben, ist teuer.",die,"Die Reise, die wir geplant haben, ist teuer.",,Feminine,Accusative,
806,18,"Der Film, _____ im Kino läuft, ist interessant.",der,"Der Film, der im Kino läuft, ist interessant.",,Masculine,Nominative,
807,18,"Die Wohnung, _____ wir gemietet haben, ist klein.",die,"Die Wohnung, die wir gemietet haben, ist klein.",,Feminine,Accusative,
808,18,"Das Problem, _____ wir lösen müssen, ist schwierig.",das,"Das Problem, das wir lösen müssen, ist schwierig.",,neuter,Accusative,
809,18,"Die Aufgabe, _____ er bekommen hat, ist einfach.",die,"Die Aufgabe, die er bekommen hat, ist einfach.",,Feminine,Accusative,
810,18,"Der Computer, _____ neu ist, funktioniert gut.",der,"Der Computer, der neu ist, funktioniert gut.",,Masculine,Nominative,
811,18,"Die Musik, _____ ich höre, ist entspannend.",die,"Die Musik, die ich höre, ist entspannend.",,Feminine,Accusative,
812,18,"Das Essen, _____ gut schmeckt, ist teuer.",das,"Das Essen, das gut schmeckt, ist teuer.",,neuter,Nominative,
813,18,"Die Leute, _____ hier wohnen, sind nett.",die,"Die Leute, die hier wohnen, sind nett.",,Feminine,Nominative,
814,18,"Der Zug, _____ Verspätung hat, kommt bald an.",der,"Der Zug, der Verspätung hat, kommt bald an.",,Masculine,Nominative,
815,18,"Das Hotel, _____ wir gebucht haben, ist modern.",das,"Das Hotel, das wir gebucht haben, ist modern.",,neuter,Accusative,
816,18,"Die Sprache, _____ ich lerne, ist schwer.",die,"Die Sprache, die ich lerne, ist schwer.",,Feminine,Accusative,
817,18,"Der Sport, _____ ich mache, ist gesund.",den,"Der Sport, den ich mache, ist gesund.",,Masculine,Accusative,
818,18,"Die Ferien, _____ wir hatten, waren toll.",die,"Die Ferien, die wir hatten, waren toll.",,Feminine,Accusative,
819,18,"Der Urlaub, _____ sie macht, ist lang.",den,"Der Urlaub, den sie macht, ist lang.",,Masculine,Accusative,
820,18,"Das Geschenk, _____ ich bekommen habe, ist schön.",das,"Das Geschenk, das ich bekommen habe, ist schön.",,neuter,Accusative,
821,18,"Die Party, _____ wir gefeiert haben, war lustig.",die,"Die Party, die wir gefeiert haben, war lustig.",,Feminine,Accusative,
822,18,"Das ist das Buch, _____ ich gelesen habe.",das,"Das ist das Buch, das ich gelesen habe.",,neuter,Accusative,
823,18,"Die Reise, _____ wir gebucht haben, war schön.",die,"Die Reise, die wir gebucht haben, war schön.",,Feminine,Accusative,
824,18,"Der Film, _____ wir gesehen haben, war spannend.",den,"Der Film, den wir gesehen haben, war spannend.",,Masculine,Accusative,
825,18,"Das Problem, _____ wir besprochen haben, ist gelöst.",das,"Das Problem, das wir besprochen haben, ist gelöst.",,neuter,Accusative,
826,18,"Die Aufgabe, _____ er erledigt hat, war schwierig.",die,"Die Aufgabe, die er erledigt hat, war schwierig.",,Feminine,Accusative,
827,18,"Der Computer, _____ ich gekauft habe, ist schnell.",den,"Der Computer, den ich gekauft habe, ist schnell.",,Masculine,Accusative,
828,18,"Die Musik, _____ du hörst, gefällt mir.",die,"Die Musik, die du hörst, gefällt mir.",,Feminine,Accusative,
829,18,"Das Essen, _____ wir bestellt haben, ist lecker.",das,"Das Essen, das wir bestellt haben, ist lecker.",,neuter,Accusative,
830,18,"Die Leute, _____ ich getroffen habe, waren freundlich.",die,"Die Leute, die ich getroffen habe, waren freundlich.",,Feminine,Accusative,
831,18,"Der Zug, _____ wir verpasst haben, fährt später.",den,"Der Zug, den wir verpasst haben, fährt später.",,Masculine,Accusative,
832,18,"Das Hotel, _____ sie gefunden haben, ist billig.",das,"Das Hotel, das sie gefunden haben, ist billig.",,neuter,Accusative,
833,18,"Die Arbeit, _____ sie gefunden hat, ist gut bezahlt.",die,"Die Arbeit, die sie gefunden hat, ist gut bezahlt.",,Feminine,Accusative,
834,18,"Das Wetter, _____ wir hatten, war schlecht.",das,"Das Wetter, das wir hatten, war schlecht.",,neuter,Accusative,
835,18,"Die Ferien, _____ sie geplant haben, sind kurz.",die,"Die Ferien, die sie geplant haben, sind kurz.",,Feminine,Accusative,
836,18,"Der Urlaub, _____ er macht, ist erholsam.",den,"Der Urlaub, den er macht, ist erholsam.",,Masculine,Accusative,
837,18,"Das Geschenk, _____ du bekommen hast, ist nützlich.",das,"Das Geschenk, das du bekommen hast, ist nützlich.",,neuter,Accusative,
838,18,"Die Party, _____ sie organisiert haben, war super.",die,"Die Party, die sie organisiert haben, war super.",,Feminine,Accusative,
839,18,"Das ist der Mann, _____ ich geholfen habe.",dem,"Das ist der Mann, dem ich geholfen habe.",,neuter,Dative,
840,18,"Die Frau, _____ ich das Buch gegeben habe, ist nett.",der,"Die Frau, der ich das Buch gegeben habe, ist nett.",,Feminine,Dative,
841,18,"Das Kind, _____ wir gratuliert haben, hat sich gefreut.",dem,"Das Kind, dem wir gratuliert haben, hat sich gefreut.",,neuter,Dative,
842,18,"Die Firma, _____ wir die Rechnung geschickt haben, ist groß.",an die,"Die Firma, an die wir die Rechnung geschickt haben, ist groß.",,Feminine,Accusative,
843,18,"Die Kollegin, _____ ich die Nachricht geschickt habe, arbeitet im Büro.",der,"Die Kollegin, der ich die Nachricht geschickt habe, arbeitet im Büro.",,Feminine,Dative,
844,18,"Der Lehrer, _____ wir zuhören, ist erfahren.",dem,"Der Lehrer, dem wir zuhören, ist erfahren.",,Masculine,Dative,
845,18,"Die Familie, _____ wir einen Besuch gemacht haben, geht es gut.",bei der,"Die Familie, bei der wir einen Besuch gemacht haben, geht es gut.",,Feminine,Dative,
846,18,"Der Stuhl, _____ du sitzt, ist bequem.",auf dem,"Der Stuhl, auf dem du sitzt, ist bequem.",,Masculine,Dative,
847,18,"Das Fenster, _____ es zieht, ist undicht.",aus dem,"Das Fenster, aus dem es zieht, ist undicht.",,neuter,Dative,
848,18,"Der Baum, _____ viele Vögel nisten, ist alt.",in dem,"Der Baum, in dem viele Vögel nisten, ist alt.",,Masculine,Dative,
849,18,"Die Lampe, _____ ich eine neue Birne eingesetzt habe, leuchtet wieder.",in die,"Die Lampe, in die ich eine neue Birne eingesetzt habe, leuchtet wieder.",,Feminine,Accusative,
850,18,"Der Tisch, _____ wir uns setzen, ist gedeckt.",an den,"Der Tisch, an den wir uns setzen, ist gedeckt.",,Masculine,Accusative,
851,18,"Der Chef, _____ ich die Idee vorgestellt habe,  hat sie gemocht.",dem,"Der Chef, dem ich die Idee vorgestellt habe, hat sie gemocht.",,Masculine,Dative,
852,18,"Die Kinder, _____ wir Geschenke gegeben haben, haben sich gefreut.",denen,"Die Kinder, denen wir Geschenke gegeben haben, haben sich gefreut.",,Plural,Dative,
853,18,"Das Projekt, _____ wir arbeiten, ist wichtig.",an dem,"Das Projekt, an dem wir arbeiten, ist wichtig.",,neuter,Dative,
854,18,"Das Problem, _____ wir uns beschäftigen, ist kompliziert.",mit dem,"Das Problem, mit dem wir uns beschäftigen, ist kompliziert.",,neuter,Dative,
855,18,"Der Computer, _____ ich arbeite, ist neu.",mit dem,"Der Computer, mit dem ich arbeite, ist neu.",,Masculine,Dative,
856,18,"Das Auto, _____ er fährt, ist schnell.",mit dem,"Das Auto, mit dem er fährt, ist schnell.",,neuter,Dative,
