Nr,level,german,english,preposition,sentence
469,11,angesichts,"in view of, considering",,
470,12,_____ seiner Hilfe konnten wir das Problem schnell lösen.,"Thanks to his help, we were able to solve the problem quickly.",Dank,Dank seiner Hilfe konnten wir das Problem schnell lösen.
471,12,"Die Firma wächst stetig, _____ innovativer Ideen.",The company is growing steadily thanks to innovative ideas.,dank,"Die Firma wächst stetig, dank innovativer Ideen."
472,12,_____ der modernen Medizin leben die Menschen länger.,"Thanks to modern medicine, people live longer.",Dank,Dank der modernen Medizin leben die Menschen länger.
473,12,"Er hat die Prüfung bestanden, _____ seines intensiven Lernens.",He passed the exam thanks to his intensive studying.,dank,"Er hat die Prüfung bestanden, dank seines intensiven Lernens."
474,12,_____ des guten Wetters konnten wir die Reise genießen.,"Thanks to the good weather, we were able to enjoy the trip.",Dank,Dank des guten Wetters konnten wir die Reise genießen.
475,12,Die Identität des Täters wurde _____ DNA-Analyse bestätigt.,The identity of the perpetrator was confirmed using DNA analysis.,mittels,Die Identität des Täters wurde mittels DNA-Analyse bestätigt.
476,12,Das Problem wurde _____ einer neuen Software gelöst.,The problem was solved by means of new software.,mittels,Das Problem wurde mittels einer neuen Software gelöst.
477,12,_____ moderner Technologien kann die Effizienz gesteigert werden.,Efficiency can be increased through modern technologies.,Mittels,Mittels moderner Technologien kann die Effizienz gesteigert werden.
478,12,Die Zahlung erfolgt _____ Kreditkarte oder Überweisung.,Payment is made by means of credit card or bank transfer.,mittels,Die Zahlung erfolgt mittels Kreditkarte oder Überweisung.
479,12,Das Unternehmen optimiert seine Prozesse _____ künstlicher Intelligenz.,The company optimizes its processes using artificial intelligence.,mittels,Das Unternehmen optimiert seine Prozesse mittels künstlicher Intelligenz.
480,12,Das Problem wurde _____ eine neue Methode gelöst.,The problem was solved through a new method.,durch,Das Problem wurde durch eine neue Methode gelöst.
481,12,Die Stadt wurde _____ ein Erdbeben zerstört.,The city was destroyed by an earthquake.,durch,Die Stadt wurde durch ein Erdbeben zerstört.
482,12,Die Tür wurde _____ einen starken Windstoß geöffnet.,The door was opened by a strong gust of wind.,durch,Die Tür wurde durch einen starken Windstoß geöffnet.
483,12,Das Unternehmen wurde _____ eine Fusion gerettet.,The company was saved through a merger.,durch,Das Unternehmen wurde durch eine Fusion gerettet.
484,12,Die Daten wurden _____ eine Software analysiert.,The data was analyzed by a software program.,durch,Die Daten wurden durch eine Software analysiert.
485,12,Er half ihr _____ Freundlichkeit.,He helped her out of kindness.,aus,Er half ihr aus Freundlichkeit.
486,12,Sie entschied sich _____ Vernunft für diesen Job.,She chose this job out of reason.,aus,Sie entschied sich aus Vernunft für diesen Job.
487,12,_____ Respekt unterbrach er die Diskussion nicht.,"Out of respect, he didn’t interrupt the discussion.",Aus,Aus Respekt unterbrach er die Diskussion nicht.
488,12,Er spendete Geld _____ Mitgefühl für die Opfer.,He donated money out of compassion for the victims.,aus,Er spendete Geld aus Mitgefühl für die Opfer.
489,12,_____ Interesse besuchte sie das Seminar.,She attended the seminar out of interest.,Aus,Aus Interesse besuchte sie das Seminar.
490,12,Er zitterte _____ Kälte.,He was shivering from the cold.,vor,Er zitterte vor Kälte.
491,12,Sie weinte _____ Freude.,She cried out of joy.,vor,Sie weinte vor Freude.
492,12,_____ Angst konnte er nicht sprechen.,"Out of fear, he couldn’t speak.",Vor,Vor Angst konnte er nicht sprechen.
493,12,Er wurde _____ Schreck blass.,He turned pale from shock.,vor,Er wurde vor Schreck blass.
494,12,Sie lachte _____ Erleichterung.,She laughed out of relief.,vor,Sie lachte vor Erleichterung.
495,12,_____ ausreichender Beweise konnte der Verdächtige nicht verurteilt werden.,"Due to a lack of sufficient evidence, the suspect could not be convicted.",Mangels,Mangels ausreichender Beweise konnte der Verdächtige nicht verurteilt werden.
496,12,_____ Erfahrung fiel ihm die Aufgabe besonders schwer.,"Due to a lack of experience, the task was particularly difficult for him.",Mangels,Mangels Erfahrung fiel ihm die Aufgabe besonders schwer.
497,12,_____ finanzieller Mittel wurde das Projekt gestoppt.,"Due to a lack of financial resources, the project was stopped.",Mangels,Mangels finanzieller Mittel wurde das Projekt gestoppt.
498,12,_____ Interesse wurde die Veranstaltung abgesagt.,"Due to a lack of interest, the event was canceled.",Mangels,Mangels Interesse wurde die Veranstaltung abgesagt.
499,12,_____ besserer Alternativen entschied man sich für diese Lösung.,"For lack of better alternatives, this solution was chosen.",Mangels,Mangels besserer Alternativen entschied man sich für diese Lösung.
500,12,Das Buch wurde _____ einem berühmten Autor geschrieben.,The book was written by a famous author.,von,Das Buch wurde von einem berühmten Autor geschrieben.
501,12,Der Dieb wurde _____ der Polizei festgenommen.,The thief was arrested by the police.,von,Der Dieb wurde von der Polizei festgenommen.
502,12,Die Brücke wurde _____ Ingenieuren geplant.,The bridge was designed by engineers.,von,Die Brücke wurde von Ingenieuren geplant.
503,12,Der Fehler wurde _____ einem Mitarbeiter entdeckt.,The mistake was discovered by an employee.,von,Der Fehler wurde von einem Mitarbeiter entdeckt.
504,12,Die Entscheidung wurde _____ der Geschäftsleitung getroffen.,The decision was made by the management.,von,Die Entscheidung wurde von der Geschäftsleitung getroffen.
505,12,_____ seinen Kollegen arbeitet er lieber allein.,"In contrast to his colleagues, he prefers to work alone.",Im Gegensatz zu,Im Gegensatz zu seinen Kollegen arbeitet er lieber allein.
506,12,_____ früheren Jahren hat sich das Klima stark verändert.,"In contrast to previous years, the climate has changed significantly.",Im Gegensatz zu,Im Gegensatz zu früheren Jahren hat sich das Klima stark verändert.
507,12,_____ ihren Erwartungen war die Prüfung ziemlich schwer.,"Contrary to her expectations, the exam was quite difficult.",Im Gegensatz zu,Im Gegensatz zu ihren Erwartungen war die Prüfung ziemlich schwer.
508,12,_____ vielen anderen Unternehmen setzt diese Firma auf Nachhaltigkeit.,"Unlike many other companies, this firm focuses on sustainability.",Im Gegensatz zu,Im Gegensatz zu vielen anderen Unternehmen setzt diese Firma auf Nachhaltigkeit.
509,12,_____ meinem Bruder interessiere ich mich nicht für Sport.,"Unlike my brother, I am not interested in sports.",Im Gegensatz zu,Im Gegensatz zu meinem Bruder interessiere ich mich nicht für Sport.
510,12,_____ der Statistik lässt sich der Trend klar erkennen.,The trend can be clearly seen based on the statistics.,Anhand,Anhand der Statistik lässt sich der Trend klar erkennen.
511,12,_____ seiner Aussagen kann man die Situation besser verstehen.,"Based on his statements, one can better understand the situation.",Anhand,Anhand seiner Aussagen kann man die Situation besser verstehen.
512,12,Die Qualität wird _____ verschiedener Kriterien bewertet.,The quality is assessed based on various criteria.,anhand,Die Qualität wird anhand verschiedener Kriterien bewertet.
513,12,_____ dieser Beispiele wird das Problem deutlich.,This problem becomes clear through these examples.,Anhand,Anhand dieser Beispiele wird das Problem deutlich.
514,12,Die Echtheit des Dokuments wurde _____ von Experten geprüft.,The authenticity of the document was verified by experts.,anhand,Die Echtheit des Dokuments wurde anhand von Experten geprüft.
515,12,_____ ihm hat niemand die Prüfung bestanden.,"Except for him, no one passed the exam.",Ausser,Ausser ihm hat niemand die Prüfung bestanden.
516,12,_____ finanziellen Problemen gibt es noch andere Herausforderungen.,"Besides financial problems, there are other challenges.",Ausser,Ausser finanziellen Problemen gibt es noch andere Herausforderungen.
517,12,_____ in Deutschland wird dieses Produkt auch in Österreich verkauft.,"Apart from Germany, this product is also sold in Austria.",Ausser,Ausser in Deutschland wird dieses Produkt auch in Österreich verkauft.
518,12,_____ bei starkem Regen gehen wir jeden Tag joggen.,"Except in heavy rain, we go jogging every day.",Ausser,Ausser bei starkem Regen gehen wir jeden Tag joggen.
519,12,_____ seiner Familie hat er niemandem davon erzählt.,"Apart from his family, he hasn’t told anyone about it.",Ausser,Ausser seiner Familie hat er niemandem davon erzählt.
520,12,_____ des starken Regens gab es Überschwemmungen in der Region.,"As a result of the heavy rain, there were floods in the region.",Infolge,Infolge des starken Regens gab es Überschwemmungen in der Region.
521,12,_____ der Wirtschaftskrise mussten viele Unternehmen schließen.,"Due to the economic crisis, many businesses had to close.",Infolge,Infolge der Wirtschaftskrise mussten viele Unternehmen schließen.
522,12,_____ eines technischen Fehlers wurde der Flug gestrichen.,"Due to a technical error, the flight was canceled.",Infolge,Infolge eines technischen Fehlers wurde der Flug gestrichen.
523,12,_____ der neuen Gesetzesänderung gelten strengere Regeln für Unternehmen.,"As a result of the new law change, stricter regulations apply to companies.",Infolge,Infolge der neuen Gesetzesänderung gelten strengere Regeln für Unternehmen.
524,12,_____ der schlechten Wetterbedingungen wurde das Event verschoben.,"Due to bad weather conditions, the event was postponed.",Infolge,Infolge der schlechten Wetterbedingungen wurde das Event verschoben.
525,12,_____ der steigenden Kosten muss das Budget überarbeitet werden.,"In view of the rising costs, the budget must be revised.",Angesichts,Angesichts der steigenden Kosten muss das Budget überarbeitet werden.
526,12,_____ der aktuellen Situation sollten wir vorsichtig sein.,"Given the current situation, we should be cautious.",Angesichts,Angesichts der aktuellen Situation sollten wir vorsichtig sein.
527,12,_____ der wirtschaftlichen Lage werden viele Unternehmen vorsichtiger investieren.,"Considering the economic situation, many companies are investing more cautiously.",Angesichts,Angesichts der wirtschaftlichen Lage werden viele Unternehmen vorsichtiger investieren.
528,12,_____ der Beweise konnte der Richter eine klare Entscheidung treffen.,"In light of the evidence, the judge was able to make a clear decision.",Angesichts,Angesichts der Beweise konnte der Richter eine klare Entscheidung treffen.
529,12,_____ des Klimawandels müssen wir nachhaltiger leben.,"In view of climate change, we need to live more sustainably.",Angesichts,Angesichts des Klimawandels müssen wir nachhaltiger leben.
530,12,Der Preis beträgt 100 Euro _____ Steuern.,"The price is 100 euros, including taxes.",inklusive,Der Preis beträgt 100 Euro inklusive Steuern.
531,12,Das Hotel bietet ein Frühstücksbuffet _____ Getränke.,"The hotel offers a breakfast buffet, including drinks.",inklusive,Das Hotel bietet ein Frühstücksbuffet inklusive Getränke.
532,12,Alle Teilnehmer erhalten ein Paket _____ Arbeitsmaterialien.,"All participants receive a package, including work materials.",inklusive,Alle Teilnehmer erhalten ein Paket inklusive Arbeitsmaterialien.
533,12,Die Miete beträgt 900 Euro _____ Nebenkosten.,"The rent is 900 euros, including utilities.",inklusive,Die Miete beträgt 900 Euro inklusive Nebenkosten.
534,12,Der Flugpreis ist _____ Gepäck und Sitzplatzreservierung.,The flight price includes luggage and seat reservation.,inklusive,Der Flugpreis ist inklusive Gepäck und Sitzplatzreservierung.
535,12,_____ seinem Gehalt erhält er monatliche Boni.,"In addition to his salary, he receives monthly bonuses.",Zusätzlich zu,Zusätzlich zu seinem Gehalt erhält er monatliche Boni.
536,12,_____ den Hausaufgaben müssen die Schüler ein Projekt vorbereiten.,"In addition to the homework, the students have to prepare a project.",Zusätzlich zu,Zusätzlich zu den Hausaufgaben müssen die Schüler ein Projekt vorbereiten.
537,12,Sie hat _____ ihrem Studium einen Nebenjob.,She has a part-time job in addition to her studies.,zusätzlich zu,Sie hat zusätzlich zu ihrem Studium einen Nebenjob.
538,12,_____ den üblichen Gebühren fallen noch Servicekosten an.,"In addition to the usual fees, there are also service costs.",Zusätzlich zu,Zusätzlich zu den üblichen Gebühren fallen noch Servicekosten an.
539,12,Er trainiert _____ seinem normalen Sportprogramm dreimal pro Woche im Fitnessstudio.,"In addition to his regular sports routine, he trains at the gym three times a week.",zusätzlich zu,Er trainiert zusätzlich zu seinem normalen Sportprogramm dreimal pro Woche im Fitnessstudio.