Nr,exercise,question,answer,german,english,french,case_english,case_french,explanation_english,explanation_french
170,7,genervt _____ sein,von,genervt von sein,to be annoyed by,être agacé par,Dative,Datif,to be annoyed by = genervt von sein + Dative,être agacé par = genervt von sein + Datif
171,7,schädlich _____ sein,für,schädlich für sein,to be harmful to,être nocif pour,Accusative,Accusatif,to be harmful to = schädlich für sein + Accusative,être nocif pour = schädlich für sein + Accusatif
172,8,Ich bin ärgerlich _____ die ständigen Verspätungen.,über,Ich bin ärgerlich über die ständigen Verspätungen.,I am annoyed about the constant delays.,Je suis agacé par les retards constants.,,,to be annoyed about (a situation) = ärgerlich über sein + Accusative,être agacé par (une situation) = ärgerlich über sein + Accusatif
173,8,Sie ist ärgerlich _____ den Fehler im Bericht.,über,Sie ist ärgerlich über den Fehler im Bericht.,She is annoyed about the mistake in the report.,Elle est agacée par l’erreur dans le rapport.,,,to be annoyed about (a situation) = ärgerlich über sein + Accusative,être agacé par (une situation) = ärgerlich über sein + Accusatif
174,8,Der Chef war ärgerlich _____ die schlechte Kommunikation im Team.,über,Der Chef war ärgerlich über die schlechte Kommunikation im Team.,The boss was annoyed about the poor communication within the team.,Le patron était contrarié par la mauvaise communication au sein de l’équipe.,,,to be annoyed about (a situation) = ärgerlich über sein + Accusative,être agacé par (une situation) = ärgerlich über sein + Accusatif
175,8,"Sie ist ärgerlich _____ ihren Kollegen, weil er das Meeting vergessen hat.",auf,"Sie ist ärgerlich auf ihren Kollegen, weil er das Meeting vergessen hat.",She is annoyed with her colleague because he forgot the meeting.,Elle est ennuyée par son collègue parce qu’il a oublié la réunion.,,,to be annoyed with (a person) = ärgerlich auf sein + Accusative,être agacé par (une personne) = ärgerlich auf sein + Accusatif
176,8,"Ich war ärgerlich _____ meinen Bruder, weil er mein Fahrrad genommen hat.",auf,"Ich war ärgerlich auf meinen Bruder, weil er mein Fahrrad genommen hat.",I was annoyed with my brother because he took my bike.,J’étais ennuyé par mon frère parce qu’il a pris mon vélo.,,,to be annoyed with (a person) = ärgerlich auf sein + Accusative,être agacé par (une personne) = ärgerlich auf sein + Accusatif
177,8,"Der Lehrer ist ärgerlich _____ die Schüler, weil sie nicht aufgepasst haben.",auf,"Der Lehrer ist ärgerlich auf die Schüler, weil sie nicht aufgepasst haben.",The teacher is annoyed with the students because they didn’t pay attention.,Le professeur est ennuyé par les élèves parce qu’ils n’ont pas été attentifs.,,,to be annoyed with (a person) = ärgerlich auf sein + Accusative,être agacé par (une personne) = ärgerlich auf sein + Accusatif
178,8,Der Lehrer ist immer aufmerksam _____ die Fragen seiner Schüler.,auf,Der Lehrer ist immer aufmerksam auf die Fragen seiner Schüler.,The teacher is always attentive to his students’ questions.,Le professeur est toujours attentif aux questions de ses élèves.,,,to be attentive to = aufmerksam auf sein + Accusative,être attentif à = aufmerksam auf sein + Accusatif
179,8,Sie war aufmerksam _____ jedes Detail während der Besprechung.,auf,Sie war aufmerksam auf jedes Detail während der Besprechung.,She was attentive to every detail during the meeting.,Elle était attentive à chaque détail pendant la réunion.,,,to be attentive to = aufmerksam auf sein + Accusative,être attentif à = aufmerksam auf sein + Accusatif
180,8,Gute Führungskräfte sind aufmerksam _____ die Bedürfnisse ihres Teams.,auf,Gute Führungskräfte sind aufmerksam auf die Bedürfnisse ihres Teams.,Good leaders are attentive to the needs of their team.,Les bons dirigeants sont attentifs aux besoins de leur équipe.,,,to be attentive to = aufmerksam auf sein + Accusative,être attentif à = aufmerksam auf sein + Accusatif
181,8,Er ist immer noch böse _____ den Streit von gestern.,über,Er ist immer noch böse über den Streit von gestern.,He is still angry about the argument from yesterday.,Il est encore en colère à propos de la dispute d’hier.,,,to be angry about = böse über sein + Accusative,être en colère à propos de = böse über sein + Accusatif
182,8,Sie war böse _____ die ungerechte Behandlung im Büro.,über,Sie war böse über die ungerechte Behandlung im Büro.,She was angry about the unfair treatment at the office.,Elle était en colère à propos du traitement injuste au bureau.,,,to be angry about = böse über sein + Accusative,être en colère à propos de = böse über sein + Accusatif
183,8,Viele Bürger sind böse _____ die neuen Regelungen der Regierung.,über,Viele Bürger sind böse über die neuen Regelungen der Regierung.,Many citizens are angry about the government’s new regulations.,De nombreux citoyens sont en colère à propos des nouvelles règles du gouvernement.,,,to be angry about = böse über sein + Accusative,être en colère à propos de = böse über sein + Accusatif
184,8,"Ich bin böse _____ meinen Freund, weil er unser Treffen vergessen hat.",auf,"Ich bin böse auf meinen Freund, weil er unser Treffen vergessen hat.",I’m angry with my friend because he forgot our meeting.,Je suis en colère contre mon ami parce qu’il a oublié notre rendez-vous.,,,to be angry with = böse auf sein + Accusative,être en colère envers = böse auf sein + Accusatif
185,8,"Sie ist böse _____ ihren Bruder, weil er sie angelogen hat.",auf,"Sie ist böse auf ihren Bruder, weil er sie angelogen hat.",She is angry with her brother because he lied to her.,Elle est en colère contre son frère parce qu’il lui a menti.,,,to be angry with = böse auf sein + Accusative,être en colère envers = böse auf sein + Accusatif
186,8,"Der Chef war böse _____ das Team, weil das Projekt zu spät fertig wurde.",auf,"Der Chef war böse auf das Team, weil das Projekt zu spät fertig wurde.",The boss was angry with the team because the project was finished late.,Le patron était en colère contre l’équipe parce que le projet a été terminé en retard.,,,to be angry with = böse auf sein + Accusative,être en colère envers = böse auf sein + Accusatif
187,8,Er war sehr höflich _____ den Gästen und bot ihnen etwas zu trinken an.,zu,Er war sehr höflich zu den Gästen und bot ihnen etwas zu trinken an.,He was very polite to the guests and offered them something to drink.,Il a été très poli avec les invités et leur a offert quelque chose à boire.,,,"to be polite to, towards = höflich zu sein + Dative",être poli avec = höflich zu sein + Datif
188,8,"Sei bitte höflich _____ deiner Großmutter, wenn sie anruft.",zu,"Sei bitte höflich zu deiner Großmutter, wenn sie anruft.",Please be polite to your grandmother when she calls.,Sois poli avec ta grand-mère quand elle appelle.,,,"to be polite to, towards = höflich zu sein + Dative",être poli avec = höflich zu sein + Datif
189,8,Die Kinder waren erstaunlich höflich _____ den neuen Lehrern.,zu,Die Kinder waren erstaunlich höflich zu den neuen Lehrern.,The children were surprisingly polite to the new teachers.,Les enfants étaient étonnamment polis avec les nouveaux professeurs.,,,"to be polite to, towards = höflich zu sein + Dative",être poli avec = höflich zu sein + Datif
190,8,"Er war unhöflich _____ der Kellnerin, was allen unangenehm war.",zu,"Er war unhöflich zu der Kellnerin, was allen unangenehm war.","He was rude to the waitress, which made everyone uncomfortable.","Il a été malpoli avec la serveuse, ce qui a mis tout le monde mal à l’aise.",,,"to be rude to, towards = unhöflich zu sein + Dative",être malpoli avec = unhöflich zu sein + Datif
191,8,"Sei nicht unhöflich _____ deinen Eltern, sie wollen dir nur helfen.",zu,"Sei nicht unhöflich zu deinen Eltern, sie wollen dir nur helfen.","Don’t be rude to your parents, they just want to help you.","Ne sois pas malpoli avec tes parents, ils veulent seulement t’aider.",,,"to be rude to, towards = unhöflich zu sein + Dative",être malpoli avec = unhöflich zu sein + Datif
192,8,"Manche Kunden sind unhöflich _____ den Angestellten, wenn sie warten müssen.",zu,"Manche Kunden sind unhöflich zu den Angestellten, wenn sie warten müssen.",Some customers are rude to the employees when they have to wait.,Certains clients sont malpolis avec les employés quand ils doivent attendre.,,,"to be rude to, towards = unhöflich zu sein + Dative",être malpoli avec = unhöflich zu sein + Datif
193,8,Das Restaurant ist bekannt _____ seinen schlechten Service.,für,Das Restaurant ist bekannt für seinen schlechten Service.,The restaurant is known for its poor service.,Le restaurant est connu pour son mauvais service.,,,to be known for (something negative) = bekannt für sein + Accusative,être connu pour (quelque chose de négatif) = bekannt für sein + Accusatif
194,8,Er ist bekannt _____ seine unpünktliche Art.,für,Er ist bekannt für seine unpünktliche Art.,He is known for always being late.,Il est connu pour son manque de ponctualité.,,,to be known for (something negative) = bekannt für sein + Accusative,être connu pour (quelque chose de négatif) = bekannt für sein + Accusatif
195,8,Die Firma ist bekannt _____ ihre komplizierten Bürokratieprozesse.,für,Die Firma ist bekannt für ihre komplizierten Bürokratieprozesse.,The company is known for its complicated bureaucracy.,L’entreprise est connue pour sa bureaucratie compliquée.,,,to be known for (something negative) = bekannt für sein + Accusative,être connu pour (quelque chose de négatif) = bekannt für sein + Accusatif
196,8,Paris ist berühmt _____ seine wunderschönen Sehenswürdigkeiten.,für,Paris ist berühmt für seine wunderschönen Sehenswürdigkeiten.,Paris is famous for its beautiful sights.,Paris est célèbre pour ses magnifiques monuments.,,,to be famous for (something positive) = berühmt für sein + Accusative,être célèbre pour (quelque chose de positif) = berühmt für sein + Accusatif
197,8,Er ist berühmt _____ seine großartigen Filme.,für,Er ist berühmt für seine großartigen Filme.,He is famous for his great movies.,Il est célèbre pour ses excellents films.,,,to be famous for (something positive) = berühmt für sein + Accusative,être célèbre pour (quelque chose de positif) = berühmt für sein + Accusatif
198,8,Die Schweiz ist berühmt _____ ihre Schokolade und ihre Berge.,für,Die Schweiz ist berühmt für ihre Schokolade und ihre Berge.,Switzerland is famous for its chocolate and its mountains.,La Suisse est célèbre pour son chocolat et ses montagnes.,,,to be famous for (something positive) = berühmt für sein + Accusative,être célèbre pour (quelque chose de positif) = berühmt für sein + Accusatif
199,8,Sie ist zurzeit beschäftigt _____ einem wichtigen Projekt.,mit,Sie ist zurzeit beschäftigt mit einem wichtigen Projekt.,She is currently busy with an important project.,Elle est actuellement occupée par un projet important.,,,"to be busy, occupied with = beschäftigt mit sein + Dative","être occupé par, avec = beschäftigt mit sein + Datif"
200,8,Ich war den ganzen Tag beschäftigt _____ der Vorbereitung der Präsentation.,mit,Ich war den ganzen Tag beschäftigt mit der Vorbereitung der Präsentation.,I was busy all day with preparing the presentation.,J’ai été occupé toute la journée à préparer la présentation.,,,"to be busy, occupied with = beschäftigt mit sein + Dative","être occupé par, avec = beschäftigt mit sein + Datif"
201,8,Er ist immer beschäftigt _____ seiner Arbeit und hat kaum Freizeit.,mit,Er ist immer beschäftigt mit seiner Arbeit und hat kaum Freizeit.,He is always busy with his work and has hardly any free time.,Il est toujours occupé par son travail et a à peine du temps libre.,,,"to be busy, occupied with = beschäftigt mit sein + Dative","être occupé par, avec = beschäftigt mit sein + Datif"
202,8,Ich bin sehr dankbar _____ deine Hilfe gestern.,für,Ich bin sehr dankbar für deine Hilfe gestern.,I’m very grateful for your help yesterday.,Je suis très reconnaissant pour ton aide d’hier.,,,"to be grateful, thankful for = dankbar für sein + Accusative",être reconnaissant pour = dankbar für sein + Accusatif
203,8,Sie ist dankbar _____ die Unterstützung ihrer Familie.,für,Sie ist dankbar für die Unterstützung ihrer Familie.,She is thankful for her family’s support.,Elle est reconnaissante pour le soutien de sa famille.,,,"to be grateful, thankful for = dankbar für sein + Accusative",être reconnaissant pour = dankbar für sein + Accusatif
204,8,"Wir sind dankbar _____ jede Erfahrung, die uns weiterbringt.",für,"Wir sind dankbar für jede Erfahrung, die uns weiterbringt.",We are grateful for every experience that helps us grow.,Nous sommes reconnaissants pour chaque expérience qui nous fait progresser.,,,"to be grateful, thankful for = dankbar für sein + Accusative",être reconnaissant pour = dankbar für sein + Accusatif
205,8,Er ist genervt _____ dem ständigen Lärm der Baustelle.,von,Er ist genervt von dem ständigen Lärm der Baustelle.,He is annoyed by the constant noise from the construction site.,Il est agacé par le bruit constant du chantier.,,,to be annoyed by = genervt von sein + Dative,être agacé par = genervt von sein + Datif
206,8,Sie war genervt _____ seinen endlosen Geschichten.,von,Sie war genervt von seinen endlosen Geschichten.,She was annoyed by his endless stories.,Elle était agacée par ses histoires sans fin.,,,to be annoyed by = genervt von sein + Dative,être agacé par = genervt von sein + Datif
207,8,"Ich bin genervt _____ den vielen E-Mails, die ich jeden Tag bekomme.",von,"Ich bin genervt von den vielen E-Mails, die ich jeden Tag bekomme.",I’m annoyed by the many emails I get every day.,Je suis agacé par les nombreux e-mails que je reçois chaque jour.,,,to be annoyed by = genervt von sein + Dative,être agacé par = genervt von sein + Datif
208,8,Rauchen ist schädlich _____ die Gesundheit.,für,Rauchen ist schädlich für die Gesundheit.,Smoking is harmful to your health.,Fumer est nocif pour la santé.,,,to be harmful to = schädlich für sein + Accusative,être nocif pour = schädlich für sein + Accusatif
209,8,Zu viel Zucker ist schädlich _____ die Zähne.,für,Zu viel Zucker ist schädlich für die Zähne.,Too much sugar is harmful to the teeth.,Trop de sucre est nocif pour les dents.,,,to be harmful to = schädlich für sein + Accusative,être nocif pour = schädlich für sein + Accusatif
210,8,Lärm kann schädlich _____ das Gehör sein.,für,Lärm kann schädlich für das Gehör sein.,Noise can be harmful to hearing.,Le bruit peut être nocif pour l’ouïe.,,,to be harmful to = schädlich für sein + Accusative,être nocif pour = schädlich für sein + Accusatif
211,8,Sie ist bereit _____ neuen Herausforderungen.,zu,Sie ist bereit zu neuen Herausforderungen.,She is ready for new challenges.,Elle est prête pour de nouveaux défis.,,,"to be ready for, ready to = bereit zu sein + Dative","être prêt pour, prêt à = bereit zu sein + Datif"
212,8,Er ist bereit _____ einem Kompromiss.,zu,Er ist bereit zu einem Kompromiss.,He is ready for a compromise.,Il est prêt à un compromis.,,,"to be ready for, ready to = bereit zu sein + Dative","être prêt pour, prêt à = bereit zu sein + Datif"
213,8,"Wir sind bereit _____ Veränderungen, wenn sie dem Team langfristig helfen.",zu,"Wir sind bereit zu Veränderungen, wenn sie dem Team langfristig helfen.",We are ready for changes if they help the team in the long run.,Nous sommes prêts à des changements s’ils aident l’équipe à long terme.,,,"to be ready for, ready to = bereit zu sein + Dative","être prêt pour, prêt à = bereit zu sein + Datif"
214,8,Er ist fähig _____ großen Leistungen.,zu,Er ist fähig zu großen Leistungen.,He is capable of great achievements.,Il est capable de grandes réalisations.,,,"to be capable of, capable to = fähig zu sein + Dative",être capable de = fähig zu sein + Datif
215,8,Sie ist fähig _____ einer schnellen Problemlösung.,zu,Sie ist fähig zu einer schnellen Problemlösung.,She is capable of quick problem-solving.,Elle est capable de résoudre rapidement les problèmes.,,,"to be capable of, capable to = fähig zu sein + Dative",être capable de = fähig zu sein + Datif
216,8,"Der Mensch ist fähig _____ erstaunlicher Kreativität, wenn er unter Druck steht.",zu,"Der Mensch ist fähig zu erstaunlicher Kreativität, wenn er unter Druck steht.",Humans are capable of remarkable creativity when under pressure.,L’être humain est capable d’une créativité étonnante lorsqu’il est sous pression.,,,"to be capable of, capable to = fähig zu sein + Dative",être capable de = fähig zu sein + Datif
217,9,schuld _____ sein,an,schuld an sein,to be blamed for,"être blâmé pour, être responsable pour",Dative,Datif,to be blamed for = schuld an sein + Dative,"être blâmé pour, être responsable pour = schuld an sein + Datif"
218,9,sicher _____ sein,vor,sicher vor sein,to be safe from,être à l'abri de,Dative,Datif,to be safe from = sicher vor sein + Dative,être à l'abri de = sicher vor sein + Datif
219,9,typisch _____ sein,für,typisch für sein,to be typical for,être typique pour,Accusative,Accusatif,to be typical for = typisch für sein + Accusative,être typique pour = typisch für sein + Accusatif
220,9,überzeugt _____ sein,von,überzeugt von sein,to be convinced by,être convaincu de,Dative,Datif,to be convinced by = überzeugt von sein + Dative,être convaincu de = überzeugt von sein + Datif
221,9,unabhängig _____ sein,von,unabhängig von sein,to be independent of,être indépendant de,Dative,Datif,to be independent of = unabhängig von sein + Dative,être indépendant de = unabhängig von sein + Datif
222,9,unangenehm _____ sein,für,unangenehm für sein,to be unpleasant for,être désagréable pour,Accusative,Accusatif,to be unpleasant for = unangenehm für sein + Accusative,être désagréable pour = unangenehm für sein + Accusatif
223,9,unschädlich _____ sein,für,unschädlich für sein,to be harmless for,être inoffensif pour,Dative,Datif,to be harmless for = unschädlich für sein + Dative,être inoffensif pour = unschädlich für sein + Datif
224,9,unzufrieden _____ sein,mit,unzufrieden mit sein,"to be dissatisfied with, by",être insatisfait de,Dative,Datif,"to be dissatisfied with, by = unzufrieden mit sein + Dative",être insatisfait de = unzufrieden mit sein + Datif
225,9,verärgert _____ sein,über,verärgert über sein,"to be annoyed with, by",être agacé par,Accusative,Accusatif,"to be annoyed with, by = verärgert über sein + Accusative",être agacé par = verärgert über sein + Accusatif
226,9,verliebt _____ sein,in,verliebt in sein,to be in love with,être amoureux de,Accusative,Accusatif,to be in love with = verliebt in sein + Accusative,être amoureux de = verliebt in sein + Accusatif
227,9,verlobt _____ sein,mit,verlobt mit sein,to be engaged to,être fiancé à,Dative,Datif,to be engaged to = verlobt mit sein + Dative,être fiancé à = verlobt mit sein + Datif
228,9,verwandt _____ sein,mit,verwandt mit sein,to be related to,être lié à,Dative,Datif,to be related to = verwandt mit sein + Dative,être lié à = verwandt mit sein + Datif
229,9,zufrieden _____ sein,mit,zufrieden mit sein,to be satisfied with,être satisfait de,Dative,Datif,to be satisfied with = zufrieden mit sein + Dative,être satisfait de = zufrieden mit sein + Datif
230,9,bekannt _____ sein,als,bekannt als sein,to be known as,être connu comme,Nominative,Nominatif,to be known as = bekannt als sein + Nominative,être connu comme = bekannt als sein + Nominatif
231,9,lieb _____ sein,zu,lieb zu sein,to be kind to,être gentil avec,Dative,Datif,to be kind to = lieb zu sein + Dative,être gentil avec = lieb zu sein + Datif
232,10,"Er ist schuld _____ dem Unfall, weil er zu schnell gefahren ist.",an,"Er ist schuld an dem Unfall, weil er zu schnell gefahren ist.",He is to blame for the accident because he was driving too fast.,"Il est blâmé pour l’accident, car il conduisait trop vite.",,,to be blamed for = schuld an sein + Dative,"être blâmé pour, être responsable pour = schuld an sein + Datif"
233,10,Sie war schuld _____ der Verspätung des Zuges.,an,Sie war schuld an der Verspätung des Zuges.,She was to blame for the train’s delay.,Elle était responsable du retard du train.,,,to be blamed for = schuld an sein + Dative,"être blâmé pour, être responsable pour = schuld an sein + Datif"
234,10,"Niemand ist allein schuld _____ dem Problem, es war ein Missverständnis.",an,"Niemand ist allein schuld an dem Problem, es war ein Missverständnis.",No one is solely to blame for the problem; it was a misunderstanding.,Personne n’est seul à blâmer pour le problème ; c’était un malentendu.,,,to be blamed for = schuld an sein + Dative,"être blâmé pour, être responsable pour = schuld an sein + Datif"
235,10,In diesem Haus sind wir sicher _____ dem Sturm.,vor,In diesem Haus sind wir sicher vor dem Sturm.,In this house we are safe from the storm.,"Dans cette maison, nous sommes à l’abri de la tempête.",,,to be safe from = sicher vor sein + Dative,être à l'abri de = sicher vor sein + Datif
236,10,Kinder sollten sicher _____ Gefahren im Internet sein.,vor,Kinder sollten sicher vor Gefahren im Internet sein.,Children should be safe from dangers on the internet.,Les enfants devraient être à l’abri des dangers sur Internet.,,,to be safe from = sicher vor sein + Dative,être à l'abri de = sicher vor sein + Datif
237,10,"Niemand ist völlig sicher _____ Fehlern, auch Experten nicht.",vor,"Niemand ist völlig sicher vor Fehlern, auch Experten nicht.","No one is completely safe from mistakes, not even experts.","Personne n’est totalement à l’abri des erreurs, pas même les experts.",,,to be safe from = sicher vor sein + Dative,être à l'abri de = sicher vor sein + Datif
238,10,Regen im April ist typisch _____ dieses Land.,für,Regen im April ist typisch für dieses Land.,Rain in April is typical for this country.,La pluie en avril est typique pour ce pays.,,,to be typical for = typisch für sein + Accusative,être typique pour = typisch für sein + Accusatif
239,10,Diese Art von Humor ist typisch _____ ihn.,für,Diese Art von Humor ist typisch für ihn.,This kind of humor is typical for him.,Ce genre d’humour est typique de lui.,,,to be typical for = typisch für sein + Accusative,être typique pour = typisch für sein + Accusatif
240,10,Verspätungen sind leider typisch _____ den öffentlichen Verkehr hier.,für,Verspätungen sind leider typisch für den öffentlichen Verkehr hier.,Delays are unfortunately typical for public transport here.,Les retards sont malheureusement typiques des transports publics ici.,,,to be typical for = typisch für sein + Accusative,être typique pour = typisch für sein + Accusatif
241,10,"Ich bin überzeugt _____ seiner Idee, sie könnte wirklich funktionieren.",von,"Ich bin überzeugt von seiner Idee, sie könnte wirklich funktionieren.",I’m convinced by his idea; it could really work.,"Je suis convaincu par son idée, elle pourrait vraiment fonctionner.",,,to be convinced by = überzeugt von sein + Dative,être convaincu de = überzeugt von sein + Datif
242,10,Sie ist überzeugt _____ der Qualität dieses Produkts.,von,Sie ist überzeugt von der Qualität dieses Produkts.,She is convinced by the quality of this product.,Elle est convaincue par la qualité de ce produit.,,,to be convinced by = überzeugt von sein + Dative,être convaincu de = überzeugt von sein + Datif
243,10,Der Professor ist überzeugt _____ der Wichtigkeit weiterer Forschung.,von,Der Professor ist überzeugt von der Wichtigkeit weiterer Forschung.,The professor is convinced of the importance of further research.,Le professeur est convaincu de l’importance de poursuivre la recherche.,,,to be convinced by = überzeugt von sein + Dative,être convaincu de = überzeugt von sein + Datif
244,10,Sie möchte finanziell unabhängig _____ ihren Eltern sein.,von,Sie möchte finanziell unabhängig von ihren Eltern sein.,She wants to be financially independent of her parents.,Elle veut être financièrement indépendante de ses parents.,,,to be independent of = unabhängig von sein + Dative,être indépendant de = unabhängig von sein + Datif
245,10,Das Ergebnis ist unabhängig _____ der Methode fast gleich.,von,Das Ergebnis ist unabhängig von der Methode fast gleich.,"The result is almost the same, independent of the method.","Le résultat est presque identique, indépendamment de la méthode.",,,to be independent of = unabhängig von sein + Dative,être indépendant de = unabhängig von sein + Datif
246,10,Wahre Freundschaft ist unabhängig _____ Alter oder Herkunft.,von,Wahre Freundschaft ist unabhängig von Alter oder Herkunft.,True friendship is independent of age or background.,La véritable amitié est indépendante de l’âge ou de l’origine.,,,to be independent of = unabhängig von sein + Dative,être indépendant de = unabhängig von sein + Datif
247,10,Der Rauch war unangenehm _____ die Gäste im Restaurant.,für,Der Rauch war unangenehm für die Gäste im Restaurant.,The smoke was unpleasant for the guests in the restaurant.,La fumée était désagréable pour les invités au restaurant.,,,to be unpleasant for = unangenehm für sein + Accusative,être désagréable pour = unangenehm für sein + Accusatif
