Nr,exercise,level_verben,question,answer,case,german,english,verb
589,22,,Er regt sich _____ jede Kleinigkeit auf.,über,,Er regt sich über jede Kleinigkeit auf.,He gets upset about every little thing.,aufregen
590,22,,Ich rege mich _____ den Lärm auf.,über,,Ich rege mich über den Lärm auf.,I get annoyed about the noise.,aufregen
591,22,,Sie regt sich oft _____ unfreundliche Menschen auf.,über,,Sie regt sich oft über unfreundliche Menschen auf.,She often gets upset about unfriendly people.,aufregen
592,22,,Er bezeichnet sich _____ Experten.,als,,Er bezeichnet sich als Experten.,He refers to himself as an expert.,bezeichnen
593,22,,Das kann man _____ Erfolg bezeichnen.,als,,Das kann man als Erfolg bezeichnen.,You can describe that as a success.,bezeichnen
594,22,,Sie bezeichnet ihn _____ ihren besten Freund.,als,,Sie bezeichnet ihn als ihren besten Freund.,She calls him her best friend.,bezeichnen
595,22,,Ich telefoniere gerade _____ meinem Kollegen.,mit,,Ich telefoniere gerade mit meinem Kollegen.,I’m on the phone with my colleague right now.,telefonieren
596,22,,Sie telefoniert oft _____ ihrer Mutter.,mit,,Sie telefoniert oft mit ihrer Mutter.,She often talks on the phone with her mother.,telefonieren
597,22,,Er telefoniert jeden Abend _____ seiner Freundin.,mit,,Er telefoniert jeden Abend mit seiner Freundin.,He talks to his girlfriend on the phone every evening.,telefonieren
598,22,,Man kann die Tiere _____ Gruppen unterscheiden.,in,,Man kann die Tiere in Gruppen unterscheiden.,You can distinguish the animals into groups.,unterscheiden
599,22,,Die Produkte unterscheiden sich _____ Qualität und Preis.,in,,Die Produkte unterscheiden sich in Qualität und Preis.,The products differ in quality and price.,unterscheiden
600,22,,Die Aufgaben lassen sich _____ drei Kategorien unterscheiden.,in,,Die Aufgaben lassen sich in drei Kategorien unterscheiden.,The tasks can be divided into three categories.,unterscheiden
601,22,,Ich wundere mich _____ seine Entscheidung.,über,,Ich wundere mich über seine Entscheidung.,I’m surprised by his decision.,wundern
602,22,,Sie wunderte sich _____ das Ergebnis.,über,,Sie wunderte sich über das Ergebnis.,She was amazed by the result.,wundern
603,22,,Wir wundern uns _____ sein merkwürdiges Verhalten.,über,,Wir wundern uns über sein merkwürdiges Verhalten.,We wonder about his strange behavior.,wundern
604,22,,Sie bemüht sich _____ einen Studienplatz an einer renommierten Universität.,um,,Sie bemüht sich um einen Studienplatz an einer renommierten Universität.,She is striving for a place at a prestigious university.,bemühen
605,22,,Er bemüht sich _____ eine bessere Work-Life-Balance.,um,,Er bemüht sich um eine bessere Work-Life-Balance.,He strives for a better work-life balance.,bemühen
606,22,,Ich bemühe mich _____ mehr Geduld im Alltag.,um,,Ich bemühe mich um mehr Geduld im Alltag.,I try to be more patient in everyday life.,bemühen
607,22,,Ich möchte mich herzlich _____ Ihre Unterstützung bedanken.,für,,Ich möchte mich herzlich für Ihre Unterstützung bedanken.,I would like to sincerely thank you for your support.,bedanken
608,22,,Er bedankte sich bei den Kollegen _____ die angenehme Zusammenarbeit.,für,,Er bedankte sich bei den Kollegen für die angenehme Zusammenarbeit.,He thanked his colleagues for the pleasant cooperation.,bedanken
609,22,,Wir bedanken uns _____ das tolle Geschenk.,für,,Wir bedanken uns für das tolle Geschenk.,Thank you for the great gift.,bedanken
610,22,,Ich bedanke mich _____ meinen Eltern für ihre Geduld.,bei,,Ich bedanke mich bei meinen Eltern für ihre Geduld.,I thank my parents for their patience.,bedanken
611,22,,Er bedankte sich _____ seinem Lehrer für die wertvollen Tipps.,bei,,Er bedankte sich bei seinem Lehrer für die wertvollen Tipps.,He thanked his teacher for the valuable tips.,bedanken
612,22,,Sie bedankt sich _____ ihrer Freundin für die Hilfe beim Umzug.,bei,,Sie bedankt sich bei ihrer Freundin für die Hilfe beim Umzug.,She thanks her friend for her help with the move.,bedanken
613,22,,Ich bin gerade _____ Kochen.,beim,,Ich bin gerade beim Kochen.,I’m currently cooking.,sein
614,22,,"Sie war _____ Lernen, als ich anrief.",beim,,"Sie war beim Lernen, als ich anrief.",She was studying when I called.,sein
615,22,,Der Hund ist _____ Gestreichelt-Werden.,beim,,Der Hund ist beim Gestreichelt-Werden.,The dog is being stroked.,sein
616,22,,Ich habe mich _____ den schlechten Service im Restaurant beschwert.,über,,Ich habe mich über den schlechten Service im Restaurant beschwert.,I complained about the bad service in the restaurant.,beschweren
617,22,,Viele Bürger beschweren sich _____ die hohen Steuern.,über,,Viele Bürger beschweren sich über die hohen Steuern.,Many citizens complain about high taxes.,beschweren
618,22,,Sie beschwert sich ständig _____ das Wetter.,über,,Sie beschwert sich ständig über das Wetter.,She constantly complains about the weather.,beschweren
619,22,,Sie hat sich _____ der Lehrerin über die schwierige Prüfung beschwert.,bei,,Sie hat sich bei der Lehrerin über die schwierige Prüfung beschwert.,She complained to the teacher about the difficult exam.,beschweren
620,22,,Ich beschwere mich _____ dem Chef über meinen Kollegen.,bei,,Ich beschwere mich beim Chef über meinen Kollegen.,I am complaining to the boss about my colleague.,beschweren
621,22,,Er hat sich _____ Vermieter über den Lärm beschwert.,beim,,Er hat sich beim Vermieter über den Lärm beschwert.,He complained to the landlord about the noise.,beschweren
622,22,,Ich entschuldige mich _____ meine Verspätung.,für,,Ich entschuldige mich für meine Verspätung.,I apologize for my delay.,entschuldigen
623,22,,Sie hat sich _____ ihren Fehler entschuldigt.,für,,Sie hat sich für ihren Fehler entschuldigt.,She apologized for her mistake.,entschuldigen
624,22,,Er entschuldigte sich _____ seine unhöflichen Worte.,für,,Er entschuldigte sich für seine unhöflichen Worte.,He apologized for his rude words.,entschuldigen
625,22,,Ich habe mich _____ meiner Freundin für mein Verhalten entschuldigt.,bei,,Ich habe mich bei meiner Freundin für mein Verhalten entschuldigt.,I apologized to my girlfriend for my behavior.,entschuldigen
626,22,,Er hat sich _____ seinem Lehrer für die Unaufmerksamkeit entschuldigt.,bei,,Er hat sich bei seinem Lehrer für die Unaufmerksamkeit entschuldigt.,He apologized to his teacher for not paying attention.,entschuldigen
627,22,,Sie entschuldigte sich _____ ihren Eltern für das Missverständnis.,bei,,Sie entschuldigte sich bei ihren Eltern für das Missverständnis.,She apologized to her parents for the misunderstanding.,entschuldigen
628,22,,Das Problem ergibt sich _____ mangelnder Kommunikation.,aus,,Das Problem ergibt sich aus mangelnder Kommunikation.,The problem results from a lack of communication.,ergeben
629,22,,Die Lösung ergibt sich _____ den gesammelten Daten.,aus,,Die Lösung ergibt sich aus den gesammelten Daten.,The solution results from the collected data.,ergeben
630,22,,Ein interessantes Muster ergab sich _____ der Analyse der Umfrageergebnisse.,aus,,Ein interessantes Muster ergab sich aus der Analyse der Umfrageergebnisse.,An interesting pattern emerged from the analysis of the survey results.,ergeben
631,22,,Der Hersteller garantiert _____ die Qualität des Produkts.,für,,Der Hersteller garantiert für die Qualität des Produkts.,The manufacturer guarantees the quality of the product.,garantieren
632,22,,Ich kann _____ die Pünktlichkeit meines Freundes garantieren.,für,,Ich kann für die Pünktlichkeit meines Freundes garantieren.,I can vouch for my friend's punctuality.,garantieren
633,22,,Die Firma garantiert _____ eine schnelle Lieferung.,für,,Die Firma garantiert für eine schnelle Lieferung.,The company guarantees fast delivery.,garantieren
634,23,21 - 30 (B2),hinweisen _____,auf,Akk.,hinweisen auf,to point out,hinweisen
635,23,21 - 30 (B2),nachdenken _____,über,Akk.,nachdenken über,to think about,nachdenken
636,23,21 - 30 (B2),reagieren _____,auf,Akk.,reagieren auf,to react to,reagieren
637,23,21 - 30 (B2),senden _____,an,Akk.,senden an,to send to,senden
638,23,21 - 30 (B2),werben _____,für,Akk.,werben für,to advertise for,werben
639,23,21 - 30 (B2),sich beteiligen _____,an,Dat.,sich beteiligen an,to take part in,beteiligen
640,23,21 - 30 (B2),einstellen _____,auf,Akk.,einstellen auf,to adjust to,einstellen
641,23,21 - 30 (B2),beitragen _____,zu,Dat.,beitragen zu,to contribute to,beitragen
642,23,21 - 30 (B2),zweifeln _____,an,Dat.,zweifeln an,to doubt,zweifeln
643,23,1 - 5 (A1),_____ sich haben,bei,Dat.,bei sich haben,"to have with oneself, to carry with oneself",haben
644,23,21 - 30 (B2),sich unterhalten _____,mit,Dat.,sich unterhalten mit,to talk with,unterhalten
645,23,21 - 30 (B2),sich unterhalten _____,über,Akk.,sich unterhalten über,"to talk, converse about",unterhalten
646,23,21 - 30 (B2),verlangen _____,von,Dat.,verlangen von,to demand from,verlangen
647,23,11 - 20 (B1),gelten _____,für,Akk.,gelten für,to apply to,gelten
648,23,11 - 20 (B1),gelten _____,als,Nom.,gelten als,to be considered as,gelten
649,24,,Der Lehrer wies die Schüler _____ die Bedeutung der Hausaufgaben hin.,auf,,Der Lehrer wies die Schüler auf die Bedeutung der Hausaufgaben hin.,The teacher pointed out the importance of homework to the students.,hinweisen
650,24,,Sie wies _____ die Fehler im Bericht hin.,auf,,Sie wies auf die Fehler im Bericht hin.,She pointed out the mistakes in the report.,hinweisen
651,24,,Ich möchte dich _____ einen wichtigen Termin hinweisen.,auf,,Ich möchte dich auf einen wichtigen Termin hinweisen.,I would like to draw your attention to an important date.,hinweisen
652,24,,Ich muss noch einmal _____ dein Angebot nachdenken.,über,,Ich muss noch einmal über dein Angebot nachdenken.,I need to think about your offer again.,nachdenken
653,24,,Wir denken _____ die besten Lösungen für dieses Problem nach.,über,,Wir denken über die besten Lösungen für dieses Problem nach.,We are thinking about the best solutions to this problem.,nachdenken
654,24,,Er denkt gerade _____ einen Jobwechsel nach.,über,,Er denkt gerade über einen Jobwechsel nach.,He is currently thinking about changing jobs.,nachdenken
655,24,,Wie hast du _____ die Kritik reagiert?,auf,,Wie hast du auf die Kritik reagiert?,How did you react to the criticism?,reagieren
656,24,,Sie reagierte _____ die Frage mit einem Lächeln.,auf,,Sie reagierte auf die Frage mit einem Lächeln.,She responded to the question with a smile.,reagieren
657,24,,Er reagierte sofort _____ das laute Geräusch.,auf,,Er reagierte sofort auf das laute Geräusch.,He reacted immediately to the loud noise.,reagieren
658,24,,Ich habe die Bewerbung _____ die Personalabteilung gesendet.,an,,Ich habe die Bewerbung an die Personalabteilung gesendet.,I sent the application to the HR department.,senden
659,24,,Sie hat eine Einladung _____ alle Kollegen gesendet.,an,,Sie hat eine Einladung an alle Kollegen gesendet.,She sent an invitation to all colleagues.,senden
660,24,,Er sendet die Unterlagen _____ seinen neuen Arbeitgeber.,an,,Er sendet die Unterlagen an seinen neuen Arbeitgeber.,He sends the documents to his new employer.,senden
661,24,,Die Organisation wirbt _____ mehr Gleichberechtigung.,für,,Die Organisation wirbt für mehr Gleichberechtigung.,The organization campaigns for more equality.,werben
662,24,,Sie wirbt _____ eine neue Marke im Fernsehen.,für,,Sie wirbt für eine neue Marke im Fernsehen.,She advertises a new brand on television.,werben
663,24,,Er wirbt in den sozialen Medien _____ sein eigenes Unternehmen.,für,,Er wirbt in den sozialen Medien für sein eigenes Unternehmen.,He advertises his own company on social media.,werben
664,24,,Viele Studierende beteiligen sich _____ sozialen Projekten.,an,,Viele Studierende beteiligen sich an sozialen Projekten.,Many students participate in social projects.,beteiligen
665,24,,Er hat sich _____ der Organisation der Konferenz beteiligt.,an,,Er hat sich an der Organisation der Konferenz beteiligt.,He participated in organizing the conference.,beteiligen
666,24,,Wir beteiligen uns aktiv _____ der Diskussion.,an,,Wir beteiligen uns aktiv an der Diskussion.,We are actively involved in the discussion.,beteiligen
667,24,,Wir müssen uns _____ längere Wartezeiten einstellen.,auf,,Wir müssen uns auf längere Wartezeiten einstellen.,We have to prepare for longer waiting times.,einstellen
668,24,,Er hat sich schnell _____ die neue Umgebung eingestellt.,auf,,Er hat sich schnell auf die neue Umgebung eingestellt.,He quickly adapted to the new environment.,einstellen
669,24,,Sie stellt sich gerade _____ das Leben mit dem Baby ein.,auf,,Sie stellt sich gerade auf das Leben mit dem Baby ein.,She is just adjusting to life with the baby.,einstellen
670,24,,Jeder kann etwas _____ Umweltschutz beitragen.,zum,,Jeder kann etwas zum Umweltschutz beitragen.,Everyone can contribute to environmental protection.,beitragen
671,24,,"Die Studie trägt _____ bei, unser Verständnis der Materie zu verbessern.",dazu,,"Die Studie trägt dazu bei, unser Verständnis der Materie zu verbessern.",The study contributes to improving our understanding of the subject.,beitragen
672,24,,Sein Engagement hat viel _____ Erfolg des Projekts beigetragen.,zum,,Sein Engagement hat viel zum Erfolg des Projekts beigetragen.,His commitment has contributed greatly to the success of the project.,beitragen
673,24,,Er zweifelt _____ der Wahrheit der Aussagen.,an,,Er zweifelt an der Wahrheit der Aussagen.,He doubts the truth of the statements.,zweifeln
674,24,,"Ich zweifle _____, ob wir das Ziel rechtzeitig erreichen.",daran,,"Ich zweifle daran, ob wir das Ziel rechtzeitig erreichen.",I doubt whether we will reach the goal on time.,zweifeln
675,24,,Sie zweifelt _____ seinen guten Absichten.,an,,Sie zweifelt an seinen guten Absichten.,She doubts his good intentions.,zweifeln
676,24,,Trotz der strengen Sicherheitskontrollen hatte er seinen Ausweis zum Glück _____ sich.,bei,,Trotz der strengen Sicherheitskontrollen hatte er seinen Ausweis zum Glück bei sich.,"Despite the strict security checks, he luckily had his ID with him.",haben
677,24,,"Sie war sehr erleichtert, als sie merkte, dass sie ihr Handy doch _____ sich hatte.",bei,,"Sie war sehr erleichtert, als sie merkte, dass sie ihr Handy doch bei sich hatte.",She was very relieved when she realized she had her cell phone with her after all.,haben
678,24,,"Ich habe immer einen Notizblock _____ mir, falls mir eine Idee kommt.",bei,,"Ich habe immer einen Notizblock bei mir, falls mir eine Idee kommt.",I always have a notepad with me in case I get an idea.,haben
679,24,,Wir unterhalten uns _____ dem Nachbarn.,mit,,Wir unterhalten uns mit dem Nachbarn.,We are chatting with the neighbor.,unterhalten
680,24,,Ich habe mich lange _____ ihm unterhalten.,mit,,Ich habe mich lange mit ihm unterhalten.,I had a long conversation with him.,unterhalten
681,24,,Sie unterhält sich gerade _____ ihrer Kollegin über das neue Projekt.,mit,,Sie unterhält sich gerade mit ihrer Kollegin über das neue Projekt.,She is talking to her colleague about the new project.,unterhalten
682,24,,Sie unterhalten sich _____ Politik.,über,,Sie unterhalten sich über Politik.,They are talking about politics.,unterhalten
683,24,,Wir haben uns _____ das Konzert unterhalten.,über,,Wir haben uns über das Konzert unterhalten.,We talked about the concert.,unterhalten
684,24,,Er unterhält sich oft _____ Filme und Serien.,über,,Er unterhält sich oft über Filme und Serien.,He often talks about movies and series.,unterhalten
685,24,,Er verlangt Respekt _____ seinen Mitarbeitern.,von,,Er verlangt Respekt von seinen Mitarbeitern.,He demands respect from his employees.,verlangen
686,24,,Ich verlange eine Erklärung _____ dir.,von,,Ich verlange eine Erklärung von dir.,I demand an explanation from you.,verlangen
687,24,,Sie verlangt _____ ihren Kindern mehr Verantwortungsbewusstsein.,von,,Sie verlangt von ihren Kindern mehr Verantwortungsbewusstsein.,She demands a greater sense of responsibility from her children.,verlangen
688,24,,Die neuen Regeln gelten _____ alle Mitarbeiter.,für,,Die neuen Regeln gelten für alle Mitarbeiter.,The new rules apply to all employees.,gelten
689,24,,Das Angebot gilt nur _____ kurze Zeit.,für,,Das Angebot gilt nur für kurze Zeit.,The offer is valid for a short time only.,gelten
690,24,,Diese Vorschrift gilt auch _____ internationale Studierende.,für,,Diese Vorschrift gilt auch für internationale Studierende.,This regulation also applies to international students.,gelten
691,24,,Er gilt _____ Experte auf diesem Gebiet.,als,,Er gilt als Experte auf diesem Gebiet.,He is considered an expert in this field.,gelten
692,24,,Das Buch gilt _____ Klassiker der deutschen Literatur.,als,,Das Buch gilt als Klassiker der deutschen Literatur.,The book is considered a classic of German literature.,gelten
693,24,,Sie gilt _____ sehr zuverlässige Kollegin.,als,,Sie gilt als sehr zuverlässige Kollegin.,She is considered a very reliable colleague.,gelten
694,25,21 - 30 (B2),informieren _____,über,Akk.,informieren über,to inform oneself about,informieren
695,25,21 - 30 (B2),informieren _____,bei,Dat.,informieren bei,to inform at,informieren
696,25,11 - 20 (B1),rechnen _____,mit,Dat.,rechnen mit,to count on,rechnen
697,25,11 - 20 (B1),zwingen _____,zu,Dat.,zwingen zu,to force to,zwingen
698,25,11 - 20 (B1),einsetzen _____,für,Akk.,einsetzen für,to advocate for,einsetzen
699,25,6 - 10 (A2),ausgehen _____,von,Dat.,ausgehen von,"to assume, to come from",ausgehen
700,25,21 - 30 (B2),berichten _____,von,Dat.,berichten von,"to report on (something personal, an experience)",berichten
701,25,21 - 30 (B2),berichten _____,über,Akk.,berichten über,to report on (something objective),berichten
702,25,21 - 30 (B2),eignen _____,für,Akk.,eignen für,to be suitable for (a concrete goal or group),eignen
703,25,21 - 30 (B2),eignen _____,zu,Dat.,eignen zu,to be suitable for (an abstract function),eignen
704,25,11 - 20 (B1),greifen _____,zu,Dat.,greifen zu,to reach for,greifen
705,25,21 - 30 (B2),verfügen _____,über,Akk.,verfügen über,to have at one's disposal,verfügen
706,25,21 - 30 (B2),sich handeln _____,um,Akk.,sich handeln um,to be about,handeln
707,25,21 - 30 (B2),handeln _____,von,Dat.,handeln von,to revolve around / be about,handeln
708,25,21 - 30 (B2),handeln _____,mit,Dat.,handeln mit,to trade with / in,handeln
709,26,,Der Arzt informierte den Patienten _____ die Risiken der Operation.,über,,Der Arzt informierte den Patienten über die Risiken der Operation.,The doctor informed the patient about the risks of the operation.,informieren
710,26,,Wir wurden _____ die neuen Regelungen informiert.,über,,Wir wurden über die neuen Regelungen informiert.,We were informed about the new regulations.,informieren
711,26,,Sie informiert ihre Kunden regelmäßig _____ aktuelle Angebote.,über,,Sie informiert ihre Kunden regelmäßig über aktuelle Angebote.,It regularly informs its customers about current offers.,informieren
712,26,,Er informierte sich _____ der Bank über die aktuellen Zinssätze.,bei,,Er informierte sich bei der Bank über die aktuellen Zinssätze.,He inquired at the bank about the current interest rates.,informieren
713,26,,Ich habe mich _____ meinem Chef über das neue Projekt informiert.,bei,,Ich habe mich bei meinem Chef über das neue Projekt informiert.,I informed myself about the new project from my boss.,informieren
714,26,,Sie hat sich _____ Reisebüro über mögliche Urlaubsziele informiert.,beim,,Sie hat sich beim Reisebüro über mögliche Urlaubsziele informiert.,She has obtained information from the travel agency about possible vacation destinations.,informieren
715,26,,Ich rechne _____ einem Anruf von ihm.,mit,,Ich rechne mit einem Anruf von ihm.,I am expecting a call from him.,rechnen
716,26,,Wir rechnen _____ einer baldigen Entscheidung.,mit,,Wir rechnen mit einer baldigen Entscheidung.,We are expecting a decision soon.,rechnen
717,26,,Sie rechnet nicht mehr _____ einer Rückmeldung.,mit,,Sie rechnet nicht mehr mit einer Rückmeldung.,She no longer expects a response.,rechnen
718,26,,Die Situation zwang uns _____ einer schnellen Entscheidung.,zu,,Die Situation zwang uns zu einer schnellen Entscheidung.,The situation forced us to make a quick decision.,zwingen
719,26,,"Er wurde _____ gezwungen, seine Meinung zu ändern.",dazu,,"Er wurde dazu gezwungen, seine Meinung zu ändern.",He was forced to change his opinion.,zwingen
720,26,,"Sie zwang sich _____ einem Lächeln, obwohl sie traurig war.",zu,,"Sie zwang sich zu einem Lächeln, obwohl sie traurig war.","She forced herself to smile, even though she was sad.",zwingen
721,26,,Wir setzen uns _____ bessere Bedingungen ein.,für,,Wir setzen uns für bessere Bedingungen ein.,We advocate for better conditions.,einsetzen
722,26,,Er setzt sich _____ den Umweltschutz ein.,für,,Er setzt sich für den Umweltschutz ein.,He is committed to environmental protection.,einsetzen
723,26,,Sie setzt sich aktiv _____ die Rechte von Kindern ein.,für,,Sie setzt sich aktiv für die Rechte von Kindern ein.,It actively campaigns for children's rights.,einsetzen
724,26,,"Wir gehen _____ aus, dass er pünktlich kommt.",davon,,"Wir gehen davon aus, dass er pünktlich kommt.",We assume that he will arrive on time.,ausgehen
725,26,,"Ich gehe _____ aus, dass du mir hilfst.",davon,,"Ich gehe davon aus, dass du mir hilfst.",I assume that you will help me.,ausgehen
726,26,,Die Polizei geht _____ einem Unfall aus.,von,,Die Polizei geht von einem Unfall aus.,The police believe it was an accident.,ausgehen
727,26,,Sie berichtete _____ ihren Erlebnissen während des Auslandssemesters.,von,,Sie berichtete von ihren Erlebnissen während des Auslandssemesters.,She talked about her experiences during the semester abroad.,berichten
728,26,,Er hat _____ seinem ersten Arbeitstag berichtet.,von,,Er hat von seinem ersten Arbeitstag berichtet.,He reported on his first day at work.,berichten
729,26,,Ich möchte dir _____ meiner Reise nach Norwegen berichten.,von,,Ich möchte dir von meiner Reise nach Norwegen berichten.,I would like to tell you about my trip to Norway.,berichten
730,26,,Die Medien berichten ausführlich _____ den aktuellen Konflikt.,über,,Die Medien berichten ausführlich über den aktuellen Konflikt.,The media report extensively on the current conflict.,berichten
731,26,,Die Zeugin berichtete _____ den Unfallhergang.,über,,Die Zeugin berichtete über den Unfallhergang.,The witness reported on how the accident happened.,berichten
732,26,,Er berichtet regelmäßig _____ technische Neuerungen in seinem Blog.,über,,Er berichtet regelmäßig über technische Neuerungen in seinem Blog.,He regularly reports on technical innovations in his blog.,berichten
733,26,,Dieses Programm eignet sich _____ fortgeschrittene Nutzer.,für,,Dieses Programm eignet sich für fortgeschrittene Nutzer.,This program is suitable for advanced users.,eignen
734,26,,Die Methode eignet sich gut _____ den Einsatz im Unterricht.,für,,Die Methode eignet sich gut für den Einsatz im Unterricht.,The method is well suited for use in class.,eignen
735,26,,Das Buch eignet sich perfekt _____ Anfänger.,für,,Das Buch eignet sich perfekt für Anfänger.,The book is perfect for beginners.,eignen
736,26,,Dieses Holz eignet sich nicht _____ Möbelbau.,zum,,Dieses Holz eignet sich nicht zum Möbelbau.,This wood is not suitable for making furniture.,eignen
737,26,,Die App eignet sich hervorragend _____ Lernen unterwegs.,zum,,Die App eignet sich hervorragend zum Lernen unterwegs.,The app is perfectly suited for learning on the go.,eignen
738,26,,Diese Schere eignet sich gut _____ Basteln mit Kindern.,zum,,Diese Schere eignet sich gut zum Basteln mit Kindern.,These scissors are ideal for crafting with children.,eignen
739,26,,In Stresssituationen greifen viele Menschen _____ Schokolade.,zu,,In Stresssituationen greifen viele Menschen zu Schokolade.,"In stressful situations, many people reach for chocolate.",greifen
740,26,,"Er griff _____ Handy, um Hilfe zu rufen.",zum,,"Er griff zum Handy, um Hilfe zu rufen.",He reached for his cell phone to call for help.,greifen
741,26,,Sie greift abends gern _____ einem guten Buch.,zu,,Sie greift abends gern zu einem guten Buch.,She likes to read a good book in the evening.,greifen
742,26,,"Die Firma verfügt _____ moderne Maschinen, die die Produktion verbessern.",über,,"Die Firma verfügt über moderne Maschinen, die die Produktion verbessern.",The company has modern machines that improve production.,verfügen
743,26,,Er verfügt _____ viel Erfahrung in diesem Bereich.,über,,Er verfügt über viel Erfahrung in diesem Bereich.,He has a lot of experience in this field.,verfügen
744,26,,Die Schule verfügt _____ eine gut ausgestattete Bibliothek.,über,,Die Schule verfügt über eine gut ausgestattete Bibliothek.,The school has a well-equipped library.,verfügen
745,26,,Es handelt sich _____ ein Missverständnis.,um,,Es handelt sich um ein Missverständnis.,It’s about a misunderstanding.,handeln
746,26,,Der Film handelt sich _____ eine wahre Geschichte.,um,,Der Film handelt sich um eine wahre Geschichte.,The film is about a true story.,handeln
747,26,,In dem Buch handelt es sich _____ ein historisches Ereignis.,um,,In dem Buch handelt es sich um ein historisches Ereignis.,The book is about a historical event.,handeln
748,26,,Das Buch handelt _____ Liebe und Verlust.,von,,Das Buch handelt von Liebe und Verlust.,The book is about love and loss.,handeln
749,26,,Die Geschichte handelt _____ einem jungen Abenteurer.,von,,Die Geschichte handelt von einem jungen Abenteurer.,The story is about a young adventurer.,handeln
750,26,,Der Film handelt _____ einer schwierigen Vater-Sohn-Beziehung.,von,,Der Film handelt von einer schwierigen Vater-Sohn-Beziehung.,The movie is about a difficult father-son relationship.,handeln
