Nr,exercise,question,answer,german,english,french,case_english,case_french,explanation_english,explanation_french
86,4,Sie ist _____ einem Lehrer verheiratet.,mit,Sie ist mit einem Lehrer verheiratet.,She is married to a teacher.,Elle est mariée à un professeur.,,,to be married to = verheiratet mit sein + Dative,être marié à = verheiratet mit sein + Datif
87,4,"Mein Onkel ist _____ einer Ärztin verheiratet, die in Berlin arbeitet.",mit,"Mein Onkel ist mit einer Ärztin verheiratet, die in Berlin arbeitet.",My uncle is married to a doctor who works in Berlin.,Mon oncle est marié à une médecin qui travaille à Berlin.,,,to be married to = verheiratet mit sein + Dative,être marié à = verheiratet mit sein + Datif
88,4,Ich bin traurig _____ das Ende unserer Freundschaft.,über,Ich bin traurig über das Ende unserer Freundschaft.,I am sad about the end of our friendship.,Je suis triste de la fin de notre amitié.,,,to be sad about = traurig über sein + Accusative,être triste de = traurig über sein + Accusatif
89,4,Sie ist traurig _____ den Verlust ihres Haustiers.,über,Sie ist traurig über den Verlust ihres Haustiers.,She is sad about the loss of her pet.,Elle est triste de la perte de son animal de compagnie.,,,to be sad about = traurig über sein + Accusative,être triste de = traurig über sein + Accusatif
90,4,"Er war sehr traurig _____ die Nachricht, dass sein Lieblingscafé geschlossen wurde.",über,"Er war sehr traurig über die Nachricht, dass sein Lieblingscafé geschlossen wurde.",He was very sad about the news that his favorite café had closed.,Il était très triste d’apprendre que son café préféré avait fermé.,,,to be sad about = traurig über sein + Accusative,être triste de = traurig über sein + Accusatif
91,4,Er ist wütend _____ die ungerechte Behandlung.,über,Er ist wütend über die ungerechte Behandlung.,He is angry about the unfair treatment.,Il est en colère à cause du traitement injuste qu’il subit.,,,to be angry about = wütend über sein + Accusative,être en colère à propos de = wütend über sein + Accusatif
92,4,Sie ist wütend _____ den schlechten Kundenservice.,über,Sie ist wütend über den schlechten Kundenservice.,She is angry about the poor customer service.,Elle est en colère à cause du mauvais service client.,,,to be angry about = wütend über sein + Accusative,être en colère à propos de = wütend über sein + Accusatif
93,4,"Viele Bürger sind wütend _____ die neuen Steuern, die plötzlich eingeführt wurden.",über,"Viele Bürger sind wütend über die neuen Steuern, die plötzlich eingeführt wurden.",Many citizens are angry about the new taxes that were suddenly introduced.,De nombreux citoyens sont en colère à propos des nouvelles taxes qui ont été introduites soudainement.,,,to be angry about = wütend über sein + Accusative,être en colère à propos de = wütend über sein + Accusatif
94,4,Ich bin enttäuscht _____ Ergebnis.,vom,Ich bin enttäuscht vom Ergebnis.,I am disappointed with the result.,Je suis déçu du résultat.,,,to be disappointed by = enttäuscht von sein + Dative,être déçu par = enttäuscht von sein + Datif
95,4,Sie war enttäuscht _____ seinem Verhalten.,von,Sie war enttäuscht von seinem Verhalten.,She was disappointed with his behavior.,Elle était déçue par son comportement.,,,to be disappointed by = enttäuscht von sein + Dative,être déçu par = enttäuscht von sein + Datif
96,4,"Wir sind enttäuscht _____ Service im Restaurant, er war wirklich langsam.",vom,"Wir sind enttäuscht vom Service im Restaurant, er war wirklich langsam.",We are disappointed with the service at the restaurant; it was really slow.,"Nous sommes déçus du service au restaurant, il était vraiment lent.",,,to be disappointed by = enttäuscht von sein + Dative,être déçu par = enttäuscht von sein + Datif
97,5,gewöhnt _____ sein,an,gewöhnt an sein,to be used to,être habitué à,Accusative,Accusatif,to be used to = gewöhnt an sein + Accusative,être habitué à = gewöhnt an sein + Accusatif
98,5,schuldig _____ sein,an,schuldig an sein,to be guilty of,être coupable de,Dative,Datif,to be guilty of = schuldig an sein + Dative,être coupable de = schuldig an sein + Datif
99,5,stolz _____ sein,auf,stolz auf sein,to be proud of,être fier de,Accusative,Accusatif,to be proud of = stolz auf sein + Accusative,être fier de = stolz auf sein + Accusatif
100,5,gespannt _____ sein,auf,gespannt auf sein,to be excited about,être enthousiasmé à propos de,Accusative,Accusatif,to be excited about = gespannt auf sein + Accusative,être enthousiasmé à propos de = gespannt auf sein + Accusatif
101,5,bekannt _____ sein,bei,bekannt bei sein,"to be known to, with",être connu auprès de,Dative,Datif,"to be known to, with = bekannt bei sein + Dative",être connu auprès de = bekannt bei sein + Datif
102,5,verantwortlich _____ sein,für,verantwortlich für sein,to be responsible for,être responsable de,Accusative,Accusatif,to be responsible for = verantwortlich für sein + Accusative,être responsable de = verantwortlich für sein + Accusatif
103,5,befreundet _____ sein,mit,befreundet mit sein,to be friends with,être amis avec,Dative,Datif,to be friends with = befreundet mit sein + Dative,être amis avec = befreundet mit sein + Datif
104,5,verrückt _____ sein,nach,verrückt nach sein,to be crazy about,être fou de,Dative,Datif,to be crazy about = verrückt nach sein + Dative,être fou de = verrückt nach sein + Datif
105,5,aufgeregt _____ sein,über,aufgeregt über sein,to be excited about,être enthousiasmé à propos de,Accusative,Accusatif,to be excited about = aufgeregt über sein + Accusative,être enthousiasmé à propos de = aufgeregt über sein + Accusatif
106,5,froh _____ sein,über,froh über sein,to be happy about,être heureux de,Accusative,Accusatif,to be happy about = froh über sein + Accusative,être heureux de = froh über sein + Accusatif
107,5,begeistert _____ sein,von,begeistert von sein,to be enthusiastic about,être enthousiaste à propos de,Dative,Datif,to be enthusiastic about = begeistert von sein + Dative,être enthousiaste à propos de = begeistert von sein + Datif
108,5,abhängig _____ sein,von,abhängig von sein,to be dependent on,être dépendant de,Dative,Datif,to be dependent on = abhängig von sein + Dative,être dépendant de = abhängig von sein + Datif
109,5,frei _____ sein,von,frei von sein,to be free from,"être libre de, être exempt de",Dative,Datif,to be free from = frei von sein + Dative,"être libre de, être exempt de = frei von sein + Datif"
110,5,müde _____ sein,von,müde von sein,to be tired from,être fatigué de,Dative,Datif,to be tired from = müde von sein + Dative,être fatigué de = müde von sein + Datif
111,5,angenehm _____ sein,für,angenehm für sein,to be pleasant for,être agréable pour,Accusative,Accusatif,to be pleasant for = angenehm für sein + Accusative,être agréable pour = angenehm für sein + Accusatif
112,6,Ich bin _____ die langen Arbeitszeiten gewöhnt.,an,Ich bin an die langen Arbeitszeiten gewöhnt.,I am used to the long working hours.,Je suis habitué aux longues heures de travail.,,,to be used to = gewöhnt an sein + Accusative,être habitué à = gewöhnt an sein + Accusatif
113,6,Sie ist _____ Leben in der Großstadt gewöhnt.,ans,Sie ist ans Leben in der Großstadt gewöhnt.,She is used to life in the big city.,Elle est habituée à la vie dans la grande ville.,,,to be used to = gewöhnt an sein + Accusative,être habitué à = gewöhnt an sein + Accusatif
114,6,Nach mehreren Jahren im Ausland ist er _____ das ständige Reisen und die verschiedenen Kulturen gewöhnt.,an,Nach mehreren Jahren im Ausland ist er an das ständige Reisen und die verschiedenen Kulturen gewöhnt.,"After several years abroad, he is used to constant traveling and different cultures.","Après plusieurs années à l’étranger, il est habitué aux voyages constants et aux différentes cultures.",,,to be used to = gewöhnt an sein + Accusative,être habitué à = gewöhnt an sein + Accusatif
115,6,Er ist schuldig _____ Unfall.,am,Er ist schuldig am Unfall.,He is guilty of the accident.,Il est coupable de l'accident.,,,to be guilty of = schuldig an sein + Dative,être coupable de = schuldig an sein + Datif
116,6,Sie wurde schuldig _____ der Verzögerung befunden.,an,Sie wurde schuldig an der Verzögerung befunden.,She was found guilty of the delay.,Elle a été reconnue coupable de retard.,,,to be guilty of = schuldig an sein + Dative,être coupable de = schuldig an sein + Datif
117,6,"Der Manager fühlte sich schuldig _____ Scheitern des Projekts, obwohl er alles versucht hatte.",am,"Der Manager fühlte sich schuldig am Scheitern des Projekts, obwohl er alles versucht hatte.","The manager felt guilty for the failure of the project, even though he had tried everything.","Le directeur se sentait coupable de l'échec du projet, même s'il avait tout essayé.",,,to be guilty of = schuldig an sein + Dative,être coupable de = schuldig an sein + Datif
118,6,"Ich bin stolz _____ meinen Bruder, der die Prüfung bestanden hat.",auf,"Ich bin stolz auf meinen Bruder, der die Prüfung bestanden hat.","I am proud of my brother, who passed the exam.",Je suis fier de mon frère qui a réussi l'examen.,,,to be proud of = stolz auf sein + Accusative,être fier de = stolz auf sein + Accusatif
119,6,Sie ist stolz _____ ihr Team nach dem erfolgreichen Projektabschluss.,auf,Sie ist stolz auf ihr Team nach dem erfolgreichen Projektabschluss.,She is proud of her team after the successful project completion.,Elle est fière de son équipe après la réussite du projet.,,,to be proud of = stolz auf sein + Accusative,être fier de = stolz auf sein + Accusatif
120,6,"Die Eltern sind stolz _____ ihre Tochter, die ein Stipendium für die Universität bekommen hat.",auf,"Die Eltern sind stolz auf ihre Tochter, die ein Stipendium für die Universität bekommen hat.",The parents are proud of their daughter who received a scholarship for university.,Les parents sont fiers de leur fille qui a obtenu une bourse pour l’université.,,,to be proud of = stolz auf sein + Accusative,être fier de = stolz auf sein + Accusatif
121,6,Wir sind gespannt _____ die Präsentation der neuen Produkte.,auf,Wir sind gespannt auf die Präsentation der neuen Produkte.,We are excited about the presentation of the new products.,Nous sommes ravis de la présentation des nouveaux produits.,,,to be excited about = gespannt auf sein + Accusative,être enthousiasmé à propos de = gespannt auf sein + Accusatif
122,6,Er ist gespannt _____ den Ausgang des Wettbewerbs.,auf,Er ist gespannt auf den Ausgang des Wettbewerbs.,He is excited about the outcome of the competition.,Il est enthousiasmé par le résultat de la compétition.,,,to be excited about = gespannt auf sein + Accusative,être enthousiasmé à propos de = gespannt auf sein + Accusatif
123,6,"Die Zuschauer sind gespannt _____ den Film, über den alle seit Wochen sprechen.",auf,"Die Zuschauer sind gespannt auf den Film, über den alle seit Wochen sprechen.",The audience is curious about the movie everyone has been talking about for weeks.,Les spectateurs sont impatients de voir le film dont tout le monde parle depuis des semaines.,,,to be excited about = gespannt auf sein + Accusative,être enthousiasmé à propos de = gespannt auf sein + Accusatif
124,6,Er ist bekannt _____ seinen Kollegen für seine Zuverlässigkeit.,bei,Er ist bekannt bei seinen Kollegen für seine Zuverlässigkeit.,He is known by his colleagues for his reliability.,Il est connu par ses collègues pour sa fiabilité.,,,"to be known to, with = bekannt bei sein + Dative",être connu auprès de = bekannt bei sein + Datif
125,6,Das Restaurant ist bekannt _____ Touristen für seine gute Küche.,bei,Das Restaurant ist bekannt bei Touristen für seine gute Küche.,The restaurant is known among tourists for its good cuisine.,Le restaurant est connu parmi les touristes pour sa bonne cuisine.,,,"to be known to, with = bekannt bei sein + Dative",être connu auprès de = bekannt bei sein + Datif
126,6,Die Sängerin ist bekannt _____ jungen Leuten für ihre energiegeladenen Auftritte.,bei,Die Sängerin ist bekannt bei jungen Leuten für ihre energiegeladenen Auftritte.,The singer is well known among young people for her energetic performances.,La chanteuse est connue des jeunes pour ses performances pleines d’énergie.,,,"to be known to, with = bekannt bei sein + Dative",être connu auprès de = bekannt bei sein + Datif
127,6,Er ist verantwortlich _____ die Organisation der Konferenz.,für,Er ist verantwortlich für die Organisation der Konferenz.,He is responsible for organizing the conference.,Il est responsable de l'organisation de la conférence.,,,to be responsible for = verantwortlich für sein + Accusative,être responsable de = verantwortlich für sein + Accusatif
128,6,Sie ist verantwortlich _____ das gesamte Marketingteam.,für,Sie ist verantwortlich für das gesamte Marketingteam.,She is responsible for the entire marketing team.,Elle est responsable de toute l'équipe marketing.,,,to be responsible for = verantwortlich für sein + Accusative,être responsable de = verantwortlich für sein + Accusatif
129,6,Die Abteilung ist verantwortlich _____ die Umsetzung der neuen Strategie im Unternehmen.,für,Die Abteilung ist verantwortlich für die Umsetzung der neuen Strategie im Unternehmen.,The department is responsible for implementing the new strategy in the company.,Le département est responsable de la mise en œuvre de la nouvelle stratégie dans l’entreprise.,,,to be responsible for = verantwortlich für sein + Accusative,être responsable de = verantwortlich für sein + Accusatif
130,6,Er ist seit Jahren _____ seinem Nachbarn befreundet.,mit,Er ist seit Jahren mit seinem Nachbarn befreundet.,He has been friends with his neighbor for years.,Il est ami avec son voisin depuis des années.,,,to be friends with = befreundet mit sein + Dative,être amis avec = befreundet mit sein + Datif
131,6,Sie ist eng _____ ihrer ehemaligen Kollegin befreundet.,mit,Sie ist eng mit ihrer ehemaligen Kollegin befreundet.,She is close friends with her former colleague.,Elle est une amie proche de son ancien collègue.,,,to be friends with = befreundet mit sein + Dative,être amis avec = befreundet mit sein + Datif
132,6,"Ich bin gut _____ einem Musiker befreundet, den ich auf einer Reise kennengelernt habe.",mit,"Ich bin gut mit einem Musiker befreundet, den ich auf einer Reise kennengelernt habe.",I’m good friends with a musician I met on a trip.,Je suis ami avec un musicien que j’ai rencontré lors d’un voyage.,,,to be friends with = befreundet mit sein + Dative,être amis avec = befreundet mit sein + Datif
133,6,Sie ist verrückt _____ Schokolade.,nach,Sie ist verrückt nach Schokolade.,She is crazy about chocolate.,Elle est folle du chocolat.,,,to be crazy about = verrückt nach sein + Dative,être fou de = verrückt nach sein + Datif
134,6,Er ist verrückt _____ alten Autos.,nach,Er ist verrückt nach alten Autos.,He is crazy about vintage cars.,Il est fou des voitures anciennes.,,,to be crazy about = verrückt nach sein + Dative,être fou de = verrückt nach sein + Datif
135,6,Meine Freundin ist verrückt _____ Reisen und plant ständig ihren nächsten Urlaub.,nach,Meine Freundin ist verrückt nach Reisen und plant ständig ihren nächsten Urlaub.,My girlfriend is crazy about traveling and is always planning her next vacation.,Ma copine est folle de voyages et planifie sans cesse ses prochaines vacances.,,,to be crazy about = verrückt nach sein + Dative,être fou de = verrückt nach sein + Datif
136,6,Er ist aufgeregt _____ die Neuigkeiten.,über,Er ist aufgeregt über die Neuigkeiten.,He is excited about the news.,Il est enthousiasmé par la nouvelle.,,,to be excited about = aufgeregt über sein + Accusative,être enthousiasmé à propos de = aufgeregt über sein + Accusatif
137,6,Die Kinder sind aufgeregt _____ das bevorstehende Fest.,über,Die Kinder sind aufgeregt über das bevorstehende Fest.,The children are excited about the upcoming celebration.,Les enfants sont enthousiasmés par la célébration à venir.,,,to be excited about = aufgeregt über sein + Accusative,être enthousiasmé à propos de = aufgeregt über sein + Accusatif
138,6,Sie war aufgeregt _____ das Vorstellungsgespräch und konnte kaum schlafen.,über,Sie war aufgeregt über das Vorstellungsgespräch und konnte kaum schlafen.,She was excited about the job interview and could hardly sleep.,Elle était excitée à propos de l’entretien d’embauche et n’a presque pas dormi.,,,to be excited about = aufgeregt über sein + Accusative,être enthousiasmé à propos de = aufgeregt über sein + Accusatif
139,6,Ich bin froh _____ deine Entscheidung.,über,Ich bin froh über deine Entscheidung.,I am happy about your decision.,Je suis heureux de votre décision.,,,to be happy about = froh über sein + Accusative,être heureux de = froh über sein + Accusatif
140,6,Sie ist froh _____ die positive Entwicklung.,über,Sie ist froh über die positive Entwicklung.,She is happy about the positive development.,Elle se réjouit de l’évolution positive.,,,to be happy about = froh über sein + Accusative,être heureux de = froh über sein + Accusatif
141,6,"Wir sind froh _____ das Ergebnis der Verhandlungen, das für alle fair ist.",über,"Wir sind froh über das Ergebnis der Verhandlungen, das für alle fair ist.","We are glad about the outcome of the negotiations, which is fair for everyone.","Nous sommes heureux du résultat des négociations, qui est juste pour tout le monde.",,,to be happy about = froh über sein + Accusative,être heureux de = froh über sein + Accusatif
142,6,Ich bin begeistert _____ ihrer Kreativität.,von,Ich bin begeistert von ihrer Kreativität.,I am impressed by her creativity.,Je suis impressionné par sa créativité.,,,to be enthusiastic about = begeistert von sein + Dative,être enthousiaste à propos de = begeistert von sein + Datif
143,6,Er war begeistert _____ der Show gestern Abend.,von,Er war begeistert von der Show gestern Abend.,He was excited about the show last night.,Il était excité par le spectacle d’hier soir.,,,to be enthusiastic about = begeistert von sein + Dative,être enthousiaste à propos de = begeistert von sein + Datif
144,6,Die Touristen waren begeistert _____ der Schönheit der alten Stadt.,von,Die Touristen waren begeistert von der Schönheit der alten Stadt.,The tourists were amazed by the beauty of the old town.,Les touristes étaient enthousiasmés par la beauté de la vieille ville.,,,to be enthusiastic about = begeistert von sein + Dative,être enthousiaste à propos de = begeistert von sein + Datif
145,6,Er ist abhängig _____ der Unterstützung seiner Familie.,von,Er ist abhängig von der Unterstützung seiner Familie.,He is dependent on his family's support.,Il dépend du soutien de sa famille.,,,to be dependent on = abhängig von sein + Dative,être dépendant de = abhängig von sein + Datif
146,6,Die Firma ist abhängig _____ den Marktbedingungen.,von,Die Firma ist abhängig von den Marktbedingungen.,The company is dependent on market conditions.,L'entreprise dépend des conditions du marché.,,,to be dependent on = abhängig von sein + Dative,être dépendant de = abhängig von sein + Datif
147,6,Viele Studenten sind finanziell abhängig _____ ihren Eltern während des Studiums.,von,Viele Studenten sind finanziell abhängig von ihren Eltern während des Studiums.,Many students are financially dependent on their parents during their studies.,De nombreux étudiants dépendent financièrement de leurs parents pendant leurs études.,,,to be dependent on = abhängig von sein + Dative,être dépendant de = abhängig von sein + Datif
148,6,Das Produkt ist frei _____ chemischen Zusatzstoffen.,von,Das Produkt ist frei von chemischen Zusatzstoffen.,The product is free from chemical additives.,Le produit est exempt d'additifs chimiques.,,,to be free from = frei von sein + Dative,"être libre de, être exempt de = frei von sein + Datif"
149,6,Sie ist endlich frei _____ ihrer Angst vor Versagen.,von,Sie ist endlich frei von ihrer Angst vor Versagen.,She is finally free from her fear of failure.,Elle est enfin libérée de sa peur de l’échec.,,,to be free from = frei von sein + Dative,"être libre de, être exempt de = frei von sein + Datif"
150,6,"Nach der Behandlung fühlte er sich frei _____ den Schmerzen, die ihn monatelang geplagt hatten.",von,"Nach der Behandlung fühlte er sich frei von den Schmerzen, die ihn monatelang geplagt hatten.","After the treatment, he felt free from the pain that had troubled him for months.","Après le traitement, il s’est senti libéré des douleurs qui le tourmentaient depuis des mois.",,,to be free from = frei von sein + Dative,"être libre de, être exempt de = frei von sein + Datif"
151,6,Ich bin müde _____ der langen Reise.,von,Ich bin müde von der langen Reise.,I am tired from the long journey.,Je suis fatigué du long voyage.,,,to be tired from = müde von sein + Dative,être fatigué de = müde von sein + Datif
152,6,Er ist müde _____ der anstrengenden Arbeit.,von,Er ist müde von der anstrengenden Arbeit.,He is tired from the exhausting work.,Il est fatigué par le travail épuisant.,,,to be tired from = müde von sein + Dative,être fatigué de = müde von sein + Datif
153,6,"Wir sind müde _____ den endlosen Diskussionen, die zu nichts führen.",von,"Wir sind müde von den endlosen Diskussionen, die zu nichts führen.",We are tired of the endless discussions that lead nowhere.,Nous sommes fatigués des discussions sans fin qui ne mènent à rien.,,,to be tired from = müde von sein + Dative,être fatigué de = müde von sein + Datif
154,6,Seine ruhige Stimme ist angenehm _____ die Zuhörer.,für,Seine ruhige Stimme ist angenehm für die Zuhörer.,His calm voice is pleasant for the listeners.,Sa voix calme est agréable pour les auditeurs.,,,to be pleasant for = angenehm für sein + Accusative,être agréable pour = angenehm für sein + Accusatif
155,6,Die Musik war angenehm _____ alle Gäste im Restaurant.,für,Die Musik war angenehm für alle Gäste im Restaurant.,The music was pleasant for all the guests in the restaurant.,La musique était agréable pour tous les invités au restaurant.,,,to be pleasant for = angenehm für sein + Accusative,être agréable pour = angenehm für sein + Accusatif
156,6,Das warme Wetter ist sehr angenehm _____ einen Spaziergang im Park.,für,Das warme Wetter ist sehr angenehm für einen Spaziergang im Park.,The warm weather is very pleasant for a walk in the park.,Le temps chaud est très agréable pour une promenade dans le parc.,,,to be pleasant for = angenehm für sein + Accusative,être agréable pour = angenehm für sein + Accusatif
157,7,ärgerlich _____ sein,über,ärgerlich über sein,to be annoyed about (a situation),être agacé par (une situation),Accusative,Accusatif,to be annoyed about (a situation) = ärgerlich über sein + Accusative,être agacé par (une situation) = ärgerlich über sein + Accusatif
158,7,ärgerlich _____ sein,auf,ärgerlich auf sein,to be annoyed with (a person),être agacé par (une personne),Accusative,Accusatif,to be annoyed with (a person) = ärgerlich auf sein + Accusative,être agacé par (une personne) = ärgerlich auf sein + Accusatif
159,7,bereit _____ sein,zu,bereit zu sein,"to be ready for, ready to","être prêt pour, prêt à",Dative,Datif,"to be ready for, ready to = bereit zu sein + Dative","être prêt pour, prêt à = bereit zu sein + Datif"
160,7,fähig _____ sein,zu,fähig zu sein,"to be capable of, capable to",être capable de,Dative,Datif,"to be capable of, capable to = fähig zu sein + Dative",être capable de = fähig zu sein + Datif
161,7,aufmerksam _____ sein,auf,aufmerksam auf sein,to be attentive to,être attentif à,Accusative,Accusatif,to be attentive to = aufmerksam auf sein + Accusative,être attentif à = aufmerksam auf sein + Accusatif
162,7,böse _____ sein,über,böse über sein,to be angry about,être en colère à propos de,Accusative,Accusatif,to be angry about = böse über sein + Accusative,être en colère à propos de = böse über sein + Accusatif
163,7,böse _____ sein,auf,böse auf sein,to be angry with,être en colère envers,Accusative,Accusatif,to be angry with = böse auf sein + Accusative,être en colère envers = böse auf sein + Accusatif
164,7,höflich _____ sein,zu,höflich zu sein,"to be polite to, towards",être poli avec,Dative,Datif,"to be polite to, towards = höflich zu sein + Dative",être poli avec = höflich zu sein + Datif
165,7,unhöflich _____ sein,zu,unhöflich zu sein,"to be rude to, towards",être malpoli avec,Dative,Datif,"to be rude to, towards = unhöflich zu sein + Dative",être malpoli avec = unhöflich zu sein + Datif
166,7,bekannt _____ sein,für,bekannt für sein,to be known for (something negative),être connu pour (quelque chose de négatif),Accusative,Accusatif,to be known for (something negative) = bekannt für sein + Accusative,être connu pour (quelque chose de négatif) = bekannt für sein + Accusatif
167,7,berühmt _____ sein,für,berühmt für sein,to be famous for (something positive),être célèbre pour (quelque chose de positif),Accusative,Accusatif,to be famous for (something positive) = berühmt für sein + Accusative,être célèbre pour (quelque chose de positif) = berühmt für sein + Accusatif
168,7,beschäftigt _____ sein,mit,beschäftigt mit sein,"to be busy, occupied with","être occupé par, avec",Dative,Datif,"to be busy, occupied with = beschäftigt mit sein + Dative","être occupé par, avec = beschäftigt mit sein + Datif"
169,7,dankbar _____ sein,für,dankbar für sein,"to be grateful, thankful for",être reconnaissant pour,Accusative,Accusatif,"to be grateful, thankful for = dankbar für sein + Accusative",être reconnaissant pour = dankbar für sein + Accusatif
