Nr,exercise,question,answer,german,english,explanation,case
401,10,Der Tisch ist _____ massivem Holz gefertigt.,aus,Der Tisch ist aus massivem Holz gefertigt.,The table is made of solid wood.,to indicate a material → aus + Dat.,
402,10,Diese Schale ist _____ Keramik und handbemalt.,aus,Diese Schale ist aus Keramik und handbemalt.,This bowl is made of ceramic and hand-painted.,to indicate a material → aus + Dat.,
403,10,Die Brücke wurde _____ Stahl gebaut.,aus,Die Brücke wurde aus Stahl gebaut.,The bridge was built from steel.,to indicate a material → aus + Dat.,
404,10,Seine Jacke ist _____ Leder und sehr teuer.,aus,Seine Jacke ist aus Leder und sehr teuer.,His jacket is made of leather and very expensive.,to indicate a material → aus + Dat.,
405,10,Das Haus wurde _____ alten Ziegeln restauriert.,aus,Das Haus wurde aus alten Ziegeln restauriert.,The house was restored using old bricks.,to indicate a material → aus + Dat.,
406,10,Das Kleid ist _____ einfacher Schönheit.,von,Das Kleid ist von einfacher Schönheit.,The dress is of simple beauty.,to indicate a quality → von + Dat.,
407,10,Er ist ein Mann _____ großem Mut.,von,Er ist ein Mann von großem Mut.,He is a man of great courage.,to indicate a quality → von + Dat.,
408,10,Sie spricht mit einer Stimme _____ besonderer Wärme.,von,Sie spricht mit einer Stimme von besonderer Wärme.,She speaks with a voice of special warmth.,to indicate a quality → von + Dat.,
409,10,Das war eine Entscheidung _____ großer Bedeutung.,von,Das war eine Entscheidung von großer Bedeutung.,That was a decision of great importance.,to indicate a quality → von + Dat.,
410,10,Der Künstler ist für Werke _____ hoher Qualität bekannt.,von,Der Künstler ist für Werke von hoher Qualität bekannt.,The artist is known for works of high quality.,to indicate a quality → von + Dat.,
411,10,Sie steht mit ihrem Lied _____ Platz eins der Charts.,auf,Sie steht mit ihrem Lied auf Platz eins der Charts.,Her song is at number one in the charts.,to indicate a place in a ranking → auf + Dat.,
412,10,Unsere Mannschaft ist _____ Platz drei der Tabelle.,auf,Unsere Mannschaft ist auf Platz drei der Tabelle.,Our team is in third place in the league table.,to indicate a place in a ranking → auf + Dat.,
413,10,Der Film landete sofort _____ Platz zwei.,auf,Der Film landete sofort auf Platz zwei.,The movie immediately landed in second place.,to indicate a place in a ranking → auf + Dat.,
414,10,"Er kämpft, um wieder _____ Platz eins zu kommen.",auf,"Er kämpft, um wieder auf Platz eins zu kommen.",He's fighting to get back to first place.,to indicate a place in a ranking → auf + Dat.,
415,10,_____ Platz fünf ist ein Überraschungskandidat.,Auf,Auf Platz fünf ist ein Überraschungskandidat.,In fifth place is a surprise candidate.,to indicate a place in a ranking → auf + Dat.,
416,10,Wolken zogen schnell _____ den Himmel.,über,Wolken zogen schnell über den Himmel.,Clouds moved quickly across the sky.,to indicate a movement parallel to a surface – <i>across</i> → über + Akk.,
417,10,Ein Vogel flog _____ das Feld.,über,Ein Vogel flog über das Feld.,A bird flew across the field.,to indicate a movement parallel to a surface – <i>across</i> → über + Akk.,
418,10,Die Kinder rannten lachend _____ die Wiese.,über,Die Kinder rannten lachend über die Wiese.,The children ran laughing across the meadow.,to indicate a movement parallel to a surface – <i>across</i> → über + Akk.,
419,10,Der Wind wehte stark _____ das Land.,über,Der Wind wehte stark über das Land.,The wind blew strongly across the land.,to indicate a movement parallel to a surface – <i>across</i> → über + Akk.,
420,10,Ein Schatten glitt lautlos _____ den Boden.,über,Ein Schatten glitt lautlos über den Boden.,A shadow silently glided across the ground.,to indicate a movement parallel to a surface – <i>across</i> → über + Akk.,
421,10,Der Größe nach kommt Dresden _____ Leipzig.,vor,Der Größe nach kommt Dresden vor Leipzig.,"In terms of size, Dresden comes before Leipzig.",to indicate a relative importance → vor + Dat.,
422,10,Nach Erfahrung steht sie _____ allen anderen Bewerbern.,vor,Nach Erfahrung steht sie vor allen anderen Bewerbern.,"In terms of experience, she ranks above all other applicants.",to indicate a relative importance → vor + Dat.,
423,10,_____ allem steht die Sicherheit der Gäste.,Vor,Vor allem steht die Sicherheit der Gäste.,"Above all, the guests' safety comes first.",to indicate a relative importance → vor + Dat.,
424,10,Qualität geht bei uns _____ Quantität.,vor,Qualität geht bei uns vor Quantität.,"For us, quality comes before quantity.",to indicate a relative importance → vor + Dat.,
425,10,Er stellt seine Arbeit immer _____ seine Freizeit.,vor,Er stellt seine Arbeit immer vor seine Freizeit.,He always puts his work before his free time.,to indicate a relative importance → vor + Dat.,
426,10,Das Auto fuhr _____ einen Baum.,gegen,Das Auto fuhr gegen einen Baum.,The car crashed into a tree.,to indicate a direction against an object → gegen + Akk.,
427,10,Stell die Leiter _____ die Wand.,gegen,Stell die Leiter gegen die Wand.,Put the ladder against the wall.,to indicate a direction against an object → gegen + Akk.,
428,10,Der Ball fliegt _____ die Wand.,gegen,Der Ball fliegt gegen die Wand.,The ball flies against the wall.,to indicate a direction against an object → gegen + Akk.,
429,10,Er lehnt die Leiter _____ das Haus.,gegen,Er lehnt die Leiter gegen das Haus.,He's leaning the ladder against the house.,to indicate a direction against an object → gegen + Akk.,
430,10,Sie stellt ihre Tasche _____ den Stuhl.,gegen,Sie stellt ihre Tasche gegen den Stuhl.,She's putting her bag against the chair.,to indicate a direction against an object → gegen + Akk.,
431,10,Die Fenster zeigen _____ Süden.,nach,Die Fenster zeigen nach Süden.,The windows face south.,to indicate a resting direction of an object – <i>facing</i> → nach + Dat.,
432,10,Unser Balkon geht _____ Westen.,nach,Unser Balkon geht nach Westen.,Our balcony faces west.,to indicate a resting direction of an object – <i>facing</i> → nach + Dat.,
433,10,Das Sofa steht _____ dem Fernseher gerichtet.,nach,Das Sofa steht nach dem Fernseher gerichtet.,The sofa is positioned facing the TV.,to indicate a resting direction of an object – <i>facing</i> → nach + Dat.,
434,10,Die Kirche ist _____ Osten ausgerichtet.,nach,Die Kirche ist nach Osten ausgerichtet.,The church is oriented towards the east.,to indicate a resting direction of an object – <i>facing</i> → nach + Dat.,
435,10,Ihr Schreibtisch zeigt _____ dem Fenster.,nach,Ihr Schreibtisch zeigt nach dem Fenster.,Her desk faces the window.,to indicate a resting direction of an object – <i>facing</i> → nach + Dat.,
436,10,_____ Beginn des Kurses war alles noch ziemlich chaotisch.,Zu,Zu Beginn des Kurses war alles noch ziemlich chaotisch.,"At the beginning of the course, everything was still pretty chaotic.","in temporal context before words such as Ende, Beginn, Mal and Zeit → zu + Dat.",
437,10,_____ dieser Zeit lebte ich noch in Berlin.,Zu,Zu dieser Zeit lebte ich noch in Berlin.,I was still living in Berlin at the time.,"in temporal context before words such as Ende, Beginn, Mal and Zeit → zu + Dat.",
438,10,_____ ersten Mal habe ich echtes Interesse an Geschichte gezeigt.,Zum,Zum ersten Mal habe ich echtes Interesse an Geschichte gezeigt.,"For the first time, I showed a real interest in history.","in temporal context before words such as Ende, Beginn, Mal and Zeit → zu + Dat.",
439,10,_____ meiner Schulzeit war das Internet noch nicht so verbreitet.,Zu,Zu meiner Schulzeit war das Internet noch nicht so verbreitet.,"When I was at school, the internet was not yet so widespread.","in temporal context before words such as Ende, Beginn, Mal and Zeit → zu + Dat.",
440,10,_____ Ende des Films wurde es richtig spannend.,Zu,Zu Ende des Films wurde es richtig spannend.,It got really exciting at the end of the movie.,"in temporal context before words such as Ende, Beginn, Mal and Zeit → zu + Dat.",
441,10,"Ich war gestern _____ der Post, um ein Paket abzuholen.",auf,"Ich war gestern auf der Post, um ein Paket abzuholen.",I went to the post office yesterday to pick up a parcel.,to indicate a location in an institutional building and doing an activity related to that building → auf + Dat.,
442,10,Sie hat ihre Überweisung _____ der Bank erledigt.,auf,Sie hat ihre Überweisung auf der Bank erledigt.,She did her bank transfer at the bank.,to indicate a location in an institutional building and doing an activity related to that building → auf + Dat.,
443,10,Wir müssen morgen früh _____ dem Amt unseren neuen Ausweis beantragen.,auf,Wir müssen morgen früh auf dem Amt unseren neuen Ausweis beantragen.,We have to apply for our new ID card at the office tomorrow morning.,to indicate a location in an institutional building and doing an activity related to that building → auf + Dat.,
444,10,Er hat den Antrag _____ der Behörde persönlich abgegeben.,auf,Er hat den Antrag auf der Behörde persönlich abgegeben.,He handed in the application at the office in person.,to indicate a location in an institutional building and doing an activity related to that building → auf + Dat.,
445,10,"Ich bin gerade _____ der Arbeit, ich rufe dich später zurück.",auf,"Ich bin gerade auf der Arbeit, ich rufe dich später zurück.","I'm at work right now, I'll call you back later.",to indicate a location in an institutional building and doing an activity related to that building → auf + Dat.,
446,11,"starting, from ... on",ab,,,"starting, from ... on = ab + Dat.",Dat.
447,11,instead of,anstatt,,,instead of = anstatt + Gen.,Gen.
448,11,outside of,außerhalb,,,outside of = außerhalb + Gen.,Gen.
449,11,"through, across",durch,,,"through, across = durch + Akk.",Akk.
450,11,"opposite of, across from",gegenüber,,,"opposite of, across from = gegenüber + Dat.",Dat.
451,11,"inside of, within",innerhalb,,,"inside of, within = innerhalb + Gen.",Gen.
452,11,"according to (preposition, with Genitive)",laut,,,"according to (preposition, with Genitive) = laut + Gen.",Gen.
453,11,"despite, regardless of",trotz,,,"despite, regardless of = trotz + Gen.",Gen.
454,11,"during, throughout, while",während,,,"during, throughout, while = während + Gen.",Gen.
455,11,"due to, because of",wegen,,,"due to, because of = wegen + Gen.",Gen.
456,11,"according to (postposition, with Dative)",zufolge,,,"according to (postposition, with Dative) = zufolge + Dat.",Dat.
457,12,_____ nächstem Monat werde ich zweimal pro Woche einen Sprachkurs besuchen.,Ab,Ab nächstem Monat werde ich zweimal pro Woche einen Sprachkurs besuchen.,"Starting next month, I will be attending a language course twice a week.","starting, from ... on = ab + Dat.",
458,12,Die Bibliothek ist _____ Montag wieder geöffnet.,ab,Die Bibliothek ist ab Montag wieder geöffnet.,The library is open again from Monday.,"starting, from ... on = ab + Dat.",
459,12,_____ sofort ist Rauchen im Gebäude verboten.,Ab,Ab sofort ist Rauchen im Gebäude verboten.,Smoking is prohibited in the building with immediate effect.,"starting, from ... on = ab + Dat.",
460,12,_____ dem Sommer plane ich eine lange Reise durch Europa.,Ab,Ab dem Sommer plane ich eine lange Reise durch Europa.,I'm planning a long trip through Europe starting in the summer.,"starting, from ... on = ab + Dat.",
461,12,_____ nächstem Jahr wird die Stadt eine neue Umweltsteuer einführen.,Ab,Ab nächstem Jahr wird die Stadt eine neue Umweltsteuer einführen.,"Starting next year, the city will introduce a new environmental tax.","starting, from ... on = ab + Dat.",
462,12,_____ eines Autos kaufte er ein Fahrrad.,Anstatt,Anstatt eines Autos kaufte er ein Fahrrad.,"Instead of a car, he bought a bicycle.",instead of = anstatt + Gen.,
463,12,Sie trank Wasser _____ eines Softdrinks.,anstatt,Sie trank Wasser anstatt eines Softdrinks.,She drank water instead of a soft drink.,instead of = anstatt + Gen.,
464,12,_____ einer Entschuldigung gab er nur eine Ausrede.,Anstatt,Anstatt einer Entschuldigung gab er nur eine Ausrede.,"Instead of an apology, he just gave an excuse.",instead of = anstatt + Gen.,
465,12,Wir entschieden uns für eine Wanderung _____ eines Kinobesuchs.,anstatt,Wir entschieden uns für eine Wanderung anstatt eines Kinobesuchs.,We chose to go hiking instead of going to the cinema.,instead of = anstatt + Gen.,
466,12,"_____ eines grossen Geschenks machte er eine kleine, persönliche Geste.",Anstatt,"Anstatt eines grossen Geschenks machte er eine kleine, persönliche Geste.","Instead of a big gift, he made a small, personal gesture.",instead of = anstatt + Gen.,
467,12,_____ der Stadt gibt es viele schöne Wanderwege.,Außerhalb,Außerhalb der Stadt gibt es viele schöne Wanderwege.,"Outside the city, there are many beautiful hiking trails.",outside of = außerhalb + Gen.,
468,12,Das Parken ist _____ der Geschäftszeiten kostenlos.,außerhalb,Das Parken ist außerhalb der Geschäftszeiten kostenlos.,Parking is free outside business hours.,outside of = außerhalb + Gen.,
469,12,_____ meines Arbeitsbereichs kenne ich mich nicht so gut aus.,Außerhalb,Außerhalb meines Arbeitsbereichs kenne ich mich nicht so gut aus.,"Outside of my field of work, I am not very knowledgeable.",outside of = außerhalb + Gen.,
470,12,"Wir wohnen _____ des Stadtzentrums, aber die Verbindung ist gut.",außerhalb,"Wir wohnen außerhalb des Stadtzentrums, aber die Verbindung ist gut.","We live outside the city center, but the connection is good.",outside of = außerhalb + Gen.,
471,12,_____ der Schule treffe ich mich oft mit meinen Freunden.,Außerhalb,Außerhalb der Schule treffe ich mich oft mit meinen Freunden.,"Outside of school, I often meet up with my friends.",outside of = außerhalb + Gen.,
472,12,Wir fahren _____ den Tunnel.,durch,Wir fahren durch den Tunnel.,We drive through the tunnel.,"through, across = durch + Akk.",
473,12,Ich gehe _____ den Park.,durch,Ich gehe durch den Park.,I walk through the park.,"through, across = durch + Akk.",
474,12,Der Brief kam _____ die Post.,durch,Der Brief kam durch die Post.,The letter came by mail.,"through, across = durch + Akk.",
475,12,Der Fluss fliesst _____ die Stadt.,durch,Der Fluss fliesst durch die Stadt.,The river flows through the city.,"through, across = durch + Akk.",
476,12,Man sieht _____ das Fenster.,durch,Man sieht durch das Fenster.,One can see through the window.,"through, across = durch + Akk.",
477,12,Die Bank liegt _____ der Post.,gegenüber,Die Bank liegt gegenüber der Post.,The bank is located across from the post office.,"opposite of, across from = gegenüber + Dative",
478,12,Mein Haus steht direkt _____ dem Park.,gegenüber,Mein Haus steht direkt gegenüber dem Park.,My house is directly across from the park.,"opposite of, across from = gegenüber + Dative",
479,12,Die Post ist genau _____ dem Bäcker.,gegenüber,Die Post ist genau gegenüber dem Bäcker.,The post office is right across from the bakery.,"opposite of, across from = gegenüber + Dative",
480,12,_____ dem Fussballstadion hat es einen grossen Parkplatz.,Gegenüber,Gegenüber dem Fussballstadion hat es einen grossen Parkplatz.,There is a large parking lot across from the football stadium.,"opposite of, across from = gegenüber + Dative",
481,12,Sie sass mir im Café _____ und hat gelächelt.,gegenüber,Sie sass mir im Café gegenüber und hat gelächelt.,She sat across from me in the café and smiled.,"opposite of, across from = gegenüber + Dative",
482,12,_____ der Stadt gibt es viele historische Gebäude.,Innerhalb,Innerhalb der Stadt gibt es viele historische Gebäude.,"Within the city, there are many historical buildings.","inside of, within = innerhalb + Gen.",
483,12,Die Lieferung erfolgt _____ einer Woche.,innerhalb,Die Lieferung erfolgt innerhalb einer Woche.,The delivery will take place within a week.,"inside of, within = innerhalb + Gen.",
484,12,_____ des Unternehmens gab es viele Veränderungen.,Innerhalb,Innerhalb des Unternehmens gab es viele Veränderungen.,There have been many changes within the company.,"inside of, within = innerhalb + Gen.",
485,12,Bitte beantworten Sie die E-Mail _____ von 24 Stunden.,innerhalb,Bitte beantworten Sie die E-Mail innerhalb von 24 Stunden.,Please reply to the email within 24 hours.,"inside of, within = innerhalb + Gen.",
486,12,_____ der Schule gibt es strenge Regeln für die Nutzung von Handys.,Innerhalb,Innerhalb der Schule gibt es strenge Regeln für die Nutzung von Handys.,"Inside the school, there are strict rules for the use of mobile phones.","inside of, within = innerhalb + Gen.",
487,12,_____ der Zeitung wird das Wetter morgen sonnig.,Laut,Laut der Zeitung wird das Wetter morgen sonnig.,"According to the newspaper, the weather will be sunny tomorrow.",according to = laut + Gen.,
488,12,_____ des Lehrers müssen wir das Buch bis nächste Woche lesen.,Laut,Laut des Lehrers müssen wir das Buch bis nächste Woche lesen.,"According to the teacher, we have to read the book by next week.",according to = laut + Gen.,
489,12,_____ einer Studie trinken Deutsche viel Kaffee.,Laut,Laut einer Studie trinken Deutsche viel Kaffee.,"According to a study, Germans drink a lot of coffee.",according to = laut + Gen.,
490,12,_____ der Regeln ist das Rauchen hier verboten.,Laut,Laut der Regeln ist das Rauchen hier verboten.,"According to the rules, smoking is prohibited here.",according to = laut + Gen.,
491,12,_____ meines Freundes ist das Restaurant sehr gut.,Laut,Laut meines Freundes ist das Restaurant sehr gut.,"According to my friend, the restaurant is very good.",according to = laut + Gen.,
492,12,_____ des Regens gingen wir spazieren.,Trotz,Trotz des Regens gingen wir spazieren.,"Despite the rain, we went for a walk.","despite, regardless of = trotz + Gen.",
493,12,Er bestand die Prüfung _____ seiner Nervosität.,trotz,Er bestand die Prüfung trotz seiner Nervosität.,He passed the exam despite his nervousness.,"despite, regardless of = trotz + Gen.",
494,12,_____ des schlechten Wetters fand das Konzert draussen statt.,Trotz,Trotz des schlechten Wetters fand das Konzert draussen statt.,"Despite the bad weather, the concert took place outside.","despite, regardless of = trotz + Gen.",
495,12,"Sie kam pünktlich, _____ des Verkehrs.",trotz,"Sie kam pünktlich, trotz des Verkehrs.",She arrived on time despite the traffic.,"despite, regardless of = trotz + Gen.",
496,12,_____ seiner Müdigkeit arbeitete er bis spät in die Nacht.,Trotz,Trotz seiner Müdigkeit arbeitete er bis spät in die Nacht.,"Despite his fatigue, he worked late into the night.","despite, regardless of = trotz + Gen.",
497,12,_____ des Essens sollte man nicht telefonieren.,Während,Während des Essens sollte man nicht telefonieren.,"During the meal, one should not use the phone.","during, throughout, while = während + Gen.",
498,12,Er blieb ruhig _____ des gesamten Meetings.,während,Er blieb ruhig während des gesamten Meetings.,He stayed calm throughout the entire meeting.,"during, throughout, while = während + Gen.",
499,12,_____ des Sommers fahren viele Menschen in den Urlaub.,Während,Während des Sommers fahren viele Menschen in den Urlaub.,"During the summer, many people go on vacation.","during, throughout, while = während + Gen.",
500,12,Sie hat viel gelernt _____ ihres Studiums.,während,Sie hat viel gelernt während ihres Studiums.,She learned a lot during her studies.,"during, throughout, while = während + Gen.",
501,12,_____ der Nacht sind die Straßen oft leer.,Während,Während der Nacht sind die Straßen oft leer.,"During the night, the streets are often empty.","during, throughout, while = während + Gen.",
502,12,_____ des schlechten Wetters wurde das Spiel abgesagt.,Wegen,Wegen des schlechten Wetters wurde das Spiel abgesagt.,"Because of the bad weather, the game was canceled.","due to, because of = wegen + Gen.",
503,12,Er konnte nicht kommen _____ einer wichtigen Besprechung.,wegen,Er konnte nicht kommen wegen einer wichtigen Besprechung.,He couldn't come because of an important meeting.,"due to, because of = wegen + Gen.",
504,12,_____ des Verkehrs sind wir zu spät gekommen.,Wegen,Wegen des Verkehrs sind wir zu spät gekommen.,"Because of the traffic, we arrived late.","due to, because of = wegen + Gen.",
505,12,Sie war traurig _____ der schlechten Nachricht.,wegen,Sie war traurig wegen der schlechten Nachricht.,She was sad because of the bad news.,"due to, because of = wegen + Gen.",
506,12,_____ seines Fleisses hat er die Beförderung bekommen.,Wegen,Wegen seines Fleisses hat er die Beförderung bekommen.,"Because of his diligence, he got the promotion.","due to, because of = wegen + Gen.",
507,12,Einer aktuellen Studie _____ schlafen Jugendliche heutzutage weniger als früher.,zufolge,Einer aktuellen Studie zufolge schlafen Jugendliche heutzutage weniger als früher.,"According to a recent study, teenagers sleep less nowadays than in the past.",according to = Dat.+ zufolge,
508,12,Dem Bericht _____ wird die Wirtschaft im nächsten Jahr langsamer wachsen.,zufolge,Dem Bericht zufolge wird die Wirtschaft im nächsten Jahr langsamer wachsen.,"According to the report, the economy will grow more slowly next year.",according to = Dat.+ zufolge,
509,12,Den Experten _____ ist eine schnelle Lösung des Problems unwahrscheinlich.,zufolge,Den Experten zufolge ist eine schnelle Lösung des Problems unwahrscheinlich.,"According to experts, a quick solution to the problem is unlikely.",according to = Dat.+ zufolge,
510,12,Medienberichten _____ gab es mehrere Verletzte beim Unfall.,zufolge,Medienberichten zufolge gab es mehrere Verletzte beim Unfall.,"According to media reports, there were several injuries in the accident.",according to = Dat.+ zufolge,
511,12,Der Polizei _____ wurde der Verdächtige am frühen Morgen festgenommen.,zufolge,Der Polizei zufolge wurde der Verdächtige am frühen Morgen festgenommen.,"According to the police, the suspect was arrested early in the morning.",according to = Dat.+ zufolge,
512,13,Sie fühlte sich wohl _____ ihren Freunden.,unter,Sie fühlte sich wohl unter ihren Freunden.,She felt comfortable among her friends.,translation of <i>among</i> to describe an element as part of a group → unter + Dat.,
513,13,Er ist gern _____ Menschen.,unter,Er ist gern unter Menschen.,He likes to be among people.,translation of <i>among</i> to describe an element as part of a group → unter + Dat.,
514,13,_____ den Gästen war auch ein berühmter Schauspieler.,Unter,Unter den Gästen war auch ein berühmter Schauspieler.,Among the guests was also a famous actor.,translation of <i>among</i> to describe an element as part of a group → unter + Dat.,
515,13,_____ Freunden spricht man offen über alles.,Unter,Unter Freunden spricht man offen über alles.,"Among friends, people speak openly about everything.",translation of <i>among</i> to describe an element as part of a group → unter + Dat.,
516,13,Er fühlt sich _____ seinen Kollegen manchmal ausgeschlossen.,unter,Er fühlt sich unter seinen Kollegen manchmal ausgeschlossen.,He sometimes feels excluded among his colleagues.,translation of <i>among</i> to describe an element as part of a group → unter + Dat.,
517,13,_____ Kindern ist dieses Spiel sehr beliebt.,Bei,Bei Kindern ist dieses Spiel sehr beliebt.,This game is very popular among children.,"translation of <i>among</i> to describe a category or a context – <i>in the context of</i>, <i>in the case of</i>, <i>when it comes to</i> → bei + Dat.",
518,13,_____ Katzen ist dieses Verhalten normal.,Bei,Bei Katzen ist dieses Verhalten normal.,This behavior is normal among cats.,"translation of <i>among</i> to describe a category or a context – <i>in the context of</i>, <i>in the case of</i>, <i>when it comes to</i> → bei + Dat.",
519,13,_____ unseren Kunden kommt das neue Design gut an.,Bei,Bei unseren Kunden kommt das neue Design gut an.,The new design is well received among our customers.,"translation of <i>among</i> to describe a category or a context – <i>in the context of</i>, <i>in the case of</i>, <i>when it comes to</i> → bei + Dat.",
520,13,_____ Jugendlichen ist dieses Lied sehr beliebt.,Bei,Bei Jugendlichen ist dieses Lied sehr beliebt.,This song is very popular among teenagers.,"translation of <i>among</i> to describe a category or a context – <i>in the context of</i>, <i>in the case of</i>, <i>when it comes to</i> → bei + Dat.",
521,13,_____ vielen Menschen führt Stress zu Schlafstörungen.,Bei,Bei vielen Menschen führt Stress zu Schlafstörungen.,"Among many people, stress leads to sleep disturbances.","translation of <i>among</i> to describe a category or a context – <i>in the context of</i>, <i>in the case of</i>, <i>when it comes to</i> → bei + Dat.",
522,13,Wähle _____ den verschiedenen Optionen.,zwischen,Wähle zwischen den verschiedenen Optionen.,Choose among the different options.,translation of <i>among</i> in a context of defined options → zwischen + Dat.,
523,13,_____ den Schülern gibt es große Unterschiede.,Zwischen,Zwischen den Schülern gibt es große Unterschiede.,There are big differences among the students.,translation of <i>among</i> in a context of defined options → zwischen + Dat.,
524,13,_____ den Meinungen herrscht kein klarer Konsens.,Zwischen,Zwischen den Meinungen herrscht kein klarer Konsens.,There is no clear consensus among the opinions.,translation of <i>among</i> in a context of defined options → zwischen + Dat.,
525,13,Es gibt große Unterschiede _____ den Kulturen. ,zwischen,Es gibt große Unterschiede zwischen den Kulturen. ,There are big differences among the cultures.,translation of <i>among</i> in a context of defined options → zwischen + Dat.,
