Nr,exercise,question,answer,german,english,explanation,case
274,7,Das Kind läuft _____ den Eingang.,an,Das Kind läuft an den Eingang.,The child runs to the entrance.,to indicate a direction to the immediate vicinity of something → an + Akk.,
275,7,Sie setzt sich _____ Feuer.,ans,Sie setzt sich ans Feuer.,She sits down by the fire.,to indicate a direction to the immediate vicinity of something → an + Akk.,
276,7,Ich gehe _____ den Strand.,an,Ich gehe an den Strand.,I am going to the beach.,"to indicate a direction next to a body of water – Küste, Strand, Meer, See etc. → an + Akk.",
277,7,Wir fahren _____ die Nordsee.,an,Wir fahren an die Nordsee.,We are driving to the North Sea.,"to indicate a direction next to a body of water – Küste, Strand, Meer, See etc. → an + Akk.",
278,7,Die Touristen fahren _____ den See.,an,Die Touristen fahren an den See.,The tourists go to the lake.,"to indicate a direction next to a body of water – Küste, Strand, Meer, See etc. → an + Akk.",
279,7,"Er geht _____ Meer, um zu schwimmen.",ans,"Er geht ans Meer, um zu schwimmen.",He goes to the sea to swim.,"to indicate a direction next to a body of water – Küste, Strand, Meer, See etc. → an + Akk.",
280,7,Wir machen einen Spaziergang _____ den Fluss.,an,Wir machen einen Spaziergang an den Fluss.,We go for a walk to the river.,"to indicate a direction next to a body of water – Küste, Strand, Meer, See etc. → an + Akk.",
281,7,Wir fahren _____ die Insel,auf,Wir fahren auf die Insel.,We travel onto the island.,"to indicate a direction to open, flat or elevated spaces in nature → auf + Akk.",
282,7,Wir wandern _____ den Berg.,auf,Wir wandern auf den Berg.,We hike up the mountain.,"to indicate a direction to open, flat or elevated spaces in nature → auf + Akk.",
283,7,Die Kinder laufen _____ die Wiese.,auf,Die Kinder laufen auf die Wiese.,The children run to the meadow.,"to indicate a direction to open, flat or elevated spaces in nature → auf + Akk.",
284,7,"Er fährt _____ das Land, um Ruhe zu finden.",auf,"Er fährt auf das Land, um Ruhe zu finden.",He goes to the countryside to find peace and quiet.,"to indicate a direction to open, flat or elevated spaces in nature → auf + Akk.",
285,7,"Sie gehen _____ das Feld, um Gemüse zu ernten.",auf,"Sie gehen auf das Feld, um Gemüse zu ernten.",They go to the field to harvest vegetables.,"to indicate a direction to open, flat or elevated spaces in nature → auf + Akk.",
286,7,Wir gehen _____ den Marktplatz.,auf,Wir gehen auf den Marktplatz.,We go to the market square.,"to indicate a direction to open urban spaces – terraces, balconies, squares → auf + Akk.",
287,7,Sie läuft _____ den Spielplatz.,auf,Sie läuft auf den Spielplatz.,She runs to the playground.,"to indicate a direction to open urban spaces – terraces, balconies, squares → auf + Akk.",
288,7,"Ich gehe _____ die Terrasse, um frische Luft zu holen.",auf,"Ich gehe auf die Terrasse, um frische Luft zu holen.",I go out onto the terrace to get some fresh air.,"to indicate a direction to open urban spaces – terraces, balconies, squares → auf + Akk.",
289,7,Er tritt _____ den Balkon und schaut hinaus.,auf,Er tritt auf den Balkon und schaut hinaus.,He steps onto the balcony and looks out.,"to indicate a direction to open urban spaces – terraces, balconies, squares → auf + Akk.",
290,7,Die Kinder rennen _____ den Schulhof.,auf,Die Kinder rennen auf den Schulhof.,The children run into the schoolyard.,"to indicate a direction to open urban spaces – terraces, balconies, squares → auf + Akk.",
291,7,Das Kind springt _____ Meer.,ins,Das Kind springt ins Meer.,The child jumps into the sea.,to indicate a direction to a delimited space in nature → in + Akk.,
292,7,Wir gehen _____ den Wald spazieren.,in,Wir gehen in den Wald spazieren.,We go for a walk in the forest.,to indicate a direction to a delimited space in nature → in + Akk.,
293,7,Die Kinder laufen _____ den Park.,in,Die Kinder laufen in den Park.,The children run into the park.,to indicate a direction to a delimited space in nature → in + Akk.,
294,7,Der Vogel taucht _____ den See.,in,Der Vogel taucht in den See.,The bird is diving into the lake.,to indicate a direction to a delimited space in nature → in + Akk.,
295,7,Für seine Arbeit muss er _____ die Wildnis gehen.,in,Für seine Arbeit muss er in die Wildnis gehen.,"For his work, he needs to go in the wilderness.",to indicate a direction to a delimited space in nature → in + Akk.,
296,7,Wir fahren _____ die Schweiz.,in,Wir fahren in die Schweiz.,We go to Switzerland.,to indicate a direction to a country with an article → in + Akk.,
297,7,Er zieht _____ die Türkei.,in,Er zieht in die Türkei.,He moves to Turkey.,to indicate a direction to a country with an article → in + Akk.,
298,7,Ich reise _____ die USA.,in,Ich reise in die USA.,I'm traveling to the USA.,to indicate a direction to a country with an article → in + Akk.,
299,7,Sie fliegt _____ den Iran.,in,Sie fliegt in den Iran.,She flies to Iran.,to indicate a direction to a country with an article → in + Akk.,
300,7,"Wir gehen _____ den Sudan, um dort zu arbeiten.",in,"Wir gehen in den Sudan, um dort zu arbeiten.",We go to Sudan to work there.,to indicate a direction to a country with an article → in + Akk.,
301,7,Wir fahren _____ Deutschland.,nach,Wir fahren nach Deutschland.,We drive to Germany.,"to indicate a direction to a country, region or city with no article → nach + Dat.",
302,7,Sie fliegt _____ Berlin.,nach,Sie fliegt nach Berlin.,She's flying to Berlin.,"to indicate a direction to a country, region or city with no article → nach + Dat.",
303,7,Ich reise _____ Spanien.,nach,Ich reise nach Spanien.,I'm traveling to Spain.,"to indicate a direction to a country, region or city with no article → nach + Dat.",
304,7,Er zieht _____ Bayern.,nach,Er zieht nach Bayern.,He moves to Bavaria.,"to indicate a direction to a country, region or city with no article → nach + Dat.",
305,7,Die Familie fliegt _____ Rom.,nach,Die Familie fliegt nach Rom.,The family flies to Rome.,"to indicate a direction to a country, region or city with no article → nach + Dat.",
306,7,Ich gehe jetzt _____ Hause.,nach,Ich gehe jetzt nach Hause.,I'm going home now.,"to indicate a direction to home in combination with ""Hause"" → nach + Dat.",
307,7,Wir fahren spät _____ Hause.,nach,Wir fahren spät nach Hause.,We're going home late.,"to indicate a direction to home in combination with ""Hause"" → nach + Dat.",
308,7,Er kommt um 18 Uhr _____ Hause.,nach,Er kommt um 18 Uhr nach Hause.,He comes home at 6 pm.,"to indicate a direction to home in combination with ""Hause"" → nach + Dat.",
309,7,Sie will sofort _____ Hause gehen.,nach,Sie will sofort nach Hause gehen.,She wants to go home straight away.,"to indicate a direction to home in combination with ""Hause"" → nach + Dat.",
310,7,Nach der Arbeit gehe ich direkt _____ Hause.,nach,Nach der Arbeit gehe ich direkt nach Hause.,I'm going straight home after work.,"to indicate a direction to home in combination with ""Hause"" → nach + Dat.",
311,7,Ich gehe _____ Arzt.,zum,Ich gehe zum Arzt.,I'm going to the doctor.,"to indicate a direction to a place involving other people – a shop, an institution, an event → zu + Dat.",
312,7,Wir fahren _____ Schule.,zur,Wir fahren zur Schule.,We drive to school.,"to indicate a direction to a place involving other people – a shop, an institution, an event → zu + Dat.",
313,7,Er geht _____ Arbeit.,zur,Er geht zur Arbeit.,He goes to work.,"to indicate a direction to a place involving other people – a shop, an institution, an event → zu + Dat.",
314,7,Ich bringe das Paket _____ Post.,zur,Ich bringe das Paket zur Post.,I am taking the package to the post office.,"to indicate a direction to a place involving other people – a shop, an institution, an event → zu + Dat.",
315,7,Die Kinder laufen _____ Supermarkt.,zum,Die Kinder laufen zum Supermarkt.,The children run to the supermarket.,"to indicate a direction to a place involving other people – a shop, an institution, an event → zu + Dat.",
316,7,Ich gehe _____ zur Ecke.,bis,Ich gehe bis zur Ecke.,I walk up to the corner.,to indicate a direction up to a certain place → bis + Akk.,
317,7,Fahr _____ zur nächsten Haltestelle.,bis,Fahr bis zur nächsten Haltestelle.,Ride until the next stop.,to indicate a direction up to a certain place → bis + Akk.,
318,7,Wir laufen _____ zum Park.,bis,Wir laufen bis zum Park.,We’re walking as far as the park.,to indicate a direction up to a certain place → bis + Akk.,
319,7,Der Zug fährt _____ nach München.,bis,Der Zug fährt bis nach München.,The train goes as far as Munich.,to indicate a direction up to a certain place → bis + Akk.,
320,7,Geh _____ zur Ampel und dann links.,bis,Geh bis zur Ampel und dann links.,Go up to the traffic light and then left.,to indicate a direction up to a certain place → bis + Akk.,
321,7,Sie trinkt _____ einer Tasse.,aus,Sie trinkt aus einer Tasse.,She drinks from a cup.,"to indicate an origin, from an enclosed place → aus + Dat.",
322,7,Das Wasser kommt _____ der Flasche.,aus,Das Wasser kommt aus der Flasche.,The water comes out of the bottle.,"to indicate an origin, from an enclosed place → aus + Dat.",
323,7,Er geht _____ dem Haus.,aus,Er geht aus dem Haus.,He goes out of the house.,"to indicate an origin, from an enclosed place → aus + Dat.",
324,7,Ich nehme das Buch _____ dem Regal.,aus,Ich nehme das Buch aus dem Regal.,I take the book from the shelf.,"to indicate an origin, from an enclosed place → aus + Dat.",
325,7,Sie steigt _____ dem Bus.,aus,Sie steigt aus dem Bus.,She gets out of the bus.,"to indicate an origin, from an enclosed place → aus + Dat.",
326,7,Ich komme gerade _____ der Arbeit.,von,Ich komme gerade von der Arbeit.,I just came from work.,"to indicate an origin, typically from an institution or a place where ""in"" cannot be used → von + Dat.",
327,7,Er fährt _____ der Schule nach Hause.,von,Er fährt von der Schule nach Hause.,He is driving home from school.,"to indicate an origin, typically from an institution or a place where ""in"" cannot be used → von + Dat.",
328,7,Wir kommen _____ einer langen Reise.,von,Wir kommen von einer langen Reise.,We are coming from a long trip.,"to indicate an origin, typically from an institution or a place where ""in"" cannot be used → von + Dat.",
329,7,Sie kommt gerade _____ ihren Großeltern.,von,Sie kommt gerade von ihren Großeltern.,She has just come from her grandparents' house.,"to indicate an origin, typically from an institution or a place where ""in"" cannot be used → von + Dat.",
330,7,Der Zug fährt _____ Hamburg nach München.,von,Der Zug fährt von Hamburg nach München.,The train is traveling from Hamburg to Munich.,"to indicate an origin, typically from an institution or a place where ""in"" cannot be used → von + Dat.",
331,8,Das kostet fünf Euro _____ Person.,pro,Das kostet fünf Euro pro Person.,That costs five euros per person.,to indicate the basic unit when dividing a quantity → pro + Akk.,
332,8,Es regnet 2 mm _____ Quadratmeter.,pro,Es regnet 2 mm pro Quadratmeter.,It is raining 2 mm per square meter.,to indicate the basic unit when dividing a quantity → pro + Akk.,
333,8,Bananen kosten vier Euro _____ Kilo.,pro,Bananen kosten vier Euro pro Kilo.,Bananas cost four euros per kilo.,to indicate the basic unit when dividing a quantity → pro + Akk.,
334,8,"Ein Bier _____ Person, bitte!",pro,"Ein Bier pro Person, bitte!","One beer per person, please!",to indicate the basic unit when dividing a quantity → pro + Akk.,
335,8,Es gab 1.000 Mark Belohnung _____ Kopf.,pro,Es gab 1.000 Mark Belohnung pro Kopf.,"There was a reward of 1,000 marks per person.",to indicate the basic unit when dividing a quantity → pro + Akk.,
336,8,Der Film ist _____ Deutsch.,auf,Der Film ist auf Deutsch.,The movie is in German.,to indicate a language → auf,
337,8,Können Sie das bitte _____ Englisch sagen?,auf,Können Sie das bitte auf Englisch sagen?,Can you please say that in English?,to indicate a language → auf,
338,8,Wir schreiben den Brief _____ Französisch.,auf,Wir schreiben den Brief auf Französisch.,We are writing the letter in French.,to indicate a language → auf,
339,8,Die Präsentation war _____ Spanisch.,auf,Die Präsentation war auf Spanisch.,The presentation was in Spanish.,to indicate a language → auf,
340,8,Ich habe das Buch _____ Italienisch gelesen.,auf,Ich habe das Buch auf Italienisch gelesen.,I read the book in Italian.,to indicate a language → auf,
341,8,Ich gehe _____ Fuss.,zu,Ich gehe zu Fuss.,I go on foot.,to indicate the mode of locomotion on foot → zu + Dat.,
342,8,Ich gehe jeden Tag _____ Fuß zur Arbeit.,zu,Ich gehe jeden Tag zu Fuß zur Arbeit.,I walk to work every day.,to indicate the mode of locomotion on foot → zu + Dat.,
343,8,"Ich gehe jeden Morgen _____ Fuß zur Arbeit, weil das Wetter schön ist.",zu,"Ich gehe jeden Morgen zu Fuß zur Arbeit, weil das Wetter schön ist.",I go to work every morning because the weather is beautiful.,to indicate the mode of locomotion on foot → zu + Dat.,
344,8,Wir sind gestern _____ Fuß in die Stadt gegangen und haben ein Eis gegessen.,zu,Wir sind gestern zu Fuß in die Stadt gegangen und haben ein Eis gegessen.,We walked into the city yesterday and ate ice cream.,to indicate the mode of locomotion on foot → zu + Dat.,
345,8,Die Kinder gehen _____ Fuß zur Schule.,zu,Die Kinder gehen zu Fuß zur Schule.,The children walk to school.,to indicate the mode of locomotion on foot → zu + Dat.,
346,8,Das kostet zwischen 50 _____ 60 Euro.,bis,Das kostet zwischen 50 bis 60 Euro.,That costs between 50 to 60 euros.,to indicate an upper limit → bis + Akk.,
347,8,Wir erwarten 20 _____ 30 Teilnehmer.,bis,Wir erwarten 20 bis 30 Teilnehmer.,We’re expecting 20 to 30 participants.,to indicate an upper limit → bis + Akk.,
348,8,Die Fahrt dauert etwa zwei _____ drei Stunden.,bis,Die Fahrt dauert etwa zwei bis drei Stunden.,The trip takes about two to three hours.,to indicate an upper limit → bis + Akk.,
349,8,Wir sind gestern 20 _____ 25 Kilometer gelaufen.,bis,Wir sind gestern 20 bis 25 Kilometer gelaufen.,We ran 20 to 25 kilometers yesterday.,to indicate an upper limit → bis + Akk.,
350,8,Die Temperaturen liegen bei 15 _____ 20 Grad.,bis,Die Temperaturen liegen bei 15 bis 20 Grad.,Temperatures are between 15 and 20 degrees.,to indicate an upper limit → bis + Akk.,
351,8,Ich fahre jeden Morgen _____ dem Bus zur Arbeit.,mit,Ich fahre jeden Morgen mit dem Bus zur Arbeit.,I take the bus to work every morning.,to indicate a mode of locomotion using a vehicle -> mit + Dat.,
352,8,Wir reisen im Sommer _____ dem Zug nach Italien.,mit,Wir reisen im Sommer mit dem Zug nach Italien.,We travel to Italy by train in the summer.,to indicate a mode of locomotion using a vehicle -> mit + Dat.,
353,8,Mein Vater fährt gerne _____ dem Auto in die Berge.,mit,Mein Vater fährt gerne mit dem Auto in die Berge.,My father likes to go to the mountains by car.,to indicate a mode of locomotion using a vehicle -> mit + Dat.,
354,8,Die Touristen fahren _____ dem Schiff auf dem Rhein.,mit,Die Touristen fahren mit dem Schiff auf dem Rhein.,The tourists travel by boat on the Rhine.,to indicate a mode of locomotion using a vehicle -> mit + Dat.,
355,8,Morgen fliegen wir _____ dem Flugzeug nach Spanien.,mit,Morgen fliegen wir mit dem Flugzeug nach Spanien.,Tomorrow we are flying to Spain.,to indicate a mode of locomotion using a vehicle -> mit + Dat.,
356,9,_____ fünf Jahren lernte er lesen.,Mit,Mit fünf Jahren lernte er lesen.,He learned to read at the age of five.,to indicate an age → mit + Dat.,
357,9,"Sie fing _____ sechs Jahren an, Klavier zu spielen.",mit,"Sie fing mit sechs Jahren an, Klavier zu spielen.",She started playing the piano at six years old.,to indicate an age → mit + Dat.,
358,9,_____ zehn Jahren zog er mit seiner Familie um.,Mit,Mit zehn Jahren zog er mit seiner Familie um.,"At the age of ten, he moved with his family.",to indicate an age → mit + Dat.,
359,9,Ich habe _____ acht Jahren mein erstes Buch geschrieben.,mit,Ich habe mit acht Jahren mein erstes Buch geschrieben.,I wrote my first book at the age of eight.,to indicate an age → mit + Dat.,
360,9,_____ zwölf Jahren durfte sie zum ersten Mal allein reisen.,Mit,Mit zwölf Jahren durfte sie zum ersten Mal allein reisen.,"At twelve, she was allowed to travel alone for the first time.",to indicate an age → mit + Dat.,
361,9,_____ Frühstück esse ich meistens Brot mit Marmelade.,Zum,Zum Frühstück esse ich meistens Brot mit Marmelade.,"For breakfast, I usually eat bread with jam.","to indicate an occasion such as a meal, a celebration or an event → zu + Dat.",
362,9,Was gibt es _____ Mittagessen?,zum,Was gibt es zum Mittagessen?,What’s for lunch?,"to indicate an occasion such as a meal, a celebration or an event → zu + Dat.",
363,9,Ich habe ihm ein Buch _____ Geburtstag geschenkt.,zum,Ich habe ihm ein Buch zum Geburtstag geschenkt.,I gave him a book for his birthday.,"to indicate an occasion such as a meal, a celebration or an event → zu + Dat.",
364,9,Wir tragen elegante Kleidung _____ Hochzeit meiner Schwester.,zur,Wir tragen elegante Kleidung zur Hochzeit meiner Schwester.,We’re wearing elegant clothes for my sister’s wedding.,"to indicate an occasion such as a meal, a celebration or an event → zu + Dat.",
365,9,Sie haben eine große Party _____ Jubiläum organisiert.,zum,Sie haben eine große Party zum Jubiläum organisiert.,They organized a big party for the anniversary.,"to indicate an occasion such as a meal, a celebration or an event → zu + Dat.",
366,9,Wir haben uns _____ der Party kennengelernt.,auf,Wir haben uns auf der Party kennengelernt.,We met at the party.,to indicate a presence or participation to an event → auf + Dat.,
367,9,Sie hat _____ dem Konzert laut mitgesungen.,auf,Sie hat auf dem Konzert laut mitgesungen.,She sang along loudly at the concert.,to indicate a presence or participation to an event → auf + Dat.,
368,9,"Ich war gestern _____ dem Ball, aber es hat mir nicht gefallen.",auf,"Ich war gestern auf dem Ball, aber es hat mir nicht gefallen.",I was at the ball yesterday but I didn't like it.,to indicate a presence or participation to an event → auf + Dat.,
369,9,Er hat _____ der Hochzeit seiner Schwester getanzt.,auf,Er hat auf der Hochzeit seiner Schwester getanzt.,He danced at his sister's wedding.,to indicate a presence or participation to an event → auf + Dat.,
370,9,_____ dem Fest gab es viele interessante Spiele für Kinder.,Auf,Auf dem Fest gab es viele interessante Spiele für Kinder.,"At the festival, there were many fun games for children.",to indicate a presence or participation to an event → auf + Dat.,
371,9,Er studiert _____ der Technischen Universität München Maschinenbau.,an,Er studiert an der Technischen Universität München Maschinenbau.,He is studying mechanical engineering at the Technical University of Munich.,to indicate a participation to an educational or cultural institution → an + Dat.,
372,9,Sie unterrichtet seit fünf Jahren Deutsch _____ einer Sprachschule.,an,Sie unterrichtet seit fünf Jahren Deutsch an einer Sprachschule.,She has been teaching German at a language school for five years.,to indicate a participation to an educational or cultural institution → an + Dat.,
373,9,Nach dem Abschluss bekam er eine Stelle _____ einem renommierten Theater.,an,Nach dem Abschluss bekam er eine Stelle an einem renommierten Theater.,"After graduating, he got a job at a renowned theater.",to indicate a participation to an educational or cultural institution → an + Dat.,
374,9,Ich habe ein Auslandssemester _____ einer Universität in Spanien gemacht.,an,Ich habe ein Auslandssemester an einer Universität in Spanien gemacht.,I spent a semester abroad at a university in Spain.,to indicate a participation to an educational or cultural institution → an + Dat.,
375,9,Viele berühmte Musiker haben _____ dieser Musikhochschule studiert.,an,Viele berühmte Musiker haben an dieser Musikhochschule studiert.,Many famous musicians have studied at this university.,to indicate a participation to an educational or cultural institution → an + Dat.,
376,9,Wir sind _____ Frankfurt nach München geflogen.,über,Wir sind über Frankfurt nach München geflogen.,We flew to Munich via Frankfurt.,"to indicate a movement through, <i>via</i> a place toward a destination → über + Akk.",
377,9,Der Zug fährt _____ Köln nach Brüssel.,über,Der Zug fährt über Köln nach Brüssel.,The train goes to Brussels via Cologne.,"to indicate a movement through, <i>via</i> a place toward a destination → über + Akk.",
378,9,Sie sind _____ die Alpen nach Italien gereist.,über,Sie sind über die Alpen nach Italien gereist.,They traveled to Italy via the Alps.,"to indicate a movement through, <i>via</i> a place toward a destination → über + Akk.",
379,9,Er kam _____ die Schweiz nach Frankreich.,über,Er kam über die Schweiz nach Frankreich.,He came to France via Switzerland.,"to indicate a movement through, <i>via</i> a place toward a destination → über + Akk.",
380,9,Wir fahren _____ die Autobahn A9 nach Leipzig.,über,Wir fahren über die Autobahn A9 nach Leipzig.,We're driving to Leipzig via the A9 motorway.,"to indicate a movement through, <i>via</i> a place toward a destination → über + Akk.",
381,9,_____ Notfall rufen Sie bitte sofort den Rettungsdienst.,Im,Im Notfall rufen Sie bitte sofort den Rettungsdienst.,"In case of emergency, please call emergency services immediately.",before words in Fall → in + Dat.,
382,9,_____ Zweifelsfall entscheiden wir uns für die sicherere Option.,Im,Im Zweifelsfall entscheiden wir uns für die sicherere Option.,"In case of doubt, we’ll choose the safer option.",before words in Fall → in + Dat.,
383,9,_____ Ernstfall muss schnell gehandelt werden.,Im,Im Ernstfall muss schnell gehandelt werden.,"In a serious situation, quick action is required.",before words in Fall → in + Dat.,
384,9,_____ Idealfall ist das Projekt in drei Monaten abgeschlossen.,Im,Im Idealfall ist das Projekt in drei Monaten abgeschlossen.,"Ideally, the project will be completed in three months.",before words in Fall → in + Dat.,
385,9,_____ Extremfall können ganze Dörfer evakuiert werden.,Im,Im Extremfall können ganze Dörfer evakuiert werden.,"In extreme cases, entire villages may be evacuated.",before words in Fall → in + Dat.,
386,9,_____ acht Uhr bin ich aufgestanden.,Gegen,Gegen acht Uhr bin ich aufgestanden.,I got up around eight o’clock.,"to indicate a non-precise time of the day – <i>around</i>, <i>towards</i> → gegen + Akk.",
387,9,Wir essen meistens _____ 19 Uhr zu Abend.,gegen,Wir essen meistens gegen 19 Uhr zu Abend.,We usually have dinner around 7 p.m.,"to indicate a non-precise time of the day – <i>around</i>, <i>towards</i> → gegen + Akk.",
388,9,_____ Mittag wurde das Wetter besser.,Gegen,Gegen Mittag wurde das Wetter besser.,The weather improved around noon.,"to indicate a non-precise time of the day – <i>around</i>, <i>towards</i> → gegen + Akk.",
389,9,Er kam _____ zehn nach Hause.,gegen,Er kam gegen zehn nach Hause.,He came home around ten.,"to indicate a non-precise time of the day – <i>around</i>, <i>towards</i> → gegen + Akk.",
390,9,_____ Mitternacht hörte die Musik endlich auf.,Gegen,Gegen Mitternacht hörte die Musik endlich auf.,The music finally stopped around midnight.,"to indicate a non-precise time of the day – <i>around</i>, <i>towards</i> → gegen + Akk.",
391,9,Wir fahren morgen _____ Süden ans Meer.,nach,Wir fahren morgen nach Süden ans Meer.,We’re driving south to the sea tomorrow.,"to indicate a general direction such as Norden, oben, rechts etc. → nach + Dat.",
392,9,"Er schaute kurz _____ oben, als er das Flugzeug hörte.",nach,"Er schaute kurz nach oben, als er das Flugzeug hörte.",He looked up briefly when he heard the plane.,"to indicate a general direction such as Norden, oben, rechts etc. → nach + Dat.",
393,9,Die Katze sprang plötzlich _____ unten vom Balkon.,nach,Die Katze sprang plötzlich nach unten vom Balkon.,The cat suddenly jumped down from the balcony.,"to indicate a general direction such as Norden, oben, rechts etc. → nach + Dat.",
394,9,An der Kreuzung musst du _____ rechts abbiegen.,nach,An der Kreuzung musst du nach rechts abbiegen.,"At the intersection, you have to turn right.","to indicate a general direction such as Norden, oben, rechts etc. → nach + Dat.",
395,9,"Sie drehte sich _____ links, um den Lautsprecher besser zu hören.",nach,"Sie drehte sich nach links, um den Lautsprecher besser zu hören.",She turned left to hear the loudspeaker better.,"to indicate a general direction such as Norden, oben, rechts etc. → nach + Dat.",
396,10,_____ dem Wetterbericht soll es morgen regnen.,Nach,Nach dem Wetterbericht soll es morgen regnen.,"According to the weather report, it’s supposed to rain tomorrow.",translation of <i>according to</i> → nach + Dat.,
397,10,_____ Meinung der Lehrerin war der Test nicht schwer.,Nach,Nach Meinung der Lehrerin war der Test nicht schwer.,"According to the teacher’s opinion, the test wasn’t hard.",translation of <i>according to</i> → nach + Dat.,
398,10,_____ dem Plan beginnt der Kurs um neun Uhr.,Nach,Nach dem Plan beginnt der Kurs um neun Uhr.,"According to the schedule, the course starts at nine.",translation of <i>according to</i> → nach + Dat.,
399,10,_____ Experten ist das eine gute Lösung.,Nach,Nach Experten ist das eine gute Lösung.,"According to experts, that’s a good solution.",translation of <i>according to</i> → nach + Dat.,
400,10,_____ dem Gesetz ist das verboten.,Nach,Nach dem Gesetz ist das verboten.,"According to the law, that is forbidden.",translation of <i>according to</i> → nach + Dat.,
