Nr,exercise,question,answer,german,english,french,ich,du,er/sie/es,wir,ihr,Sie
1,1,sein,,,to be,être,wäre,wärest,wäre,wären,wäret,wären
2,1,haben,,,"to have, to contain","avoir, contenir",hätte,hättest,hätte,hätten,hättet,hätten
3,1,werden,,,"to become, will, to be done (passive voice)",devenir,würde,würdest,würde,würden,würdet,würden
4,1,können,,,"can, to be able to","pouvoir, être capable de",könnte,könntest,könnte,könnten,könntet,könnten
5,1,müssen,,,"must, to have to, to be obliged (to do something)","devoir, être obligé (de faire quelque chose)",müsste,müsstest,müsste,müssten,müsstet,müssten
6,1,mögen,,,to like,"aimer, apprécier",möchte,möchtest,möchte,möchten,möchtet,möchten
7,1,dürfen,,,"to be allowed (to do something), may","être autorisé (à faire quelque chose), peut",dürfte,dürftest,dürfte,dürften,dürftet,dürften