Nr,exercise,question,answer,english,french
617,30,graben,gegraben,"to dig, to excavate, to delve","creuser, fouiller, excaver"
618,31,zurückgehen,zurückgegangen,"to go back, to decrease, to decline","revenir en arrière, diminuer, décliner"
619,31,aufmachen,aufgemacht,"to open (coll.), to head or move off (refl.), to undo something","ouvrir (familier), se diriger ou s'éloigner (réfl.), défaire quelque chose"
620,31,beteiligen,beteiligt,"to participate, to be involved, to take part","participer, être impliqué, prendre part"
621,31,verfügen,verfügt,"to have at one’s disposal (formal), to possess, to control","avoir à sa disposition (formel), posséder, contrôler"
622,31,benötigen,benötigt,"to need, to require (formal)","avoir besoin, exiger"
623,31,drucken,gedruckt,to print,imprimer
624,31,erledigen,erledigt,"to handle, to deal with, to get done","gérer, traiter, faire avancer les choses"
625,31,entlassen,entlassen,"to dismiss, to fire, to release","congédier, licencier, libérer"
626,31,verschieben,verschoben,"to postpone, to move, to shift","reporter, déplacer, décaler"
627,31,ergeben,ergeben,"to result in, to yield, to surrender","aboutir à, céder, se rendre"
628,31,leiten,geleitet,"to lead, to manage, to conduct","diriger, gérer, conduire"
629,31,handeln,gehandelt,"to act, to deal, to trade, to negotiate","agir, traiter, commercer, négocier"
630,31,schalten,geschaltet,"to switch, to shift gears, to turn on, to turn off","changer, changer de vitesse, allumer, éteindre"
631,31,prüfen,geprüft,"to check, to examine, to test, to investigate","vérifier, examiner, tester, enquêter"
632,31,untersuchen,untersucht,"to investigate, to examine, to analyze","enquêter, examiner, analyser"
633,31,auswirken,ausgewirkt,"to affect, to have an impact","affecter, avoir un impact"
634,31,unternehmen,unternommen,"to undertake, to attempt, to take action","entreprendre, tenter, agir"
635,31,präsentieren,präsentiert,"to present, to showcase","présenter, mettre en valeur"
636,31,einrichten,eingerichtet,"to set up, to furnish, to arrange","installer, meubler, aménager"
637,31,anerkennen,anerkannt,"to recognize, to acknowledge, to approve","reconnaître, admettre, approuver"
638,32,verwalten,verwaltet,"to manage, to administer","gérer, administrer"
639,32,leisten,geleistet,"to achieve, to perform, to provide","réaliser, réaliser, fournir"
640,32,einführen,eingeführt,"to introduce, to implement, to import","introduire, mettre en œuvre, importer"
641,32,beitragen,beigetragen,to contribute,contribuer
642,32,behandeln,behandelt,"to treat, to handle, to deal with","traiter, manipuler, faire face à"
643,32,erzeugen,erzeugt,"to generate, to produce, to create","générer, produire, créer"
644,32,produzieren,produziert,"to produce, to manufacture","produire, fabriquer"
645,32,berechnen,berechnet,"to calculate, to charge","calculer, facturer"
646,32,fressen,gefressen,"to devour, to eat (animals), to gobble","dévorer, manger (des animaux), engloutir"
647,32,analysieren,analysiert,to analyze,analyser
648,32,fördern,gefördert,"to promote, to support","promouvoir, soutenir"
649,32,werben,geworben,"to advertise, to recruit","faire de la publicité, recruter"
650,32,beeinflussen,beeinflusst,"to influence, to affect","influencer, affecter"
651,32,zulassen,zugelassen,"to allow, to permit, to license","permettre, autoriser, autoriser"
652,32,erfolgen,erfolgt,"to occur, to take place","se produire, avoir lieu"
653,32,reichen,gereicht,"to reach, to hand, to be enough","atteindre, mettre la main, être suffisant"
654,32,regeln,geregelt,"to regulate, to control, to settle","réguler, contrôler, régler"
655,32,ordnen,geordnet,"to arrange, to organize, to classify","arranger, organiser, classer"
656,32,zielen,gezielt,"to aim, to target, to focus on","viser, cibler, se concentrer sur"
657,32,leihen,geliehen,"to lend, to borrow","prêter, emprunter"
658,33,investieren,investiert,to invest,investir
659,33,fordern,gefordert,"to demand, to require, to call for","exiger, requérir, réclamer"
660,33,füllen,gefüllt,"to fill, to stuff","remplir, farcir"
661,33,stärken,gestärkt,"to strengthen, to reinforce","renforcer, consolider"
662,33,verlängern,verlängert,"to extend, to prolong","étendre, prolonger"
663,33,bezeichnen,bezeichnet,"to designate, to label, to describe","désigner, étiqueter, décrire"
664,33,schreiten,geschritten,"to stride, to proceed, to step (formal)","marcher à grands pas, avancer, faire un pas (formel)"
665,33,binden,gebunden,"to tie, to bind, to attach","attacher, lier"
666,33,gießen,gegossen,"to pour, to water (plants), to cast (metal)","verser, arroser (des plantes), couler (du métal)"
667,33,lehren,gelehrt,"to teach, to instruct","enseigner, instruire"
668,33,übernachten,übernachtet,"to stay overnight, to spend the night",passer la nuit
669,33,schießen,geschossen,"to shoot, to fire","tirer, faire feu"
670,33,verraten,verraten,"to betray, to reveal","trahir, révéler"
671,33,fassen,gefasst,"to grasp, to seize, to capture, to comprehend","saisir, capturer, comprendre"
672,33,wenden,gewendet,"to turn, to reverse, to address","tourner, inverser, s'adresser"
673,33,erteilen,erteilt,"to grant, to issue, to give","accorder, délivrer, donner"
674,33,beachten,beachtet,"to notice, to pay attention to, to observe","remarquer, prêter attention à, observer"
675,33,belegen,belegt,"to prove, to occupy, to substantiate","prouver, occuper, étayer"
676,33,feststellen,festgestellt,"to determine, to ascertain, to notice","déterminer, constater, remarquer"
677,33,rücken,gerückt,"to move, to shift, to edge","déplacer, décaler, border"
678,34,landen,gelandet,"to land, to end up","atterrir, finir"
679,34,auftreten,aufgetreten,"to appear, to occur, to perform","apparaître, se produire, accomplir"
680,34,vergeben,vergeben,"to forgive, to award, to assign","pardonner, récompenser, attribuer"
681,34,begleiten,begleitet,"to accompany, to escort","accompagner, escorter"
682,34,umgehen,umgangen,"to handle, to deal with, to avoid","gérer, faire face à, éviter"
683,34,profitieren,profitiert,"to benefit, to profit","bénéficier, profiter"
684,34,ablehnen,abgelehnt,"to refuse, to reject, to decline","refuser, rejeter, décliner"
685,34,angeben,angegeben,"to state, to declare, to show off","déclarer, affirmer, se vanter"
686,34,abhängen,abgehangen,"to depend on, to hang out (coll.)","dépendre de, fréquenter (coll.)"
687,34,retten,gerettet,"to save, to rescue","sauver, secourir"
688,34,erwerben,erworben,"to acquire, to purchase, to gain","acquérir, acheter, gagner"
689,34,anpassen,angepasst,"to adapt, to adjust","s'adapter, ajuster"
690,34,verleihen,verliehen,"to award, to grant, to lend","attribuer, accorder, prêter"
691,34,anzeigen,angezeigt,"to report, to indicate, to display","signaler, indiquer, afficher"
692,34,betonen,betont,"to emphasize, to stress","souligner, insister"
693,34,ausführen,ausgeführt,"to carry out, to execute, to perform","réaliser, exécuter, accomplir"
694,34,bedienen,bedient,"to serve, to operate, to use","servir, opérer, utiliser"
695,34,durchführen,durchgeführt,"to carry out, to conduct, to implement","réaliser, mener, mettre en œuvre"
696,34,eignen,geeignet,"to be suitable, to be appropriate","être convenable, être approprié"
697,34,festlegen,festgelegt,"to define, to determine, to set","définir, déterminer, établir"
698,35,fließen,geflossen,"to flow, to run","couler, courir"
699,35,gelangen,gelangt,"to reach, to arrive","atteindre, arriver"
700,35,gestalten,gestaltet,"to shape, to design, to organize","façonner, concevoir, organiser"
701,35,eröffnen,eröffnet,"to open, to inaugurate","ouvrir, inaugurer"
702,35,gewährleisten,gewährleistet,"to ensure, to guarantee","assurer, garantir"
703,35,integrieren,integriert,"to integrate, to incorporate","intégrer, incorporer"
704,35,löschen,gelöscht,"to delete, to extinguish, to erase","supprimer, éteindre, effacer"
705,35,speichern,gespeichert,"to save, to store","sauvegarder, stocker"
706,35,steigern,gesteigert,"to increase, to boost, to enhance","augmenter, stimuler, améliorer"
707,35,steuern,gesteuert,"to steer, to control, to govern","diriger, contrôler, gouverner"
708,35,umsetzen,umgesetzt,"to implement, to apply, to put into practice","mettre en œuvre, appliquer, mettre en pratique"
709,35,unterscheiden,unterschieden,"to distinguish, to differentiate","distinguer, différencier"
710,35,verfolgen,verfolgt,"to pursue, to track, to follow, to prosecute","poursuivre, pister, suivre"
711,35,weisen,gewiesen,"to point, to direct, to indicate","pointer, diriger, indiquer"
712,35,widmen,gewidmet,"to dedicate, to devote",consacrer
713,35,betreiben,betrieben,"to operate, to run, to conduct","opérer, diriger, conduire"
714,35,errichten,errichtet,"to build, to erect, to establish","construire, ériger, établir"
715,35,unterhalten,unterhalten,"to entertain, to maintain, to support, to convert","divertir, entretenir, soutenir, convertir"
716,35,telefonieren,telefoniert,to talk on the phone,parler au téléphone
717,35,reiten,geritten,to ride (a horse),monter à cheval
718,36,schweigen,geschwiegen,"to be silent, to say nothing","se taire, ne rien dire"
719,36,verabschieden,verabschiedet,"to say goodbye, to bid farewell, to adopt (a law formally)","dire au revoir, faire ses adieux"
720,36,anschließen,angeschlossen,"to join, to attach, to affiliate, to connect","rejoindre, attacher, s'affilier, se connecter"
721,36,aussteigen,ausgestiegen,"to exit, to get off","sortir, descendre"
722,36,einsteigen,eingestiegen,"to enter, to get in, to board","entrer, monter à bord, embarquer"
723,36,ausfüllen,ausgefüllt,"to complete, to fill in, to fill out","compléter, remplir"
724,36,ausgeben,ausgegeben,"to spend, to expend, to issue","dépenser, émettre"
725,36,nicken,genickt,to nod,hocher la tête
726,36,verlangen,verlangt,"to demand, to request","exiger, requérir"
727,36,behaupten,behauptet,"to claim, to assert, to maintain","revendiquer, affirmer, maintenir"
728,36,stoppen,gestoppt,to stop a movement (vehicle or person),arrêter un mouvement (véhicule ou personne)
729,36,zuhören,zugehört,to listen to someone (with dative),écouter quelqu'un
730,36,ausrichten,ausgerichtet,"to align, to arrange, to organize","aligner, arranger, organiser"
731,36,wiegen,gewogen,"to weight, to balance",peser
732,36,austauschen,ausgetauscht,"to exchange, to replace, to swap","échanger, remplacer, permuter"
733,36,einziehen,eingezogen,"to move in, to penetrate, to infiltrate","s'introduire, pénétrer, s'infiltrer"
734,36,zusammenfassen,zusammengefasst,"to summarize, to condense, to abstract","résumer, condenser, abstraire"
735,36,erschrecken,erschrocken,"to be frightened, to frighten","avoir peur, effrayer"
736,36,markieren,markiert,"to mark, to highlight","marquer, mettre en valeur"
737,36,begegnen,begegnet,"to encounter (with dative), to meet","rencontrer, se rencontrer"
738,37,wagen,gewagt,"to venture, to dare, to risk, to jeopardise","s'aventurer, oser, risquer, mettre en péril"
739,37,schaden,geschadet,"to damage, to harm (someone)","endommager, nuire (à quelqu'un)"
740,37,zitieren,zitiert,"to cite, to quote",citer
741,37,aktivieren,aktiviert,"to activate, to enable","activer, permettre"
742,37,verhandeln,verhandelt,to negotiate,négocier
743,37,verhalten,verhalten,"to behave (refl.), to act (refl.), to press (coll.)","se comporter (réfl.), agir (réfl.), faire pression (familier)"
744,37,stürzen,gestürzt,"to fall, to rush, to throw, to overturn, to overthrow something","tomber, se précipiter, jeter, renverser, renverser quelque chose"
745,37,einfügen,eingefügt,"to insert, to infix, to conform","insérer, infixer, se conformer"
746,37,fortsetzen,fortgesetzt,"to continue, to carry on, to extend, to proceed","continuer, poursuivre, étendre, procéder"
747,37,ermitteln,ermittelt,"to determine, to ascertain","déterminer, s'assurer"
748,37,packen,gepackt,"to pack, to grab, to manage","emballer, saisir, gérer"
749,37,klagen,geklagt,"to complain, to lament, to sue","se plaindre, se lamenter, poursuivre en justice"
750,37,rollen,gerollt,to roll,rouler
751,37,importieren,importiert,to import,importer
752,37,gleichen,geglichen,"to equal, to match, to resemble","égaler, ressembler"
753,37,fällen,gefällt,"to fall, to fell",tomber
754,37,würzen,gewürzt,"to season, to flavor","assaisonner, aromatiser"
755,37,heilen,geheilt,to heal,guérir
756,37,eingehen,eingegangen,"to shrink (textile), to wither, to die (plants, animals), to assume something","rétrécir (textile), se faner, mourir (plantes, animaux), prendre quelque chose"
757,37,betreffen,betroffen,"to concern, to affect","concerner, affecter"
758,38,biegen,gebogen,"to turn, to bend","tourner, se pencher"
759,38,vorkommen,vorgekommen,"to occur, to happen, to advance","se produire, arriver, progresser"
760,38,identifizieren,identifiziert,to identify,identifier
761,38,operieren,operiert,to operate,opérer
762,38,preisen,gepriesen,"to praise, to commend","louer, féliciter"
763,38,klopfen,geklopft,"to knock, to tap (food)","frapper, tapoter (nourriture)"
764,38,ergreifen,ergriffen,"to seize, to grasp, to take hold of","saisir, s'emparer de"
765,38,kopieren,kopiert,"to copy, to duplicate","copier, dupliquer"
766,38,versehen,versehen,"to provide, to equip, to supply","fournir, équiper, approvisionner"
767,38,winken,gewinkt,to wave,faire signe
768,38,anlegen,angelegt,"to create, to invest","créer, investir"
769,38,umfassen,umfasst,"to include, to comprise","inclure, comprendre"
770,38,vornehmen,vorgenommen,"to undertake, to carry out","entreprendre, réaliser"
771,38,definieren,definiert,to define,définir
772,38,verzeihen,verziehen,"to forgive, to pardon, to excuse","pardonner, excuser"
773,38,streichen,gestrichen,"to stroke, to cancel, to spread, to rub, to paint","caresser, annuler, étaler, frotter, peindre"
774,38,kleben,geklebt,"to stick, to adhere, to bond, to glue","coller, adhérer, lier"
775,38,schmelzen,geschmolzen,to melt,faire fondre
776,38,bluten,geblutet,"to bleed, to haemorrhage","saigner, avoir une hémorragie"
777,38,saufen,gesoffen,"to drink (animals), to booze","boire (des animaux), s'enivrer"
778,39,vorgehen,vorgegangen,"to proceed, to advance, to go ahead","procéder, avancer, aller de l'avant"
779,39,vorliegen,vorgelegen,"to exist, to be available","exister, être disponible"
780,39,meiden,gemieden,"to avoid, to shun","éviter, fuir"
781,39,lohnen,gelohnt,"to be worthwhile, to pay off","être utile, être rentable"
782,39,abfahren,abgefahren,"to depart, to leave","partir, quitter"
783,39,zurückgeben,zurückgegeben,"to return, to give back, to answer back","rendre, répondre"
784,39,verstecken,versteckt,"to hide, to conceal","cacher, dissimuler"
785,39,pflegen,gepflegt,"to nurse, to care for, to maintain","soigner, prendre soin de, entretenir"
786,39,verurteilen,verurteilt,"to condemn, to sentence","condamner, prononcer une sentence"
787,39,finanzieren,finanziert,"to finance, to fund","financer, financer"
788,39,erleichtern,erleichtert,"to facilitate, to ease, to relieve","faciliter, alléger, soulager"
789,39,abbrechen,abgebrochen,"to cancel, to break off, to interrupt","annuler, interrompre, rompre"
790,39,zusammenarbeiten,zusammengearbeitet,"to cooperate, to collaborate","coopérer, collaborer"
791,39,erheben,erhoben,"to raise, to collect, to levy","lever, collecter, prélever"
792,39,betragen,betragen,"to amount to, to come to","s'élever à, arriver à"
793,39,vermitteln,vermittelt,"to convey, to mediate, to arrange","transmettre, servir de médiateur, arranger"
794,39,ausreichen,ausgereicht,"to suffice, to be sufficient, to be adequate","suffire, être suffisant, être adéquat"
795,39,bewirken,bewirkt,"to bring about, to cause, to effect","provoquer, causer, effectuer"
796,39,erfordern,erfordert,"to require, to demand, to necessitate","exiger, nécessiter"
797,39,ausmachen,ausgemacht,"to arrange, to constitute, to represent, to settle","organiser, constituer, représenter, régler"
798,40,beißen,gebissen,to bite,mordre
799,40,aufregen,aufgeregt,"to upset, to agitate, to annoy","déranger, agiter, ennuyer"
800,40,vergrößern,vergrößert,to enlarge,pour agrandir
801,40,trocknen,getrocknet,"to dry, to dehumidify","sécher, déshumidifier"
802,40,beten,gebetet,to pray,prier
803,40,jagen,gejagt,"to hunt, to chase, to pursue","chasser, poursuivre"
804,40,einnehmen,eingenommen,"to capture, to earn, to ingest","capturer, gagner, ingérer"
805,40,vorlegen,vorgelegt,"to present, to submit, to bring forward","présenter, soumettre, avancer"
806,40,zuordnen,zugeordnet,"to assign, to allocate","attribuer, allouer"
807,40,betrachten,betrachtet,"to view, to observe","voir, observer"
808,40,beziehen,bezogen,"to refer, to obtain","se référer, obtenir"
809,40,basieren,basiert,to base,à la base
810,40,stechen,gestochen,"to sting, to prick, to puncture, to pierce","piquer, percer"
811,40,bergen,geborgen,"to recover, to rescue, to save, to salvage","récupérer, secourir, sauver, sauver"
812,40,kehren,gekehrt,"to return, to sweep","retourner, balayer"
813,40,baden,gebadet,"to bathe, to swim, to take a bath","se baigner, nager, prendre un bain"
814,40,demonstrieren,demonstriert,"to demonstrate, to show","démontrer, montrer"
815,40,schmerzen,geschmerzt,"to hurt, to ache","faire mal, souffrir"
816,40,spalten,gespalten,"to split, to divide","diviser, diviser"
817,40,graben,gegraben,"to dig, to excavate, to delve","creuser, fouiller, excaver"
818,41,quellen,gequollen,"to soak, to swell","tremper, gonfler"
819,41,klicken,geklickt,to click,cliquer
820,41,senken,gesenkt,"to lower, to sink, to drop, to reduce","abaisser, couler, laisser tomber, réduire"
821,41,irren,geirrt,to err,se tromper
822,41,mitkommen,mitgekommen,"to come along, to keep up","venir, suivre"
823,41,grillen,gegrillt,"to grill, to barbecue","griller, faire un barbecue"
824,41,saugen,gesaugt,"to suck, to vacuum, to suckle","sucer, aspirer, téter"
825,41,widersprechen,widersprochen,"to contradict, to disagree","contredire, être en désaccord"
826,41,ernähren,ernährt,"to feed, to nourish, to sustain","nourrir, entretenir, soutenir"
827,41,ankündigen,angekündigt,"to announce, to declare","annoncer, déclarer"
828,41,verarbeiten,verarbeitet,"to process, to handle, to work through","traiter, manipuler, travailler"
829,41,frieren,gefroren,"to freeze, to feel cold","geler, avoir froid"
830,41,bedanken,bedankt,to thank,remercier
831,41,tanken,getankt,"to refuel, to fill up","faire le plein, faire le plein"
832,41,beruhigen,beruhigt,"to calm, to reassure, to soothe","calmer, rassurer, apaiser"
833,41,zögern,gezögert,to hesitate,hésiter
834,41,blühen,geblüht,"to bloom, to flourish","fleurir, s'épanouir"
835,41,klappen,geklappt,"to work out, to go smoothly, to fold","travailler, se dérouler sans problème, plier"
836,41,verlaufen,verlaufen,"to proceed, to pass, to go (in a certain way)","procéder, passer, aller (d'une certaine manière)"
837,41,prägen,geprägt,"to shape, to influence, to mint","façonner, influencer, frapper"
838,42,ausfallen,ausgefallen,"to fail, to be canceled, to malfunction","échouer, être annulé, dysfonctionner"
839,42,ansprechen,angesprochen,"to address, to speak to, to appeal to","s'adresser à, parler à, faire appel à"
840,42,aufbauen,aufgebaut,"to build, to establish, to develop","construire, établir, développer"
841,42,sperren,gesperrt,"to block, to lock, to close off","bloquer, verrouiller, fermer"
842,42,protestieren,protestiert,"to protest, to object","protester, s'opposer"
843,42,einschalten,eingeschaltet,"to switch on, to intervene, to turn on","allumer, intervenir"
844,42,realisieren,realisiert,"to realize, to implement, to actualize","réaliser, mettre en œuvre, actualiser"
845,42,zurückziehen,zurückgezogen,"to withdraw, to pull back, to retreat","se retirer, se replier"
846,42,auffallen,aufgefallen,"to stand out, to catch someone's eye (with dative)","se démarquer, attirer l'attention (avec le datif)"
847,42,aufgeben,aufgegeben,"to give up on, to give up (refl.), to abandon","renoncer à, abandonner (réfl.),"
848,42,bekämpfen,bekämpft,to fight against something,lutter contre quelque chose
849,42,erstrecken,erstreckt,"to extend, to span, to bestride","étendre, enjamber"
850,42,mischen,gemischt,"to mix, to blend",mélanger
851,42,ergänzen,ergänzt,"to complement, to add, to supplement","compléter, ajouter, suppléer"
852,42,überwachen,überwacht,"to keep under surveillance, to monitor, to observe, to oversee","surveiller, observer, superviser"
853,42,verteidigen,verteidigt,to defend,défendre
854,42,erfassen,erfasst,"to record, to capture, to collect","enregistrer, capturer, collecter"
855,42,unterliegen,unterlegen,"to be subject to, to undergo","être soumis à, subir"
856,42,renovieren,renoviert,"to refurbish, to renovate","remettre à neuf, rénover"
857,42,bestrafen,bestraft,to punish,punir
858,43,stinken,gestunken,to stink,puer
859,43,abstimmen,abgestimmt,"to coordinate, to vote, to adjust","coordonner, voter, ajuster"
860,43,einleiten,eingeleitet,"to introduce, to initiate, to commence","introduire, initier, commencer"
861,43,klettern,geklettert,"to climb, to scale","grimper, escalader"
862,43,nachweisen,nachgewiesen,"to prove, to account for, to demonstrate","prouver, rendre compte de, démontrer"
863,43,weitergeben,weitergegeben,"to pass on, to impart, to relay","transmettre, relayer"
864,43,sondern,gesondert,"to separate, to split","séparer, diviser"
865,43,einigen,geeinigt,"to unite, to reconcile, to agree","s'unir, se réconcilier, s'accorder"
866,43,aufweisen,aufgewiesen,"to exhibit, to feature, to show, to boast","exposer, mettre en valeur, montrer, se vanter"
867,43,eingeben,eingegeben,"to enter, to input, to give, to supply","entrer, saisir, donner, fournir"
868,43,abonnieren,abonniert,to subscribe,s'abonner
869,43,aktualisieren,aktualisiert,to update,mettre à jour
870,43,ausstellen,ausgestellt,"to exhibit, to display","exposer, montrer"
871,43,gleiten,geglitten,"to glide, to slide","glisser, glisser"
872,43,umstellen,umgestellt,"to relocate, to adapt, to change","déménager, s'adapter, changer"
873,43,erlassen,erlassen,"to enact, to issue, to forgive, to let off, to release from","promulguer, pardonner, renoncer à, libérer de"
874,43,zerschlagen,zerschlagen,"to break, to crush, to defeat, to shatter","briser, écraser, vaincre, anéantir"
875,43,gratulieren,gratuliert,"to congratulate, to compliment on","féliciter, complimenter"
876,43,schwitzen,geschwitzt,"to sweat, to be in a sweat","transpirer, être en sueur"
877,43,posten,gepostet,"to post, to shop","poster, acheter"
878,44,grüßen,gegrüßt,"to greet, to salute","saluer, faire un salut"
879,44,hindern,gehindert,to prevent somebody from doing something,empêcher quelqu'un de faire quelque chose
880,44,befreien,befreit,to free (make free),libérer (rendre libre)
881,44,schwören,geschworen,"to swear, to take an oath","jurer, prêter serment"
882,44,angreifen,angegriffen,to attack,attaquer
883,44,trauen,getraut,"to trust, to marry, to dare (refl.)","faire confiance, se marier, oser (réfl.)"
884,44,hetzen,gehetzt,"to rush, to hurry","se précipiter, se dépêcher"
885,44,kürzen,gekürzt,"to shorten, to reduce, to abbreviate","réduire, raccourcir, abréger"
886,44,nützen,genützt,"to be of use, to be useful, to benefit",utiliser
887,44,befehlen,befohlen,"to command, to order, to bid","ordonner, commander, enjoindre"
888,44,blasen,geblasen,"to blow, to play, to puff, to breathe on, to emit",souffler
889,44,deuten,gedeutet,"to indicate, to interpret, to point","interpréter, indiquer"
890,44,einbauen,eingebaut,"to install, to build in, to build into","installer, monter, intégrer, insérer"
891,44,leuchten,geleuchtet,"to shine, to glow, to be illuminated","briller, allumer, éclairer"
892,44,managen,gemanagt,"to manage, to oversee, to organize, to supervise","gérer, contrôler"
893,44,ringen,gerungen,"to struggle, to wrestle, to agonise",lutter
894,44,rühren,gerührt,"to stir, to move, to mix",remuer
895,44,überwinden,überwunden,"to overcome, to conquer, to surmount",surmonter
896,44,verderben,verdorben,"to decay, to spoil, to addle, to degenerate","gâcher, gâter, perdre, périr"
897,44,verweigern,verweigert,"to refuse, to deny, to decline, to reject",refuser
898,45,gebrauchen,gebraucht,"to use, to make use of","utiliser, faire usage de"
899,45,vernichten,vernichtet,"to destroy, to ruin, to annihilate, to eradicate","détruire, ruiner, anéantir, éradiquer"
900,45,reißen,gerissen,"to rip, to tear, to break","déchirer, arracher, se casser, rompre"
901,45,angeln,geangelt,"to angle, to fish, to hook up","pêcher, aller à la pêcher"
902,45,zusagen,zugesagt,"to promise, to accept, to agree","promettre, accepter, convenir"
903,45,bewältigen,bewältigt,"to manage, to cope with, to overcome, to get over","gérer, faire face à, surmonter"
904,45,begrüßen,begrüßt,"to greet, to welcome","saluer, accueillir"
905,45,aussprechen,ausgesprochen,"to pronounce, to express, to speak out","prononcer, exprimer, s'exprimer"
906,45,entwerfen,entworfen,"to design, to draft, to sketch","concevoir, ébaucher, esquisser"
907,45,versorgen,versorgt,"to supply, to provide for, to take care of","fournir, pourvoir à, prendre soin de"
908,45,abheben,abgehoben,"to withdraw (money), to take off (aircraft)","retirer (de l'argent), décoller (un avion)"
909,45,verbreiten,verbreitet,"to spread, to disseminate","diffuser, propager"
910,45,hinterlassen,hinterlassen,"to leave behind, to bequeath","laisser derrière soi, léguer"
911,45,beantragen,beantragt,"to apply for, to request","demander, requérir"
912,45,verpflichten,verpflichtet,"to oblige, to commit, to bind","obliger, engager, lier"
913,45,klingeln,geklingelt,"to ring, to chime","sonner, faire sonner"
