Nr,exercise,question,answer,english,french
914,45,verbrennen,verbrannt,"to burn, to consume by fire, to incinerate","brûler, consumer par le feu, incinérer"
915,45,gebären,geboren,to give birth to,donner naissance à
916,45,beurteilen,beurteilt,"to judge, to assess","juger, évaluer"
917,45,wetten,gewettet,"to bet, to wager","parier, miser"
918,46,überlassen,überlassen,"to leave to, to entrust, to surrender","laisser à, confier, abandonner"
919,46,engagieren,engagiert,"to hire, to engage, to get involved","embaucher, engager, s'impliquer"
920,46,überleben,überlebt,to survive,survivre
921,46,scheitern,gescheitert,"to fail, to fall through","échouer, tomber à travers"
922,46,unterstreichen,unterstrichen,"to underline, to emphasize, to highlight","souligner, mettre en valeur, mettre en valeur"
923,46,vorlesen,vorgelesen,"to read aloud, to read out",lire à haute voix
924,46,aufführen,aufgeführt,"to perform, to present","exécuter, présenter"
925,46,anhalten,angehalten,"to stop (cease moving), to continue, to compel","arrêter (cesser de bouger), continuer, contraindre"
926,46,aufhalten,aufgehalten,"to stop, to stay, to delay","arrêter, rester, retarder"
927,46,genügen,genügt,"to suffice, to satisfy","suffire, satisfaire"
928,46,ablaufen,abgelaufen,"to expire, to run out, to discharge","expirer, s'épuiser, se décharger"
929,46,anführen,angeführt,"to cite, to lead, to quote","citer, diriger"
930,46,ausdrucken,ausgedruckt,"to print, to print out, to print off",imprimer
931,46,eintragen,eingetragen,"to register, to enter, to record, to enrol","inscrire, entrer, enregistrer, inscrire"
932,46,erarbeiten,erarbeitet,"to develop, to elaborate, to work out, to acquire","développer, élaborer, acquérir"
933,46,notieren,notiert,"to note, to quote","à noter, à citer"
934,46,streiken,gestreikt,"to strike, to be on strike","faire grève, être en grève"
935,46,verschreiben,verschrieben,"to prescribe, to commit oneself to, to misspell by accident","prescrire, s'engager à, faire une faute d'orthographe par accident"
936,46,vertreiben,vertrieben,"to expel, to dislodge, to displace","expulser, déloger, déplacer"
937,46,auspacken,ausgepackt,"to unpack, to unwrap, to blow the whistle on","déballer, dénoncer"
938,47,existieren,existiert,to exist,exister
939,47,bedrohen,bedroht,"to threaten, to menace",menacer
940,47,ausüben,ausgeübt,"to exercise, to perform, to practice","exercer, exécuter, pratiquer"
941,47,verstärken,verstärkt,"to amplify, to intensify, to strengthen","amplifier, intensifier, renforcer"
942,47,überschreiten,überschritten,"to exceed, to overstep, to surpass","dépasser, outrepasser, surpasser"
943,47,übergeben,übergeben,"to hand over, to vomit (refl.)","remettre, vomir (réfl.)"
944,47,stützen,gestützt,"to support, to back, to hold something up, to bolster","soutenir, appuyer, soutenir quelque chose, étayer"
945,47,abrufen,abgerufen,"to retrieve, to access, to call away","récupérer, accéder, appeler"
946,47,bedenken,bedacht,"to consider, to reflect, to give, to allow for","considérer, réfléchir, donner, permettre"
947,47,befassen,befasst,"to address, to deal with, to attend to","s'adresser à, traiter, s'occuper de"
948,47,beschleunigen,beschleunigt,"to accelerate, to speed up",accélérer
949,47,einschließen,eingeschlossen,"to include, to enclose, to lock up, to surround","inclure, enfermer, entourer"
950,47,fügen,gefügt,"to acquiesce, to comply, to fit together","acquiescer, se conformer, s'adapter"
951,47,beruhen,beruht,"to base on, to depend on","se baser sur, dépendre de"
952,47,gewähren,gewährt,"to grant, to afford, to allow, to accord","accorder, permettre"
953,47,qualifizieren,qualifiziert,"to qualify, to qualify for","se qualifier, se qualifier pour"
954,47,umgeben,umgeben,"to surround, to enclose, to encompass","entourer, enfermer, englober"
955,47,verringern,verringert,"to decrease, to diminish, to ease, to lower","diminuer, soulager, abaisser"
956,47,kontaktieren,kontaktiert,to contact,contacter
957,47,dringen,gedrungen,to penetrate,pénétrer
958,48,vorwerfen,vorgeworfen,"to reproach, to accuse of, to allege","reprocher, accuser de, alléguer"
959,48,verwirklichen,verwirklicht,"to realize, to actualize, to fulfill, to implement","réaliser, concrétiser, accomplir, mettre en œuvre"
960,48,formen,geformt,"to form, to shape, to model, to mold, to fashion","former, modeler, façonner"
961,48,aufstellen,aufgestellt,"to set up, to establish","mettre en place, établir"
962,48,ausschließen,ausgeschlossen,"to exclude, to eliminate","exclure, éliminer"
963,48,durchsetzen,durchgesetzt,"to enforce, to assert","faire respecter, affirmer"
964,48,weiterleiten,weitergeleitet,"to forward, to pass on","transmettre, faire passer"
965,48,wiederherstellen,wiederhergestellt,"to restore, to recover, to rehabilitate","restaurer, récupérer, réhabiliter"
966,48,hingehen,hingegangen,"to go (there), (of time) to pass","aller (là-bas), passer (le temps)"
967,48,zurückkehren,zurückgekehrt,to return,revenir
968,48,impfen,geimpft,"to vaccinate, to immunize, to inject","vacciner, immuniser, injecter"
969,48,betrügen,betrogen,"to cheat, to swindle, to defraud","tricher, escroquer, frauder"
970,48,heizen,geheizt,"to heat, to warm, to fuel","chauffer, se chauffer"
971,48,siegen,gesiegt,"to win, to prevail, to triumph","gagner, triompher, prévaloir"
972,48,vereinigen,vereinigt,"to coalesce, to unify, to merge","unir, réunir, unifier, combiner"
973,48,verwechseln,verwechselt,"to mix up, to confuse, to mistake for",confondre
974,48,zittern,gezittert,"to shiver, to tremble, to fear","trembler, frissonner, grelotter"
975,48,hochladen,hochgeladen,to upload,"uploader, télécharger"
976,48,züchten,gezüchtet,"to breed, to grow","se reproduire, grandir"
977,48,wehren,gewehrt,"to defend, to resist","défendre, résister"
978,49,beleidigen,beleidigt,"to offend someone, to insult someone","offenser quelqu'un, insulter quelqu'un"
979,49,verklagen,verklagt,"to sue, to bring a suit against, to bring an action against","poursuivre en justice, intenter un procès"
980,49,isolieren,isoliert,"to isolate, to insulate",isoler
981,49,locken,gelockt,"to entice, to lure, to rock, to tempt","attirer, allécher"
982,49,ruhen,geruht,"to rest, to be at rest, to repose",reposer
983,49,schleifen,geschleift,"to drag, to drill, to pull","poncer, affûter, aiguiser, tailler"
984,49,strahlen,gestrahlt,"to radiate, to beam","rayonner, briller, illuminer"
985,49,streben,gestrebt,"to strive, to tend to, to aspire","aspirer, s'efforcer, viser"
986,49,strecken,gestreckt,"to stretch, to dilute, to extend","étirer, allonger"
987,49,versagen,versagt,"to fail, to refuse, to deny","échouer, refuser, nier"
988,49,faulenzen,gefaulenzt,"to chill, to laze around","se détendre, paresser"
989,49,umtauschen,umgetauscht,"to convert, to exchange (currency)","convertir, échanger (monnaie)"
990,49,anprobieren,anprobiert,"to try on, to fit, to fit on","essayer, ajuster, s'adapter à"
991,49,duschen,geduscht,"to shower, to have a shower, to take a shower","se doucher, prendre une douche"
992,49,husten,gehustet,"to cough, to have a cough","tousser, toussoter"
993,49,zelten,gezeltet,"to camp, to camp out, to tent",camper
994,49,genesen,genesen,"to recover, to convalesce, to get well",se rétablir
995,49,aufsteigen,aufgestiegen,"to rise, to ascend, to advance, to climb","s'élever, monter, avancer, grimper"
996,49,umsteigen,umgestiegen,"to change, to transfer, to switch","changer, transférer, commuter"
997,49,zubereiten,zubereitet,"to prepare (food), to cook","préparer (de la nourriture), cuisiner"
998,50,hervorheben,hervorgehoben,"to emphasize, to highlight, to stress","souligner, mettre en valeur, insister"
999,50,abbauen,abgebaut,"to dismantle, to reduce, to break down","démanteler, réduire, décomposer"
1000,50,basteln,gebastelt,"to craft, to tinker","bricoler, fabriquer"
1001,50,entziehen,entzogen,"to withdraw, to remove, to deprive","retirer, enlever, priver"
1002,50,zugeben,zugegeben,"to admit, to confess, to add","admettre, confesser, ajouter"
1003,50,besorgen,besorgt,"to get, to obtain, to take care of","obtenir, prendre soin de"
1004,50,auswerten,ausgewertet,"to evaluate, to analyze, to assess","évaluer, analyser, estimer"
1005,50,anwenden,angewendet,"to apply, to make use of","appliquer, faire usage de"
1006,50,bevorzugen,bevorzugt,"to prefer, to favor","préférer, favoriser"
1007,50,überweisen,überwiesen,"to transfer (money), to refer (a patient)","transférer (de l'argent), référer (un patient)"
1008,50,vertiefen,vertieft,"to deepen, to intensify","approfondir, intensifier"
1009,50,bemerken,bemerkt,"to notice, to observe, to remark","remarquer, observer"
1010,50,beschädigen,beschädigt,"to damage, to harm","endommager, nuire"
1011,50,zusammenstellen,zusammengestellt,"to compile, to assemble","compiler, assembler"
1012,50,verwandeln,verwandelt,"to transform, to convert, to turn into, to metamorphose","transformer, convertir, se métamorphoser"
1013,50,absolvieren,absolviert,"to complete, to graduate, to finish","compléter, obtenir un diplôme, finir"
1014,50,verbrauchen,verbraucht,"to consume, to use","consommer, utiliser"
1015,50,zusehen,zugesehen,"to watch, to see, to make sure (that something happens)","regarder, voir, s'assurer (que quelque chose se passe)"
1016,50,auffordern,aufgefordert,"to request, to invite, to ask","demander, inviter"
1017,50,berechtigen,berechtigt,"to authorize, to entitle to, to empower","autoriser, donner droit à, habiliter"
1018,51,befürchten,befürchtet,"to fear, to apprehend, to be afraid","craindre, appréhender, avoir peur"
1019,51,aufheben,aufgehoben,"to abolish, to lift, to pick up, to keep","abolir, lever, ramasser, garder"
1020,51,bewahren,bewahrt,"to keep, to preserve (to maintain the condition of)","garder, préserver (maintenir l'état de)"
1021,51,berühren,berührt,to touch,toucher
1022,51,anstellen,angestellt,"to queue (refl.), to employ someone, to hire, to get into mischief","faire la queue (réfl.), employer quelqu'un, faire des bêtises"
1023,51,auftauchen,aufgetaucht,"to arise, to surface, to turn up","surgir, faire surface, apparaître"
1024,51,aussuchen,ausgesucht,"to select, to choose, to pick","sélectionner, choisir, cueillir"
1025,51,festhalten,festgehalten,"to hold, to retain something, to record something, to detain","détenir, conserver quelque chose, enregistrer quelque chose, détenir"
1026,51,beherrschen,beherrscht,"to dominate, to master, to control, to rule","dominer, maîtriser, contrôler, régner"
1027,51,weitermachen,weitergemacht,"go on, keep going, continue to do something","continuer, continuer à faire quelque chose"
1028,51,ableiten,abgeleitet,"to derive, to deduce","dériver, déduire"
1029,51,auflösen,aufgelöst,"to dissolve, to resolve, to annul, to liquidate","dissoudre, résoudre, annuler, liquider"
1030,51,beklagen,beklagt,"to complain, to lament, to air grievances","se plaindre, se lamenter, exprimer des griefs"
1031,51,drängen,gedrängt,"to urge, to push, to cajole, to shove","exhorter, pousser, cajoler, bousculer"
1032,51,auslösen,ausgelöst,"to ransom, to trigger, to initiate, to set up","rançonner, déclencher, initier, mettre en place"
1033,51,einschränken,eingeschränkt,"to limit, to restrict, to stint, to circumscribe","limiter, restreindre, circonscrire"
1034,51,eintreten,eingetreten,"to enter, to join, to occur","entrer, se joindre, se produire"
1035,51,belasten,belastet,"to burden, to charge, to strain","charger, accabler, mettre à rude épreuve"
1036,51,interpretieren,interpretiert,"to interpret, to take as","interpréter, prendre comme"
1037,51,kombinieren,kombiniert,to combine,combiner
1038,52,nähern,genähert,"to approach, to get closer, to advance","s'approcher, se rapprocher, avancer"
1039,52,orientieren,orientiert,to orient,orienter
1040,52,rechtfertigen,gerechtfertigt,"to justify, to warrant, to back up, to exculpate","justifier, garantir, appuyer, disculper"
1041,52,transportieren,transportiert,"to transport, to transfer","transporter, transférer"
1042,52,wahrnehmen,wahrgenommen,"to perceive, to notice, to observe, to sense","percevoir, remarquer, observer, pressentir"
1043,52,benennen,benannt,"to name, to designate, to appoint","nommer, désigner"
1044,52,verpacken,verpackt,"to pack, to wrap, to package","emballer, envelopper, conditionner"
1045,52,versichern,versichert,"to assure, to insure, to cover","assurer, couvrir"
1046,52,meistern,gemeistert,"to master, to overcome, to cope with","maîtriser, surmonter, faire face à"
1047,52,drohen,gedroht,to threaten,menacer
1048,52,vereinfachen,vereinfacht,"to simplify, to demystify, to deskill, to dumb down","simplifier, démystifier, déqualifier, abêtir"
1049,52,spezialisieren,spezialisiert,"to specialize, to specialise, to differentiate, to focus","se spécialiser, se différencier, se concentrer"
1050,52,umbringen,umgebracht,"to kill, to murder, to be very angry at someone","tuer, assassiner, être très en colère contre quelqu'un"
1051,52,beeinträchtigen,beeinträchtigt,"to affect, to impair, to alloy, to compromise","affecter, altérer, allier, compromettre"
1052,52,beinhalten,beinhaltet,"to include, to contain, to entail, to comprise","inclure, contenir, impliquer, comprendre"
1053,52,bereitstellen,bereitgestellt,"to make available, to provide, to supply","mettre à disposition, fournir, approvisionner"
1054,52,gestatten,gestattet,"to allow, to permit, to license","autoriser, permettre, concéder une licence"
1055,52,scheren,geschert,"to shear, to care, to clip, to cut","tondre, entretenir, tailler, couper"
1056,52,sicherstellen,sichergestellt,"to seize, to assure, to confiscate, to guarantee","saisir, assurer, confisquer, garantir"
1057,52,erläutern,erläutert,"to explain, to clarify","expliquer, clarifier"
1058,53,verweisen,verwiesen,"to refer, to direct","se référer, diriger"
1059,53,vorsehen,vorgesehen,"to plan, to provide for","planifier, prévoir"
1060,53,sieben,gesiebt,"to sieve, to filter","tamiser, filtrer"
1061,53,nachfragen,nachgefragt,"to ask, to inquire, to demand","demander, s'enquérir, exiger"
1062,53,ausdrücken,ausgedrückt,"to express, to articulate, to convey, to embody","exprimer, articuler, transmettre, incarner"
1063,53,anfallen,angefallen,"to accrue, to accumulate, to arise, to incur","s'accumuler, survenir, encourir"
1064,53,einhalten,eingehalten,"to observe, to adhere, to comply","observer, adhérer, se conformer"
1065,53,ereignen,ereignet,"to happen, to occur, to bechance","se produire, avoir lieu, être fortuit"
1066,53,publizieren,publiziert,"to publish, to publicize, to announce","publier, faire connaître, annoncer"
1067,53,regieren,regiert,"to govern, to reign, to rule, to command","gouverner, régner, diriger, commander"
1068,53,synchronisieren,synchronisiert,"to synchronize, to dub, to sync","synchroniser, doubler"
1069,53,hinzufügen,hinzugefügt,to add,ajouter
1070,53,entkommen,entkommen,to escape,s'échapper
1071,53,rächen,gerächt,to take revenge (refl.),se venger (réfl.)
1072,53,schleichen,geschlichen,"to sneak, to creep","se faufiler, ramper"
1073,53,blitzen,geblitzt,to flash,"clignoter, étinceler, flasher, scintiller"
1074,53,herausfordern,herausgefordert,"to challenge, to provoke, to banter to","défier, affronter"
1075,53,pfeifen,gepfiffen,"to whistle, to ignore, to referee, to arbitrate","siffler, siffloter"
1076,53,plagen,geplagt,"to bother, to annoy, to plague, to rack","tourmenter, affliger"
1077,53,reizen,gereizt,"to stimulate, to irritate, to tease","irriter, émouvoir, exciter"
1078,54,toben,getobt,"to fume, to rage, to rampage, to romp","se défouler, se déchaîner, fulminer"
1079,54,zaubern,gezaubert,"to perform magic, to conjure, to magic","conjurer, ensorceler, conjurer, évoquer"
1080,54,grenzen,gegrenzt,"to abut, to approach, to border, to limit",limiter
1081,54,konfigurieren,konfiguriert,"to configure, to set up",configurer
1082,54,tagen,getagt,"to meet, to convene, to be in session","se réunir, tenir une réunion"
1083,54,verfahren,verfahren,"to proceed, to act, to deal",procéder
1084,54,auskommen,ausgekommen,"to get along, to get on, to manage",s'entendre
1085,54,verkehren,verkehrt,"to circulate, to interact, to turn, to twist",circuler
1086,54,hauen,gehauen,"to slash, to cut, to hit (coll.)","trancher, couper, frapper (coll.)"
1087,54,falten,gefaltet,"to fold, to bend, to crease","plier, froisser, se plisser"
1088,54,weichen,gewichen,to soften,adoucir
1089,54,opfern,geopfert,to sacrifice,sacrifier
1090,54,ehren,geehrt,"to honor, to respect, to esteem",honorer
1091,54,erwägen,erwogen,"to consider, to contemplate, to ponder","envisager, considérer"
1092,54,räumen,geräumt,"to clear, to remove, to vacate","déblayer, débrancher, dégager"
1093,54,spritzen,gespritzt,"to inject, to spray, to splash","injecter, pulvériser, gicler, éclabousser"
1094,54,stopfen,gestopft,"to stuff, to darn, to jam","bourrer, combler"
1095,54,wachen,gewacht,"to wakem, to guard, to be awake","veiller, réveiller, surveiller"
1096,54,weggehen,weggegangen,"to go away, to leave","s'en aller, quitter"
1097,54,bügeln,gebügelt,to iron,repasser (des vêtements)
1098,55,schwellen,geschwollen,"to swell, to expand, to rise","gonfler, enfler"
1099,55,amüsieren,amüsiert,"to amuse, to entertain, to enjoy oneself","amuser, divertir, se faire plaisir"
1100,55,lauten,gelautet,"to read, to sound, to go (as in “it goes like…”)","lire, sonner"
1101,55,anfassen,angefasst,"to touch, to handle","toucher, manipuler"
1102,55,vorgeben,vorgegeben,"to claim, to pretend, to set (a pace)","revendiquer, prétendre, donner (un rythme)"
1103,55,erkunden,erkundet,"to explore, to investigate","explorer, enquêter"
1104,55,beauftragen,beauftragt,"to assign, to commission, to instruct","assigner, commissionner, instruire"
1105,55,beeindrucken,beeindruckt,to impress,impressionner
1106,55,wundern,gewundert,"to surprise, to amaze","surprendre, étonner"
1107,55,überqueren,überquert,to cross,traverser
1108,55,verfassen,verfasst,"to write, to compose, to draft","écrire, composer, rédiger"
1109,55,einschlafen,eingeschlafen,to fall asleep,s'endormir
1110,55,bereiten,bereitet,"to prepare, to cause","préparer, provoquer"
1111,55,veranstalten,veranstaltet,"to organize, to arrange, to host","organiser, arranger, héberger"
1112,55,abziehen,abgezogen,"to remove, to deduct, to withdraw","supprimer, déduire, retirer"
1113,55,lenken,gelenkt,"to steer, to direct, to guide","diriger, orienter, guider"
1114,55,tauchen,getaucht,"to dive, to dip","plonger, tremper"
1115,55,ablenken,abgelenkt,"to distract, to divert, to steer away","distraire, détourner, éloigner"
1116,55,anschauen,angeschaut,"to look at, to behold, to take a look at, to watch (Bayern and Austria)","regarder, contempler, jeter un coup d'œil à, observer (Bayern et Autriche)"
1117,55,begehen,begangen,"to commit, perpetrate (a crime, an offence)","commettre, perpétrer (un crime, un délit)"
1118,56,ertragen,ertragen,"to bear, to stand","supporter, se tenir debout"
1119,56,verhaften,verhaftet,"to detain, to take into custody","détenir, mettre en détention"
1120,56,aufbrechen,aufgebrochen,"to leave, to set off, to start, to break, to burst","partir, se mettre en route, démarrer, rompre, éclater"
1121,56,umdrehen,umgedreht,to turn around,faire demi-tour
1122,56,begeistern,begeistert,"to enthuse, to be enthusiastic (refl.)","enthousiasmer, être enthousiaste (réfl.)"
1123,56,anregen,angeregt,"to encourage, to stimulate, to excite, to inspire","encourager, stimuler, exciter, inspirer"
1124,56,abschneiden,abgeschnitten,"to cut off, to amputate, to block","couper, amputer, bloquer"
1125,56,einfallen,eingefallen,"to collapse, to come to mind","s'effondrer, venir à l'esprit"
1126,56,abweichen,abgewichen,"to depart (from), to soak off","partir (de), s'imprégner"
1127,56,abbilden,abgebildet,"to depict, to map, to illustrate","représenter, cartographier, illustrer"
1128,56,aufladen,aufgeladen,"to charge, to load, to burden, to impose","charger, accabler, imposer"
1129,56,verdanken,verdankt,"to owe, to be indebted, to owe to","devoir (quelque chose à quelqu'un), être redevable"
1130,56,erregen,erregt,"to arouse, to stimulate, to agitate","éveiller, stimuler, agiter"
1131,56,schütteln,geschüttelt,"to agitate, to shake, to jolt","agiter, secouer"
1132,56,verkünden,verkündet,"to announce, to proclaim, to declare","annoncer, proclamer, déclarer"
1133,56,erleiden,erlitten,"to endure, to suffer, to experience, to experience pain","endurer, souffrir, éprouver, ressentir de la douleur"
1134,56,zurückhalten,zurückgehalten,"to restrain, to hold back, to withhold","restreindre, retenir"
1135,56,verdoppeln,verdoppelt,"to double, to duplicate, to reduplicate, to geminate","doubler, dupliquer, redoubler, géminer"
1136,56,besetzen,besetzt,"to occupy, to border, to cast","occuper, border, jeter"
1137,56,herrschen,geherrscht,"to rule, to prevail, to control","gouverner, prévaloir, contrôler"
1138,57,erweisen,erwiesen,"to prove (passively), to turn out to be, to show","prouver (passivement), s'avérer être, montrer"
1139,57,tauschen,getauscht,"to swap, to trade, to exchange","échanger, troquer, échanger"
1140,57,übertreiben,übertrieben,"to exaggerate, to overdo","exagérer, exagérer"
1141,57,agieren,agiert,"to act, to operate, to perform, to act out","agir, opérer, exécuter"
1142,57,begeben,begeben,"to proceed to, to repair to, to endorse, to happen","procéder, réparer, approuver, se produire"
1143,57,bremsen,gebremst,"to slow down, to brake, to decelerate, to retard","ralentir, freiner, décélérer, retarder"
1144,57,dokumentieren,dokumentiert,"to record, to document, to demonstrate, to evidence","enregistrer, documenter, démontrer, prouver"
1145,57,einreichen,eingereicht,"to submit, to present, to bring, to bring in, to deposit","soumettre, présenter, apporter, déposer"
1146,57,erforschen,erforscht,"to research, to investigate, to explore, to ascertain","faire des recherches, enquêter, explorer, vérifier"
1147,57,angehen,angegangen,"to concern, to tackle (a problem), to turn on (a machine)","s'inquiéter, s'attaquer (à un problème), mettre en marche (une machine)"
1148,57,ausbauen,ausgebaut,"to expand, to develop","étendre, développer"
1149,57,registrieren,registriert,"to register, to enroll","s'inscrire, s'inscrire"
1150,57,verknüpfen,verknüpft,"to connect, to link, to associate, to tie, to annex to","connecter, relier, associer, lier, annexer à"
1151,57,einpacken,eingepackt,"to pack in, to pack, to wrap, to wrap up","emballer, conclure"
1152,57,kommunizieren,kommuniziert,"to communicate, to commune, to connect","communiquer, se connecter"
1153,57,scannen,gescannt,"to scan, to court, to digitize","scanner, porter devant les tribunaux, numériser"
1154,57,vergehen,vergangen,"to die, to pass, to elapse, to perish","mourir, passer, s'écouler, périr"
1155,57,verabreden,verabredet,"to arrange, to make an appointment","prendre rendez-vous, convenir d'un rendez-vous"
1156,57,kommentieren,kommentiert,to comment,commenter
1157,57,abbiegen,abgebogen,"to turn, to turn off, to bend","tourner, éteindre, plier"
1158,58,aufzeigen,aufgezeigt,"to point out, to demonstrate, to indicate","souligner, démontrer, indiquer"
1159,58,auseinandersetzen,auseinandergesetzt,"to discuss, to engage, to altercate, to argue with","discuter, s'engager, se disputer, argumenter avec"
1160,58,langweilen,gelangweilt,"to bore, to be bored, to be boring","s'ennuyer, être ennuyé, être ennuyeux"
1161,58,losgehen,losgegangen,"to leave, to go off, to advance","partir, s'en aller, avancer"
1162,58,recyceln,recycelt,to recycle,recycler
1163,58,aushalten,ausgehalten,"to bear, to endure, to withstand, to tolerate","supporter, endurer, résister, tolérer"
1164,58,staubsaugen,staubgesaugt,"to vacuum, to hoover","passer l'aspirateur, aspirer"
1165,58,beschützen,beschützt,"to protect, defend (security)","protéger, défendre (sécurité)"
1166,58,schulden,geschuldet,"to owe, to be due to","devoir, être dû à"
1167,58,aussagen,ausgesagt,"to testify, to state","témoigner, déclarer"
1168,58,lauschen,gelauscht,"to listen, to eavesdrop","écouter, espionner"
1169,58,aufbringen,aufgebracht,"to capture, to raise, to antagonise",appliquer
1170,58,befestigen,befestigt,"to attach, to fasten, to secure",fixer
1171,58,begrenzen,begrenzt,"to limit, to restrict, to bound","limiter, resteindre, confiner"
1172,58,entnehmen,entnommen,"to extract, to gather from, to remove","retirer, tirer, déduire"
1173,58,optimieren,optimiert,"to optimize, to improve, to steamline",optimiser
1174,58,platzieren,platziert,"to place, to position, to be placed",placer
1175,58,schwinden,geschwunden,"to diminish, to fade, to shrink","disparaître, diminuer, s'évanouir"
1176,58,übereinstimmen,übereingestimmt,"to agree, to conur, to correspond","concorder, correspondre, coïncider"
1177,58,anfragen,angefragt,"to ask, to inquire, to enquire, to request",demander
1178,59,beibehalten,beibehalten,"to maintain, to keep, to retain",maintenir
1179,59,deaktivieren,deaktiviert,"to deactivate, to disable",désactiver
1180,59,exportieren,exportiert,to export,exporter
1181,59,gebieten,geboten,"to command, to demand, to bid, to dominate","dominer, ordonner"
1182,59,geleiten,geleitet,"to accompany, to escort, to conduct",accompagner
1183,59,listen,gelistet,"to list, to allow in, to lead as a series","énumérer, citer"
1184,59,positionieren,positioniert,"to position, to assert, to clarify","positionner, placer"
1185,59,proben,geprobt,"to rehearse, to practice",répéter
1186,59,ticken,getickt,"to tick, to tap, to act","faire tic, taper"
1187,59,übermitteln,übermittelt,"to communicate, to deliver, to transmit","transmettre, communiquer"
1188,59,werten,gewertet,"to assess, to consider, to value",évaluer
1189,59,zugreifen,zugegriffen,"to access, to grab, to help oneself",accéder
