Nr,exercise,question,english,french,ich,du,er/sie/es,wir,ihr,Sie
875,44,gratulieren,"to congratulate, to compliment on","féliciter, complimenter",,,gratulierte,,,
876,44,schwitzen,"to sweat, to be in a sweat","transpirer, être en sueur",,,schwitzte,,,
877,44,posten,"to post, to shop","poster, acheter",,,postete,,,
878,45,grüßen,"to greet, to salute","saluer, faire un salut",,,grüßte,,,
879,45,hindern,to prevent somebody from doing something,empêcher quelqu'un de faire quelque chose,,,hinderte,,,
880,45,befreien,to free (make free),libérer (rendre libre),,,befreite,,,
881,45,schwören,"to swear, to take an oath","jurer, prêter serment",,,schwor,,,
882,45,angreifen,to attack,attaquer,,,griff an,,,
883,45,trauen,"to trust, to marry, to dare (refl.)","faire confiance, se marier, oser (réfl.)",,,traute,,,
884,45,hetzen,"to rush, to hurry","se précipiter, se dépêcher",,,hetzte,,,
885,45,kürzen,"to shorten, to reduce, to abbreviate","réduire, raccourcir, abréger",,,kürzte,,,
886,45,nützen,"to be of use, to be useful, to benefit",utiliser,,,nützte,,,
887,45,befehlen,"to command, to order, to bid","ordonner, commander, enjoindre",,,befahl,,,
888,45,blasen,"to blow, to play, to puff, to breathe on, to emit",souffler,,,blies,,,
889,45,deuten,"to indicate, to interpret, to point","interpréter, indiquer",,,deutete,,,
890,45,einbauen,"to install, to build in, to build into","installer, monter, intégrer, insérer",,,baute ein,,,
891,45,leuchten,"to shine, to glow, to be illuminated","briller, allumer, éclairer",,,leuchtete,,,
892,45,managen,"to manage, to oversee, to organize, to supervise","gérer, contrôler",,,managte,,,
893,45,ringen,"to struggle, to wrestle, to agonise",lutter,,,rang,,,
894,45,rühren,"to stir, to move, to mix",remuer,,,rührte,,,
895,45,überwinden,"to overcome, to conquer, to surmount",surmonter,,,überwand,,,
896,45,verderben,"to decay, to spoil, to addle, to degenerate","gâcher, gâter, perdre, périr",,,verdarb,,,
897,45,verweigern,"to refuse, to deny, to decline, to reject",refuser,,,verweigerte,,,
898,46,gebrauchen,"to use, to make use of","utiliser, faire usage de",,,gebrauchte,,,
899,46,vernichten,"to destroy, to ruin, to annihilate, to eradicate","détruire, ruiner, anéantir, éradiquer",,,vernichtete,,,
900,46,reißen,"to rip, to tear, to break","déchirer, arracher, se casser, rompre",,,riss,,,
901,46,angeln,"to angle, to fish, to hook up","pêcher, aller à la pêcher",,,angelte,,,
902,46,zusagen,"to promise, to accept, to agree","promettre, accepter, convenir",,,sagte zu,,,
903,46,bewältigen,"to manage, to cope with, to overcome, to get over","gérer, faire face à, surmonter",,,bewältigte,,,
904,46,begrüßen,"to greet, to welcome","saluer, accueillir",,,begrüßte,,,
905,46,aussprechen,"to pronounce, to express, to speak out","prononcer, exprimer, s'exprimer",,,sprach aus,,,
906,46,entwerfen,"to design, to draft, to sketch","concevoir, ébaucher, esquisser",,,entwarf,,,
907,46,versorgen,"to supply, to provide for, to take care of","fournir, pourvoir à, prendre soin de",,,versorgte,,,
908,46,abheben,"to withdraw (money), to take off (aircraft)","retirer (de l'argent), décoller (un avion)",,,hob ab,,,
909,46,verbreiten,"to spread, to disseminate","diffuser, propager",,,verbreitete,,,
910,46,hinterlassen,"to leave behind, to bequeath","laisser derrière soi, léguer",,,hinterließ,,,
911,46,beantragen,"to apply for, to request","demander, requérir",,,beantragte,,,
912,46,verpflichten,"to oblige, to commit, to bind","obliger, engager, lier",,,verpflichtete,,,
913,46,klingeln,"to ring, to chime","sonner, faire sonner",,,klingelte,,,
914,46,verbrennen,"to burn, to consume by fire, to incinerate","brûler, consumer par le feu, incinérer",,,verbrannte,,,
915,46,gebären,to give birth to,donner naissance à,,,gebar,,,
916,46,beurteilen,"to judge, to assess","juger, évaluer",,,beurteilte,,,
917,46,wetten,"to bet, to wager","parier, miser",,,wettete,,,
918,47,überlassen,"to leave to, to entrust, to surrender","laisser à, confier, abandonner",,,überließ,,,
919,47,engagieren,"to hire, to engage, to get involved","embaucher, engager, s'impliquer",,,engagierte,,,
920,47,überleben,to survive,survivre,,,überlebte,,,
921,47,scheitern,"to fail, to fall through","échouer, tomber à travers",,,scheiterte,,,
922,47,unterstreichen,"to underline, to emphasize, to highlight","souligner, mettre en valeur, mettre en valeur",,,unterstrich,,,
923,47,vorlesen,"to read aloud, to read out",lire à haute voix,,,las vor,,,
924,47,aufführen,"to perform, to present","exécuter, présenter",,,führte auf,,,
925,47,anhalten,"to stop (cease moving), to continue, to compel","arrêter (cesser de bouger), continuer, contraindre",,,hielt an,,,
926,47,aufhalten,"to stop, to stay, to delay","arrêter, rester, retarder",,,hielt auf,,,
927,47,genügen,"to suffice, to satisfy","suffire, satisfaire",,,genügte,,,
928,47,ablaufen,"to expire, to run out, to discharge","expirer, s'épuiser, se décharger",,,lief ab,,,
929,47,anführen,"to cite, to lead, to quote","citer, diriger",,,führte an,,,
930,47,ausdrucken,"to print, to print out, to print off",imprimer,,,druckte aus,,,
931,47,eintragen,"to register, to enter, to record, to enrol","inscrire, entrer, enregistrer, inscrire",,,trug ein,,,
932,47,erarbeiten,"to develop, to elaborate, to work out, to acquire","développer, élaborer, acquérir",,,erarbeitete,,,
933,47,notieren,"to note, to quote","à noter, à citer",,,notierte,,,
934,47,streiken,"to strike, to be on strike","faire grève, être en grève",,,streikte,,,
935,47,verschreiben,"to prescribe, to commit oneself to, to misspell by accident","prescrire, s'engager à, faire une faute d'orthographe par accident",,,verschrieb,,,
936,47,vertreiben,"to expel, to dislodge, to displace","expulser, déloger, déplacer",,,vertrieb,,,
937,47,auspacken,"to unpack, to unwrap, to blow the whistle on","déballer, dénoncer",,,packte aus,,,
938,48,existieren,to exist,exister,,,existierte,,,
939,48,bedrohen,"to threaten, to menace",menacer,,,bedrohte,,,
940,48,ausüben,"to exercise, to perform, to practice","exercer, exécuter, pratiquer",,,übte aus,,,
941,48,verstärken,"to amplify, to intensify, to strengthen","amplifier, intensifier, renforcer",,,verstärkte,,,
942,48,überschreiten,"to exceed, to overstep, to surpass","dépasser, outrepasser, surpasser",,,überschritt,,,
943,48,übergeben,"to hand over, to vomit (refl.)","remettre, vomir (réfl.)",,,übergab,,,
944,48,stützen,"to support, to back, to hold something up, to bolster","soutenir, appuyer, soutenir quelque chose, étayer",,,stützte,,,
945,48,abrufen,"to retrieve, to access, to call away","récupérer, accéder, appeler",,,rief ab,,,
946,48,bedenken,"to consider, to reflect, to give, to allow for","considérer, réfléchir, donner, permettre",,,bedachte,,,
947,48,befassen,"to address, to deal with, to attend to","s'adresser à, traiter, s'occuper de",,,befasste,,,
948,48,beschleunigen,"to accelerate, to speed up",accélérer,,,beschleunigte,,,
949,48,einschließen,"to include, to enclose, to lock up, to surround","inclure, enfermer, entourer",,,schloss ein,,,
950,48,fügen,"to acquiesce, to comply, to fit together","acquiescer, se conformer, s'adapter",,,fügte,,,
951,48,beruhen,"to base on, to depend on","se baser sur, dépendre de",,,beruhte,,,
952,48,gewähren,"to grant, to afford, to allow, to accord","accorder, permettre",,,gewährte,,,
953,48,qualifizieren,"to qualify, to qualify for","se qualifier, se qualifier pour",,,qualifizierte,,,
954,48,umgeben,"to surround, to enclose, to encompass","entourer, enfermer, englober",,,umgab,,,
955,48,verringern,"to decrease, to diminish, to ease, to lower","diminuer, soulager, abaisser",,,verringerte,,,
956,48,kontaktieren,to contact,contacter,,,kontaktierte,,,
957,48,dringen,to penetrate,pénétrer,,,drang,,,
958,49,vorwerfen,"to reproach, to accuse of, to allege","reprocher, accuser de, alléguer",,,warf vor,,,
959,49,verwirklichen,"to realize, to actualize, to fulfill, to implement","réaliser, concrétiser, accomplir, mettre en œuvre",,,verwirklichte,,,
960,49,formen,"to form, to shape, to model, to mold, to fashion","former, modeler, façonner",,,formte,,,
961,49,aufstellen,"to set up, to establish","mettre en place, établir",,,stellte auf,,,
962,49,ausschließen,"to exclude, to eliminate","exclure, éliminer",,,schloss aus,,,
963,49,durchsetzen,"to enforce, to assert","faire respecter, affirmer",,,setzte durch,,,
964,49,weiterleiten,"to forward, to pass on","transmettre, faire passer",,,leitete weiter,,,
965,49,wiederherstellen,"to restore, to recover, to rehabilitate","restaurer, récupérer, réhabiliter",,,stellte wieder her,,,
966,49,hingehen,"to go (there), (of time) to pass","aller (là-bas), passer (le temps)",,,ging hin,,,
967,49,zurückkehren,to return,revenir,,,kehrte zurück,,,
968,49,impfen,"to vaccinate, to immunize, to inject","vacciner, immuniser, injecter",,,impfte,,,
969,49,betrügen,"to cheat, to swindle, to defraud","tricher, escroquer, frauder",,,betrog,,,
970,49,heizen,"to heat, to warm, to fuel","chauffer, se chauffer",,,heizte,,,
971,49,siegen,"to win, to prevail, to triumph","gagner, triompher, prévaloir",,,siegte,,,
972,49,vereinigen,"to coalesce, to unify, to merge","unir, réunir, unifier, combiner",,,vereinigte,,,
973,49,verwechseln,"to mix up, to confuse, to mistake for",confondre,,,verwechselte,,,
974,49,zittern,"to shiver, to tremble, to fear","trembler, frissonner, grelotter",,,zitterte,,,
975,49,hochladen,to upload,"uploader, télécharger",,,lud hoch,,,
976,49,züchten,"to breed, to grow","se reproduire, grandir",,,züchtete,,,
977,49,wehren,"to defend, to resist","défendre, résister",,,wehrte,,,
978,50,beleidigen,"to offend someone, to insult someone","offenser quelqu'un, insulter quelqu'un",,,beleidigte,,,
979,50,verklagen,"to sue, to bring a suit against, to bring an action against","poursuivre en justice, intenter un procès",,,verklagte,,,
980,50,isolieren,"to isolate, to insulate",isoler,,,isolierte,,,
981,50,locken,"to entice, to lure, to rock, to tempt","attirer, allécher",,,lockte,,,
982,50,ruhen,"to rest, to be at rest, to repose",reposer,,,ruhte,,,
983,50,schleifen,"to drag, to drill, to pull","poncer, affûter, aiguiser, tailler",,,schleifte,,,
984,50,strahlen,"to radiate, to beam","rayonner, briller, illuminer",,,strahlte,,,
985,50,streben,"to strive, to tend to, to aspire","aspirer, s'efforcer, viser",,,strebte,,,
986,50,strecken,"to stretch, to dilute, to extend","étirer, allonger",,,streckte,,,
987,50,versagen,"to fail, to refuse, to deny","échouer, refuser, nier",,,versagte,,,
988,50,faulenzen,"to chill, to laze around","se détendre, paresser",,,faulenzte,,,
989,50,umtauschen,"to convert, to exchange (currency)","convertir, échanger (monnaie)",,,tauschte um,,,
990,50,anprobieren,"to try on, to fit, to fit on","essayer, ajuster, s'adapter à",,,probierte an,,,
991,50,duschen,"to shower, to have a shower, to take a shower","se doucher, prendre une douche",,,duschte,,,
992,50,husten,"to cough, to have a cough","tousser, toussoter",,,hustete,,,
993,50,zelten,"to camp, to camp out, to tent",camper,,,zeltete,,,
994,50,genesen,"to recover, to convalesce, to get well",se rétablir,,,genas,,,
995,50,aufsteigen,"to rise, to ascend, to advance, to climb","s'élever, monter, avancer, grimper",,,stieg auf,,,
996,50,umsteigen,"to change, to transfer, to switch","changer, transférer, commuter",,,stieg um,,,
997,50,zubereiten,"to prepare (food), to cook","préparer (de la nourriture), cuisiner",,,bereitete zu,,,
998,51,hervorheben,"to emphasize, to highlight, to stress","souligner, mettre en valeur, insister",,,hob hervor,,,
999,51,abbauen,"to dismantle, to reduce, to break down","démanteler, réduire, décomposer",,,baute ab,,,
1000,51,basteln,"to craft, to tinker","bricoler, fabriquer",,,bastelte,,,
1001,51,entziehen,"to withdraw, to remove, to deprive","retirer, enlever, priver",,,entzog,,,
1002,51,zugeben,"to admit, to confess, to add","admettre, confesser, ajouter",,,gab zu,,,
1003,51,besorgen,"to get, to obtain, to take care of","obtenir, prendre soin de",,,besorgte,,,
1004,51,auswerten,"to evaluate, to analyze, to assess","évaluer, analyser, estimer",,,wertete aus,,,
1005,51,anwenden,"to apply, to make use of","appliquer, faire usage de",,,wendete an,,,
1006,51,bevorzugen,"to prefer, to favor","préférer, favoriser",,,bevorzugte,,,
1007,51,überweisen,"to transfer (money), to refer (a patient)","transférer (de l'argent), référer (un patient)",,,überwies,,,
1008,51,vertiefen,"to deepen, to intensify","approfondir, intensifier",,,vertiefte,,,
1009,51,bemerken,"to notice, to observe, to remark","remarquer, observer",,,bemerkte,,,
1010,51,beschädigen,"to damage, to harm","endommager, nuire",,,beschädigte,,,
1011,51,zusammenstellen,"to compile, to assemble","compiler, assembler",,,stellte zusammen,,,
1012,51,verwandeln,"to transform, to convert, to turn into, to metamorphose","transformer, convertir, se métamorphoser",,,verwandelte,,,
1013,51,absolvieren,"to complete, to graduate, to finish","compléter, obtenir un diplôme, finir",,,absolvierte,,,
1014,51,verbrauchen,"to consume, to use","consommer, utiliser",,,verbrauchte,,,
1015,51,zusehen,"to watch, to see, to make sure (that something happens)","regarder, voir, s'assurer (que quelque chose se passe)",,,sah zu,,,
1016,51,auffordern,"to request, to invite, to ask","demander, inviter",,,forderte auf,,,
1017,51,berechtigen,"to authorize, to entitle to, to empower","autoriser, donner droit à, habiliter",,,berechtigte,,,
1018,52,befürchten,"to fear, to apprehend, to be afraid","craindre, appréhender, avoir peur",,,befürchtete,,,
1019,52,aufheben,"to abolish, to lift, to pick up, to keep","abolir, lever, ramasser, garder",,,hob auf,,,
1020,52,bewahren,"to keep, to preserve (to maintain the condition of)","garder, préserver (maintenir l'état de)",,,bewahrte,,,
1021,52,berühren,to touch,toucher,,,berührte,,,
1022,52,anstellen,"to queue (refl.), to employ someone, to hire, to get into mischief","faire la queue (réfl.), employer quelqu'un, faire des bêtises",,,stellte an,,,
1023,52,auftauchen,"to arise, to surface, to turn up","surgir, faire surface, apparaître",,,tauchte auf,,,
1024,52,aussuchen,"to select, to choose, to pick","sélectionner, choisir, cueillir",,,suchte aus,,,
1025,52,festhalten,"to hold, to retain something, to record something, to detain","détenir, conserver quelque chose, enregistrer quelque chose, détenir",,,hielt fest,,,
1026,52,beherrschen,"to dominate, to master, to control, to rule","dominer, maîtriser, contrôler, régner",,,beherrschte,,,
1027,52,weitermachen,"go on, keep going, continue to do something","continuer, continuer à faire quelque chose",,,machte weiter,,,
1028,52,ableiten,"to derive, to deduce","dériver, déduire",,,leitete ab,,,
1029,52,auflösen,"to dissolve, to resolve, to annul, to liquidate","dissoudre, résoudre, annuler, liquider",,,löste auf,,,
1030,52,beklagen,"to complain, to lament, to air grievances","se plaindre, se lamenter, exprimer des griefs",,,beklagte,,,
1031,52,drängen,"to urge, to push, to cajole, to shove","exhorter, pousser, cajoler, bousculer",,,drängte,,,
1032,52,auslösen,"to ransom, to trigger, to initiate, to set up","rançonner, déclencher, initier, mettre en place",,,löste aus,,,
1033,52,einschränken,"to limit, to restrict, to stint, to circumscribe","limiter, restreindre, circonscrire",,,schränkte ein,,,
1034,52,eintreten,"to enter, to join, to occur","entrer, se joindre, se produire",,,trat ein,,,
1035,52,belasten,"to burden, to charge, to strain","charger, accabler, mettre à rude épreuve",,,belastete,,,
1036,52,interpretieren,"to interpret, to take as","interpréter, prendre comme",,,interpretierte,,,
1037,52,kombinieren,to combine,combiner,,,kombinierte,,,
1038,53,nähern,"to approach, to get closer, to advance","s'approcher, se rapprocher, avancer",,,näherte,,,
1039,53,orientieren,to orient,orienter,,,orientierte,,,
1040,53,rechtfertigen,"to justify, to warrant, to back up, to exculpate","justifier, garantir, appuyer, disculper",,,rechtfertigte,,,
1041,53,transportieren,"to transport, to transfer","transporter, transférer",,,transportierte,,,
1042,53,wahrnehmen,"to perceive, to notice, to observe, to sense","percevoir, remarquer, observer, pressentir",,,nahm wahr,,,
1043,53,benennen,"to name, to designate, to appoint","nommer, désigner",,,benannte,,,
1044,53,verpacken,"to pack, to wrap, to package","emballer, envelopper, conditionner",,,verpackte,,,
1045,53,versichern,"to assure, to insure, to cover","assurer, couvrir",,,versicherte,,,
1046,53,meistern,"to master, to overcome, to cope with","maîtriser, surmonter, faire face à",,,meisterte,,,
1047,53,drohen,to threaten,menacer,,,drohte,,,
1048,53,vereinfachen,"to simplify, to demystify, to deskill, to dumb down","simplifier, démystifier, déqualifier, abêtir",,,vereinfachte,,,
1049,53,spezialisieren,"to specialize, to specialise, to differentiate, to focus","se spécialiser, se différencier, se concentrer",,,spezialisierte,,,
1050,53,umbringen,"to kill, to murder, to be very angry at someone","tuer, assassiner, être très en colère contre quelqu'un",,,brachte um,,,
1051,53,beeinträchtigen,"to affect, to impair, to alloy, to compromise","affecter, altérer, allier, compromettre",,,beeinträchtigte,,,
1052,53,beinhalten,"to include, to contain, to entail, to comprise","inclure, contenir, impliquer, comprendre",,,beinhaltete,,,
1053,53,bereitstellen,"to make available, to provide, to supply","mettre à disposition, fournir, approvisionner",,,stellte bereit,,,
1054,53,gestatten,"to allow, to permit, to license","autoriser, permettre, concéder une licence",,,gestattete,,,
1055,53,scheren,"to shear, to care, to clip, to cut","tondre, entretenir, tailler, couper",,,scherte,,,
1056,53,sicherstellen,"to seize, to assure, to confiscate, to guarantee","saisir, assurer, confisquer, garantir",,,stellte sicher,,,
1057,53,erläutern,"to explain, to clarify","expliquer, clarifier",,,erläuterte,,,
1058,54,verweisen,"to refer, to direct","se référer, diriger",,,verwies,,,
1059,54,vorsehen,"to plan, to provide for","planifier, prévoir",,,sah vor,,,
1060,54,sieben,"to sieve, to filter","tamiser, filtrer",,,siebte,,,
1061,54,nachfragen,"to ask, to inquire, to demand","demander, s'enquérir, exiger",,,fragte nach,,,
1062,54,ausdrücken,"to express, to articulate, to convey, to embody","exprimer, articuler, transmettre, incarner",,,drückte aus,,,
1063,54,anfallen,"to accrue, to accumulate, to arise, to incur","s'accumuler, survenir, encourir",,,fiel an,,,
1064,54,einhalten,"to observe, to adhere, to comply","observer, adhérer, se conformer",,,hielt ein,,,
1065,54,ereignen,"to happen, to occur, to bechance","se produire, avoir lieu, être fortuit",,,ereignete,,,
1066,54,publizieren,"to publish, to publicize, to announce","publier, faire connaître, annoncer",,,publizierte,,,
1067,54,regieren,"to govern, to reign, to rule, to command","gouverner, régner, diriger, commander",,,regierte,,,
1068,54,synchronisieren,"to synchronize, to dub, to sync","synchroniser, doubler",,,synchronisierte,,,
1069,54,hinzufügen,to add,ajouter,,,fügte hinzu,,,
1070,54,entkommen,to escape,s'échapper,,,entkam,,,
1071,54,rächen,to take revenge (refl.),se venger (réfl.),,,rächte,,,
1072,54,schleichen,"to sneak, to creep","se faufiler, ramper",,,schlich,,,
1073,54,blitzen,to flash,"clignoter, étinceler, flasher, scintiller",,,blitzte,,,
1074,54,herausfordern,"to challenge, to provoke, to banter to","défier, affronter",,,forderte heraus,,,
1075,54,pfeifen,"to whistle, to ignore, to referee, to arbitrate","siffler, siffloter",,,pfiff,,,
1076,54,plagen,"to bother, to annoy, to plague, to rack","tourmenter, affliger",,,plagte,,,
1077,54,reizen,"to stimulate, to irritate, to tease","irriter, émouvoir, exciter",,,reizte,,,
1078,55,toben,"to fume, to rage, to rampage, to romp","se défouler, se déchaîner, fulminer",,,tobte,,,
1079,55,zaubern,"to perform magic, to conjure, to magic","conjurer, ensorceler, conjurer, évoquer",,,zauberte,,,
1080,55,grenzen,"to abut, to approach, to border, to limit",limiter,,,grenzte,,,
1081,55,konfigurieren,"to configure, to set up",configurer,,,konfigurierte,,,
1082,55,tagen,"to meet, to convene, to be in session","se réunir, tenir une réunion",,,tagte,,,
1083,55,verfahren,"to proceed, to act, to deal",procéder,,,verfuhr,,,
1084,55,auskommen,"to get along, to get on, to manage",s'entendre,,,kam aus,,,
1085,55,verkehren,"to circulate, to interact, to turn, to twist",circuler,,,verkehrte,,,
1086,55,hauen,"to slash, to cut, to hit (coll.)","trancher, couper, frapper (coll.)",,,haute,,,
1087,55,falten,"to fold, to bend, to crease","plier, froisser, se plisser",,,faltete,,,
1088,55,weichen,to soften,adoucir,,,wich,,,
1089,55,opfern,to sacrifice,sacrifier,,,opferte,,,
1090,55,ehren,"to honor, to respect, to esteem",honorer,,,ehrte,,,
1091,55,erwägen,"to consider, to contemplate, to ponder","envisager, considérer",,,erwog,,,
1092,55,räumen,"to clear, to remove, to vacate","déblayer, débrancher, dégager",,,räumte,,,
1093,55,spritzen,"to inject, to spray, to splash","injecter, pulvériser, gicler, éclabousser",,,spritzte,,,
1094,55,stopfen,"to stuff, to darn, to jam","bourrer, combler",,,stopfte,,,
1095,55,wachen,"to wakem, to guard, to be awake","veiller, réveiller, surveiller",,,wachte,,,
1096,55,weggehen,"to go away, to leave","s'en aller, quitter",,,ging weg,,,
1097,55,bügeln,to iron,repasser (des vêtements),,,bügelte,,,
1098,56,schwellen,"to swell, to expand, to rise","gonfler, enfler",,,schwoll,,,
1099,56,amüsieren,"to amuse, to entertain, to enjoy oneself","amuser, divertir, se faire plaisir",,,amüsierte,,,
1100,56,lauten,"to read, to sound, to go (as in “it goes like…”)","lire, sonner",,,lautete,,,
1101,56,anfassen,"to touch, to handle","toucher, manipuler",,,fasste an,,,
1102,56,vorgeben,"to claim, to pretend, to set (a pace)","revendiquer, prétendre, donner (un rythme)",,,gab vor,,,
1103,56,erkunden,"to explore, to investigate","explorer, enquêter",,,erkundete,,,
1104,56,beauftragen,"to assign, to commission, to instruct","assigner, commissionner, instruire",,,beauftragte,,,
1105,56,beeindrucken,to impress,impressionner,,,beeindruckte,,,
1106,56,wundern,"to surprise, to amaze","surprendre, étonner",,,wunderte,,,
1107,56,überqueren,to cross,traverser,,,überquerte,,,
1108,56,verfassen,"to write, to compose, to draft","écrire, composer, rédiger",,,verfasste,,,
1109,56,einschlafen,to fall asleep,s'endormir,,,schlief ein,,,
1110,56,bereiten,"to prepare, to cause","préparer, provoquer",,,bereitete,,,
1111,56,veranstalten,"to organize, to arrange, to host","organiser, arranger, héberger",,,veranstaltete,,,
1112,56,abziehen,"to remove, to deduct, to withdraw","supprimer, déduire, retirer",,,zog ab,,,
1113,56,lenken,"to steer, to direct, to guide","diriger, orienter, guider",,,lenkte,,,
1114,56,tauchen,"to dive, to dip","plonger, tremper",,,tauchte,,,
1115,56,ablenken,"to distract, to divert, to steer away","distraire, détourner, éloigner",,,lenkte ab,,,
1116,56,anschauen,"to look at, to behold, to take a look at, to watch (Bayern and Austria)","regarder, contempler, jeter un coup d'œil à, observer (Bayern et Autriche)",,,schaute an,,,
1117,56,begehen,"to commit, perpetrate (a crime, an offence)","commettre, perpétrer (un crime, un délit)",,,beging,,,
1118,57,ertragen,"to bear, to stand","supporter, se tenir debout",,,ertrug,,,
1119,57,verhaften,"to detain, to take into custody","détenir, mettre en détention",,,verhaftete,,,
1120,57,aufbrechen,"to leave, to set off, to start, to break, to burst","partir, se mettre en route, démarrer, rompre, éclater",,,brach auf,,,
1121,57,umdrehen,to turn around,faire demi-tour,,,drehte um,,,
1122,57,begeistern,"to enthuse, to be enthusiastic (refl.)","enthousiasmer, être enthousiaste (réfl.)",,,begeisterte,,,
1123,57,anregen,"to encourage, to stimulate, to excite, to inspire","encourager, stimuler, exciter, inspirer",,,regte an,,,
1124,57,abschneiden,"to cut off, to amputate, to block","couper, amputer, bloquer",,,schnitt ab,,,
1125,57,einfallen,"to collapse, to come to mind","s'effondrer, venir à l'esprit",,,fiel ein,,,
1126,57,abweichen,"to depart (from), to soak off","partir (de), s'imprégner",,,wich ab,,,
1127,57,abbilden,"to depict, to map, to illustrate","représenter, cartographier, illustrer",,,bildete ab,,,
1128,57,aufladen,"to charge, to load, to burden, to impose","charger, accabler, imposer",,,lud auf,,,
1129,57,verdanken,"to owe, to be indebted, to owe to","devoir (quelque chose à quelqu'un), être redevable",,,verdankte,,,
1130,57,erregen,"to arouse, to stimulate, to agitate","éveiller, stimuler, agiter",,,erregte,,,
1131,57,schütteln,"to agitate, to shake, to jolt","agiter, secouer",,,schüttelte,,,
1132,57,verkünden,"to announce, to proclaim, to declare","annoncer, proclamer, déclarer",,,verkündete,,,
1133,57,erleiden,"to endure, to suffer, to experience, to experience pain","endurer, souffrir, éprouver, ressentir de la douleur",,,erlitt,,,
1134,57,zurückhalten,"to restrain, to hold back, to withhold","restreindre, retenir",,,hielt zurück,,,
1135,57,verdoppeln,"to double, to duplicate, to reduplicate, to geminate","doubler, dupliquer, redoubler, géminer",,,verdoppelte,,,
1136,57,besetzen,"to occupy, to border, to cast","occuper, border, jeter",,,besetzte,,,
1137,57,herrschen,"to rule, to prevail, to control","gouverner, prévaloir, contrôler",,,herrschte,,,
1138,58,erweisen,"to prove (passively), to turn out to be, to show","prouver (passivement), s'avérer être, montrer",,,erwies,,,
1139,58,tauschen,"to swap, to trade, to exchange","échanger, troquer, échanger",,,tauschte,,,
1140,58,übertreiben,"to exaggerate, to overdo","exagérer, exagérer",,,übertrieb,,,
