Nr,exercise,question,answer,combination,german,english,french,gender_english,gender_french,explanation_english,explanation_french,verb,level verb,level chatgpt,case_preposition,bedeutung
345,16,"Es ist wichtig, offene Gespräche in der Familie zu _____.",führen,ein Gespräch führen,"Es ist wichtig, offene Gespräche in der Familie zu führen.",It’s important to have open conversations within the family.,Il est important d’avoir des conversations ouvertes dans la famille.,,,"ein Gespräch führen = to have a conversation, to talk, to discuss","ein Gespräch führen = parler, discuter, avoir une conversation",,,,,
346,16,Sie _____ ein ernstes Gespräch mit ihrem Chef.,führte,ein Gespräch führen,Sie führte ein ernstes Gespräch mit ihrem Chef.,She had a serious conversation with her boss.,Elle a eu une conversation sérieuse avec son patron.,,,"ein Gespräch führen = to have a conversation, to talk, to discuss","ein Gespräch führen = parler, discuter, avoir une conversation",,,,,
347,16,Sie hat endlich eine Entscheidung _____ und ist umgezogen.,getroffen,eine Entscheidung treffen,Sie hat endlich eine Entscheidung getroffen und ist umgezogen.,She finally made a decision and moved away.,Elle a enfin pris une décision et a déménagé.,,,"eine Entscheidung treffen = to decide, to make a decision","eine Entscheidung treffen = décider, prendre une décision",,,,,
348,16,Wir müssen bald eine gemeinsame Entscheidung _____.,treffen,eine Entscheidung treffen,Wir müssen bald eine gemeinsame Entscheidung treffen.,We need to make a joint decision soon.,Nous devons bientôt prendre une décision commune.,,,"eine Entscheidung treffen = to decide, to make a decision","eine Entscheidung treffen = décider, prendre une décision",,,,,
349,16,"Als er den Unfall bemerkte, _____ er sofort um Hilfe.",rief,um Hilfe rufen,"Als er den Unfall bemerkte, rief er sofort um Hilfe.","When he noticed the accident, he immediately called for help.","Lorsqu’il a remarqué l’accident, il a immédiatement appelé à l’aide.",,,um Hilfe rufen = to cry for help,um Hilfe rufen = appeler à l'aide,,,,,
350,16,"Da niemand ans Telefon ging, blieb ihm nichts anderes übrig, als um Hilfe zu _____.",rufen,um Hilfe rufen,"Da niemand ans Telefon ging, blieb ihm nichts anderes übrig, als um Hilfe zu rufen.","Since nobody answered the phone, he had no choice but to call for help.","Comme personne ne répondait au téléphone, il ne lui restait plus qu’à appeler à l’aide.",,,um Hilfe rufen = to cry for help,um Hilfe rufen = appeler à l'aide,,,,,
351,16,"Man sollte mehr Verständnis für Menschen _____, die unter großem Druck stehen.",haben,Verständnis haben,"Man sollte mehr Verständnis für Menschen haben, die unter großem Druck stehen.",One should have more understanding for people who are under great pressure.,On devrait avoir plus de compréhension pour les personnes qui sont sous une forte pression.,,,Verständnis haben = be understanding,Verständnis haben = faire preuve de compréhension,,,,,
352,16,"Die Kundin _____ Verständnis dafür, dass es aufgrund technischer Probleme zu Verzögerungen kam.",hatte,Verständnis haben,"Die Kundin hatte Verständnis dafür, dass es aufgrund technischer Probleme zu Verzögerungen kam.",The customer understood that technical problems had caused delays.,La cliente a compris que des problèmes techniques avaient entraîné des retards.,,,Verständnis haben = be understanding,Verständnis haben = faire preuve de compréhension,,,,,
353,16,"Viele Studierende sind nervös, wenn sie zum ersten Mal eine mündliche Prüfung _____ müssen.",ablegen,eine Prüfung ablegen,"Viele Studierende sind nervös, wenn sie zum ersten Mal eine mündliche Prüfung ablegen müssen.",Many students are nervous when they have to take an oral exam for the first time.,Beaucoup d’étudiants sont nerveux quand ils doivent passer un examen oral pour la première fois.,,,eine Prüfung ablegen = to take an exam,eine Prüfung ablegen = passer un examen,,,,,
354,16,Er hat mehrere Prüfungen an einem Tag _____ und war danach völlig erschöpft.,abgelegt,eine Prüfung ablegen,Er hat mehrere Prüfungen an einem Tag abgelegt und war danach völlig erschöpft.,He took several exams in one day and was completely exhausted afterward.,Il a passé plusieurs examens en une seule journée et était complètement épuisé après.,,,eine Prüfung ablegen = to take an exam,eine Prüfung ablegen = passer un examen,,,,,
355,16,Bei der Abschlussfeier hat der beste Student eine inspirierende Rede _____.,gehalten,eine Rede halten,Bei der Abschlussfeier hat der beste Student eine inspirierende Rede gehalten.,"At the graduation ceremony, the top student delivered an inspiring speech.","Lors de la cérémonie de fin d’études, le meilleur étudiant a tenu un discours inspirant.",,,eine Rede halten = to give a speech,"eine Rede halten = faire un discours, prononcer un discours",,,,,
356,16,"Wenn man eine gute Rede _____ will, sollte man sie vorher gründlich vorbereiten.",halten,eine Rede halten,"Wenn man eine gute Rede halten will, sollte man sie vorher gründlich vorbereiten.","If you want to give a good speech, you should prepare it thoroughly beforehand.","Si on veut prononcer un bon discours, il faut bien le préparer à l’avance.",,,eine Rede halten = to give a speech,"eine Rede halten = faire un discours, prononcer un discours",,,,,
357,16,"Der Ausschuss _____ das Angebot einstimmig ab, nachdem mehrere Unstimmigkeiten in den Unterlagen entdeckt worden waren.",lehnte,ein Angebot ablehnen,"Der Ausschuss lehnte das Angebot einstimmig ab, nachdem mehrere Unstimmigkeiten in den Unterlagen entdeckt worden waren.",The committee unanimously rejected the offer after several inconsistencies in the documents were discovered.,Le comité a refusé l’offre à l’unanimité après avoir découvert plusieurs incohérences dans les documents.,,,ein Angebot ablehnen = to decline an offer,ein Angebot ablehnen = refuser une offre,,,,,
358,16,"Aus strategischen Gründen _____ der Vorstand das Angebot ab, obwohl es finanziell sehr attraktiv wirkte.",lehnte,ein Angebot ablehnen,"Aus strategischen Gründen lehnte der Vorstand das Angebot ab, obwohl es finanziell sehr attraktiv wirkte.","For strategic reasons, the board rejected the offer even though it appeared very attractive financially.","Pour des raisons stratégiques, le conseil d’administration a refusé l’offre, même si elle semblait très intéressante financièrement.",,,ein Angebot ablehnen = to decline an offer,ein Angebot ablehnen = refuser une offre,,,,,
359,16,"Der Ausschuss _____ das überarbeitete Angebot an, nachdem alle offenen Fragen geklärt worden waren.",nahm,ein Angebot annehmen,"Der Ausschuss nahm das überarbeitete Angebot an, nachdem alle offenen Fragen geklärt worden waren.",The committee accepted the revised offer after all outstanding questions had been resolved.,Le comité a accepté l’offre révisée après que toutes les questions en suspens eurent été clarifiées.,,,ein Angebot annehmen = to accept an offer,ein Angebot annehmen = accepter une offre,,,,,
360,16,"Aus Zeitdruck _____ der Kunde schließlich das erste Angebot an, obwohl weitere Vergleiche sinnvoll gewesen wären.",nahm,ein Angebot annehmen,"Aus Zeitdruck nahm der Kunde schließlich das erste Angebot an, obwohl weitere Vergleiche sinnvoll gewesen wären.","Under time pressure, the customer ultimately accepted the first offer, even though further comparisons would have been sensible.","Sous la pression du temps, le client a finalement accepté la première offre, même si d’autres comparaisons auraient été judicieuses.",,,ein Angebot annehmen = to accept an offer,ein Angebot annehmen = accepter une offre,,,,,
361,17,_____ bauen,einen Unfall,einen Unfall bauen,einen Unfall bauen,"to crash, to cause an accident",provoquer un accident. créer un accident,Masculine,Masculin,"einen Unfall bauen = to crash, to cause an accident",einen Unfall bauen = provoquer un accident. créer un accident,,,B2,,
362,17,_____ kommen,zu einem Ergebnis,zu einem Ergebnis kommen,zu einem Ergebnis kommen,"to reach a conclusion, to arrive at a finding, to be an outcome","parvenir à un résultat, arriver à un résultat",Neuter,Neutre,"zu einem Ergebnis kommen = to reach a conclusion, to arrive at a finding, to be an outcome","zu einem Ergebnis kommen = parvenir à un résultat, arriver à un résultat",,,B2,,
363,17,_____ bringen,in Erfahrung,in Erfahrung bringen,in Erfahrung bringen,"to find out, to learn, to come to know","apprendre, se renseigner",Feminine,Féminin,"in Erfahrung bringen = to find out, to learn, to come to know","in Erfahrung bringen = apprendre, se renseigner",,,C1,,
364,17,_____ gehen,in Erfüllung,in Erfüllung gehen,in Erfüllung gehen,"to come true, to fulfill",se réaliser,Feminine,Féminin,"in Erfüllung gehen = to come true, to fulfill",in Erfüllung gehen = se réaliser,,,B2C1,,
365,17,_____ fassen,einen Entschluss,einen Entschluss fassen,einen Entschluss fassen,to decide,prendre une décision,Masculine,Masculin,einen Entschluss fassen = to decide,einen Entschluss fassen = prendre une décision,,,C1,,
366,17,_____ kommen,zum Abschluss,zum Abschluss kommen,zum Abschluss kommen,to come to a conclusion,arriver à une conclusion,Masculine,Masculin,zum Abschluss kommen = to come to a conclusion,zum Abschluss kommen = arriver à une conclusion,,,B2C1,,abschließen
367,17,_____ ergreifen,einen Beruf,einen Beruf ergreifen,einen Beruf ergreifen,"to choose a profession, to take up a profession","choisir une profession, exercer une profession",Masculine,Masculin,"einen Beruf ergreifen = to choose a profession, to take up a profession","einen Beruf ergreifen = choisir une profession, exercer une profession",,,B2C1,,
368,17,_____ führen,Beweis,Beweis führen,Beweis führen,to provide evidence,"apporter une preuve, apporter des évidences",Masculine,Masculin,Beweis führen = to provide evidence,"Beweis führen = apporter une preuve, apporter des évidences",,,C1,,
369,17,_____ stellen,in Aussicht,in Aussicht stellen,in Aussicht stellen,"to promise, to have in prospect",promettre,Feminine,Féminin,"in Aussicht stellen = to promise, to have in prospect",in Aussicht stellen = promettre,,,C1,,
370,17,_____ ziehen,in Betracht,in Betracht ziehen,in Betracht ziehen,"to consider, to take into account, to take into consideration","prendre en considération, envisager",Masculine,Masculin,"in Betracht ziehen = to consider, to take into account, to take into consideration","in Betracht ziehen = prendre en considération, envisager",,,C1,,
371,17,_____ nehmen,Rücksicht,Rücksicht nehmen,Rücksicht nehmen,"to be considerate of, to take something into account",faire preuve de considération,Feminine,Féminin,"Rücksicht nehmen = to be considerate of, to take something into account",Rücksicht nehmen = faire preuve de considération,,,B2C1,auf,
372,17,_____ nehmen,in Anspruch,in Anspruch nehmen,in Anspruch nehmen,"to use, to make use of",utiliser,Masculine,Masculin,"in Anspruch nehmen = to use, to make use of",in Anspruch nehmen = utiliser,,,C1,,
373,17,_____ stellen,einen Antrag,einen Antrag stellen,einen Antrag stellen,to apply for,soumettre une candidature,Masculine,Masculin,einen Antrag stellen = to apply for,einen Antrag stellen = soumettre une candidature,,,B2,bei / auf,
374,17,_____ halten,ein Versprechen,ein Versprechen halten,ein Versprechen halten,keep a promise,tenir une promesse,Neuter,Neutre,ein Versprechen halten = keep a promise,ein Versprechen halten = tenir une promesse,halten,A1,B1B2,,versprechen
375,17,_____ bringen,in Ordnung,in Ordnung bringen,in Ordnung bringen,put things in order,mettre en ordre,Feminine,Féminin,in Ordnung bringen = put things in order,in Ordnung bringen = mettre en ordre,bringen,A1,B1B2,,
376,18,einen Unfall _____,bauen,einen Unfall bauen,einen Unfall bauen,"to crash, to cause an accident",provoquer un accident. créer un accident,,,"einen Unfall bauen = to crash, to cause an accident",einen Unfall bauen = provoquer un accident. créer un accident,,,,,
377,18,zu einem Ergebnis _____,kommen,zu einem Ergebnis kommen,zu einem Ergebnis kommen,"to reach a conclusion, to arrive at a finding, to be an outcome","parvenir à un résultat, arriver à un résultat",,,"zu einem Ergebnis kommen = to reach a conclusion, to arrive at a finding, to be an outcome","zu einem Ergebnis kommen = parvenir à un résultat, arriver à un résultat",,,,,
378,18,in Erfahrung _____,bringen,in Erfahrung bringen,in Erfahrung bringen,"to find out, to learn, to come to know","apprendre, se renseigner",,,"in Erfahrung bringen = to find out, to learn, to come to know","in Erfahrung bringen = apprendre, se renseigner",,,,,
379,18,in Erfüllung _____,gehen,in Erfüllung gehen,in Erfüllung gehen,"to come true, to fulfill",se réaliser,,,"in Erfüllung gehen = to come true, to fulfill",in Erfüllung gehen = se réaliser,,,,,
380,18,einen Entschluss _____,fassen,einen Entschluss fassen,einen Entschluss fassen,to decide,prendre une décision,,,einen Entschluss fassen = to decide,einen Entschluss fassen = prendre une décision,,,,,
381,18,zum Abschluss _____,kommen,zum Abschluss kommen,zum Abschluss kommen,to come to a conclusion,arriver à une conclusion,,,zum Abschluss kommen = to come to a conclusion,zum Abschluss kommen = arriver à une conclusion,,,,,
382,18,einen Beruf _____,ergreifen,einen Beruf ergreifen,einen Beruf ergreifen,"to choose a profession, to take up a profession","choisir une profession, exercer une profession",,,"einen Beruf ergreifen = to choose a profession, to take up a profession","einen Beruf ergreifen = choisir une profession, exercer une profession",,,,,
383,18,Beweis _____,führen,Beweis führen,Beweis führen,to provide evidence,"apporter une preuve, apporter des évidences",,,Beweis führen = to provide evidence,"Beweis führen = apporter une preuve, apporter des évidences",,,,,
384,18,in Aussicht _____,stellen,in Aussicht stellen,in Aussicht stellen,"to promise, to have in prospect",promettre,,,"in Aussicht stellen = to promise, to have in prospect",in Aussicht stellen = promettre,,,,,
385,18,in Betracht _____,ziehen,in Betracht ziehen,in Betracht ziehen,"to consider, to take into account, to take into consideration","prendre en considération, envisager",,,"in Betracht ziehen = to consider, to take into account, to take into consideration","in Betracht ziehen = prendre en considération, envisager",,,,,
386,18,Rücksicht _____,nehmen,Rücksicht nehmen,Rücksicht nehmen,"to be considerate of, to take something into account",faire preuve de considération,,,"Rücksicht nehmen = to be considerate of, to take something into account",Rücksicht nehmen = faire preuve de considération,,,,,
387,18,in Anspruch _____,nehmen,in Anspruch nehmen,in Anspruch nehmen,"to use, to make use of",utiliser,,,"in Anspruch nehmen = to use, to make use of",in Anspruch nehmen = utiliser,,,,,
388,18,einen Antrag _____,stellen,einen Antrag stellen,einen Antrag stellen,to apply for,soumettre une candidature,,,einen Antrag stellen = to apply for,einen Antrag stellen = soumettre une candidature,,,,bei / auf,
389,18,ein Versprechen _____,halten,ein Versprechen halten,ein Versprechen halten,keep a promise,tenir une promesse,,,ein Versprechen halten = keep a promise,ein Versprechen halten = tenir une promesse,halten,A1,B1B2,,versprechen
390,18,in Ordnung _____,bringen,in Ordnung bringen,in Ordnung bringen,put things in order,mettre en ordre,,,in Ordnung bringen = put things in order,in Ordnung bringen = mettre en ordre,bringen,A1,B1B2,,
391,19,"Er hat gestern mit seinem Motorrad einen _____ gebaut, ist aber zum Glück nicht verletzt worden.",Unfall,einen Unfall bauen,"Er hat gestern mit seinem Motorrad einen Unfall gebaut, ist aber zum Glück nicht verletzt worden.","He had an accident on his motorcycle yesterday, but luckily he wasn’t injured.","Il a eu un accident avec sa moto hier, mais heureusement il n’a pas été blessé.",,,"einen Unfall bauen = to crash, to cause an accident",einen Unfall bauen = provoquer un accident. créer un accident,,,,,
392,19,"Wenn man müde fährt, kann man schnell einen _____ bauen, ohne es zu merken.",Unfall,einen Unfall bauen,"Wenn man müde fährt, kann man schnell einen Unfall bauen, ohne es zu merken.","If you drive while tired, you can easily have an accident without realizing it.","Quand on conduit fatigué, on peut rapidement provoquer un accident sans s’en rendre compte.",,,"einen Unfall bauen = to crash, to cause an accident",einen Unfall bauen = provoquer un accident. créer un accident,,,,,
393,19,Nach langen Diskussionen ist das Team endlich _____ gekommen.,zu einem Ergebnis,zu einem Ergebnis kommen,Nach langen Diskussionen ist das Team endlich zu einem Ergebnis gekommen.,"After long discussions, the team finally reached a result.","Après de longues discussions, l’équipe est finalement arrivée à un résultat.",,,"zu einem Ergebnis kommen = to reach a conclusion, to arrive at a finding, to be an outcome","zu einem Ergebnis kommen = parvenir à un résultat, arriver à un résultat",,,,,
394,19,"Wir sind noch nicht _____ gekommen, weil wichtige Daten fehlen.",zu einem Ergebnis,zu einem Ergebnis kommen,"Wir sind noch nicht zu einem Ergebnis gekommen, weil wichtige Daten fehlen.",We have not yet reached a conclusion because important data is missing.,"Nous ne sommes pas encore arrivés à un résultat, car il manque des données importantes.",,,"zu einem Ergebnis kommen = to reach a conclusion, to arrive at a finding, to be an outcome","zu einem Ergebnis kommen = parvenir à un résultat, arriver à un résultat",,,,,
395,19,"Ich versuche gerade _____ zu bringen, wer für das neue Projekt verantwortlich ist.",in Erfahrung,in Erfahrung bringen,"Ich versuche gerade in Erfahrung zu bringen, wer für das neue Projekt verantwortlich ist.",I'm currently trying to find out who is responsible for the new project.,J’essaie en ce moment de découvrir qui est responsable du nouveau projet.,,,"in Erfahrung bringen = to find out, to learn, to come to know","in Erfahrung bringen = apprendre, se renseigner",,,,,
396,19,"Wir müssen _____ bringen, welche Anforderungen der Kunde wirklich hat.",in Erfahrung,in Erfahrung bringen,"Wir müssen in Erfahrung bringen, welche Anforderungen der Kunde wirklich hat.",We need to find out what the client’s real requirements are.,Nous devons découvrir quelles sont réellement les exigences du client.,,,"in Erfahrung bringen = to find out, to learn, to come to know","in Erfahrung bringen = apprendre, se renseigner",,,,,
397,19,"Für sie ging ein großer Wunsch _____, als sie ihr eigenes Café eröffnen konnte.",in Erfüllung,in Erfüllung gehen,"Für sie ging ein großer Wunsch in Erfüllung, als sie ihr eigenes Café eröffnen konnte.",A big wish came true for her when she was able to open her own café.,Un grand souhait s’est réalisé pour elle quand elle a pu ouvrir son propre café.,,,"in Erfüllung gehen = to come true, to fulfill",in Erfüllung gehen = se réaliser,,,,,
398,19,"Wenn all diese Bedingungen erfüllt sind, kann der Vertrag offiziell _____ gehen.",in Erfüllung,in Erfüllung gehen,"Wenn all diese Bedingungen erfüllt sind, kann der Vertrag offiziell in Erfüllung gehen.","If all these conditions are met, the contract can officially come into effect.","Si toutes ces conditions sont remplies, le contrat peut officiellement entrer en vigueur.",,,"in Erfüllung gehen = to come true, to fulfill",in Erfüllung gehen = se réaliser,,,,,
399,19,"Nach langen Diskussionen fasste das Team den _____, das Projekt zu verschieben.",Entschluss,einen Entschluss fassen,"Nach langen Diskussionen fasste das Team den Entschluss, das Projekt zu verschieben.","After long discussions, the team made the decision to postpone the project.","Après de longues discussions, l’équipe a pris la décision de reporter le projet.",,,einen Entschluss fassen = to decide,einen Entschluss fassen = prendre une décision,,,,,
400,19,"Sie hat den _____ gefasst, ein Jahr im Ausland zu arbeiten.",Entschluss,einen Entschluss fassen,"Sie hat den Entschluss gefasst, ein Jahr im Ausland zu arbeiten.",She made the decision to work abroad for a year.,Elle a pris la décision de travailler à l’étranger pendant un an.,,,einen Entschluss fassen = to decide,einen Entschluss fassen = prendre une décision,,,,,
401,19,Nach mehreren Monaten Arbeit ist das Projekt endlich _____ gekommen.,zum Abschluss,zum Abschluss kommen,Nach mehreren Monaten Arbeit ist das Projekt endlich zum Abschluss gekommen.,"After several months of work, the project has finally come to an end.","Après plusieurs mois de travail, le projet est enfin arrivé à son terme.",,,zum Abschluss kommen = to come to a conclusion,zum Abschluss kommen = arriver à une conclusion,,,,,
402,19,Die Verhandlungen kamen erst spät in der Nacht _____.,zum Abschluss,zum Abschluss kommen,Die Verhandlungen kamen erst spät in der Nacht zum Abschluss.,The negotiations only came to an end late at night.,Les négociations ne se sont terminées que tard dans la nuit.,,,zum Abschluss kommen = to come to a conclusion,zum Abschluss kommen = arriver à une conclusion,,,,,
403,19,"Viele junge Menschen wollen einen _____ ergreifen, der sowohl sicher als auch abwechslungsreich ist.",Beruf,einen Beruf ergreifen,"Viele junge Menschen wollen einen Beruf ergreifen, der sowohl sicher als auch abwechslungsreich ist.",Many young people want to pursue a profession that is both secure and varied.,Beaucoup de jeunes veulent exercer un métier qui soit à la fois sûr et varié.,,,"einen Beruf ergreifen = to choose a profession, to take up a profession","einen Beruf ergreifen = choisir une profession, exercer une profession",,,,,
404,19,"Sie hat schon früh entschieden, einen sozialen _____ zu ergreifen.",Beruf,einen Beruf ergreifen,"Sie hat schon früh entschieden, einen sozialen Beruf zu ergreifen.",She decided early on to pursue a social profession.,Elle a décidé très tôt d’exercer un métier dans le domaine social.,,,"einen Beruf ergreifen = to choose a profession, to take up a profession","einen Beruf ergreifen = choisir une profession, exercer une profession",,,,,
405,19,"Der Anwalt konnte keinen klaren _____ führen, dass sein Mandant unschuldig war.",Beweis,Beweis führen,"Der Anwalt konnte keinen klaren Beweis führen, dass sein Mandant unschuldig war.",The lawyer was unable to provide clear proof that his client was innocent.,L’avocat n’a pas pu apporter une preuve claire que son client était innocent.,,,Beweis führen = to provide evidence,"Beweis führen = apporter une preuve, apporter des évidences",,,,,
406,19,"Um seine These zu unterstützen, führte er mehrere wissenschaftliche _____.",Beweise,Beweis führen,"Um seine These zu unterstützen, führte er mehrere wissenschaftliche Beweise.","To support his thesis, he presented several scientific proofs.","Pour soutenir sa thèse, il a apporté plusieurs preuves scientifiques.",,,Beweis führen = to provide evidence,"Beweis führen = apporter une preuve, apporter des évidences",,,,,
407,19,"Die Firma hat den Mitarbeitern eine Bonuszahlung _____ gestellt, wenn die Ziele erreicht werden.",in Aussicht,in Aussicht stellen,"Die Firma hat den Mitarbeitern eine Bonuszahlung in Aussicht gestellt, wenn die Ziele erreicht werden.",The company has promised employees a bonus payment if the targets are met.,L’entreprise a promis une prime aux employés si les objectifs sont atteints.,,,"in Aussicht stellen = to promise, to have in prospect",in Aussicht stellen = promettre,,,,,
408,19,"Der Politiker stellte weitere Investitionen _____, um die Lage zu verbessern.",in Aussicht,in Aussicht stellen,"Der Politiker stellte weitere Investitionen in Aussicht, um die Lage zu verbessern.",The politician promised additional investments to improve the situation.,Le politicien a annoncé d’éventuels investissements pour améliorer la situation.,,,"in Aussicht stellen = to promise, to have in prospect",in Aussicht stellen = promettre,,,,,
409,19,"Wir sollten _____ ziehen, das Projekt zu verschieben, wenn die Ressourcen nicht ausreichen.",in Betracht,in Betracht ziehen,"Wir sollten in Betracht ziehen, das Projekt zu verschieben, wenn die Ressourcen nicht ausreichen.",We should consider postponing the project if the resources aren’t sufficient.,Nous devrions envisager de reporter le projet si les ressources ne suffisent pas.,,,"in Betracht ziehen = to consider, to take into account, to take into consideration","in Betracht ziehen = prendre en considération, envisager",,,,,
410,19,"Sie zieht _____, nächstes Jahr eine Weiterbildung zu machen.",in Betracht,in Betracht ziehen,"Sie zieht in Betracht, nächstes Jahr eine Weiterbildung zu machen.",She is considering doing further training next year.,Elle envisage de suivre une formation l’année prochaine.,,,"in Betracht ziehen = to consider, to take into account, to take into consideration","in Betracht ziehen = prendre en considération, envisager",,,,,
411,19,Man sollte im Alltag mehr _____ auf ältere Menschen nehmen.,Rücksicht,Rücksicht nehmen,Man sollte im Alltag mehr Rücksicht auf ältere Menschen nehmen.,People should be more considerate of elderly people in everyday life.,On devrait être plus attentif aux personnes âgées dans la vie quotidienne.,,,"Rücksicht nehmen = to be considerate of, to take something into account",Rücksicht nehmen = faire preuve de considération,,,,,
