Nr,exercise,level_verb,Nr_verb,answer,question,german,english,french,type,prefix,level_root,root_german,root_english,root_french,explanation_prefix_english,explanation_prefix_french,explanation_english_beta,explanation_french_beta
766,30,B2,608,ausschließen,,,"to exclude, to eliminate","exclure, éliminer",2. prefix,aus,A1,schließen,"to shut, to close, to lock, to conclude","fermer, clore, verrouiller, conclure",,,,
767,30,B2,615,anprobieren,,,"to try on, to fit, to fit on","essayer, ajuster, s'adapter à",2. prefix,an,B1,probieren,"to try, to taste, to sample, to probe","essayer, goûter, échantillonner, sonder","to add the meaning of <i>on</i>, of a contact → an",,,
768,30,B2,619,abstimmen,,,"to coordinate, to vote, to adjust","coordonner, voter, ajuster",2. prefix,ab,B1,stimmen,"to be true, to vote, to tune","être vrai, voter, s'accorder",,,,
769,30,B2,621,weitermachen,,,"to go on, to keep going, to continue to do something","continuer, continuer à faire quelque chose",2. prefix,weiter,A1,machen,"to make, to prepare, to do","faire, préparer",,,,
770,30,B2,623,anschauen,,,"to look at, to behold, to take a look at, to watch (Bayern and Austria)","regarder, contempler, jeter un coup d'œil à, observer (Bayern et Autriche)",2. prefix,an,A2,schauen,to look at (Bayern and Austria),regarder (Bayern et Autriche),to add intensity to a reference point → an,,,
771,30,B2,626,angreifen,,,to attack,attaquer,2. prefix,an,B1,greifen,"to grab, to grasp, to seize","saisir, s'emparer","to add the meaning of <i>on</i>, of a contact → an",,,
772,30,B2,627,beeindrucken,,,to impress,impressionner,2. prefix,beein,B2,drucken,to print,imprimer,,,,
773,30,B2,629,einpacken,,,"to pack in, to pack, to wrap, to wrap up","emballer, conclure",2. prefix,ein,B2,packen,"to pack, to grab, to manage","emballer, saisir, gérer","to add the meaning of <i>in</i>, <i>into</i> → ein",,,
774,30,B2,630,auspacken,,,"to unpack, to unwrap, to blow the whistle on","déballer, dénoncer",2. prefix,aus,B2,packen,"to pack, to grab, to manage","emballer, saisir, gérer",,,,
775,30,B2,631,ausdrücken,,,"to express, to articulate, to convey, to embody","exprimer, articuler, transmettre, incarner",2. prefix,aus,B1,drücken,"to press, to push","appuyer, pousser",,,,
776,30,B2,633,aufwachsen,,,"to grow up, to be raised","grandir, être élevé",2. prefix,auf,B1,wachsen,"to grow, to increase","grandir, augmenter",to add the meaning of <i>up</i> → auf,,,
777,30,B2,635,entnehmen,,,"to extract, to gather from, to remove","retirer, tirer, déduire",2. prefix,ent,A1,nehmen,"to take, to cause oneself to be (in some state)","prendre, se mettre (dans un état)",,,,
778,30,B2,636,überleben,,,to survive,survivre,2. prefix,über,A1,leben,to live,vivre,"to add the meaning of <i>over</i>, to translate the prefix <i>sur</i> → über",,,
779,30,B2,640,bemerken,,,"to notice, to observe, to remark","remarquer, observer",2. prefix,be,A2,merken,"to notice, to realise, to remember (refl.)","remarquer, se rendre compte, se souvenir (réfl.)",,,,
780,70,C1,643,aussuchen,,,"to select, to choose, to pick","sélectionner, choisir, cueillir",2. prefix,aus,A1,suchen,"to seek, to search","chercher, rechercher",,,,
781,70,C1,644,vorgehen,,,"to proceed, to advance, to go ahead","procéder, avancer, aller de l'avant",2. prefix,vor,A1,gehen,"to go, to leave, to work, to function (coll.), to be going (Dat.), to be all right (Dat.)","aller, partir, fonctionner (familier)",to add the meaning of <i>forward</i> → vor,,,
782,70,C1,645,ausmachen,,,"to arrange, to constitute, to represent, to settle","organiser, constituer, représenter, régler",2. prefix,aus,A1,machen,"to make, to prepare, to do","faire, préparer","to add the meaning of ""out"", to extend, to complete → aus",,,
783,70,C1,646,ausführen,,,"to carry out, to execute, to perform","réaliser, exécuter, accomplir",2. prefix,aus,A2,führen,"to lead, to guide","guider, conduire","to add the meaning of ""out"", to extend, to complete → aus",,,
784,70,C1,647,betreiben,,,"to operate, to run, to conduct","opérer, diriger, conduire",2. prefix,be,B1,treiben,"to practice (sport), to propel, to put forth, to urge (figuratively), to fuck, to float, to sprout, to get up to","pratiquer (sport), propulser, mettre en avant, pousser (au sens figuré), baiser, flotter, germer, se lever",,,,
785,70,C1,648,ergeben,,,"to result in, to yield, to surrender","aboutir à, céder, se rendre",2. prefix,er,A1,geben,to give,donner,,,,
786,70,C1,650,umsetzen,,,"to implement, to apply, to put into practice","mettre en œuvre, appliquer, mettre en pratique",2. prefix,um,A2,setzen,"to set, to sit down (refl.)",s'asseoir (réfl.),,,,
787,70,C1,651,vornehmen,,,"to undertake, to carry out","entreprendre, réaliser",2. prefix,vor,A1,nehmen,"to take, to cause oneself to be (in some state)","prendre, se mettre (dans un état)",to add the meaning of <i>forward</i> → vor,,,
788,70,C1,656,gewährleisten,,,"to ensure, to guarantee","assurer, garantir",2. prefix,gewähr,B2,leisten,"to achieve, to perform, to provide","réaliser, réaliser, fournir",,,,
789,70,C1,657,zuordnen,,,"to assign, to allocate","attribuer, allouer",2. prefix,zu,B2,ordnen,"to arrange, to organize, to classify","arranger, organiser, classer",,,,
790,70,C1,659,einführen,,,"to introduce, to implement, to import","introduire, mettre en œuvre, importer",2. prefix,ein,A2,führen,"to lead, to guide","guider, conduire","to add the meaning of <i>in</i>, <i>into</i> → ein",,,
791,70,C1,660,anerkennen,,,"to recognize, to acknowledge, to approve","reconnaître, admettre, approuver",2. prefix,an,B1,erkennen,"to recognize, to realise","reconnaître, réaliser",to add intensity to a reference point → an,,,
792,70,C1,661,ausstellen,,,"to exhibit, to display","exposer, montrer",2. prefix,aus,A2,stellen,"to position, to put, to catch","positionner, mettre",,,,
793,70,C1,662,ausdrucken,,,"to print, to print out, to print off",imprimer,2. prefix,aus,B2,drucken,to print,imprimer,,,,
794,70,C1,663,versehen,,,"to provide, to equip, to supply","fournir, équiper, approvisionner",2. prefix,ver,A1,sehen,"to see, to realise","voir, se rendre compte",,,,
795,70,C1,664,anlegen,,,"to create, to invest","créer, investir",2. prefix,an,A2,legen,"to lay, to lean, to lie down","poser, se pencher, s'allonger","to indicate the action is partial, beginning → an",,,
796,70,C1,665,betragen,,,"to amount to, to come to","s'élever à, arriver à",2. prefix,be,A1,tragen,"to wear (clothing), to carry, to hold","porter (des vêtements), transporter, tenir",,,,
797,70,C1,667,umfassen,,,"to include, to comprise","inclure, comprendre",2. prefix,um,B2,fassen,"to grasp, to seize, to capture, to comprehend","saisir, capturer, comprendre",,,,
798,70,C1,668,beziehen,,,"to refer, to relate, to obtain, to cover, to move into","se référer, obtenir",2. prefix,be,A1,ziehen,"to pull, to drag, to move","tirer, traîner, déplacer",,,,
799,70,C1,670,versorgen,,,"to supply, to provide for, to take care of","fournir, pourvoir à, prendre soin de",2. prefix,ver,A2,sorgen,"to care, to worry","se soucier, s'inquiéter",,,,
800,71,C1,672,ergreifen,,,"to seize, to grasp, to take hold of","saisir, s'emparer de",2. prefix,er,B1,greifen,"to grab, to grasp, to seize","saisir, s'emparer",,,,
801,71,C1,673,einnehmen,,,"to capture, to earn, to ingest","capturer, gagner, ingérer",2. prefix,ein,A1,nehmen,"to take, to cause oneself to be (in some state)","prendre, se mettre (dans un état)","to add the meaning of <i>in</i>, <i>into</i> → ein",,,
802,71,C1,675,verarbeiten,,,"to process, to handle, to work through","traiter, manipuler, travailler",2. prefix,ver,A1,arbeiten,to work,travailler,,,,
803,71,C1,676,aufbauen,,,"to build, to establish, to develop","construire, établir, développer",2. prefix,auf,A2,bauen,to build,construire,to add the meaning of <i>up</i> → auf,,,
804,71,C1,678,erfordern,,,"to require, to demand, to necessitate","exiger, nécessiter",2. prefix,er,B2,fordern,"to demand, to require, to call for","exiger, requérir, réclamer",,,,
805,71,C1,682,einhalten,,,"to observe, to adhere, to comply","observer, adhérer, se conformer",2. prefix,ein,A1,halten,"to hold, to stop (a movement), to support, to keep","tenir, arrêter (un mouvement), soutenir, garder",,,,
806,71,C1,683,ausprobieren,,,"to test, to try, to check out","tester, essayer, vérifier",2. prefix,aus,B1,probieren,"to try, to taste, to sample, to probe","essayer, goûter, échantillonner, sonder",,,,
807,71,C1,684,weitergeben,,,"to pass on, to impart, to relay","transmettre, relayer",2. prefix,weiter,A1,geben,to give,donner,,,,
808,71,C1,687,einbauen,,,"to install, to build in, to build into","installer, monter, intégrer, insérer",2. prefix,ein,A2,bauen,to build,construire,"to add the meaning of <i>in</i>, <i>into</i> → ein",,,
809,71,C1,688,aufrufen,,,"to call up, to call, to call for, to invite","appeler, solliciter, inviter",2. prefix,auf,B1,rufen,"to call, to shout, to summon","appeler, crier, convoquer",,,,
810,71,C1,690,aufheben,,,"to abolish, to lift, to pick up, to keep","abolir, lever, ramasser, garder",2. prefix,auf,B1,heben,"to lift, to raise","soulever, élever",to add the meaning of <i>up</i> → auf,,,
811,71,C1,693,hinterlassen,,,"to leave behind, to bequeath","laisser derrière soi, léguer",2. prefix,hinter,A2,lassen,"to let, to leave, to allow","laisser, quitter, permettre",to add the meaning of <i>behind</i> → hinter,,,
812,71,C1,694,aufstellen,,,"to set up, to establish","mettre en place, établir",2. prefix,auf,A2,stellen,"to position, to put, to catch","positionner, mettre",to add the meaning of <i>up</i> → auf,,,
813,71,C1,696,anhaben,,,"to have on, to wear, to harm, to damage","porter, arborer, avoir, posséder",2. prefix,an,A1,haben,"to have, to contain","avoir, contenir","to add the meaning of <i>on</i>, of a contact → an",,,
814,71,C1,698,sich beeilen,,,"to hurry, to hasten, to rush (refl.)","se dépêcher, se hâter, se précipiter (réfl.)",2. prefix,be,C1,eilen,"to hurry, to rush, to be urgent, to haste","se dépêcher, se hâter, être urgent",,,,
815,71,C1,699,abbrechen,,,"to cancel, to break off, to interrupt","annuler, interrompre, rompre",2. prefix,ab,A2,brechen,to break,"casser, briser","to add the meaning of <i>off</i>, <i>away</i> → ab",,,
816,71,C1,700,zerschlagen,,,"to break, to crush, to defeat, to shatter","briser, écraser, vaincre, anéantir",2. prefix,zer,B1,schlagen,"to hit, to beat, to strike, to defeat","frapper, battre, vaincre",,,,
817,71,C1,704,bewirken,,,"to bring about, to cause, to effect","provoquer, causer, effectuer",2. prefix,be,B1,wirken,"to have an effect, to work","avoir un effet, functionner",to make an intransitive verb transitive → be,,,
818,71,C1,706,unterliegen,,,"to be subject to, to undergo","être soumis à, subir",2. prefix,unter,A2,liegen,"to lie, to be located","être allongé, être localisé","to add the meaning of <i>under</i>, to translate the prefix <i>sub-</i> → unter",,,
819,71,C1,709,gebrauchen,,,"to use, to make use of","utiliser, faire usage de",2. prefix,ge,A1,brauchen,to need,avoir besoin,,,,
820,72,C1,711,aussprechen,,,"to pronounce, to express, to speak out","prononcer, exprimer, s'exprimer",2. prefix,aus,A1,sprechen,to speak,parler (une langue),,,,
821,72,C1,712,entwerfen,,,"to design, to draft, to sketch","concevoir, ébaucher, esquisser",2. prefix,ent,A2,werfen,to throw,"jeter, lancer",,,,
822,72,C1,713,eintragen,,,"to register, to enter, to record, to enrol","inscrire, entrer, enregistrer, inscrire",2. prefix,ein,A1,tragen,"to wear (clothing), to carry, to hold","porter (des vêtements), transporter, tenir","to add the meaning of <i>in</i>, <i>into</i> → ein",,,
823,72,C1,715,zurückkehren,,,to return,revenir,2. prefix,zurück,C1,kehren,"to sweep, to return","retourner, balayer",to add the meaning of <i>back</i> → zurück,,,
824,72,C1,716,verwechseln,,,"to mix up, to confuse, to mistake for",confondre,2. prefix,ver,B1,wechseln,"to change, to switch, to exchange","changer, échanger",,,,
825,72,C1,718,verpacken,,,"to pack, to wrap, to package","emballer, envelopper, conditionner",2. prefix,ver,B2,packen,"to pack, to grab, to manage","emballer, saisir, gérer",,,,
826,72,C1,719,versichern,,,"to assure, to insure, to cover","assurer, couvrir",2. prefix,ver,B1,sichern,"to secure, to safeguard, to back up","sécuriser, sauvegarder",,,,
827,72,C1,721,bereitstellen,,,"to make available, to provide, to supply","mettre à disposition, fournir, approvisionner",2. prefix,bereit,A2,stellen,"to position, to put, to catch","positionner, mettre",,,,
828,72,C1,722,umdrehen,,,to turn around,faire demi-tour,2. prefix,um,B2,drehen,"to turn, to veer","tourner, dévier",to add the meaning of <i>around</i> → um,,,
829,72,C1,723,einfallen,,,"to invade, to collapse, to come to mind","envahir, s'effondrer, venir à l'esprit",2. prefix,ein,B1,fallen,"to fall, to fall in battle, to collapse","tomber, tomber au combat, s'effondrer",,,,
830,72,C1,726,abstellen,,,"to put down, to assign, to set down, to shut down","poser, assigner, mettre en place, fermer",2. prefix,ab,A2,stellen,"to position, to put, to catch","positionner, mettre",,,,
831,72,C1,731,vermieten,,,"to lease, to let, to rent to","louer, donner en location à",2. prefix,ver,A2,mieten,"to rent, to hire","louer, embaucher",,,,
832,72,C1,733,vorliegen,,,"to exist, to be available","exister, être disponible",2. prefix,vor,A2,liegen,"to lie, to be located","être allongé, être localisé","to add the meaning of <i>pre-</i>, that something is <i>before</i>, <i>in advance</i> → vor",,,
833,72,C1,735,erwerben,,,"to acquire, to purchase, to gain","acquérir, acheter, gagner",2. prefix,er,B2,werben,"to advertise, to recruit","faire de la publicité, recruter",,,,
834,72,C1,737,bereiten,,,"to prepare, to cause","préparer, provoquer",2. prefix,be,B2,reiten,to ride (a horse),monter à cheval,,,,
835,72,C1,739,verreisen,,,"to go away, to travel, to go on a trip","partir, voyager, faire un voyage",2. prefix,ver,A1,reisen,to travel,voyager,,,,
836,72,C1,744,vorlegen,,,"to present, to submit, to bring forward","présenter, soumettre, avancer",2. prefix,vor,A2,legen,"to lay, to lean, to lie down","poser, se pencher, s'allonger","to indicate that something is <i>in front</i>, a performance → vor",,,
837,72,C1,748,einleiten,,,"to introduce, to initiate, to commence","introduire, initier, commencer",2. prefix,ein,B2,leiten,"to lead, to manage, to conduct","diriger, gérer, conduire","to add the meaning of <i>in</i>, <i>into</i> → ein",,,
838,72,C1,749,durchsetzen,,,"to enforce, to assert","faire respecter, affirmer",2. prefix,durch,A2,setzen,"to set, to sit down (refl.)",s'asseoir (réfl.),to add the meaning of <i>through</i> → durch,,,
839,72,C1,750,nachweisen,,,"to prove, to account for, to demonstrate","prouver, rendre compte de, démontrer",2. prefix,nach,B2,weisen,"to point, to direct, to indicate","pointer, diriger, indiquer",to indicate a purposeful action → nach,,,
840,73,C1,751,aufweisen,,,"to exhibit, to feature, to show, to boast","exposer, mettre en valeur, montrer, se vanter",2. prefix,auf,B2,weisen,"to point, to direct, to indicate","pointer, diriger, indiquer",,,,
841,73,C1,753,befehlen,,,"to command, to order, to bid","ordonner, commander, enjoindre",2. prefix,be,A2,fehlen,"to lack, to be absent or missing","manquer, être absent ou manquant",,,,
842,73,C1,760,verbrennen,,,"to burn, to consume by fire, to incinerate","brûler, consumer par le feu, incinérer",2. prefix,ver,B2,brennen,"to burn, to have a strong affection for, to induce pain, to tan","brûler, avoir une forte affection pour, provoquer de la douleur",,,,
843,73,C1,761,aufhalten,,,"to stop, to stay, to delay","arrêter, rester, retarder",2. prefix,auf,A1,halten,"to hold, to stop (a movement), to support, to keep","tenir, arrêter (un mouvement), soutenir, garder",,,,
844,73,C1,762,erarbeiten,,,"to develop, to elaborate, to work out, to acquire","développer, élaborer, acquérir",2. prefix,er,A1,arbeiten,to work,travailler,,,,
845,73,C1,763,bedrohen,,,"to threaten, to menace",menacer,2. prefix,be,B2,drohen,to threaten,menacer,,,,
846,73,C1,764,ausüben,,,"to exercise, to perform, to practice","exercer, exécuter, pratiquer",2. prefix,aus,A2,üben,"to practice, to exercise, to rehearse","pratiquer, s'exercer, répéter",,,,
847,73,C1,765,verstärken,,,"to amplify, to intensify, to strengthen","amplifier, intensifier, renforcer",2. prefix,ver,B2,stärken,"to strengthen, to reinforce","renforcer, consolider",,,,
848,73,C1,766,bedenken,,,"to consider, to reflect, to give, to allow for","considérer, réfléchir, donner, permettre",2. prefix,be,A1,denken,"to think, to consider","penser, considérer",,,,
849,73,C1,769,verklagen,,,"to sue, to bring a suit against, to bring an action against","poursuivre en justice, intenter un procès",2. prefix,ver,B2,klagen,"to complain, to lament, to sue","se plaindre, se lamenter, poursuivre en justice",,,,
850,73,C1,771,beherrschen,,,"to dominate, to master, to control, to rule","dominer, maîtriser, contrôler, régner",2. prefix,be,C1,herrschen,"to rule, to prevail, to control","gouverner, prévaloir, contrôler",,,,
851,73,C1,774,auseinandersetzen,,,"to discuss, to engage, to altercate, to argue with","discuter, s'engager, se disputer, argumenter avec",2. prefix,auseinander,A2,setzen,"to set, to sit down (refl.)",s'asseoir (réfl.),,,,
852,73,C1,775,aushalten,,,"to bear, to endure, to withstand, to tolerate","supporter, endurer, résister, tolérer",2. prefix,aus,A1,halten,"to hold, to stop (a movement), to support, to keep","tenir, arrêter (un mouvement), soutenir, garder",,,,
853,73,C1,777,vorbeikommen,,,"to come by, to come over, to drop by","passer, venir voir, faire un saut",2. prefix,vorbei,A1,kommen,"to come, to make it (e.g. over something), to go to, to occur","venir, aller à, se produire",,,,
854,73,C1,778,weitergehen,,,"to continue, to proceed, to keep moving","continuer, avancer, continuer à avancer",2. prefix,weiter,A1,gehen,"to go, to leave, to work, to function (coll.), to be going (Dat.), to be all right (Dat.)","aller, partir, fonctionner (familier)",,,,
855,73,C1,779,betreten,,,"to enter, to access, to apprehend, to catch","entrer, accéder, appréhender, attraper",2. prefix,be,B2,treten,"to step, to kick, to enter","marcher, donner un coup de pied, entrer",,,,
856,73,C1,780,entsorgen,,,"to clean up, to depollute, to dispose, to dispose of","nettoyer, dépolluer, éliminer, se débarrasser de",2. prefix,ent,A2,sorgen,"to care, to worry","se soucier, s'inquiéter",,,,
857,73,C1,783,verlegen,,,"to install, to lay, to misplace, to publish","installer, poser, égarer, publier",2. prefix,ver,A2,legen,"to lay, to lean, to lie down","poser, se pencher, s'allonger",,,,
858,73,C1,784,aufschreiben,,,"to write down, to note down, to record","écrire, noter, enregistrer",2. prefix,auf,A1,schreiben,to write,écrire,,,,
859,73,C1,786,einlegen,,,"to insert, to pickle, to assert","insérer, mettre en conserve, affirmer",2. prefix,ein,A2,legen,"to lay, to lean, to lie down","poser, se pencher, s'allonger",,,,
860,74,C1,787,wahrnehmen,,,"to perceive, to notice, to observe, to sense","percevoir, remarquer, observer, pressentir",2. prefix,wahr,A1,nehmen,"to take, to cause oneself to be (in some state)","prendre, se mettre (dans un état)",,,,
861,74,C1,788,sicherstellen,,,"to seize, to assure, to confiscate, to guarantee","saisir, assurer, confisquer, garantir",2. prefix,sicher,A2,stellen,"to position, to put, to catch","positionner, mettre",,,,
862,74,C1,789,besetzen,,,"to occupy, to border, to cast","occuper, border, jeter",2. prefix,be,A2,setzen,"to set, to sit down (refl.)",s'asseoir (réfl.),to work on or change the state of an object → be,,,
863,74,C1,790,aufführen,,,"to perform, to present","exécuter, présenter",2. prefix,auf,A2,führen,"to lead, to guide","guider, conduire",,,,
864,74,C1,791,verhaften,,,"to detain, to take into custody","détenir, mettre en détention",2. prefix,ver,C1,haften,"to adhere, to be liable","adhérer, être responsable",,,,
865,74,C1,793,überlassen,,,"to leave to, to entrust, to surrender","laisser à, confier, abandonner",2. prefix,über,A2,lassen,"to let, to leave, to allow","laisser, quitter, permettre","to add the meaning of <i>over</i>, to translate the prefix <i>sur</i> → über",,,
866,74,C1,794,befürchten,,,"to fear, to apprehend, to be afraid","craindre, appréhender, avoir peur",2. prefix,be,B2,fürchten,"to fear, to be afraid of",avoir peur de,,,,
867,74,C1,795,verfassen,,,"to write, to compose, to draft","écrire, composer, rédiger",2. prefix,ver,B2,fassen,"to grasp, to seize, to capture, to comprehend","saisir, capturer, comprendre",,,,
868,74,C1,801,ablaufen,,,"to expire, to run out, to discharge","expirer, s'épuiser, se décharger",2. prefix,ab,A1,laufen,"to walk, to flow (of a fluid), to run (of an event)","marcher, couler (un fluide), se dérouler (un événement)","to add the meaning of <i>off</i>, <i>away</i> → ab",,,
869,74,C1,802,anführen,,,"to cite, to lead, to quote","citer, diriger",2. prefix,an,A2,führen,"to lead, to guide","guider, conduire",to add intensity to a reference point → an,,,
870,74,C1,803,vertreiben,,,"to expel, to dislodge, to displace, to put on the market, to sell","expulser, déloger, déplacer",2. prefix,ver,B1,treiben,"to practice (sport), to propel, to put forth, to urge (figuratively), to fuck, to float, to sprout, to get up to","pratiquer (sport), propulser, mettre en avant, pousser (au sens figuré), baiser, flotter, germer, se lever",,,,
871,74,C1,804,erteilen,,,"to grant, to issue, to give","accorder, délivrer, donner",2. prefix,er,A2,teilen,"to split, to share, to divide","diviser, partager",,,,
872,74,C1,805,erfassen,,,"to record, to capture, to collect","enregistrer, capturer, collecter",2. prefix,er,B2,fassen,"to grasp, to seize, to capture, to comprehend","saisir, capturer, comprendre",,,,
873,74,C1,806,übergeben,,,"to hand over, to vomit (refl.)","remettre, vomir (réfl.)",2. prefix,über,A1,geben,to give,donner,"to add the meaning of <i>over</i>, to translate the prefix <i>sur</i> → über",,,
874,74,C1,808,befassen,,,"to address, to deal with, to attend to","s'adresser à, traiter, s'occuper de",2. prefix,be,B2,fassen,"to grasp, to seize, to capture, to comprehend","saisir, capturer, comprendre",to discuss or mention an object → be,,,
875,74,C1,809,beruhen,,,"to base on, to depend on","se baser sur, dépendre de",2. prefix,be,C1,ruhen,"to rest, to be at rest, to repose",reposer,,,,
876,74,C1,810,vorwerfen,,,"to reproach, to accuse of, to allege","reprocher, accuser de, alléguer",2. prefix,vor,A2,werfen,to throw,"jeter, lancer",to add the meaning of <i>forward</i> → vor,,,
877,74,C1,813,vereinigen,,,"to coalesce, to unify, to merge","unir, réunir, unifier, combiner",2. prefix,ver,C1,einigen,"to unite, to reconcile, to agree","s'unir, se réconcilier, s'accorder",,,,
878,74,C1,817,sich auswirken,,,"to affect, to have an impact","affecter, avoir un impact",2. prefix,aus,B1,wirken,"to have an effect, to work","avoir un effet, functionner","to add the meaning of ""out"", to extend, to complete → aus",,,
879,74,C1,818,abbauen,,,"to dismantle, to reduce, to break down","démanteler, réduire, décomposer",2. prefix,ab,A2,bauen,to build,construire,"to add the meaning of <i>off</i>, <i>away</i> → ab",,,
880,75,C1,819,besorgen,,,"to get, to obtain, to take care of","obtenir, prendre soin de",2. prefix,be,A2,sorgen,"to care, to worry","se soucier, s'inquiéter",,,,
881,75,C1,820,anwenden,,,"to apply, to make use of","appliquer, faire usage de",2. prefix,an,B2,wenden,"to turn, to reverse, to address","tourner, inverser, s'adresser",,,,
882,75,C1,821,zusammenstellen,,,"to compile, to assemble","compiler, assembler",2. prefix,zusammen,A2,stellen,"to position, to put, to catch","positionner, mettre","to add the meaning of <i>co</i>, <i>together</i> → zusammen",,,
883,75,C1,822,verbrauchen,,,"to consume, to use","consommer, utiliser",2. prefix,ver,A1,brauchen,to need,avoir besoin,,,,
884,75,C1,823,berühren,,,to touch,toucher,2. prefix,be,C1,rühren,"to stir, to move, to mix",remuer,,,,
885,75,C1,824,anstellen,,,"to queue (refl.), to employ someone, to hire, to get into mischief","faire la queue (réfl.), employer quelqu'un, faire des bêtises",2. prefix,an,A2,stellen,"to position, to put, to catch","positionner, mettre",,,,
886,75,C1,825,festhalten,,,"to hold, to retain something, to record something, to detain","détenir, conserver quelque chose, enregistrer quelque chose, détenir",2. prefix,fest,A1,halten,"to hold, to stop (a movement), to support, to keep","tenir, arrêter (un mouvement), soutenir, garder",,,,
887,75,C1,826,auflösen,,,"to dissolve, to resolve, to annul, to liquidate","dissoudre, résoudre, annuler, liquider",2. prefix,auf,B1,lösen,"to loosen, to solve, to separate, to remove","desserrer, résoudre, séparer, enlever",,,,
888,75,C1,827,auslösen,,,"to ransom, to trigger, to initiate, to set up","rançonner, déclencher, initier, mettre en place",2. prefix,aus,B1,lösen,"to loosen, to solve, to separate, to remove","desserrer, résoudre, séparer, enlever",,,,
889,75,C1,828,eintreten,,,"to enter, to join, to occur, to step in","entrer, se joindre, se produire",2. prefix,ein,B2,treten,"to step, to kick, to enter","marcher, donner un coup de pied, entrer","to add the meaning of <i>in</i>, <i>into</i> → ein",,,
890,75,C1,831,verweisen,,,"to refer, to direct","se référer, diriger",2. prefix,ver,B2,weisen,"to point, to direct, to indicate","pointer, diriger, indiquer",,,,
891,75,C1,835,abziehen,,,"to remove, to deduct, to withdraw","supprimer, déduire, retirer",2. prefix,ab,A1,ziehen,"to pull, to drag, to move","tirer, traîner, déplacer","to add the meaning of <i>off</i>, <i>away</i> → ab",,,
