Nr,exercise,level_verb,Nr_verb,answer,question,german,english,french,type,prefix,level_root,root_german,root_english,root_french,explanation_prefix_english,explanation_prefix_french,explanation_english_beta,explanation_french_beta
1521,96,C1,993,auszeichnen,,,"to honor, to distinguish","honorer, distinguer",3. no help,aus,A2,zeichnen,"to draw, to sketch","dessiner, esquisser",,,,
1522,96,C1,994,festnehmen,,,"to arrest, to apprehend, to detain, to seize","arrêter, appréhender, détenir, saisir",3. no help,fest,A1,nehmen,"to take, to cause oneself to be (in some state)","prendre, se mettre (dans un état)",,,,
1523,96,C1,996,antreten,,,"to begin, to compete","commencer, concourir",3. no help,an,B2,treten,"to step, to kick, to enter","marcher, donner un coup de pied, entrer",,,,
1524,96,C1,997,einschlagen,,,"to strike, to hit, to drive in, to engrave, to heel in","frapper, toucher, enfoncer, graver",3. no help,ein,B1,schlagen,"to hit, to beat, to strike, to defeat","frapper, battre, vaincre",,,,
1525,96,C1,999,sich entschließen,,,to decide (to do something) (refl.),décider (de faire quelque chose) (réfl.),3. no help,ent,A1,schließen,"to shut, to close, to lock, to conclude","fermer, clore, verrouiller, conclure",,,,
1526,96,C1,1001,abdecken,,,"to cover, to remove, to uncover","couvrir, enlever, découvrir",3. no help,ab,B2,decken,"to cover, to set (a table), to hedge","couvrir, dresser (une table), se protéger",,,,
1527,96,C1,1002,absetzen,,,"to set down, to put down, to deduct, to dismiss","Déposer, mettre de côté, déduire, rejeter",3. no help,ab,A2,setzen,"to set, to sit down (refl.)",s'asseoir (réfl.),,,,
1528,96,C1,1003,benehmen,,,to behave (refl.),se comporter (réfl.),3. no help,be,A1,nehmen,"to take, to cause oneself to be (in some state)","prendre, se mettre (dans un état)",,,,
1529,96,C1,1005,ausgleichen,,,"to balance, to offset, to compensate, to equalize","équilibrer, compenser, égaliser",3. no help,aus,B2,gleichen,"to equal, to match, to resemble","égaler, ressembler",,,,
1530,96,C1,1006,einbringen,,,"to bring in, to contribute, to introduce, to harvest","apporter, contribuer, introduire, récolter",3. no help,ein,A1,bringen,"to bring, to take, to lead","apporter, prendre, conduire",,,,
1531,96,C1,1009,vorschreiben,,,"to dictate, to prescribe, to instruct, to stipulate","dicter, prescrire, instruire, stipuler",3. no help,vor,A1,schreiben,to write,écrire,,,,
1532,96,C1,1010,behindern,,,"to obstruct, to hamper","gêner, entraver",3. no help,be,C1,hindern,to prevent somebody from doing something,empêcher quelqu'un de faire quelque chose,,,,
1533,96,C1,1011,anhören,,,to listen to someone,écouter quelqu'un,3. no help,an,A1,hören,"to hear, to listen to","entendre, écouter",,,,
1534,96,C1,1014,abschalten,,,"to switch off, to disconnect, to turn off","éteindre, déconnecter, couper",3. no help,ab,B2,schalten,"to switch, to shift gears, to turn on, to turn off","changer, changer de vitesse, allumer, éteindre",,,,
1535,96,C1,1017,verzögern,,,"to delay, to postpone, to stall","retarder, reporter, bloquer",3. no help,ver,B2,zögern,to hesitate,hésiter,,,,
1536,96,C1,1020,vertragen,,,"to tolerate, to get along, to bear","tolérer, s'entendre, supporter",3. no help,ver,A1,tragen,"to wear (clothing), to carry, to hold","porter (des vêtements), transporter, tenir",,,,
1537,97,C1,1021,einbrechen,,,"to break in, to collapse, to break down","s'introduire par effraction, s'effondrer, tomber en panne",3. no help,ein,A2,brechen,to break,"casser, briser",,,,
1538,97,C1,1022,besiegen,,,to defeat (in battle or contest),vaincre (au combat ou dans un concours),3. no help,be,C1,siegen,"to win, to prevail, to triumph","gagner, triompher, prévaloir",,,,
1539,97,C1,1023,aufteilen,,,"to distribute, to divide, to partition","distribuer, diviser, partitionner",3. no help,auf,A2,teilen,"to split, to share, to divide","diviser, partager",,,,
1540,97,C1,1024,zumachen,,,"to close, to shut, to close down","fermer, cesser ses activités",3. no help,zu,A1,machen,"to make, to prepare, to do","faire, préparer",,,,
1541,97,C1,1025,hinfahren,,,"to drive there, to go, to travel","aller en voiture, y aller, voyager",3. no help,hin,A1,fahren,"to go (by vehicle), to leave, to drive","aller (en véhicule), partir, conduire",,,,
1542,97,C1,1026,austragen,,,"to deliver, to distribute, to carry out","livrer, distribuer, exécuter",3. no help,aus,A1,tragen,"to wear (clothing), to carry, to hold","porter (des vêtements), transporter, tenir",,,,
1543,97,C1,1027,überreichen,,,"to hand over, to present, to submit","remettre, présenter, soumettre",3. no help,über,B2,reichen,"to reach, to hand, to be enough","atteindre, mettre la main, être suffisant","to add the meaning of <i>over</i>, to translate the prefix <i>sur</i> → über",,,
1544,97,C1,1029,vortragen,,,"to perform, to recite, to present, to carry over","interpréter, réciter, présenter, transmettre",3. no help,vor,A1,tragen,"to wear (clothing), to carry, to hold","porter (des vêtements), transporter, tenir",,,,
1545,97,C1,1031,wiedersehen,,,"to see again, to meet again","revoir, se revoir",3. no help,wieder,A1,sehen,"to see, to realise","voir, se rendre compte",,,,
1546,97,C1,1032,ausweisen,,,"to expel, to identify, to deport","expulser, identifier, déporter",3. no help,aus,B2,weisen,"to point, to direct, to indicate","pointer, diriger, indiquer",,,,
1547,97,C1,1033,aufbewahren,,,"to preserve, to keep, to store","préserver, conserver, stocker",3. no help,auf,C1,bewahren,"to keep, to preserve (to maintain the condition of)","garder, préserver (maintenir l'état de)",,,,
1548,97,C1,1034,bedauern,,,"to regret, to deplore, to lament, to pity","regretter, déplorer, se lamenter, avoir pitié",3. no help,be,A2,dauern,"to last, to take (time)","durer, prendre (du temps)",,,,
1549,97,C1,1035,loslassen,,,"to release, to let go, to let loose, to disengage","libérer, lâcher prise, se délier, se désengager",3. no help,los,A2,lassen,"to let, to leave, to allow","laisser, quitter, permettre",,,,
1550,97,C1,1037,wegnehmen,,,"to take away, to remove, to abstract, to cancel","enlever, supprimer, abstraire, annuler",3. no help,weg,A1,nehmen,"to take, to cause oneself to be (in some state)","prendre, se mettre (dans un état)",,,,
1551,97,C1,1039,einatmen,,,"to inhale, to breath in","inspirer, respirer",3. no help,ein,B1,atmen,to breathe,respirer,,,,
1552,97,C1,1040,mitfahren,,,"to go with, to ride along","accompagner, faire un tour avec",3. no help,mit,A1,fahren,"to go (by vehicle), to leave, to drive","aller (en véhicule), partir, conduire",,,,
1553,97,C1,1041,abrechnen,,,"to settle, to account for, to bill","régler, rendre compte, facturer",3. no help,ab,B1,rechnen,"to calculate, to expect, to count on","calculer, s'attendre à, compter sur",,,,
1554,97,C1,1043,einsammeln,,,"to collect, to gather","collecter, rassembler",3. no help,ein,B1,sammeln,"to collect, to gather, to accumulate","recueillir, rassembler, accumuler",,,,
1555,97,C1,1048,zurückfahren,,,"to back, to drive back, to flinch","reculer, faire marche arrière, tressaillir",3. no help,zurück,A1,fahren,"to go (by vehicle), to leave, to drive","aller (en véhicule), partir, conduire",,,,
1556,97,C1,1055,herausfordern,,,"to challenge, to provoke, to banter to","défier, affronter",3. no help,heraus,B2,fordern,"to demand, to require, to call for","exiger, requérir, réclamer",,,,
1557,98,C1,1061,verkehren,,,"to circulate, to interact, to turn, to twist",circuler,3. no help,ver,C1,kehren,"to sweep, to return","retourner, balayer",,,,
1558,98,C1,1067,begehen,,,"to commit, perpetrate (a crime, an offence)","commettre, perpétrer (un crime, un délit)",3. no help,be,A1,gehen,"to go, to leave, to work, to function (coll.), to be going (Dat.), to be all right (Dat.)","aller, partir, fonctionner (familier)",,,,
1559,98,C1,1068,abschneiden,,,"to cut off, to amputate, to block","couper, amputer, bloquer",3. no help,ab,B1,schneiden,"to cut, to slice","couper, trancher","to add the meaning of <i>off</i>, <i>away</i> → ab",,,
1560,98,C1,1069,verdanken,,,"to owe, to be indebted, to owe to","devoir (quelque chose à quelqu'un), être redevable",3. no help,ver,A2,danken,to thank,remercier,,,,
1561,98,C1,1070,zurückhalten,,,"to restrain, to hold back, to withhold","restreindre, retenir",3. no help,zurück,A1,halten,"to hold, to stop (a movement), to support, to keep","tenir, arrêter (un mouvement), soutenir, garder",to add the meaning of <i>back</i> → zurück,,,
1562,98,C1,1071,verdoppeln,,,"to double, to duplicate, to reduplicate","doubler, dupliquer, redoubler",3. no help,ver,C2,doppeln,"to double, to duplicate, to fold","doubler, dupliquer, reproduire",,,,
1563,98,C1,1073,verknüpfen,,,"to connect, to link, to associate, to tie, to annex to","connecter, relier, associer, lier, annexer à",3. no help,ver,C1,knüpfen,"to knot, to tie, to weave",nouer,,,,
1564,98,C1,1074,aufzeigen,,,"to point out, to demonstrate, to indicate","souligner, démontrer, indiquer",3. no help,auf,A1,zeigen,"to show, to point at, to demonstrate","montrer, pointer du doigt, démontrer",,,,
1565,98,C1,1075,aufbringen,,,"to capture, to raise, to antagonise",appliquer,3. no help,auf,A1,bringen,"to bring, to take, to lead","apporter, prendre, conduire",,,,
1566,98,C1,1081,absehen,,,"to foresee, to overlook, to disregard","prévoir, négliger",3. no help,ab,A1,sehen,"to see, to realise","voir, se rendre compte",,,,
1567,98,C1,1082,einsperren,,,"to lock up, to imprison","enfermer, emprisonner",3. no help,ein,C1,sperren,"to block, to lock, to close off","bloquer, verrouiller, fermer",,,,
1568,98,C1,1086,verführen,,,"to seduce, to entice, to tempt, to debauch",séduire,3. no help,ver,A2,führen,"to lead, to guide","guider, conduire",,,,
1569,98,C1,1090,voraussetzen,,,"to presume, to require, to assume","présumer, exiger, supposer",3. no help,voraus,A2,setzen,"to set, to sit down (refl.)",s'asseoir (réfl.),,,,
1570,98,C1,1092,zurücktreten,,,"to resign, to step back, to step down, to withdraw","démissionner, se retirer, quitter ses fonctions",3. no help,zurück,B2,treten,"to step, to kick, to enter","marcher, donner un coup de pied, entrer",,,,
1571,98,C1,1093,hervorgehen,,,"to result, to arise, to arise from, to emerge","résulter, survenir, provenir de, émerger",3. no help,hervor,A1,gehen,"to go, to leave, to work, to function (coll.), to be going (Dat.), to be all right (Dat.)","aller, partir, fonctionner (familier)",,,,
1572,98,C1,1094,verbleiben,,,to remain,rester,3. no help,ver,A1,bleiben,"to remain, to stay",rester,,,,
1573,98,C1,1095,herkommen,,,"to come over, come here (towards the speaker), to come from","venir, venir ici (vers l'orateur), venir de",3. no help,her,A1,kommen,"to come, to make it (e.g. over something), to go to, to occur","venir, aller à, se produire",,,,
1574,98,C1,1096,beibringen,,,"to teach, to break (news, information) carefully to, to inflict","enseigner, annoncer (des nouvelles, des informations) avec précaution, infliger",3. no help,bei,A1,bringen,"to bring, to take, to lead","apporter, prendre, conduire",,,,
1575,98,C1,1097,befördern,,,to transport,transporter,3. no help,be,B2,fördern,"to promote, to support","promouvoir, soutenir",,,,
1576,98,C1,1099,anbringen,,,"to affix, to attach, to fasten, to add, to apply","fixer, attacher, ajouter, appliquer",3. no help,an,A1,bringen,"to bring, to take, to lead","apporter, prendre, conduire",,,,
1577,99,C1,1100,bedürfen,,,"to need, to require, to depend, to demand","avoir besoin, exiger, dépendre, demander",3. no help,be,A1,dürfen,"to be allowed (to do something), may","être autorisé (à faire quelque chose), peut",,,,
1578,99,C1,1101,begreifen,,,"to understand, to comprehend, to grasp, to realise","comprendre, saisir, appréhender, réaliser",3. no help,be,B1,greifen,"to grab, to grasp, to seize","saisir, s'emparer",,,,
1579,99,C1,1102,beitreten,,,"to join, to support, to accede to, to affiliate","adhérer, soutenir, adhérer à, s'affilier",3. no help,bei,B2,treten,"to step, to kick, to enter","marcher, donner un coup de pied, entrer",,,,
1580,99,C1,1104,einräumen,,,"to admit, to acknowledge, to concede, to put away","admettre, reconnaître, concéder, mettre de côté",3. no help,ein,B2,räumen,"to clear, to remove, to vacate","déblayer, débrancher, dégager",,,,
1581,99,C1,1105,entfallen,,,"to be omitted, to be dropped, to be canceled, to be inapplicable","à omettre, à supprimer, à annuler, à ne pas appliquer",3. no help,ent,B1,fallen,"to fall, to fall in battle, to collapse","tomber, tomber au combat, s'effondrer",,,,
1582,99,C1,1106,erbringen,,,"to yield, to provide, to raise, to deliver","céder, fournir, lever, livrer",3. no help,er,A1,bringen,"to bring, to take, to lead","apporter, prendre, conduire",,,,
1583,99,C1,1112,vermögen,,,"to be able, to be capable, to can","être capable, pouvoir",3. no help,ver,A1,mögen,to like,"aimer, apprécier",,,,
1584,99,C1,1113,verschaffen,,,"to procure, to obtain, to acquire, to earn","se procurer, obtenir, acquérir, gagner",3. no help,ver,B2,schaffen,"to manage, to accomplish, to create","gérer, accomplir, créer",,,,
1585,99,C1,1114,versenden,,,"to dispatch, to send, to forward, to ship","expédier, envoyer, faire parvenir, transporter",3. no help,ver,B1,senden,"to send, to broadcast","envoyer, diffuser",,,,
1586,99,C1,1115,zukommen,,,"to approach, to be assigned to, to be due (to)","approcher, être assigné à, être dû (à)",3. no help,zu,A1,kommen,"to come, to make it (e.g. over something), to go to, to occur","venir, aller à, se produire",,,,
1587,99,C1,1116,zusammenhängen,,,"to be related, to hang together, to associate","être apparenté, être ensemble, s'associer",3. no help,zusammen,A2,hängen,"to hang, to be fond of, depend on","accrocher, aimer, dépendre de",,,,
1588,99,C1,1117,zusammensetzen,,,"to assemble, to put together, to be composed of","assembler, réunir, être composé de",3. no help,zusammen,A2,setzen,"to set, to sit down (refl.)",s'asseoir (réfl.),,,,
1589,99,C1,1118,verbergen,,,"to conceal sth, to hide something",cacher quelque chose,3. no help,ver,C1,bergen,"to recover, to rescue, to save, to salvage","récupérer, secourir, sauver, sauver",,,,
1590,99,C1,1119,versetzen,,,"to put, to move, to deal, to give (a blow, hit), to transfer (when to do with work)","mettre, déplacer, distribuer, donner (un coup), transférer (quand il s'agit de travailler)",3. no help,ver,A2,setzen,"to set, to sit down (refl.)",s'asseoir (réfl.),,,,
1591,99,C1,1123,widerrufen,,,"to cancel, to revoke, to withdraw","annuler, révoquer, retirer",3. no help,wider,B1,rufen,"to call, to shout, to summon","appeler, crier, convoquer",,,,
1592,99,C1,1130,berufen,,,"to appoint, to invoke, to cite","nommer, invoquer, citer",3. no help,be,B1,rufen,"to call, to shout, to summon","appeler, crier, convoquer",,,,
1593,99,C1,1132,verdrängen,,,"to displace, to oust, to repress","déplacer, évincer, réprimer",3. no help,ver,C1,drängen,"to urge, to push, to cajole, to shove","exhorter, pousser, cajoler, bousculer",,,,
1594,99,C1,1134,einschreiben,,,"to sign up, to enroll",s'inscrire,3. no help,ein,A1,schreiben,to write,écrire,,,,
1595,99,C1,1137,entgegenkommen,,,"to accommodate, to approach, to come towards","s'adapter, s'approcher, venir vers",3. no help,entgegen,A1,kommen,"to come, to make it (e.g. over something), to go to, to occur","venir, aller à, se produire",,,,
1596,99,C1,1138,erziehen,,,"to educate, to raise, to nurture, to teach, to train","éduquer, élever, nourrir, enseigner, former",3. no help,er,A1,ziehen,"to pull, to drag, to move","tirer, traîner, déplacer",,,,
1597,100,C1,1139,überholen,,,"to overtake, to outstrip, to repair, to outpace","dépasser, distancer, réparer, surpasser",3. no help,über,A2,holen,to fetch,aller chercher,"to add the meaning of <i>over</i>, to translate the prefix <i>sur</i> → über",,,
1598,100,C1,1140,bemalen,,,"to paint, to apply makeup, to color","peindre, maquiller, colorier, colorer",3. no help,be,B1,malen,"to paint, to draw","peindre, dessiner",,,,
1599,100,C1,1144,sich ereignen,,,"to happen, to occur, to bechance","se produire, avoir lieu, être fortuit",3. no help,er,B2,eignen,"to be suitable, to be appropriate","être convenable, être approprié",,,,
1600,100,C1,1146,weglaufen,,,to run away,s'enfuir,3. no help,weg,A1,laufen,"to walk, to flow (of a fluid), to run (of an event)","marcher, couler (un fluide), se dérouler (un événement)",,,,
1601,100,C1,1147,vorhersagen,,,"to foretell, to forecast, to predict","prédire, prévoir, annoncer",3. no help,vorher,A1,sagen,"to say, to tell","dire, raconter",,,,
1602,100,C1,1149,erwachsen,,,"to grow up, to arise, to spring up, to accrue","grandir, surgir, jaillir, s'accumuler",3. no help,er,B1,wachsen,"to grow, to increase","grandir, augmenter",,,,
1603,100,C1,1150,abschreiben,,,"to write off, to copy, to transcribe","radier, copier, transcrire",3. no help,ab,A1,schreiben,to write,écrire,,,,
1604,100,C1,1151,erschließen,,,"to develop, to access, to deduce, to unlock","développer, accéder, déduire, déverrouiller",3. no help,we,A1,schließen,"to shut, to close, to lock, to conclude","fermer, clore, verrouiller, conclure",,,,
1605,100,C1,1152,herausnehmen,,,"to take out, to remove, to arrogate","enlever, retirer, s'arroger",3. no help,heraus,A1,nehmen,"to take, to cause oneself to be (in some state)","prendre, se mettre (dans un état)",,,,
1606,100,C1,1155,weiterhelfen,,,"to assist, to help","pour aider, pour soutenir",3. no help,weiter,A1,helfen,to help,aider,,,,
1607,100,C1,1156,aufhängen,,,"to hang up, to hang, to anchor","accrocher, suspendre, ancrer",3. no help,auf,A2,hängen,"to hang, to be fond of, depend on","accrocher, aimer, dépendre de",,,,
1608,100,C1,1157,hinlegen,,,"to lie down, to put down, to lay down","s'allonger, poser, se coucher",3. no help,hin,A2,legen,"to lay, to lean, to lie down","poser, se pencher, s'allonger",,,,
1609,100,C1,1158,beleuchten,,,"to illuminate, to examine","éclairer, examiner",3. no help,be,C1,leuchten,"to shine, to glow, to be illuminated","briller, allumer, éclairer",,,,
1610,100,C1,1160,zutreffen,,,"to apply, to hold true, to be applicable","s'appliquer, être vrai, être applicable",3. no help,zu,A1,treffen,"to meet (refl.), to encounter (refl.), to hit, to affect","rencontrer (refl.), se rencontrer (refl.), heurter, frapper",,,,
1611,100,C1,1161,zuwenden,,,"to turn to, to turn towards, to allocate, to dedicate","se tourner vers, allouer, dédier",3. no help,zu,B2,wenden,"to turn, to reverse, to address","tourner, inverser, s'adresser",,,,
1612,100,C1,1162,überreden,,,"to convince, to persuade, to argue into","convaincre, persuader, amener à argumenter",3. no help,über,A1,reden,to talk,"parler, discuter",,,,
1613,100,C1,1164,erschießen,,,to shoot dead,tuer par balle,3. no help,er,B2,schießen,"to shoot, to fire","tirer, faire feu",,,,
1614,100,C1,1165,beibehalten,,,"to maintain, to keep, to retain",maintenir,3. no help,bei,B1,behalten,to keep,garder,,,,
1615,100,C1,1166,widerstehen,,,"to resist, to withstand, to oppose","résister, supporter, s'opposer",3. no help,wider,A1,stehen,"to stand, to be, to appear","être debout, apparaître",,,,
1616,100,C1,1168,kaputtgehen,,,"to break down, to break","se briser, se dégrader",3. no help,kaputt,A1,gehen,"to go, to leave, to work, to function (coll.), to be going (Dat.), to be all right (Dat.)","aller, partir, fonctionner (familier)",,,,
1617,101,C1,1169,zusammenleben,,,"to live together, to cohabitate","vivre ensemble, cohabiter",3. no help,zusammen,A1,leben,to live,vivre,,,,
1618,101,C1,1171,ausschlafen,,,"to sleep in, to catch up on sleep","faire la grasse matinée, rattraper son sommeil",3. no help,aus,A1,schlafen,to sleep,dormir,,,,
1619,101,C1,1172,abfliegen,,,"to patrol, to depart, to fly along","patrouiller, partir, voler le long",3. no help,ab,B1,fliegen,"to fly, to travel by plane","voler, voyager en avion",,,,
1620,101,C1,1174,zuweisen,,,"to assign, to allocate, to allot","attribuer, assigner, affecter",3. no help,zu,B2,weisen,"to point, to direct, to indicate","pointer, diriger, indiquer",,,,
1621,101,C1,1180,erleiden,,,"to endure, to suffer, to experience, to experience pain","endurer, souffrir, éprouver, ressentir de la douleur",3. no help,er,B1,leiden,"to suffer, to endure, to bear","souffrir, endurer, supporter",,,,
1622,101,C1,1181,beschützen,,,"to protect, to defend (security)","protéger, défendre (sécurité)",3. no help,be,B1,schützen,"to defend (lawyer), to protect (sunprotection)","défendre (avocat), protéger (protection solaire)",,,,
1623,101,C1,1184,begrenzen,,,"to limit, to restrict, to bound","limiter, resteindre, confiner",3. no help,be,C1,grenzen,"to abut, to approach, to border, to limit",limiter,,,,
1624,101,C1,1186,anfragen,,,"to ask, to inquire, to enquire, to request",demander,3. no help,an,A1,fragen,"to ask, to wonder (refl.)","demander, se demander (réfl.)",to add intensity to a reference point → an,,,
1625,101,C1,1188,gebieten,,,"to command, to demand, to bid, to dominate","dominer, ordonner",3. no help,ge,A2,bieten,"to offer, to bid, to arise, to occur (of an opportunity) (refl.)","offrir, enchérir, surgir, se produire (d'une opportunité) (réfl.)",,,,
1626,101,C1,1189,geleiten,,,"to accompany, to escort, to conduct",accompagner,3. no help,ge,B2,leiten,"to lead, to manage, to conduct","diriger, gérer, conduire",,,,
1627,101,C1,1193,beleben,,,"to invigorate, to animate, to revive","animer, revivre, relancer",3. no help,be,A1,leben,to live,vivre,,,,
1628,101,C1,1194,erlöschen,,,"to go out, to die out, to expire",s'éteindre,3. no help,er,B2,löschen,"to delete, to extinguish, to erase","supprimer, éteindre, effacer",,,,
1629,101,C1,1198,ansteigen,,,"to rise, to increase, to ascend, to advance","s'élever, croître, monter, progresser",3. no help,an,A2,steigen,"to ascend, to climb, to rise","monter, grimper, s'élever",,,,
1630,101,C1,1199,anstreben,,,"to pursue, to seek, to strive for, to aim","poursuivre, chercher, s'efforcer d'obtenir, viser",3. no help,an,C1,streben,"to strive, to tend to, to aspire","aspirer, s'efforcer, viser",,,,
1631,101,C1,1200,ausstrahlen,,,"to emit, to broadcast, to radiate, to air","émettre, diffuser, rayonner",3. no help,aus,C1,strahlen,"to radiate, to beam","rayonner, briller, illuminer",,,,
1632,101,C1,1201,eintreffen,,,"to arrive, to come true, to happen","arriver, se réaliser, se produire",3. no help,ein,A1,treffen,"to meet (refl.), to encounter (refl.), to hit, to affect","rencontrer (refl.), se rencontrer (refl.), heurter, frapper",,,,
1633,101,C1,1203,erlernen,,,"to learn, to acquire, to master","apprendre, acquérir, maîtriser",3. no help,er,A1,lernen,"to learn, to study, to train something","apprendre, étudier, se former à quelque chose",,,,
1634,101,C1,1206,verschließen,,,"to close, to seal, to lock, to block","fermer, sceller, verrouiller, bloquer",3. no help,ver,A1,schließen,"to shut, to close, to lock, to conclude","fermer, clore, verrouiller, conclure",,,,
1635,101,C1,1207,ausarbeiten,,,"to develop, to draw up, to elaborate","développer, élaborer, mettre au point",3. no help,aus,A1,arbeiten,to work,travailler,,,,
1636,101,C1,1209,verbrechen,,,to commit (a crime),commettre (un crime),3. no help,ver,A2,brechen,to break,"casser, briser",,,,
1637,102,C1,1212,zusammenstoßen,,,"to collide, to brush, to bump","entrer en collision, se frôler, se heurter",3. no help,zusammen,B2,stoßen,"to push, to bump, to kick, to thrust","pousser, cogner, donner un coup de pied",,,,
1638,102,C1,1214,verstoßen,,,"to breach, to transgress, to violate","enfreindre, transgresser, violer",3. no help,ver,B2,stoßen,"to push, to bump, to kick, to thrust","pousser, cogner, donner un coup de pied",,,,
1639,102,C1,1215,vermischen,,,"to mix, to blend, to combine","mélanger, combiner",3. no help,ver,B2,mischen,"to mix, to blend",mélanger,,,,
1640,102,C1,1216,begleichen,,,"to acquit, to pay, to settle","acquitter, payer, régler",3. no help,be,B2,gleichen,"to equal, to match, to resemble","égaler, ressembler",,,,
1641,102,C1,1222,zulegen,,,"to add, to gain, to increase, to put on weight, to draw","ajouter, gagner, augmenter, prendre du poids, tirer",3. no help,zu,A2,legen,"to lay, to lean, to lie down","poser, se pencher, s'allonger",,,,
1642,102,C1,1223,vorweisen,,,to demonstrate,démontrer,3. no help,vor,B2,weisen,"to point, to direct, to indicate","pointer, diriger, indiquer",,,,
1643,102,C1,1227,auflisten,,,"to list, to catalogue","lister, cataloguer",3. no help,auf,C1,listen,"to list, to allow in, to lead as a series","énumérer, citer",,,,
1644,102,C1,1228,bedecken,,,"to cover, to conceal, to overlay","couvrir, dissimuler, recouvrir",3. no help,be,B2,decken,"to cover, to set (a table), to hedge","couvrir, dresser (une table), se protéger",,,,
1645,102,C1,1231,herausstellen,,,"to emphasize, to highlight, to put out","mettre en valeur, souligner, diffuser",3. no help,heraus,A2,stellen,"to position, to put, to catch","positionner, mettre",,,,
1646,102,C1,1232,nachgehen,,,"to pursue, to follow up","poursuivre, donner suite",3. no help,nach,A1,gehen,"to go, to leave, to work, to function (coll.), to be going (Dat.), to be all right (Dat.)","aller, partir, fonctionner (familier)",,,,
1647,102,C1,1236,ausnutzen,,,"to exploit, to take advantage of, to use","exploiter, tirer profit de, utiliser",3. no help,aus,B1,nutzen,"to use, to utilize, to benefit from","utiliser, exploiter, bénéficier de",,,,
1648,102,C1,1237,beschaffen,,,"to acquire, to obtain, to procure","acquérir, obtenir, se procurer",3. no help,be,B2,schaffen,"to manage, to accomplish, to create","gérer, accomplir, créer",,,,
1649,102,C1,1238,einholen,,,"to catch up, to reel in, to obtain","rattraper, obtenir",3. no help,ein,A2,holen,to fetch,aller chercher,,,,
