Nr,exercise,question,answer,german,english,french,transitivity_english,transitivity_french
1026,52,,weisen,weisen,"to point, to direct, to indicate","pointer, diriger, indiquer",Sometimes Reflexive,Parfois Réfléchi
1027,52,,importieren,importieren,to import,importer,,
1028,52,,klopfen,klopfen,"to knock, to tap (food)","frapper, tapoter (nourriture)",Sometimes Reflexive,Parfois Réfléchi
1029,52,,winken,winken,"to wave, to beckon",faire signe,,
1030,52,,schmelzen,schmelzen,to melt,faire fondre,Sometimes Reflexive,Parfois Réfléchi
1031,52,,pflegen,pflegen,"to nurse, to care for, to maintain","soigner, prendre soin de, entretenir",Sometimes Reflexive,Parfois Réfléchi
1032,52,,finanzieren,finanzieren,"to finance, to fund","financer, financer",Sometimes Reflexive,Parfois Réfléchi
1033,52,,ernähren,ernähren,"to feed, to nourish, to sustain","nourrir, entretenir, soutenir",Sometimes Reflexive,Parfois Réfléchi
1034,52,,ankündigen,ankündigen,"to announce, to declare","annoncer, déclarer",Sometimes Reflexive,Parfois Réfléchi
1035,52,,realisieren,realisieren,"to realize, to implement, to actualize","réaliser, mettre en œuvre, actualiser",,
1036,52,,verabreden,verabreden,"to arrange, to make an appointment","prendre rendez-vous, convenir d'un rendez-vous",Mostly Reflexive,Principalement Réfléchi
1037,52,,unterbrechen,unterbrechen,"to interrupt, to suspend","interrompre, suspendre",,
1038,52,,renovieren,renovieren,"to refurbish, to renovate","remettre à neuf, rénover",,
1039,52,,verschreiben,verschreiben,"to prescribe, to commit oneself to, to misspell by accident","prescrire, s'engager à, faire une faute d'orthographe par accident",Sometimes Reflexive,Parfois Réfléchi
1040,52,,hingehen,hingehen,"to go (there), (of time) to pass","aller (là-bas), passer (le temps)",,
1041,53,,weggehen,weggehen,"to go away, to leave","s'en aller, quitter",,
1042,53,,abheben,abheben,"to withdraw (money), to take off (aircraft)","retirer (de l'argent), décoller (un avion)",Sometimes Reflexive,Parfois Réfléchi
1043,53,,gratulieren,gratulieren,"to congratulate, to compliment on","féliciter, complimenter",,
1044,53,,zaubern,zaubern,"to perform magic, to conjure","conjurer, ensorceler, évoquer",,
1045,53,,servieren,servieren,to serve,servir,,
1046,53,,entlassen,entlassen,"to dismiss, to fire, to release","congédier, licencier, libérer",,
1047,53,,lehren,lehren,"to teach, to instruct","enseigner, instruire",,
1048,53,,einfügen,einfügen,"to insert, to infix, to conform","insérer, infixer, se conformer",Sometimes Reflexive,Parfois Réfléchi
1049,53,,zusagen,zusagen,"to promise, to accept, to agree","promettre, accepter, convenir",,
1050,53,,preisen,preisen,"to praise, to commend","louer, féliciter",,
1051,53,,erheben,erheben,"to raise, to collect, to levy","lever, collecter, prélever",Sometimes Reflexive,Parfois Réfléchi
1052,53,,ausreichen,ausreichen,"to suffice, to be sufficient, to be adequate","suffire, être suffisant, être adéquat",,
1053,53,,vergrößern,vergrößern,to enlarge,pour agrandir,Sometimes Reflexive,Parfois Réfléchi
1054,53,,trocknen,trocknen,"to dry, to dehumidify","sécher, déshumidifier",Sometimes Reflexive,Parfois Réfléchi
1055,53,,stechen,stechen,"to sting, to prick, to puncture, to pierce","piquer, percer",Sometimes Reflexive,Parfois Réfléchi
1056,53,,auffallen,auffallen,"to stand out, to catch someone's eye (with dative)","se démarquer, attirer l'attention (avec le datif)",,
1057,53,,mischen,mischen,"to mix, to blend",mélanger,Sometimes Reflexive,Parfois Réfléchi
1058,53,,schwitzen,schwitzen,"to sweat, to be in a sweat","transpirer, être en sueur",,
1059,53,,streiken,streiken,"to strike, to be on strike","faire grève, être en grève",,
1060,53,,heizen,heizen,"to heat, to warm, to fuel","chauffer, se chauffer",Sometimes Reflexive,Parfois Réfléchi
1061,54,,einschlafen,einschlafen,to fall asleep,s'endormir,,
1062,54,,chatten,chatten,to chat,"discuter, chatter",,
1063,54,,anklicken,anklicken,"to click, to click on, to press","cliquer, cliquer sur, appuyer",,
1064,54,,bewerten,bewerten,"to evaluate, to assess, to rate","évaluer, estimer, noter",,
1065,54,,sich bemühen,sich bemühen,"to make an effort, to strive","faire un effort, s'efforcer",Always Reflexive,Toujours Réfléchi
1066,54,,sich beteiligen,sich beteiligen,"to participate, to be involved, to take part","participer, être impliqué, prendre part",Mostly Reflexive,Principalement Réfléchi
1067,54,,vergeben,vergeben,"to forgive, to award, to assign","pardonner, récompenser, attribuer",,
1068,54,,verhandeln,verhandeln,"to negotiate, to bargain, to discuss","négocier, discuter",,
1069,54,,gleichen,gleichen,"to equal, to match, to resemble","égaler, ressembler",Sometimes Reflexive,Parfois Réfléchi
1070,54,,würzen,würzen,"to season, to flavor","assaisonner, aromatiser",,
1071,54,,sich lohnen,sich lohnen,"to be worthwhile, to pay off","être utile, être rentable",Always Reflexive,Toujours Réfléchi
1072,54,,widersprechen,widersprechen,"to contradict, to disagree","contredire, être en désaccord",,
1073,54,,frieren,frieren,"to freeze, to feel cold","geler, avoir froid",Sometimes Reflexive,Parfois Réfléchi
1074,54,,losgehen,losgehen,"to leave, to go off, to advance","partir, s'en aller, avancer",,
1075,54,,beruhigen,beruhigen,"to calm, to reassure, to soothe","calmer, rassurer, apaiser",Sometimes Reflexive,Parfois Réfléchi
1076,54,,zögern,zögern,to hesitate,hésiter,,
1077,54,,ausfallen,ausfallen,"to fail, to be canceled, to malfunction","échouer, être annulé, dysfonctionner",,
1078,54,,protestieren,protestieren,"to protest, to object","protester, s'opposer",,
1079,54,,aufgeben,aufgeben,"to give up on, to give up (refl.), to abandon","renoncer à, abandonner (réfl.),",Sometimes Reflexive,Parfois Réfléchi
1080,54,,überwachen,überwachen,"to keep under surveillance, to monitor, to observe, to oversee","surveiller, observer, superviser",,
1081,55,,verteidigen,verteidigen,to defend,défendre,Sometimes Reflexive,Parfois Réfléchi
1082,55,,bestrafen,bestrafen,to punish,punir,Sometimes Reflexive,Parfois Réfléchi
1083,55,,vorlesen,vorlesen,"to read aloud, to read out",lire à haute voix,,
1084,55,,zugeben,zugeben,"to admit, to confess, to add","admettre, confesser, ajouter",Sometimes Reflexive,Parfois Réfléchi
1085,55,,hinzufügen,hinzufügen,to add,ajouter,,
1086,55,,beurteilen,beurteilen,"to judge, to assess","juger, évaluer",,
1087,55,,husten,husten,"to cough, to have a cough","tousser, toussoter",,
1088,55,,ausschließen,ausschließen,"to exclude, to eliminate","exclure, éliminer",,
1089,55,,absolvieren,absolvieren,"to complete, to graduate, to finish","compléter, obtenir un diplôme, finir",,
1090,55,,faulenzen,faulenzen,"to chill, to laze around","se détendre, paresser",,
1091,55,,beten,beten,to pray,prier,,
1092,55,,jagen,jagen,"to hunt, to chase, to pursue","chasser, poursuivre",Sometimes Reflexive,Parfois Réfléchi
1093,55,,angeln,angeln,"to fish, to angle, to hook up","pêcher, aller à la pêcher",,
1094,55,,bluten,bluten,"to bleed, to haemorrhage","saigner, avoir une hémorragie",,
1095,55,,anprobieren,anprobieren,"to try on, to fit, to fit on","essayer, ajuster, s'adapter à",Sometimes Reflexive,Parfois Réfléchi
1096,55,,duschen,duschen,"to shower, to have a shower, to take a shower","se doucher, prendre une douche",Mostly Reflexive,Principalement Réfléchi
1097,55,,ankreuzen,ankreuzen,"to check, to cross, to mark","vérifier, croiser, marquer",,
1098,55,,graben,graben,"to dig, to excavate, to delve","creuser, fouiller, excaver",Sometimes Reflexive,Parfois Réfléchi
1099,55,,abstimmen,abstimmen,"to coordinate, to vote, to adjust","coordonner, voter, ajuster",Sometimes Reflexive,Parfois Réfléchi
1100,55,,beschädigen,beschädigen,"to damage, to harm","endommager, nuire",,
1101,56,,weitermachen,weitermachen,"to go on, to keep going, to continue to do something","continuer, continuer à faire quelque chose",,
1102,56,,existieren,existieren,to exist,exister,,
1103,56,,anschauen,anschauen,"to look at, to behold, to take a look at, to watch (Bayern and Austria)","regarder, contempler, jeter un coup d'œil à, observer (Bayern et Autriche)",Sometimes Reflexive,Parfois Réfléchi
1104,56,,veranstalten,veranstalten,"to organize, to arrange, to host","organiser, arranger, héberger",,
1105,56,,spalten,spalten,"to split, to divide","diviser, diviser",Sometimes Reflexive,Parfois Réfléchi
1106,56,,angreifen,angreifen,to attack,attaquer,,
1107,56,,beeindrucken,beeindrucken,to impress,impressionner,Sometimes Reflexive,Parfois Réfléchi
1108,56,,begeistern,begeistern,"to enthuse, to be enthusiastic (refl.)","enthousiasmer, être enthousiaste (réfl.)",Sometimes Reflexive,Parfois Réfléchi
1109,56,,einpacken,einpacken,"to pack in, to pack, to wrap, to wrap up","emballer, conclure",,
1110,56,,auspacken,auspacken,"to unpack, to unwrap, to blow the whistle on","déballer, dénoncer",,
1111,56,,ausdrücken,ausdrücken,"to express, to articulate, to convey, to embody","exprimer, articuler, transmettre, incarner",Sometimes Reflexive,Parfois Réfléchi
1112,56,,recyceln,recyceln,to recycle,recycler,,
1113,56,,aufwachsen,aufwachsen,"to grow up, to be raised","grandir, être élevé",,
1114,56,,kommunizieren,kommunizieren,"to communicate, to commune, to connect","communiquer, se connecter",,
1115,56,,entnehmen,entnehmen,"to extract, to gather from, to remove","retirer, tirer, déduire",,
1116,56,,überleben,überleben,to survive,survivre,,
1117,56,,scheitern,scheitern,"to fail, to fall through","échouer, tomber à travers",,
1118,56,,drohen,drohen,to threaten,menacer,,
1119,56,,beschweren,beschweren,"to complain, to weigh down","se plaindre, alourdir",,
1120,56,,bemerken,bemerken,"to notice, to observe, to remark","remarquer, observer",,
1121,57,,,fortsetzen,"to continue, to carry on, to extend, to proceed","continuer, poursuivre, étendre, procéder",Sometimes Reflexive,Parfois Réfléchi
1122,57,,,fällen,"to fell, to cut down, to precipitate","abattre, couper, fendre",,
1123,57,,,aussuchen,"to select, to choose, to pick","sélectionner, choisir, cueillir",Sometimes Reflexive,Parfois Réfléchi
1124,57,,,vorgehen,"to proceed, to advance, to go ahead","procéder, avancer, aller de l'avant",,
1125,57,,,ausmachen,"to arrange, to constitute, to represent, to settle","organiser, constituer, représenter, régler",Sometimes Reflexive,Parfois Réfléchi
1126,57,,,ausführen,"to carry out, to execute, to perform","réaliser, exécuter, accomplir",,
1127,57,,,betreiben,"to operate, to run, to conduct","opérer, diriger, conduire",,
1128,57,,,ergeben,"to result in, to yield, to surrender","aboutir à, céder, se rendre",Sometimes Reflexive,Parfois Réfléchi
1129,57,,,erzeugen,"to generate, to produce, to create","générer, produire, créer",,
1130,57,,,umsetzen,"to implement, to apply, to put into practice","mettre en œuvre, appliquer, mettre en pratique",Sometimes Reflexive,Parfois Réfléchi
1131,57,,,vornehmen,"to undertake, to carry out","entreprendre, réaliser",Sometimes Reflexive,Parfois Réfléchi
1132,57,,,vermitteln,"to convey, to mediate, to arrange","transmettre, servir de médiateur, arranger",,
1133,57,,,beantragen,"to apply for, to request","demander, requérir",,
1134,57,,,begegnen,"to encounter (with dative), to meet","rencontrer, se rencontrer",,
1135,57,,,ermitteln,"to investigate, to determine, to ascertain","investiguer, déterminer, s'assurer",,
1136,57,,,gewährleisten,"to ensure, to guarantee","assurer, garantir",,
1137,57,,,zuordnen,"to assign, to allocate","attribuer, allouer",Sometimes Reflexive,Parfois Réfléchi
1138,57,,,verurteilen,"to condemn, to sentence","condamner, prononcer une sentence",Sometimes Reflexive,Parfois Réfléchi
1139,57,,,einführen,"to introduce, to implement, to import","introduire, mettre en œuvre, importer",Sometimes Reflexive,Parfois Réfléchi
1140,57,,,anerkennen,"to recognize, to acknowledge, to approve","reconnaître, admettre, approuver",,
1141,58,,,ausstellen,"to exhibit, to display","exposer, montrer",Sometimes Reflexive,Parfois Réfléchi
1142,58,,,ausdrucken,"to print, to print out, to print off",imprimer,,
1143,58,,,versehen,"to provide, to equip, to supply","fournir, équiper, approvisionner",Sometimes Reflexive,Parfois Réfléchi
1144,58,,,anlegen,"to create, to invest","créer, investir",Sometimes Reflexive,Parfois Réfléchi
1145,58,,,betragen,"to amount to, to come to","s'élever à, arriver à",,
1146,58,,,tauschen,"to swap, to trade, to exchange","échanger, troquer, échanger",Sometimes Reflexive,Parfois Réfléchi
1147,58,,,umfassen,"to include, to comprise","inclure, comprendre",,
1148,58,,,beziehen,"to refer, to relate, to obtain, to cover, to move into","se référer, obtenir",Sometimes Reflexive,Parfois Réfléchi
1149,58,,,sperren,"to block, to lock, to close off","bloquer, verrouiller, fermer",Sometimes Reflexive,Parfois Réfléchi
1150,58,,,versorgen,"to supply, to provide for, to take care of","fournir, pourvoir à, prendre soin de",Sometimes Reflexive,Parfois Réfléchi
1151,58,,,schreiten,"to stride, to proceed, to step (formal)","marcher à grands pas, avancer, faire un pas (formel)",,
1152,58,,,ergreifen,"to seize, to grasp, to take hold of","saisir, s'emparer de",,
1153,58,,,einnehmen,"to capture, to earn, to ingest","capturer, gagner, ingérer",Sometimes Reflexive,Parfois Réfléchi
1154,58,,,betrachten,"to view, to observe","voir, observer",,
1155,58,,,verarbeiten,"to process, to handle, to work through","traiter, manipuler, travailler",Sometimes Reflexive,Parfois Réfléchi
1156,58,,,aufbauen,"to build, to establish, to develop","construire, établir, développer",Sometimes Reflexive,Parfois Réfléchi
1157,58,,,identifizieren,to identify,identifier,Sometimes Reflexive,Parfois Réfléchi
1158,58,,,erfordern,"to require, to demand, to necessitate","exiger, nécessiter",,
1159,58,,,biegen,"to turn, to bend","tourner, se pencher",Sometimes Reflexive,Parfois Réfléchi
1160,58,,,verpflichten,"to oblige, to commit, to bind","obliger, engager, lier",Sometimes Reflexive,Parfois Réfléchi
1161,59,,,beleidigen,"to offend someone, to insult someone","offenser quelqu'un, insulter quelqu'un",Sometimes Reflexive,Parfois Réfléchi
1162,59,,,einhalten,"to observe, to adhere, to comply","observer, adhérer, se conformer",,
1163,59,,,ausprobieren,"to test, to try, to check out","tester, essayer, vérifier",,
1164,59,,,weitergeben,"to pass on, to impart, to relay","transmettre, relayer",,
1165,59,,,posten,"to post, to shop","poster, acheter",Sometimes Reflexive,Parfois Réfléchi
1166,59,,,deuten,"to indicate, to interpret, to point","interpréter, indiquer",Sometimes Reflexive,Parfois Réfléchi
1167,59,,,einbauen,"to install, to build in, to build into","installer, monter, intégrer, insérer",,
1168,59,,,aufrufen,"to call up, to call, to call for, to invite","appeler, solliciter, inviter",,
1169,59,,,grüßen,"to greet, to salute","saluer, faire un salut",,
1170,59,,,aufheben,"to abolish, to lift, to pick up, to keep","abolir, lever, ramasser, garder",Sometimes Reflexive,Parfois Réfléchi
1171,59,,,bewahren,"to keep, to preserve (to maintain the condition of)","garder, préserver (maintenir l'état de)",Sometimes Reflexive,Parfois Réfléchi
1172,59,,,formulieren,"to formulate, to phrase","formuler, exprimer",,
1173,59,,,hinterlassen,"to leave behind, to bequeath","laisser derrière soi, léguer",,
1174,59,,,aufstellen,"to set up, to establish","mettre en place, établir",Sometimes Reflexive,Parfois Réfléchi
1175,59,,,sieben,"to sieve, to filter","tamiser, filtrer",,
1176,59,,,anhaben,"to have on, to wear, to harm, to damage","porter, arborer, avoir, posséder",,
1177,59,,,tropfen,"to drip, to drop, to be gouting","goutter, tomber",,
1178,59,,,sich beeilen,"to hurry, to hasten, to rush (refl.)","se dépêcher, se hâter, se précipiter (réfl.)",Always Reflexive,Toujours Réfléchi
1179,59,,,abbrechen,"to cancel, to break off, to interrupt","annuler, interrompre, rompre",Sometimes Reflexive,Parfois Réfléchi
1180,59,,,zerschlagen,"to break, to crush, to defeat, to shatter","briser, écraser, vaincre, anéantir",Sometimes Reflexive,Parfois Réfléchi
1181,60,,,kürzen,"to shorten, to reduce, to abbreviate","réduire, raccourcir, abréger",Sometimes Reflexive,Parfois Réfléchi
1182,60,,,nützen,"to be of use, to be useful, to benefit",utiliser,,
1183,60,,,meiden,"to avoid, to shun","éviter, fuir",,
1184,60,,,bewirken,"to bring about, to cause, to effect","provoquer, causer, effectuer",,
1185,60,,,rühren,"to stir, to move, to mix",remuer,Sometimes Reflexive,Parfois Réfléchi
1186,60,,,unterliegen,"to be subject to, to undergo","être soumis à, subir",,
1187,60,,,überwinden,"to overcome, to conquer, to surmount",surmonter,,
1188,60,,,blühen,"to bloom, to flourish","fleurir, s'épanouir",,
1189,60,,,gebrauchen,"to use, to make use of","utiliser, faire usage de",,
1190,60,,,vernichten,"to destroy, to ruin, to annihilate, to eradicate","détruire, ruiner, anéantir, éradiquer",,
1191,60,,,aussprechen,"to pronounce, to express, to speak out","prononcer, exprimer, s'exprimer",Sometimes Reflexive,Parfois Réfléchi
1192,60,,,entwerfen,"to design, to draft, to sketch","concevoir, ébaucher, esquisser",,
1193,60,,,eintragen,"to register, to enter, to record, to enrol","inscrire, entrer, enregistrer, inscrire",Sometimes Reflexive,Parfois Réfléchi
1194,60,,,qualifizieren,"to qualify, to qualify for","se qualifier, se qualifier pour",Sometimes Reflexive,Parfois Réfléchi
1195,60,,,zurückkehren,to return,revenir,,
1196,60,,,verwechseln,"to mix up, to confuse, to mistake for",confondre,,
1197,60,,,kombinieren,to combine,combiner,Sometimes Reflexive,Parfois Réfléchi
1198,60,,,verpacken,"to pack, to wrap, to package","emballer, envelopper, conditionner",Sometimes Reflexive,Parfois Réfléchi
1199,60,,,versichern,"to assure, to insure, to cover","assurer, couvrir",Sometimes Reflexive,Parfois Réfléchi
1200,60,,,meistern,"to master, to overcome, to cope with","maîtriser, surmonter, faire face à",,
1201,61,,,bereitstellen,"to make available, to provide, to supply","mettre à disposition, fournir, approvisionner",,
1202,61,,,umdrehen,to turn around,faire demi-tour,Sometimes Reflexive,Parfois Réfléchi
1203,61,,,einfallen,"to invade, to collapse, to come to mind","envahir, s'effondrer, venir à l'esprit",,
1204,61,,,falten,"to fold, to bend, to crease","plier, froisser, se plisser",Sometimes Reflexive,Parfois Réfléchi
1205,61,,,bremsen,"to slow down, to brake, to decelerate, to retard","ralentir, freiner, décélérer, retarder",Sometimes Reflexive,Parfois Réfléchi
1206,61,,,abstellen,"to put down, to assign, to set down, to shut down","poser, assigner, mettre en place, fermer",,
1207,61,,,tippen,"to type, to bet, to tap","taper, parier, appuyer",,
1208,61,,,rollen,to roll,rouler,Sometimes Reflexive,Parfois Réfléchi
1209,61,,,tanken,"to refuel, to fill up","faire le plein, faire le plein",Sometimes Reflexive,Parfois Réfléchi
1210,61,,,trauen,"to trust, to marry, to dare (refl.)","faire confiance, se marier, oser (réfl.)",Sometimes Reflexive,Parfois Réfléchi
1211,61,,,vermieten,"to lease, to let, to rent to","louer, donner en location à",,
1212,61,,,befreien,to free (make free),libérer (rendre libre),Sometimes Reflexive,Parfois Réfléchi
1213,61,,,vorliegen,"to exist, to be available","exister, être disponible",,
1214,61,,,prägen,"to shape, to influence, to mint","façonner, influencer, frapper",Sometimes Reflexive,Parfois Réfléchi
1215,61,,,erwerben,"to acquire, to purchase, to gain","acquérir, acheter, gagner",,
1216,61,,,verbreiten,"to spread, to disseminate, to distribute","diffuser, propager, distribuer",Sometimes Reflexive,Parfois Réfléchi
1217,61,,,bereiten,"to prepare, to cause","préparer, provoquer",Sometimes Reflexive,Parfois Réfléchi
1218,61,,,spinnen,"to spin, to act strangely, to act up","tisser, filer",Sometimes Reflexive,Parfois Réfléchi
1219,61,,,verreisen,"to go away, to travel, to go on a trip","partir, voyager, faire un voyage",,
1220,61,,,buchstabieren,to spell,épeler,,
1221,62,,,jobben,"to do casual jobs, to work part-time",travailler à temps partiel,,
1222,62,,,nicken,to nod,hocher la tête,,
1223,62,,,zitieren,"to cite, to quote",citer,,
1224,62,,,vorlegen,"to present, to submit, to bring forward","présenter, soumettre, avancer",,
1225,62,,,bergen,"to recover, to rescue, to save, to salvage","récupérer, secourir, sauver, sauver",,
1226,62,,,definieren,to define,définir,,
1227,62,,,basieren,to base,à la base,,
1228,62,,,einleiten,"to introduce, to initiate, to commence","introduire, initier, commencer",,
1229,62,,,durchsetzen,"to enforce, to assert","faire respecter, affirmer",Sometimes Reflexive,Parfois Réfléchi
1230,62,,,nachweisen,"to prove, to account for, to demonstrate","prouver, rendre compte de, démontrer",,
1231,62,,,aufweisen,"to exhibit, to feature, to show, to boast","exposer, mettre en valeur, montrer, se vanter",,
1232,62,,,schwören,"to swear, to take an oath","jurer, prêter serment",,
1233,62,,,befehlen,"to command, to order, to bid","ordonner, commander, enjoindre",,
1234,62,,,leuchten,"to shine, to glow, to be illuminated","briller, allumer, éclairer",,
1235,62,,,zielen,"to aim, to target, to focus on","viser, cibler, se concentrer sur",,
1236,62,,,sondern,"to separate, to split","séparer, diviser",,
1237,62,,,verderben,"to decay, to spoil, to addle, to degenerate","gâcher, gâter, perdre, périr",Sometimes Reflexive,Parfois Réfléchi
1238,62,,,verweigern,"to refuse, to deny, to decline, to reject",refuser,Sometimes Reflexive,Parfois Réfléchi
1239,62,,,bewältigen,"to manage, to cope with, to overcome, to get over","gérer, faire face à, surmonter",,
1240,62,,,verbrennen,"to burn, to consume by fire, to incinerate","brûler, consumer par le feu, incinérer",Sometimes Reflexive,Parfois Réfléchi
1241,63,,,aufhalten,"to stop, to stay, to delay","arrêter, rester, retarder",Sometimes Reflexive,Parfois Réfléchi
1242,63,,,erarbeiten,"to develop, to elaborate, to work out, to acquire","développer, élaborer, acquérir",Sometimes Reflexive,Parfois Réfléchi
1243,63,,,bedrohen,"to threaten, to menace",menacer,,
1244,63,,,ausüben,"to exercise, to perform, to practice","exercer, exécuter, pratiquer",,
1245,63,,,verstärken,"to amplify, to intensify, to strengthen","amplifier, intensifier, renforcer",Sometimes Reflexive,Parfois Réfléchi
1246,63,,,bedenken,"to consider, to reflect, to give, to allow for","considérer, réfléchir, donner, permettre",,
1247,63,,,impfen,"to vaccinate, to immunize, to inject","vacciner, immuniser, injecter",Sometimes Reflexive,Parfois Réfléchi
1248,63,,,betrügen,"to cheat, to swindle, to defraud","tricher, escroquer, frauder",,
1249,63,,,verklagen,"to sue, to bring a suit against, to bring an action against","poursuivre en justice, intenter un procès",,
1250,63,,,isolieren,"to isolate, to insulate",isoler,Sometimes Reflexive,Parfois Réfléchi
1251,63,,,beherrschen,"to dominate, to master, to control, to rule","dominer, maîtriser, contrôler, régner",,
1252,63,,,blitzen,to flash,"clignoter, étinceler, flasher, scintiller",,
1253,63,,,reizen,"to stimulate, to irritate, to tease","irriter, émouvoir, exciter",Sometimes Reflexive,Parfois Réfléchi
1254,63,,,auseinandersetzen,"to discuss, to engage, to altercate, to argue with","discuter, s'engager, se disputer, argumenter avec",Mostly Reflexive,Principalement Réfléchi
1255,63,,,aushalten,"to bear, to endure, to withstand, to tolerate","supporter, endurer, résister, tolérer",,
1256,63,,,proben,"to rehearse, to practice",répéter,,
1257,63,,,vorbeikommen,"to come by, to come over, to drop by","passer, venir voir, faire un saut",,
1258,63,,,weitergehen,"to continue, to proceed, to keep moving","continuer, avancer, continuer à avancer",,
1259,63,,,betreten,"to enter, to access, to apprehend, to catch","entrer, accéder, appréhender, attraper",,
1260,63,,,entsorgen,"to clean up, to depollute, to dispose, to dispose of","nettoyer, dépolluer, éliminer, se débarrasser de",,
1261,64,,,erwischen,"to catch, to seize, to nab, to surprise, to capture","attraper, saisir, capturer, surprendre, prendre",,
1262,64,,,sortieren,"to sort, to arrange, to merge, to assort","trier, arranger, fusionner, associer",,
1263,64,,,verlegen,"to install, to lay, to misplace, to publish","installer, poser, égarer, publier",,
1264,64,,,aufschreiben,"to write down, to note down, to record","écrire, noter, enregistrer",,
1265,64,,,segeln,"to sail, to glide","naviguer, glisser",,
1266,64,,,einlegen,"to insert, to pickle, to assert","insérer, mettre en conserve, affirmer",,
1267,64,,,wahrnehmen,"to perceive, to notice, to observe, to sense","percevoir, remarquer, observer, pressentir",,
1268,64,,,sicherstellen,"to seize, to assure, to confiscate, to guarantee","saisir, assurer, confisquer, garantir",,
1269,64,,,besetzen,"to occupy, to border, to cast","occuper, border, jeter",Sometimes Reflexive,Parfois Réfléchi
1270,64,,,aufführen,"to perform, to present","exécuter, présenter",Sometimes Reflexive,Parfois Réfléchi
1271,64,,,verhaften,"to detain, to take into custody","détenir, mettre en détention",,
1272,64,,,kommentieren,to comment,commenter,,
1273,64,,,überlassen,"to leave to, to entrust, to surrender","laisser à, confier, abandonner",,
1274,64,,,befürchten,"to fear, to apprehend, to be afraid","craindre, appréhender, avoir peur",,
1275,64,,,verfassen,"to write, to compose, to draft","écrire, composer, rédiger",,
1276,64,,,kehren,"to sweep, to return","retourner, balayer",Sometimes Reflexive,Parfois Réfléchi
1277,64,,,einigen,"to unite, to reconcile, to agree","s'unir, se réconcilier, s'accorder",Mostly Reflexive,Principalement Réfléchi
