Nr,exercise,question,answer,german,english,french,transitivity_english,transitivity_french
1799,90,,biegen,biegen,"to turn, to bend","tourner, se pencher",Sometimes Reflexive,Parfois Réfléchi
1800,90,,verpflichten,verpflichten,"to oblige, to commit, to bind","obliger, engager, lier",Sometimes Reflexive,Parfois Réfléchi
1801,91,,beleidigen,beleidigen,"to offend someone, to insult someone","offenser quelqu'un, insulter quelqu'un",,
1802,91,,einhalten,einhalten,"to observe, to adhere, to comply","observer, adhérer, se conformer",,
1803,91,,ausprobieren,ausprobieren,"to test, to try, to check out","tester, essayer, vérifier",,
1804,91,,weitergeben,weitergeben,"to pass on, to impart, to relay","transmettre, relayer",,
1805,91,,posten,posten,"to post, to shop","poster, acheter",,
1806,91,,deuten,deuten,"to indicate, to interpret, to point","interpréter, indiquer",,
1807,91,,einbauen,einbauen,"to install, to build in, to build into","installer, monter, intégrer, insérer",,
1808,91,,aufrufen,aufrufen,"to call up, to call, to call for, to invite","appeler, solliciter, inviter",,
1809,91,,grüßen,grüßen,"to greet, to salute","saluer, faire un salut",,
1810,91,,aufheben,aufheben,"to abolish, to lift, to pick up, to keep","abolir, lever, ramasser, garder",,
1811,91,,bewahren,bewahren,"to keep, to preserve (to maintain the condition of)","garder, préserver (maintenir l'état de)",,
1812,91,,formulieren,formulieren,"to formulate, to phrase","formuler, exprimer",,
1813,91,,hinterlassen,hinterlassen,"to leave behind, to bequeath","laisser derrière soi, léguer",,
1814,91,,aufstellen,aufstellen,"to set up, to establish","mettre en place, établir",,
1815,91,,sieben,sieben,"to sieve, to filter","tamiser, filtrer",,
1816,91,,anhaben,anhaben,"to have on, to wear, to harm, to damage","porter, arborer, avoir, posséder",,
1817,91,,tropfen,tropfen,"to drip, to drop, to be gouting","goutter, tomber",,
1818,91,,sich beeilen,sich beeilen,"to hurry, to hasten, to rush (refl.)","se dépêcher, se hâter, se précipiter (réfl.)",,
1819,91,,abbrechen,abbrechen,"to cancel, to break off, to interrupt","annuler, interrompre, rompre",,
1820,91,,zerschlagen,zerschlagen,"to break, to crush, to defeat, to shatter","briser, écraser, vaincre, anéantir",,
1821,92,,kürzen,kürzen,"to shorten, to reduce, to abbreviate","réduire, raccourcir, abréger",,
1822,92,,nützen,nützen,"to be of use, to be useful, to benefit",utiliser,,
1823,92,,meiden,meiden,"to avoid, to shun","éviter, fuir",,
1824,92,,bewirken,bewirken,"to bring about, to cause, to effect","provoquer, causer, effectuer",,
1825,92,,rühren,rühren,"to stir, to move, to mix",remuer,,
1826,92,,unterliegen,unterliegen,"to be subject to, to undergo","être soumis à, subir",,
1827,92,,überwinden,überwinden,"to overcome, to conquer, to surmount",surmonter,,
1828,92,,blühen,blühen,"to bloom, to flourish","fleurir, s'épanouir",,
1829,92,,gebrauchen,gebrauchen,"to use, to make use of","utiliser, faire usage de",,
1830,92,,vernichten,vernichten,"to destroy, to ruin, to annihilate, to eradicate","détruire, ruiner, anéantir, éradiquer",,
1831,92,,aussprechen,aussprechen,"to pronounce, to express, to speak out","prononcer, exprimer, s'exprimer",,
1832,92,,entwerfen,entwerfen,"to design, to draft, to sketch","concevoir, ébaucher, esquisser",,
1833,92,,eintragen,eintragen,"to register, to enter, to record, to enrol","inscrire, entrer, enregistrer, inscrire",,
1834,92,,qualifizieren,qualifizieren,"to qualify, to qualify for","se qualifier, se qualifier pour",,
1835,92,,zurückkehren,zurückkehren,to return,revenir,,
1836,92,,verwechseln,verwechseln,"to mix up, to confuse, to mistake for",confondre,,
1837,92,,kombinieren,kombinieren,to combine,combiner,,
1838,92,,verpacken,verpacken,"to pack, to wrap, to package","emballer, envelopper, conditionner",,
1839,92,,versichern,versichern,"to assure, to insure, to cover","assurer, couvrir",,
1840,92,,meistern,meistern,"to master, to overcome, to cope with","maîtriser, surmonter, faire face à",,
1841,93,,bereitstellen,bereitstellen,"to make available, to provide, to supply","mettre à disposition, fournir, approvisionner",,
1842,93,,umdrehen,umdrehen,to turn around,faire demi-tour,,
1843,93,,einfallen,einfallen,"to invade, to collapse, to come to mind","envahir, s'effondrer, venir à l'esprit",,
1844,93,,falten,falten,"to fold, to bend, to crease","plier, froisser, se plisser",,
1845,93,,bremsen,bremsen,"to slow down, to brake, to decelerate, to retard","ralentir, freiner, décélérer, retarder",,
1846,93,,abstellen,abstellen,"to put down, to assign, to set down, to shut down","poser, assigner, mettre en place, fermer",,
1847,93,,tippen,tippen,"to type, to bet, to tap","taper, parier, appuyer",,
1848,93,,rollen,rollen,to roll,rouler,,
1849,93,,tanken,tanken,"to refuel, to fill up","faire le plein, faire le plein",,
1850,93,,trauen,trauen,"to trust, to marry, to dare (refl.)","faire confiance, se marier, oser (réfl.)",,
1851,93,,vermieten,vermieten,"to lease, to let, to rent to","louer, donner en location à",,
1852,93,,befreien,befreien,to free (make free),libérer (rendre libre),,
1853,93,,vorliegen,vorliegen,"to exist, to be available","exister, être disponible",,
1854,93,,prägen,prägen,"to shape, to influence, to mint","façonner, influencer, frapper",,
1855,93,,erwerben,erwerben,"to acquire, to purchase, to gain","acquérir, acheter, gagner",,
1856,93,,verbreiten,verbreiten,"to spread, to disseminate, to distribute","diffuser, propager, distribuer",,
1857,93,,bereiten,bereiten,"to prepare, to cause","préparer, provoquer",,
1858,93,,spinnen,spinnen,"to spin, to act strangely, to act up","tisser, filer",,
1859,93,,verreisen,verreisen,"to go away, to travel, to go on a trip","partir, voyager, faire un voyage",,
1860,93,,buchstabieren,buchstabieren,to spell,épeler,,
1861,94,,jobben,jobben,"to do casual jobs, to work part-time",travailler à temps partiel,,
1862,94,,nicken,nicken,to nod,hocher la tête,,
1863,94,,zitieren,zitieren,"to cite, to quote",citer,,
1864,94,,vorlegen,vorlegen,"to present, to submit, to bring forward","présenter, soumettre, avancer",,
1865,94,,bergen,bergen,"to recover, to rescue, to save, to salvage","récupérer, secourir, sauver, sauver",,
1866,94,,definieren,definieren,to define,définir,,
1867,94,,basieren,basieren,to base,à la base,,
1868,94,,einleiten,einleiten,"to introduce, to initiate, to commence","introduire, initier, commencer",,
1869,94,,durchsetzen,durchsetzen,"to enforce, to assert","faire respecter, affirmer",,
1870,94,,nachweisen,nachweisen,"to prove, to account for, to demonstrate","prouver, rendre compte de, démontrer",,
1871,94,,aufweisen,aufweisen,"to exhibit, to feature, to show, to boast","exposer, mettre en valeur, montrer, se vanter",,
1872,94,,schwören,schwören,"to swear, to take an oath","jurer, prêter serment",,
1873,94,,befehlen,befehlen,"to command, to order, to bid","ordonner, commander, enjoindre",,
1874,94,,leuchten,leuchten,"to shine, to glow, to be illuminated","briller, allumer, éclairer",,
1875,94,,zielen,zielen,"to aim, to target, to focus on","viser, cibler, se concentrer sur",,
1876,94,,sondern,sondern,"to separate, to split","séparer, diviser",,
1877,94,,verderben,verderben,"to decay, to spoil, to addle, to degenerate","gâcher, gâter, perdre, périr",,
1878,94,,verweigern,verweigern,"to refuse, to deny, to decline, to reject",refuser,,
1879,94,,bewältigen,bewältigen,"to manage, to cope with, to overcome, to get over","gérer, faire face à, surmonter",,
1880,94,,verbrennen,verbrennen,"to burn, to consume by fire, to incinerate","brûler, consumer par le feu, incinérer",,
1881,95,,aufhalten,aufhalten,"to stop, to stay, to delay","arrêter, rester, retarder",,
1882,95,,erarbeiten,erarbeiten,"to develop, to elaborate, to work out, to acquire","développer, élaborer, acquérir",,
1883,95,,bedrohen,bedrohen,"to threaten, to menace",menacer,,
1884,95,,ausüben,ausüben,"to exercise, to perform, to practice","exercer, exécuter, pratiquer",,
1885,95,,verstärken,verstärken,"to amplify, to intensify, to strengthen","amplifier, intensifier, renforcer",,
1886,95,,bedenken,bedenken,"to consider, to reflect, to give, to allow for","considérer, réfléchir, donner, permettre",,
1887,95,,impfen,impfen,"to vaccinate, to immunize, to inject","vacciner, immuniser, injecter",,
1888,95,,betrügen,betrügen,"to cheat, to swindle, to defraud","tricher, escroquer, frauder",,
1889,95,,verklagen,verklagen,"to sue, to bring a suit against, to bring an action against","poursuivre en justice, intenter un procès",,
1890,95,,isolieren,isolieren,"to isolate, to insulate",isoler,,
1891,95,,beherrschen,beherrschen,"to dominate, to master, to control, to rule","dominer, maîtriser, contrôler, régner",,
1892,95,,blitzen,blitzen,to flash,"clignoter, étinceler, flasher, scintiller",,
1893,95,,reizen,reizen,"to stimulate, to irritate, to tease","irriter, émouvoir, exciter",,
1894,95,,auseinandersetzen,auseinandersetzen,"to discuss, to engage, to altercate, to argue with","discuter, s'engager, se disputer, argumenter avec",,
1895,95,,aushalten,aushalten,"to bear, to endure, to withstand, to tolerate","supporter, endurer, résister, tolérer",,
1896,95,,proben,proben,"to rehearse, to practice",répéter,,
1897,95,,vorbeikommen,vorbeikommen,"to come by, to come over, to drop by","passer, venir voir, faire un saut",,
1898,95,,weitergehen,weitergehen,"to continue, to proceed, to keep moving","continuer, avancer, continuer à avancer",,
1899,95,,betreten,betreten,"to enter, to access, to apprehend, to catch","entrer, accéder, appréhender, attraper",,
1900,95,,entsorgen,entsorgen,"to clean up, to depollute, to dispose, to dispose of","nettoyer, dépolluer, éliminer, se débarrasser de",,
1901,96,,erwischen,erwischen,"to catch, to seize, to nab, to surprise, to capture","attraper, saisir, capturer, surprendre, prendre",,
1902,96,,sortieren,sortieren,"to sort, to arrange, to merge, to assort","trier, arranger, fusionner, associer",,
1903,96,,verlegen,verlegen,"to install, to lay, to misplace, to publish","installer, poser, égarer, publier",,
1904,96,,aufschreiben,aufschreiben,"to write down, to note down, to record","écrire, noter, enregistrer",,
1905,96,,segeln,segeln,"to sail, to glide","naviguer, glisser",,
1906,96,,einlegen,einlegen,"to insert, to pickle, to assert","insérer, mettre en conserve, affirmer",,
1907,96,,wahrnehmen,wahrnehmen,"to perceive, to notice, to observe, to sense","percevoir, remarquer, observer, pressentir",,
1908,96,,sicherstellen,sicherstellen,"to seize, to assure, to confiscate, to guarantee","saisir, assurer, confisquer, garantir",,
1909,96,,besetzen,besetzen,"to occupy, to border, to cast","occuper, border, jeter",,
1910,96,,aufführen,aufführen,"to perform, to present","exécuter, présenter",,
1911,96,,verhaften,verhaften,"to detain, to take into custody","détenir, mettre en détention",,
1912,96,,kommentieren,kommentieren,to comment,commenter,,
1913,96,,überlassen,überlassen,"to leave to, to entrust, to surrender","laisser à, confier, abandonner",,
1914,96,,befürchten,befürchten,"to fear, to apprehend, to be afraid","craindre, appréhender, avoir peur",,
1915,96,,verfassen,verfassen,"to write, to compose, to draft","écrire, composer, rédiger",,
1916,96,,kehren,kehren,"to sweep, to return","retourner, balayer",,
1917,96,,einigen,einigen,"to unite, to reconcile, to agree","s'unir, se réconcilier, s'accorder",,
1918,96,,reißen,reißen,"to rip, to tear, to break","déchirer, arracher, se casser, rompre",,
1919,96,,saufen,saufen,"to drink (animals), to booze","boire (des animaux), s'enivrer",,
1920,96,,abonnieren,abonnieren,to subscribe,s'abonner,,
1921,97,,ablaufen,ablaufen,"to expire, to run out, to discharge","expirer, s'épuiser, se décharger",,
1922,97,,anführen,anführen,"to cite, to lead, to quote","citer, diriger",,
1923,97,,vertreiben,vertreiben,"to expel, to dislodge, to displace, to put on the market, to sell","expulser, déloger, déplacer",,
1924,97,,erteilen,erteilen,"to grant, to issue, to give","accorder, délivrer, donner",,
1925,97,,erfassen,erfassen,"to record, to capture, to collect","enregistrer, capturer, collecter",,
1926,97,,übergeben,übergeben,"to hand over, to vomit (refl.)","remettre, vomir (réfl.)",,
1927,97,,stützen,stützen,"to support, to back, to hold something up, to bolster","soutenir, appuyer, soutenir quelque chose, étayer",,
1928,97,,befassen,befassen,"to address, to deal with, to attend to","s'adresser à, traiter, s'occuper de",,
1929,97,,beruhen,beruhen,"to base on, to depend on","se baser sur, dépendre de",,
1930,97,,vorwerfen,vorwerfen,"to reproach, to accuse of, to allege","reprocher, accuser de, alléguer",,
1931,97,,verwirklichen,verwirklichen,"to realize, to actualize, to fulfill, to implement","réaliser, concrétiser, accomplir, mettre en œuvre",,
1932,97,,siegen,siegen,"to win, to prevail, to triumph","gagner, triompher, prévaloir",,
1933,97,,vereinigen,vereinigen,"to coalesce, to unify, to merge","unir, réunir, unifier, combiner",,
1934,97,,zittern,zittern,"to shiver, to tremble, to fear","trembler, frissonner, grelotter",,
1935,97,,locken,locken,"to entice, to lure, to rock, to tempt","attirer, allécher",,
1936,97,,strahlen,strahlen,"to radiate, to beam","rayonner, briller, illuminer",,
1937,97,,sich auswirken,sich auswirken,"to affect, to have an impact","affecter, avoir un impact",,
1938,97,,abbauen,abbauen,"to dismantle, to reduce, to break down","démanteler, réduire, décomposer",,
1939,97,,besorgen,besorgen,"to get, to obtain, to take care of","obtenir, prendre soin de",,
1940,97,,anwenden,anwenden,"to apply, to make use of","appliquer, faire usage de",,
1941,98,,zusammenstellen,zusammenstellen,"to compile, to assemble","compiler, assembler",,
1942,98,,verbrauchen,verbrauchen,"to consume, to use","consommer, utiliser",,
1943,98,,berühren,berühren,to touch,toucher,,
1944,98,,anstellen,anstellen,"to queue (refl.), to employ someone, to hire, to get into mischief","faire la queue (réfl.), employer quelqu'un, faire des bêtises",,
1945,98,,festhalten,festhalten,"to hold, to retain something, to record something, to detain","détenir, conserver quelque chose, enregistrer quelque chose, détenir",,
1946,98,,auflösen,auflösen,"to dissolve, to resolve, to annul, to liquidate","dissoudre, résoudre, annuler, liquider",,
1947,98,,auslösen,auslösen,"to ransom, to trigger, to initiate, to set up","rançonner, déclencher, initier, mettre en place",,
1948,98,,eintreten,eintreten,"to enter, to join, to occur, to step in","entrer, se joindre, se produire",,
1949,98,,belasten,belasten,"to burden, to charge, to strain","charger, accabler, mettre à rude épreuve",,
1950,98,,transportieren,transportieren,"to transport, to transfer","transporter, transférer",,
1951,98,,verweisen,verweisen,"to refer, to direct","se référer, diriger",,
1952,98,,regieren,regieren,"to govern, to reign, to rule, to command","gouverner, régner, diriger, commander",,
1953,98,,opfern,opfern,to sacrifice,sacrifier,,
1954,98,,überqueren,überqueren,to cross,traverser,,
1955,98,,abziehen,abziehen,"to remove, to deduct, to withdraw","supprimer, déduire, retirer",,
1956,98,,lenken,lenken,"to steer, to direct, to guide","diriger, orienter, guider",,
1957,98,,reifen,reifen,"to ripen, to mature",mûrir,,
1958,98,,ausschalten,ausschalten,"to disable, to turn off","désactiver, éteindre",,
1959,98,,tauchen,tauchen,"to dive, to dip","plonger, tremper",,
1960,98,,registrieren,registrieren,"to register, to enroll","s'inscrire, s'inscrire",,
1961,99,,langweilen,langweilen,"to bore, to be bored, to be boring","s'ennuyer, être ennuyé, être ennuyeux",,
1962,99,,übereinstimmen,übereinstimmen,"to agree, to concur, to correspond","concorder, correspondre, coïncider",,
1963,99,,kennzeichnen,kennzeichnen,"to mark, to label, to characterize, to flag","marquer, étiqueter, caractériser, signaler",,
1964,99,,füttern,füttern,to feed (an animal),nourrir (un animal),,
1965,99,,nähen,nähen,"to sew, to stitch, to seam","coudre, piquer, assembler",,
1966,99,,aktivieren,aktivieren,"to activate, to enable","activer, permettre",,
1967,99,,demonstrieren,demonstrieren,"to demonstrate, to show","démontrer, montrer",,
1968,99,,schmerzen,schmerzen,"to hurt, to ache","faire mal, souffrir",,
1969,99,,saugen,saugen,"to suck, to vacuum, to suckle","sucer, aspirer, téter",,
1970,99,,zurückziehen,zurückziehen,"to withdraw, to pull back, to retreat","se retirer, se replier",,
1971,99,,bekämpfen,bekämpfen,to fight against something,lutter contre quelque chose,,
1972,99,,erlassen,erlassen,"to enact, to issue, to forgive, to let off, to release from","promulguer, pardonner, renoncer à, libérer de",,
1973,99,,hetzen,hetzen,"to rush, to hurry","se précipiter, se dépêcher",,
1974,99,,managen,managen,"to manage, to oversee, to organize, to supervise","gérer, contrôler",,
1975,99,,genügen,genügen,"to suffice, to satisfy","suffire, satisfaire",,
1976,99,,verringern,verringern,"to decrease, to diminish, to ease, to lower","diminuer, soulager, abaisser",,
1977,99,,ruhen,ruhen,"to rest, to be at rest, to repose",reposer,,
1978,99,,angehen,angehen,"to concern, to tackle (a problem), to turn on (a machine)","s'inquiéter, s'attaquer (à un problème), mettre en marche (une machine)",,
1979,99,,wegwerfen,wegwerfen,"to throw away, to discard","jeter, se débarrasser de",,
1980,99,,sich erkundigen,sich erkundigen,"to ask, to enquire, to enquire after, to inquire","demander, s'enquérir, se renseigner sur, interroger",,
1981,100,,ablegen,ablegen,"to lay down, to put down, to remove","déposer, poser, enlever",,
1982,100,,vergehen,vergehen,"to die, to pass, to elapse, to perish","mourir, passer, s'écouler, périr",,
1983,100,,streben,streben,"to strive, to tend to, to aspire","aspirer, s'efforcer, viser",,
1984,100,,wundern,wundern,"to surprise, to amaze","surprendre, étonner",,
1985,100,,befragen,befragen,"to question, to ask, to interrogate, to consult","questionner, demander, interroger, consulter",,
1986,100,,weichen,weichen,to soften,adoucir,,
1987,100,,beißen,beißen,to bite,mordre,,
1988,100,,kühlen,kühlen,"to chill, to cool, to refrigerate","refroidir, réfrigérer",,
1989,100,,quellen,quellen,"to soak, to swell, to well, to spring","tremper, gonfler",,
1990,100,,erstrecken,erstrecken,"to extend, to span, to bestride","étendre, enjamber",,
1991,100,,gleiten,gleiten,"to glide, to slide","glisser, glisser",,
1992,100,,umstellen,umstellen,"to relocate, to adapt, to change","déménager, s'adapter, changer",,
1993,100,,hindern,hindern,to prevent somebody from doing something,empêcher quelqu'un de faire quelque chose,,
1994,100,,blasen,blasen,"to blow, to play, to puff, to breathe on, to emit",souffler,,
1995,100,,ringen,ringen,"to struggle, to wrestle, to agonise",lutter,,
1996,100,,gebären,gebären,to give birth to,donner naissance à,,
1997,100,,überschreiten,überschreiten,"to exceed, to overstep, to surpass","dépasser, outrepasser, surpasser",,
1998,100,,abrufen,abrufen,"to retrieve, to access, to call away","récupérer, accéder, appeler",,
1999,100,,einschließen,einschließen,"to include, to enclose, to lock up, to surround","inclure, enfermer, entourer",,
2000,100,,gewähren,gewähren,"to grant, to afford, to allow, to accord","accorder, permettre",,
2001,101,,formen,formen,"to form, to shape, to model, to mold, to fashion","former, modeler, façonner",,
2002,101,,weiterleiten,weiterleiten,"to forward, to pass on","transmettre, faire passer",,
2003,101,,züchten,züchten,"to breed, to grow","se reproduire, grandir",,
2004,101,,strecken,strecken,"to stretch, to dilute, to extend","étirer, allonger",,
2005,101,,versagen,versagen,"to fail, to refuse, to deny","échouer, refuser, nier",,
2006,101,,zelten,zelten,"to camp, to camp out, to tent",camper,,
2007,101,,hervorheben,hervorheben,"to emphasize, to highlight, to stress","souligner, mettre en valeur, insister",,
2008,101,,entziehen,entziehen,"to withdraw, to remove, to deprive","retirer, enlever, priver",,
2009,101,,auswerten,auswerten,"to evaluate, to analyze, to assess","évaluer, analyser, estimer",,
2010,101,,bevorzugen,bevorzugen,"to prefer, to favor","préférer, favoriser",,
2011,101,,vertiefen,vertiefen,"to deepen, to intensify","approfondir, intensifier",,
2012,101,,verwandeln,verwandeln,"to transform, to convert, to turn into, to metamorphose","transformer, convertir, se métamorphoser",,
2013,101,,auffordern,auffordern,"to request, to invite, to ask","demander, inviter",,
2014,101,,ableiten,ableiten,"to derive, to deduce","dériver, déduire",,
2015,101,,einschränken,einschränken,"to limit, to restrict, to stint, to circumscribe","limiter, restreindre, circonscrire",,
2016,101,,interpretieren,interpretieren,"to interpret, to take as","interpréter, prendre comme",,
2017,101,,benennen,benennen,"to name, to designate, to appoint","nommer, désigner",,
2018,101,,sich spezialisieren,sich spezialisieren,"to specialize, to specialise, to differentiate, to focus","se spécialiser, se différencier, se concentrer",,
2019,101,,sich erkälten,sich erkälten,"to catch a cold, to get cold","attraper un rhume, prendre froid",,
2020,101,,irren,irren,"to err, to wander",se tromper,,
2021,102,,umbringen,umbringen,"to kill, to murder, to be very angry at someone","tuer, assassiner, être très en colère contre quelqu'un",,
2022,102,,scheren,scheren,"to shear, to care, to clip, to cut","tondre, entretenir, tailler, couper",,
2023,102,,erläutern,erläutern,"to explain, to clarify","expliquer, clarifier",,
2024,102,,publizieren,publizieren,"to publish, to publicize, to announce","publier, faire connaître, annoncer",,
2025,102,,schleichen,schleichen,"to sneak, to creep","se faufiler, ramper",,
2026,102,,plagen,plagen,"to bother, to annoy, to plague, to rack","tourmenter, affliger",,
2027,102,,verfahren,verfahren,"to proceed, to act, to deal",procéder,,
2028,102,,auskommen,auskommen,"to get along, to get on, to manage",s'entendre,,
2029,102,,spritzen,spritzen,"to inject, to spray, to splash","injecter, pulvériser, gicler, éclabousser",,
2030,102,,bügeln,bügeln,to iron,repasser (des vêtements),,
2031,102,,amüsieren,amüsieren,"to amuse, to entertain, to enjoy oneself","amuser, divertir, se faire plaisir",,
2032,102,,erkunden,erkunden,"to explore, to investigate","explorer, enquêter",,
2033,102,,ablenken,ablenken,"to distract, to divert, to steer away","distraire, détourner, éloigner",,
2034,102,,aufladen,aufladen,"to charge, to load, to burden, to impose","charger, accabler, imposer",,
2035,102,,übertreiben,übertreiben,"to exaggerate, to overdo","exagérer, exagérer",,
2036,102,,dokumentieren,dokumentieren,"to record, to document, to demonstrate, to evidence","enregistrer, documenter, démontrer, prouver",,
2037,102,,ausbauen,ausbauen,"to expand, to develop","étendre, développer",,
2038,102,,scannen,scannen,"to scan, to court, to digitize","scanner, porter devant les tribunaux, numériser",,
2039,102,,abbiegen,abbiegen,"to turn, to turn off, to bend","tourner, éteindre, plier",,
2040,102,,aussagen,aussagen,"to testify, to state","témoigner, déclarer",,
2041,103,,faszinieren,faszinieren,"to fascinate, to captivate","fasciner, captiver",,
2042,103,,schimpfen,schimpfen,"to scold, to rant","gronder, pester",,
2043,103,,motivieren,motivieren,"to motivate, to give reasons, to inspire","motiver, donner des raisons, inspirer",,
2044,103,,ausleihen,ausleihen,"to borrow, to lend, to lend out","emprunter, prêter",,
2045,103,,gefährden,gefährden,to endanger,mettre en danger,,
2046,103,,aufkommen,aufkommen,"to arise, to come down, to emerge, to land","se lever, descendre, émerger, atterrir",,
2047,103,,interviewen,interviewen,to interview,interviewer,,
2048,103,,anfordern,anfordern,"to request, to solicit, to ask for, to circularize","demander, solliciter, diffuser",,
2049,103,,belohnen,belohnen,"to reward, to award, to compensate","récompenser, attribuer, indemniser",,
2050,103,,verschlafen,verschlafen,"to oversleep, to sleep in","dormir trop longtemps, faire la grasse matinée",,
2051,103,,erstatten,erstatten,"to reimburse, to refund, to report","rembourser, déduire, signaler",,
2052,103,,zuschauen,zuschauen,"to watch, to look on, to observe","regarder, observer, surveiller",,
2053,103,,einzahlen,einzahlen,"to deposit, to make a deposit","déposer, verser",,
2054,103,,betätigen,betätigen,"to operate, to activate, to engage","actionner, activer, engager",,
2055,103,,sich wohlfühlen,sich wohlfühlen,"to feel good, to be comfortable","se sentir bien, être à l'aise",,
2056,103,,färben,färben,"to color, to dye","colorer, teindre",,
2057,103,,ablesen,ablesen,"to read off, to read out, to deduce","lire à haute voix, déduire",,
2058,103,,losfahren,losfahren,"to set off, to drive off, to leave","partir, démarrer, prendre la route",,
2059,103,,schälen,schälen,to peel,peler,,
2060,103,,recherchieren,recherchieren,"to investigate, to research, to do research","enquêter, faire des recherches, mener des recherches",,
2061,104,,verkleiden,verkleiden,"to to dress up, to to disguise oneself (refl.)",se déguiser,,
2062,104,,verschicken,verschicken,"to dispatch, to despatch, to mail, to send","expédier, envoyer par la poste, envoyer",,
2063,104,,anmachen,anmachen,"to turn on, to light, to switch on","allumer, mettre en marche, allumer",,
2064,104,,aktualisieren,aktualisieren,to update,mettre à jour,,
2065,104,,wetten,wetten,"to bet, to wager","parier, miser",,
2066,104,,anhalten,anhalten,"to stop (cease moving), to continue, to compel","arrêter (cesser de bouger), continuer, contraindre",,
2067,104,,beschleunigen,beschleunigen,"to accelerate, to speed up",accélérer,,
2068,104,,fügen,fügen,"to acquiesce, to comply, to fit together","acquiescer, se conformer, s'adapter",,
